Consumer Staples,consumer-defensive,5,KXI,iShares Global Consumer Staples ETF,https://finance.yahoo.com/research-hub/screener/sec-ind_sec-top-etfs_consumer-defensive/,2026-07-20T08:47:27+00:00,en-US,US,ETF,ETF,Delayed Quote,False,LOW,2.38,22.930521,2.37332,13.45461,USD,True,1158931800000.0,2.0,,,,,-0.229996,1784318400.0,69.26,70.4785,68.91 - 70.4785,68.91,197542.0,69.49,600.0,100.0,us_market,finmb_29102231,NYSEArca,iShares Global Consumer Staples ETF,69.9,65517.0,86830.0,[],6.1100006,0.09675377,63.15 - 73.65,-4.3899994,-0.059606235,6.570244,,23.502668,,5.88915,2.19081,2.19081,1010230340.0,PRE,2.9468994,14600000.0,,68.2774,0.982605,0.014391365,67.23295,2.0270538,0.03014971,,15.0,0.0,America/New_York,EDT,-14400000.0,False,False,False,0.39,PCX,73.65,63.15,2.38,,iShares Global Consumer Staples,73.1,0.0,-0.330977,KXI,,,,,,,,,,,,,,,415-670-2000,"The fund generally invests at least 80% of its assets in the component securities of its underlying index and in investments that have economic characteristics that are substantially identical to the component securities of its underlying index and may invest up to 20% of its assets in certain futures, options and swap contracts, cash and cash equivalents. The index measures the performance of global equities in the consumer staples sector.",[],[],86400,2,69.49,69.9,68.91,70.4785,69.49,69.9,68.91,70.4785,,197542,197542,65517,86830,86830,0.0,73.1,600.0,100.0,0.0238,1010230336.0,63.15,73.65,73.65,16.615,68.2774,67.23295,,,69.1675,USD,False,Consumer Defensive,5.88915,0.52,iShares,1158019200.0,Exchange Traded Fund,0.0686173,ETF,KXI,en-US,US,ETF,Delayed Quote,True,HIGH,PCX,finmb_29102231,America/New_York,EDT,-14400000,us_market,False,-0.330977,69.26,PRE,2.38,2.19081,2.19081,1010230340.0,,0.982605,0.014391365,2.0270538,0.03014971,0.39,15,0,False,[],,1784318400,,True,1158931800000,,,,-0.229996,68.91 - 70.4785,NYSEArca,65517,6.1100006,0.09675377,63.15 - 73.65,-4.3899994,-0.059606235,6.570244,iShares Global Consumer Staples,,"The fund generally invests at least 80% of its assets in the component securities of its underlying index and in investments that have economic characteristics that are substantially identical to the component securities of its underlying index and may invest up to 20% of its assets in certain futures, options and swap contracts, cash and cash equivalents. The index measures the performance of global equities in the consumer staples sector.",Consumer Defensive,iShares,Exchange Traded Fund,0.0058999998,0.9942,0.0,0.0,0.0,0.0,0.0,0.030299999,0.0,0.96970004,0.0,0.0,0.0,0.0,0.0,0.0,0.0,0.0,0.0039,0.0073669,0.17,0.2629,110711.2,110711.2,17.0,0.38999999999999996,49.4231594,"[{""Symbol"":""WMT"",""Name"":""Walmart Inc"",""Holding Percent"":0.0857656},{""Symbol"":""COST"",""Name"":""Costco Wholesale Corp"",""Holding Percent"":0.0716862},{""Symbol"":""PG"",""Name"":""Procter & Gamble Co"",""Holding Percent"":0.058980297},{""Symbol"":""NESN.SW"",""Name"":""Nestle SA"",""Holding Percent"":0.0467166},{""Symbol"":""PM"",""Name"":""Philip Morris International Inc"",""Holding Percent"":0.0448189},{""Symbol"":""KO"",""Name"":""Coca-Cola Co"",""Holding Percent"":0.0440666},{""Symbol"":""PEP"",""Name"":""PepsiCo Inc"",""Holding Percent"":0.042522997},{""Symbol"":""ULVR.L"",""Name"":""Unilever PLC"",""Holding Percent"":0.0349361},{""Symbol"":""BATS.L"",""Name"":""British American Tobacco PLC"",""Holding Percent"":0.0326875},{""Symbol"":""MO"",""Name"":""Altria Group Inc"",""Holding Percent"":0.0320508}]","[{""Average"":""Price\/Earnings"",""KXI"":0.04361,""Category Average"":null},{""Average"":""Price\/Book"",""KXI"":0.26417,""Category Average"":null},{""Average"":""Price\/Sales"",""KXI"":0.73961,""Category Average"":null},{""Average"":""Price\/Cashflow"",""KXI"":0.07479,""Category Average"":null},{""Average"":""Median Market Cap"",""KXI"":null,""Category Average"":null},{""Average"":""3 Year Earnings Growth"",""KXI"":null,""Category Average"":null}]",0.04361,0.26417,,"[{""Average"":""Duration"",""KXI"":null,""Category Average"":null},{""Average"":""Maturity"",""KXI"":null,""Category Average"":null},{""Average"":""Credit Quality"",""KXI"":null,""Category Average"":null}]",0.048396703,,,,,,,,,,,,,,,,,,,,,,,,,,,,,
Consumer Staples,consumer-defensive,6,RSPS,Invesco S&P 500 Equal Weight Consumer Staples ETF,https://finance.yahoo.com/research-hub/screener/sec-ind_sec-top-etfs_consumer-defensive/,2026-07-20T08:47:27+00:00,en-US,US,ETF,ETF,Nasdaq Real Time Price,False,LOW,2.97,21.422451,-5.36287,14.56468,USD,True,1162909800000.0,2.0,,,,,-0.219999,1784318391.0,30.85,31.7,30.74 - 31.7,30.74,143045.0,31.07,1900.0,2100.0,us_market,finmb_30119345,NYSEArca,Invesco S&P 500 Equal Weight Consumer Staples ETF,31.33,71177.0,54590.0,[],2.6400013,0.09358388,28.21 - 33.37,-2.5199986,-0.07551689,2.3896456,0.0,22.044117,0.0,4.89334,2.38435,2.38435,239920880.0,PRE,1.3994664,,,30.0864,0.7636013,0.025380282,30.0338,0.81620026,0.027176056,,15.0,0.0,America/New_York,EDT,-14400000.0,False,False,False,0.4,PCX,33.37,28.21,2.97,,Invesco S&P 500 Equal Weight Co,0.0,0.0,-0.708076,RSPS,,,,,,,,,,,,,,,,"The fund generally will invest at least 90% of its total assets in the securities that comprise the underlying index. The underlying index is composed of all of the components of the S&P 500® Consumer Staples Index, an index that contains the common stocks of all companies included in the S&P 500® Index that are classified as members of the consumer staples sector, as defined according to the Global Industry Classification Standard (""GICS"").",[],[],86400,2,31.07,31.33,30.74,31.7,31.07,31.33,30.74,31.7,22.044117,143045,143045,71177,54590,54590,0.0,0.0,1900.0,2100.0,0.0297,239920880.0,28.21,33.37,36.458,6.694,30.0864,30.0338,0.0,0.0,30.83,USD,False,Consumer Defensive,4.89334,0.58,Invesco,1162339200.0,Exchange Traded Fund,0.0022381,ETF,RSPS,en-US,US,ETF,Nasdaq Real Time Price,True,HIGH,PCX,finmb_30119345,America/New_York,EDT,-14400000,us_market,False,-0.708076,30.85,PRE,2.97,2.38435,2.38435,239920880.0,1.3994664,0.7636013,0.025380282,0.81620026,0.027176056,0.4,15,0,False,[],,1784318391,Invesco S&P 500 Equal Weight Consumer Staples ETF,True,1162909800000,,,,-0.219999,30.74 - 31.7,NYSEArca,71177,2.6400013,0.09358388,28.21 - 33.37,-2.5199986,-0.07551689,2.3896456,Invesco S&P 500 Equal Weight Co,,"The fund generally will invest at least 90% of its total assets in the securities that comprise the underlying index. The underlying index is composed of all of the components of the S&P 500® Consumer Staples Index, an index that contains the common stocks of all companies included in the S&P 500® Index that are classified as members of the consumer staples sector, as defined according to the Global Industry Classification Standard (""GICS"").",Consumer Defensive,Invesco,Exchange Traded Fund,-0.0014,1.0014,0.0,0.0,0.0,0.0,0.0,0.025899999,0.0,0.97410005,0.0,0.0,0.0,0.0,0.0,0.0,0.0,0.0,0.004,0.0073669,0.29,0.2629,44343.51,44343.51,28.999999999999996,0.4,31.435039999999997,"[{""Symbol"":""DLTR"",""Name"":""Dollar Tree Inc"",""Holding Percent"":0.0328091},{""Symbol"":""KMB"",""Name"":""Kimberly-Clark Corp"",""Holding Percent"":0.0323382},{""Symbol"":""SYY"",""Name"":""Sysco Corp"",""Holding Percent"":0.031846},{""Symbol"":""KVUE"",""Name"":""Kenvue Inc"",""Holding Percent"":0.0316832},{""Symbol"":""MNST"",""Name"":""Monster Beverage Corp"",""Holding Percent"":0.0315363},{""Symbol"":""DG"",""Name"":""Dollar General Corp"",""Holding Percent"":0.0313268},{""Symbol"":""KDP"",""Name"":""Keurig Dr Pepper Inc"",""Holding Percent"":0.030898},{""Symbol"":""GIS"",""Name"":""General Mills Inc"",""Holding Percent"":0.030793},{""Symbol"":""HRL"",""Name"":""Hormel Foods Corp"",""Holding Percent"":0.0305789},{""Symbol"":""TGT"",""Name"":""Target Corp"",""Holding Percent"":0.0305409}]","[{""Average"":""Price\/Earnings"",""RSPS"":0.04668,""Category Average"":null},{""Average"":""Price\/Book"",""RSPS"":0.37343,""Category Average"":null},{""Average"":""Price\/Sales"",""RSPS"":0.94565,""Category Average"":null},{""Average"":""Price\/Cashflow"",""RSPS"":0.08539,""Category Average"":null},{""Average"":""Median Market Cap"",""RSPS"":null,""Category Average"":null},{""Average"":""3 Year Earnings Growth"",""RSPS"":null,""Category Average"":null}]",0.04668,0.37343,,"[{""Average"":""Duration"",""RSPS"":null,""Category Average"":null},{""Average"":""Maturity"",""RSPS"":null,""Category Average"":null},{""Average"":""Credit Quality"",""RSPS"":null,""Category Average"":null}]",0.0187419,,,,,,,,,,,,,,,,,,,,,,,,,,,,,
Consumer Staples,consumer-defensive,7,FXG,First Trust Consumer Staples AlphaDEX Fund,https://finance.yahoo.com/research-hub/screener/sec-ind_sec-top-etfs_consumer-defensive/,2026-07-20T08:47:27+00:00,en-US,US,ETF,ETF,Delayed Quote,False,LOW,2.45,16.71123,1.93371,21.69684,USD,True,1178803800000.0,2.0,,,,,-0.290001,1784318390.0,64.44,65.65,64.2303 - 65.65,64.2303,8764.0,64.73,900.0,800.0,us_market,finmb_34336427,NYSEArca,First Trust Consumer Staples AlphaDEX Fund,65.06,14338.0,10640.0,[],4.7700043,0.079939745,59.67 - 69.5,-5.0599976,-0.07280572,2.204597,0.0,17.205172,0.0,4.18411,-1.44166,-1.44166,225321808.0,PRE,3.7453856,,,62.1928,2.2472038,0.03613286,63.285,1.1550026,0.018250812,,15.0,0.0,America/New_York,EDT,-14400000.0,False,False,False,0.63,PCX,69.5,59.67,2.45,,First Trust Cons. Staples Alpha,0.0,61.09,-0.448016,FXG,,,,,,,,,,,,,,,,The fund will normally invest at least 90% of its net assets (including investment borrowings) in the securities that comprise the index. The index is a modified equal-dollar weighted index to objectively identify and select stocks from the Russell 1000® Index in the consumer staples sector that may generate positive alpha relative to traditional passive-style indices through the use of the AlphaDEX® selection methodology.,[],[],86400,2,64.73,65.06,64.2303,65.65,64.73,65.06,64.2303,65.65,17.205172,8764,8764,14338,10640,10640,61.09,0.0,900.0,800.0,0.024500001,225321808.0,59.67,69.5,70.29,12.08,62.1928,63.285,0.0,0.0,64.49,USD,False,Consumer Defensive,4.18411,0.52,First Trust,1178582400.0,Exchange Traded Fund,0.0269162,ETF,FXG,en-US,US,ETF,Delayed Quote,True,HIGH,PCX,finmb_34336427,America/New_York,EDT,-14400000,us_market,False,-0.448016,64.44,PRE,2.45,-1.44166,-1.44166,225321808.0,3.7453856,2.2472038,0.03613286,1.1550026,0.018250812,0.63,15,0,False,[],,1784318390,First Trust Consumer Staples AlphaDEX Fund,True,1178803800000,,,,-0.290001,64.2303 - 65.65,NYSEArca,14338,4.7700043,0.079939745,59.67 - 69.5,-5.0599976,-0.07280572,2.204597,First Trust Cons. Staples Alpha,,The fund will normally invest at least 90% of its net assets (including investment borrowings) in the securities that comprise the index. The index is a modified equal-dollar weighted index to objectively identify and select stocks from the Russell 1000® Index in the consumer staples sector that may generate positive alpha relative to traditional passive-style indices through the use of the AlphaDEX® selection methodology.,Consumer Defensive,First Trust,Exchange Traded Fund,0.0005,0.9995,0.0,0.0,0.0,0.0,0.0,0.09020001,0.0,0.79080003,0.0,0.0,0.0,0.0,0.033800002,0.0,0.085200004,0.0,0.0063,0.0073669,0.81,0.2629,13877.21,13877.21,81.0,0.63,38.4620298,"[{""Symbol"":""CASY"",""Name"":""Casey's General Stores Inc"",""Holding Percent"":0.0467384},{""Symbol"":""REYN"",""Name"":""Reynolds Consumer Products Inc Ordinary Shares"",""Holding Percent"":0.0434099},{""Symbol"":""COKE"",""Name"":""Coca-Cola Consolidated Inc"",""Holding Percent"":0.0426203},{""Symbol"":""DAR"",""Name"":""Darling Ingredients Inc"",""Holding Percent"":0.0378001},{""Symbol"":""MCK"",""Name"":""McKesson Corp"",""Holding Percent"":0.037374698},{""Symbol"":""SFD"",""Name"":""Smithfield Foods Inc"",""Holding Percent"":0.037126},{""Symbol"":""INGR"",""Name"":""Ingredion Inc"",""Holding Percent"":0.0359837},{""Symbol"":""LW"",""Name"":""Lamb Weston Holdings Inc"",""Holding Percent"":0.0349885},{""Symbol"":""FRPT"",""Name"":""Freshpet Inc"",""Holding Percent"":0.0343358},{""Symbol"":""CPB"",""Name"":""The Campbell's Co"",""Holding Percent"":0.0342429}]","[{""Average"":""Price\/Earnings"",""FXG"":0.05984,""Category Average"":null},{""Average"":""Price\/Book"",""FXG"":0.47751,""Category Average"":null},{""Average"":""Price\/Sales"",""FXG"":1.69646,""Category Average"":null},{""Average"":""Price\/Cashflow"",""FXG"":0.10689,""Category Average"":null},{""Average"":""Median Market Cap"",""FXG"":null,""Category Average"":null},{""Average"":""3 Year Earnings Growth"",""FXG"":null,""Category Average"":null}]",0.05984,0.47751,,"[{""Average"":""Duration"",""FXG"":null,""Category Average"":null},{""Average"":""Maturity"",""FXG"":null,""Category Average"":null},{""Average"":""Credit Quality"",""FXG"":null,""Category Average"":null}]",0.047005102,,,,,,,,,,,,,,,,,,,,,,,,,,,,,
Consumer Staples,consumer-defensive,8,HIMZ,Defiance Daily Target 2X Long HIMS ETF,https://finance.yahoo.com/research-hub/screener/sec-ind_sec-top-etfs_consumer-defensive/,2026-07-20T08:47:27+00:00,en-US,US,ETF,ETF,Nasdaq Real Time Price,False,LOW,,,,,USD,True,1741872600000.0,2.0,0.1828003,0.43204984,1784536820.0,42.4928,-2.4000015,1784318401.0,42.31,45.33,39.77 - 45.33,39.77,192547.0,44.710003,1.0,1.0,us_market,finmb_1916075038,NasdaqGM,Defiance Daily Target 2X Long HIMS ETF,40.2788,779012.0,245100.0,[],29.934002,2.4187138,12.376 - 557.48,-515.17,-0.9241049,-84.10235,0.0,62.66895,0.0,-39.34286,113.98157,113.98157,129996784.0,PRE,0.675135,,,38.65998,3.6500206,0.09441341,81.18643,-38.87643,-0.4788538,,15.0,0.0,America/New_York,EDT,-14400000.0,False,False,False,1.29,NGM,557.48,12.376,4.02,,Defiance Daily Target 2X Long H,52.58,32.11,-5.36793,HIMZ,,2025-03-13,,,,,,,,,,,,,,"The fund is an actively managed exchange traded fund (“ETF”) that attempts to achieve two times (200%) the daily percentage change in the share price of the underlying security by employing derivatives, namely swap agreements and/or listed options contracts. The fund is non-diversified.",[],[],86400,2,44.710003,40.2788,39.77,45.33,44.710003,40.2788,39.77,45.33,62.66895,192547,192547,779012,245100,245100,32.11,52.58,1.0,1.0,0.0402,129996784.0,12.376,557.48,798.0,12.376,38.65998,81.18643,0.0,0.0,42.3089,USD,False,Trading--Leveraged Equity,-39.34286,0.0,Defiance ETFs LLC,1741737600.0,Exchange Traded Fund,,ETF,HIMZ,en-US,US,ETF,Nasdaq Real Time Price,True,HIGH,NGM,finmb_1916075038,America/New_York,EDT,-14400000,us_market,False,-5.36793,42.31,PRE,4.02,113.98157,113.98157,129996784.0,0.675135,3.6500206,0.09441341,-38.87643,-0.4788538,1.29,15,0,False,[],1784536820.0,1784318401,Defiance Daily Target 2X Long HIMS ETF,True,1741872600000,0.1828003,0.43204984,42.4928,-2.4000015,39.77 - 45.33,NasdaqGM,779012,29.934002,2.4187138,12.376 - 557.48,-515.17,-0.9241049,-84.10235,Defiance Daily Target 2X Long H,,"The fund is an actively managed exchange traded fund (“ETF”) that attempts to achieve two times (200%) the daily percentage change in the share price of the underlying security by employing derivatives, namely swap agreements and/or listed options contracts. The fund is non-diversified.",Trading--Leveraged Equity,Defiance ETFs LLC,Exchange Traded Fund,-1.0142,1.4505,0.0,0.0,0.0,0.56369996,0.0,0.0,0.0,1.0,0.0,0.0,0.0,0.0,0.0,0.0,0.0,0.1237,0.0128999995,0.0,2.51,,0.0,0.0,2.51,1.2899999500000001,1.26313,"[{""Symbol"":""FGXXX"",""Name"":""First American Government Obligs X"",""Holding Percent"":0.0126313}]","[{""Average"":""Price\/Earnings"",""HIMZ"":0.0,""Category Average"":null},{""Average"":""Price\/Book"",""HIMZ"":0.0,""Category Average"":null},{""Average"":""Price\/Sales"",""HIMZ"":0.0,""Category Average"":null},{""Average"":""Price\/Cashflow"",""HIMZ"":0.0,""Category Average"":null},{""Average"":""Median Market Cap"",""HIMZ"":null,""Category Average"":null},{""Average"":""3 Year Earnings Growth"",""HIMZ"":null,""Category Average"":null}]",0.0,0.0,,"[{""Average"":""Duration"",""HIMZ"":null,""Category Average"":null},{""Average"":""Maturity"",""HIMZ"":null,""Category Average"":null},{""Average"":""Credit Quality"",""HIMZ"":null,""Category Average"":null}]",,,,,,,,,,,2025-03-13,,,,,,,,,,,,,,,,,,,
Consumer Staples,consumer-defensive,9,PBJ,Invesco Food & Beverage ETF,https://finance.yahoo.com/research-hub/screener/sec-ind_sec-top-etfs_consumer-defensive/,2026-07-20T08:47:27+00:00,en-US,US,ETF,ETF,Nasdaq Real Time Price,False,LOW,1.3,20.234723,2.34742,26.8013,USD,True,1119533400000.0,2.0,,,,,-0.2309,1784318400.0,48.61,49.6,48.35 - 49.6,48.35,17806.0,48.8409,100.0,200.0,us_market,finmb_22938452,NYSEArca,Invesco Food & Beverage ETF,49.01,17201.0,59580.0,[],5.920002,0.13867421,42.69 - 51.07,-2.459999,-0.048169162,0.95534325,0.876,20.870146,0.017935786,5.80914,-3.58991,-3.58991,89031552.0,PRE,2.3291645,2100000.0,43.303,47.9848,0.6252022,0.013029172,47.2644,1.3456001,0.028469633,1.122555,15.0,0.0,America/New_York,EDT,-14400000.0,False,False,False,0.61,PCX,51.07,42.69,1.3,USD,Invesco Food & Beverage ETF,50.92,46.42,-0.472759,PBJ,,,,,,,,,,,,,,,,"The fund generally will invest at least 90% of its total assets in securities that comprise the underlying index. The underlying index is composed of common stocks of U.S. food and beverage companies. These companies are engaged principally in the manufacture, sale or distribution of food and beverage products, agricultural products and products related to the development of new food technologies. The fund is non-diversified.",[],[],86400,2,48.8409,49.01,48.35,49.6,48.8409,49.01,48.35,49.6,,17806,17806,17201,59580,59580,46.42,50.92,100.0,200.0,0.012999999,89031552.0,42.69,51.07,51.07,9.53,47.9848,47.2644,,,48.55,USD,False,Consumer Defensive,5.80914,0.54,Invesco,1119484800.0,Exchange Traded Fund,0.0396457,ETF,PBJ,en-US,US,ETF,Delayed Quote,True,HIGH,PCX,finmb_22938452,America/New_York,EDT,-14400000,us_market,False,-0.472759,48.61,PRE,1.3,-3.58991,-3.58991,89031552.0,,0.6252022,0.013029172,1.3456001,0.028469633,0.61,15,0,False,[],,1784318400,,True,1119533400000,,,,-0.2309,48.35 - 49.6,NYSEArca,17201,5.920002,0.13867421,42.69 - 51.07,-2.459999,-0.048169162,0.95534325,Invesco Food & Beverage ETF,,"The fund generally will invest at least 90% of its total assets in securities that comprise the underlying index. The underlying index is composed of common stocks of U.S. food and beverage companies. These companies are engaged principally in the manufacture, sale or distribution of food and beverage products, agricultural products and products related to the development of new food technologies. The fund is non-diversified.",Consumer Defensive,Invesco,Exchange Traded Fund,0.0019,0.9982,0.0,0.0,0.0,0.0,0.0,0.1097,0.0547,0.78,0.0,0.0,0.0,0.0,0.0556,0.0,0.0,0.0,0.0061000003,0.0073669,1.07,0.2629,13307.65,13307.65,107.0,0.61000003,46.61512,"[{""Symbol"":""MNST"",""Name"":""Monster Beverage Corp"",""Holding Percent"":0.0560482},{""Symbol"":""CTVA"",""Name"":""Corteva Inc"",""Holding Percent"":0.0545854},{""Symbol"":""KO"",""Name"":""Coca-Cola Co"",""Holding Percent"":0.0514891},{""Symbol"":""SBUX"",""Name"":""Starbucks Corp"",""Holding Percent"":0.0513619},{""Symbol"":""ADM"",""Name"":""Archer-Daniels-Midland Co"",""Holding Percent"":0.0499232},{""Symbol"":""PEP"",""Name"":""PepsiCo Inc"",""Holding Percent"":0.047378898},{""Symbol"":""HSY"",""Name"":""The Hershey Co"",""Holding Percent"":0.0467962},{""Symbol"":""KR"",""Name"":""The Kroger Co"",""Holding Percent"":0.043852802},{""Symbol"":""CART"",""Name"":""Maplebear Inc"",""Holding Percent"":0.0324838},{""Symbol"":""FRPT"",""Name"":""Freshpet Inc"",""Holding Percent"":0.0322317}]","[{""Average"":""Price\/Earnings"",""PBJ"":0.04942,""Category Average"":null},{""Average"":""Price\/Book"",""PBJ"":0.54745,""Category Average"":null},{""Average"":""Price\/Sales"",""PBJ"":2.09512,""Category Average"":null},{""Average"":""Price\/Cashflow"",""PBJ"":0.12054,""Category Average"":null},{""Average"":""Median Market Cap"",""PBJ"":null,""Category Average"":null},{""Average"":""3 Year Earnings Growth"",""PBJ"":null,""Category Average"":null}]",0.04942,0.54745,,"[{""Average"":""Duration"",""PBJ"":null,""Category Average"":null},{""Average"":""Maturity"",""PBJ"":null,""Category Average"":null},{""Average"":""Credit Quality"",""PBJ"":null,""Category Average"":null}]",0.0501472,,,,,,,,,,,,,,,,,,,,,,,,,,,,,
Consumer Staples,consumer-defensive,10,PSL,Invesco Dorsey Wright Consumer Staples Momentum ETF,https://finance.yahoo.com/research-hub/screener/sec-ind_sec-top-etfs_consumer-defensive/,2026-07-20T08:47:27+00:00,en-US,US,ETF,ETF,Nasdaq Real Time Price,False,LOW,0.75,24.113817,12.37503,6.57046,USD,True,1160659800000.0,2.0,,,,,0.040496826,1784318400.0,114.0405,115.38,113.87 - 115.38,113.87,4460.0,114.0,3.0,3.0,us_market,finmb_29596672,NasdaqGM,Invesco Dorsey Wright Consumer Staples Momentum ETF,115.38,1814.0,2180.0,[],16.080498,0.16415371,97.96 - 117.12,-3.079506,-0.026293594,4.729545,0.0,24.553074,0.0,12.08454,3.47037,3.47037,82995288.0,PRE,4.6446524,,,111.8512,2.1893005,0.01957333,108.3249,5.715599,0.052763484,,15.0,0.0,America/New_York,EDT,-14400000.0,False,False,False,0.6,NGM,117.12,97.96,0.75,,Invesco Dorsey Wright Consumer ,114.36,113.8,0.035523534,PSL,1522281600.0,,,,,,,,,,,,,,,"The fund generally will invest at least 90% of its total assets in securities that comprise the underlying index. The underlying index is composed of at least 30 securities of companies in the consumer staples sector that have powerful relative strength or ""momentum"" characteristics.",[],[],86400,2,114.0,115.38,113.87,115.38,114.0,115.38,113.87,115.38,24.553074,4460,4460,1814,2180,2180,113.8,114.36,3.0,3.0,0.0075,82995288.0,97.96,117.12,117.12,16.11,111.8512,108.3249,0.0,0.0,114.1,USD,False,Consumer Defensive,12.08454,0.72,Invesco,1160611200.0,Exchange Traded Fund,0.1045644,ETF,PSL,en-US,US,ETF,Nasdaq Real Time Price,True,HIGH,NGM,finmb_29596672,America/New_York,EDT,-14400000,us_market,False,0.035523534,114.0405,PRE,0.75,3.47037,3.47037,82995288.0,4.6446524,2.1893005,0.01957333,5.715599,0.052763484,0.6,15,0,False,[],,1784318400,Invesco Dorsey Wright Consumer Staples Momentum ETF,True,1160659800000,,,,0.040496826,113.87 - 115.38,NasdaqGM,1814,16.080498,0.16415371,97.96 - 117.12,-3.079506,-0.026293594,4.729545,Invesco Dorsey Wright Consumer ,,"The fund generally will invest at least 90% of its total assets in securities that comprise the underlying index. The underlying index is composed of at least 30 securities of companies in the consumer staples sector that have powerful relative strength or ""momentum"" characteristics.",Consumer Defensive,Invesco,Exchange Traded Fund,0.0011999999,0.9988,0.0,0.0,0.0,0.0,0.0,0.10560001,0.0,0.8639,0.0,0.0,0.0187,0.0,0.0117,0.0,0.0,0.0,0.006,0.0073669,0.8,0.2629,17404.87,17404.87,80.0,0.6,42.8910199,"[{""Symbol"":""CASY"",""Name"":""Casey's General Stores Inc"",""Holding Percent"":0.0590461},{""Symbol"":""USFD"",""Name"":""US Foods Holding Corp"",""Holding Percent"":0.054094702},{""Symbol"":""COST"",""Name"":""Costco Wholesale Corp"",""Holding Percent"":0.049612097},{""Symbol"":""PFGC"",""Name"":""Performance Food Group Co"",""Holding Percent"":0.0489933},{""Symbol"":""CHD"",""Name"":""Church & Dwight Co Inc"",""Holding Percent"":0.0463024},{""Symbol"":""MNST"",""Name"":""Monster Beverage Corp"",""Holding Percent"":0.0390701},{""Symbol"":""PM"",""Name"":""Philip Morris International Inc"",""Holding Percent"":0.037853},{""Symbol"":""MO"",""Name"":""Altria Group Inc"",""Holding Percent"":0.0331802},{""Symbol"":""KR"",""Name"":""The Kroger Co"",""Holding Percent"":0.030661099},{""Symbol"":""ADM"",""Name"":""Archer-Daniels-Midland Co"",""Holding Percent"":0.030097201}]","[{""Average"":""Price\/Earnings"",""PSL"":0.04147,""Category Average"":null},{""Average"":""Price\/Book"",""PSL"":0.31647,""Category Average"":null},{""Average"":""Price\/Sales"",""PSL"":1.27006,""Category Average"":null},{""Average"":""Price\/Cashflow"",""PSL"":0.07938,""Category Average"":null},{""Average"":""Median Market Cap"",""PSL"":null,""Category Average"":null},{""Average"":""3 Year Earnings Growth"",""PSL"":null,""Category Average"":null}]",0.04147,0.31647,,"[{""Average"":""Duration"",""PSL"":null,""Category Average"":null},{""Average"":""Maturity"",""PSL"":null,""Category Average"":null},{""Average"":""Credit Quality"",""PSL"":null,""Category Average"":null}]",0.0574991,1522281600.0,,,,,,,,,,,,,,,,,,,,,,,,,,,,
