sector,yahoo_sector_key,rank,ticker,etf_name,source_url,retrieved_at_utc,screen_language,screen_region,screen_quote_type,screen_type_disp,screen_quote_source_name,screen_triggerable,screen_custom_price_alert_confidence,screen_yield_ttm,screen_pe_ttm,screen_annual_return_nav_y3,screen_annual_return_nav_y5,screen_currency,screen_has_pre_post_market_data,screen_first_trade_date_milliseconds,screen_price_hint,screen_pre_market_change,screen_pre_market_change_percent,screen_pre_market_time,screen_pre_market_price,screen_regular_market_change,screen_regular_market_time,screen_regular_market_price,screen_regular_market_day_high,screen_regular_market_day_range,screen_regular_market_day_low,screen_regular_market_volume,screen_regular_market_previous_close,screen_bid_size,screen_ask_size,screen_market,screen_message_board_id,screen_full_exchange_name,screen_long_name,screen_regular_market_open,screen_average_daily_volume3_month,screen_average_daily_volume10_day,screen_corporate_actions,screen_fifty_two_week_low_change,screen_fifty_two_week_low_change_percent,screen_fifty_two_week_range,screen_fifty_two_week_high_change,screen_fifty_two_week_high_change_percent,screen_fifty_two_week_change_percent,screen_trailing_annual_dividend_rate,screen_trailing_pe,screen_trailing_annual_dividend_yield,screen_ytd_return,screen_trailing_three_month_returns,screen_trailing_three_month_nav_returns,screen_net_assets,screen_market_state,screen_eps_trailing_twelve_months,screen_shares_outstanding,screen_book_value,screen_fifty_day_average,screen_fifty_day_average_change,screen_fifty_day_average_change_percent,screen_two_hundred_day_average,screen_two_hundred_day_average_change,screen_two_hundred_day_average_change_percent,screen_price_to_book,screen_source_interval,screen_exchange_data_delayed_by,screen_exchange_timezone_name,screen_exchange_timezone_short_name,screen_gmt_off_set_milliseconds,screen_esg_populated,screen_tradeable,screen_crypto_tradeable,screen_net_expense_ratio,screen_exchange,screen_fifty_two_week_high,screen_fifty_two_week_low,screen_dividend_yield,screen_financial_currency,screen_short_name,screen_ask,screen_bid,screen_regular_market_change_percent,screen_symbol,screen_dividend_date,screen_ipo_expected_date,screen_earnings_timestamp_start,screen_earnings_timestamp_end,screen_earnings_call_timestamp_start,screen_earnings_call_timestamp_end,screen_is_earnings_date_estimate,screen_prev_name,screen_name_change_date,screen_eps_forward,screen_forward_pe,screen_display_name,screen_implied_shares_outstanding,screen_market_cap,info_phone,info_long_business_summary,info_company_officers,info_executive_team,info_max_age,info_price_hint,info_previous_close,info_open,info_day_low,info_day_high,info_regular_market_previous_close,info_regular_market_open,info_regular_market_day_low,info_regular_market_day_high,info_trailing_pe,info_volume,info_regular_market_volume,info_average_volume,info_average_volume10days,info_average_daily_volume10_day,info_bid,info_ask,info_bid_size,info_ask_size,info_yield,info_total_assets,info_fifty_two_week_low,info_fifty_two_week_high,info_all_time_high,info_all_time_low,info_fifty_day_average,info_two_hundred_day_average,info_trailing_annual_dividend_rate,info_trailing_annual_dividend_yield,info_nav_price,info_currency,info_tradeable,info_category,info_ytd_return,info_beta3_year,info_fund_family,info_fund_inception_date,info_legal_type,info_three_year_average_return,info_quote_type,info_symbol,info_language,info_region,info_type_disp,info_quote_source_name,info_triggerable,info_custom_price_alert_confidence,info_exchange,info_message_board_id,info_exchange_timezone_name,info_exchange_timezone_short_name,info_gmt_off_set_milliseconds,info_market,info_esg_populated,info_regular_market_change_percent,info_regular_market_price,info_market_state,info_dividend_yield,info_trailing_three_month_returns,info_trailing_three_month_nav_returns,info_net_assets,info_eps_trailing_twelve_months,info_fifty_day_average_change,info_fifty_day_average_change_percent,info_two_hundred_day_average_change,info_two_hundred_day_average_change_percent,info_net_expense_ratio,info_source_interval,info_exchange_data_delayed_by,info_crypto_tradeable,info_corporate_actions,info_pre_market_time,info_regular_market_time,info_long_name,info_has_pre_post_market_data,info_first_trade_date_milliseconds,info_pre_market_change,info_pre_market_change_percent,info_pre_market_price,info_regular_market_change,info_regular_market_day_range,info_full_exchange_name,info_average_daily_volume3_month,info_fifty_two_week_low_change,info_fifty_two_week_low_change_percent,info_fifty_two_week_range,info_fifty_two_week_high_change,info_fifty_two_week_high_change_percent,info_fifty_two_week_change_percent,info_short_name,info_trailing_peg_ratio,fund_description,fund_overview_category_name,fund_overview_family,fund_overview_legal_type,fund_asset_class_cash_position,fund_asset_class_stock_position,fund_asset_class_bond_position,fund_asset_class_preferred_position,fund_asset_class_convertible_position,fund_asset_class_other_position,fund_sector_weight_realestate,fund_sector_weight_consumer_cyclical,fund_sector_weight_basic_materials,fund_sector_weight_consumer_defensive,fund_sector_weight_technology,fund_sector_weight_communication_services,fund_sector_weight_financial_services,fund_sector_weight_utilities,fund_sector_weight_industrials,fund_sector_weight_energy,fund_sector_weight_healthcare,fund_bond_rating_us_government,fund_annual_report_expense_ratio,fund_annual_report_expense_ratio_category_average,fund_annual_holdings_turnover,fund_annual_holdings_turnover_category_average,fund_total_net_assets,fund_total_net_assets_category_average,compact_annual_holdings_turnover_pct,compact_expense_ratio_pct,compact_top_10_holdings_weight_pct,fund_top_holdings_json,fund_equity_holdings_json,compact_price_to_earnings,compact_price_to_book,compact_weighted_average_market_cap,fund_bond_holdings_json,info_five_year_average_return,info_dividend_date,fund_bond_rating_bb,fund_bond_rating_aa,fund_bond_rating_aaa,fund_bond_rating_a,fund_bond_rating_other,fund_bond_rating_b,fund_bond_rating_bbb,fund_bond_rating_below_b,info_ipo_expected_date,info_earnings_timestamp_start,info_earnings_timestamp_end,info_current_price,info_recommendation_key,retrieval_errors,info_display_name,info_financial_currency,info_earnings_call_timestamp_start,info_earnings_call_timestamp_end,info_is_earnings_date_estimate,info_book_value,info_price_to_book,info_prev_name,info_name_change_date,info_forward_pe,info_eps_forward,info_shares_outstanding,info_market_cap,info_implied_shares_outstanding
Consumer Staples,consumer-defensive,1,XLP,State Street Consumer Staples Select Sector SPDR ETF,https://finance.yahoo.com/research-hub/screener/sec-ind_sec-top-etfs_consumer-defensive/,2026-07-20T08:47:27+00:00,en-US,US,ETF,ETF,Nasdaq Real Time Price,False,LOW,2.64,25.28445,-0.88677,17.12011,USD,True,914337000000.0,2.0,0.1800003,0.21126798,1784536125.0,85.38,-0.619995,1784318400.0,85.19,87.42,84.755 - 87.42,84.755,15432862.0,85.81,2100.0,200.0,us_market,finmb_2668776,NYSEArca,State Street Consumer Staples Select Sector SPDR ETF,86.79,11885077.0,10825290.0,[],10.029999,0.13344862,75.16 - 90.14,-4.949997,-0.054914545,5.3288817,1.73,25.915691,0.02016082,8.34449,2.1135,2.1135,13649293300.0,PRE,3.2871978,210172000.0,68.177,84.1648,1.0251999,0.012180863,82.00225,3.1877518,0.038873956,1.2495416,15.0,0.0,America/New_York,EDT,-14400000.0,False,False,False,0.08,PCX,90.14,75.16,2.64,USD,State Street Consumer Staples S,86.41,84.5,-0.722521,XLP,,,,,,,,,,,,,,,,"In seeking to track the performance of the index, the fund employs a replication strategy. It generally invests substantially all, but at least 95%, of its total assets in the securities comprising the index. The index includes companies that have been identified as Consumer Staples companies by the GICS®. It is non-diversified.",[],[],86400,2,85.81,86.79,84.755,87.42,85.81,86.79,84.755,87.42,25.915691,15431978,15431978,11885077,10825290,10825290,84.5,86.41,2100.0,200.0,0.026400002,13649293312.0,75.16,90.14,90.14,17.82,84.1648,82.00225,1.73,0.02016082,85.21209,USD,False,Consumer Defensive,8.34449,0.53,State Street Investment Management,913766400.0,Exchange Traded Fund,0.0765765,ETF,XLP,en-US,US,ETF,Nasdaq Real Time Price,True,HIGH,PCX,finmb_2668776,America/New_York,EDT,-14400000,us_market,False,-0.722521,85.19,PRE,2.64,2.1135,2.1135,13649293300.0,3.2871978,1.0251999,0.012180863,3.1877518,0.038873956,0.08,15,0,False,[],1784536125.0,1784318400,State Street Consumer Staples Select Sector SPDR ETF,True,914337000000,0.1800003,0.21126798,85.38,-0.619995,84.755 - 87.42,NYSEArca,11885077,10.029999,0.13344862,75.16 - 90.14,-4.949997,-0.054914545,5.3288817,State Street Consumer Staples S,,"In seeking to track the performance of the index, the fund employs a replication strategy. It generally invests substantially all, but at least 95%, of its total assets in the securities comprising the index. The index includes companies that have been identified as Consumer Staples companies by the GICS®. It is non-diversified.",Consumer Defensive,State Street Investment Management,Exchange Traded Fund,0.0014,0.9986,0.0,0.0,0.0,0.0,0.0,0.0191,0.0,0.9809,0.0,0.0,0.0,0.0,0.0,0.0,0.0,0.0,0.0008,0.0073669,0.08,0.2629,118256.01,118256.01,8.0,0.08,62.30989929999999,"[{""Symbol"":""WMT"",""Name"":""Walmart Inc"",""Holding Percent"":0.1078668},{""Symbol"":""COST"",""Name"":""Costco Wholesale Corp"",""Holding Percent"":0.0901589},{""Symbol"":""PG"",""Name"":""Procter & Gamble Co"",""Holding Percent"":0.0741792},{""Symbol"":""KO"",""Name"":""Coca-Cola Co"",""Holding Percent"":0.068364},{""Symbol"":""PM"",""Name"":""Philip Morris International Inc"",""Holding Percent"":0.0612522},{""Symbol"":""CL"",""Name"":""Colgate-Palmolive Co"",""Holding Percent"":0.046898097},{""Symbol"":""MO"",""Name"":""Altria Group Inc"",""Holding Percent"":0.0452707},{""Symbol"":""MNST"",""Name"":""Monster Beverage Corp"",""Holding Percent"":0.0444723},{""Symbol"":""PEP"",""Name"":""PepsiCo Inc"",""Holding Percent"":0.043169096},{""Symbol"":""MDLZ"",""Name"":""Mondelez International Inc Class A"",""Holding Percent"":0.0414677}]","[{""Average"":""Price\/Earnings"",""XLP"":0.03955,""Category Average"":null},{""Average"":""Price\/Book"",""XLP"":0.231,""Category Average"":null},{""Average"":""Price\/Sales"",""XLP"":0.73866,""Category Average"":null},{""Average"":""Price\/Cashflow"",""XLP"":0.06674,""Category Average"":null},{""Average"":""Median Market Cap"",""XLP"":null,""Category Average"":null},{""Average"":""3 Year Earnings Growth"",""XLP"":null,""Category Average"":null}]",0.03955,0.231,,"[{""Average"":""Duration"",""XLP"":null,""Category Average"":null},{""Average"":""Maturity"",""XLP"":null,""Category Average"":null},{""Average"":""Credit Quality"",""XLP"":null,""Category Average"":null}]",0.064671405,,,,,,,,,,,,,,,,,USD,,,,68.177,1.2495416,,,,,210172000.0,,
Consumer Staples,consumer-defensive,2,VDC,Vanguard Consumer Staples Index Fund ETF Shares,https://finance.yahoo.com/research-hub/screener/sec-ind_sec-top-etfs_consumer-defensive/,2026-07-20T08:47:27+00:00,en-US,US,ETF,ETF,Delayed Quote,False,LOW,2.13,25.006252,2.36621,17.48632,USD,True,1075473000000.0,2.0,1.6799927,0.7294167,1784534503.0,232.0,-2.01999,1784318400.0,230.32,236.22,229.29 - 236.22,229.29,144050.0,232.34,100.0,100.0,us_market,finmb_22939079,NYSEArca,Vanguard Consumer Staples Index Fund ETF Shares,234.59,161259.0,145430.0,[],24.87001,0.1210514,205.45 - 244.33,-14.0099945,-0.057340458,5.371034,0.0,25.541885,0.0,8.06254,1.04419,1.04419,9185586200.0,PRE,9.017345,,,228.4572,1.8628082,0.00815386,223.3569,6.9631042,0.031174788,,15.0,0.0,America/New_York,EDT,-14400000.0,False,False,False,0.09,PCX,244.33,205.45,2.13,,Vanguard Consumer Staples ETF,238.69,217.21,-0.869411,VDC,,,,,,,,,,,,,,,,"The fund employs an indexing investment approach designed to track the performance of the index, an index made up of stocks of large, mid-size, and small U.S. companies within the consumer staples sector, as classified under the GICS. The Advisor attempts to replicate the target index by seeking to invest all, or substantially all, of its assets in the stocks that make up the index, in order to hold each stock in approximately the same proportion as its weighting in the index. The fund is non-diversified.",[],[],86400,2,232.34,234.59,229.29,236.22,232.34,234.59,229.29,236.22,25.541885,144050,144050,161259,145430,145430,217.21,238.69,100.0,100.0,0.021300001,9185586176.0,205.45,244.33,244.33,30.0,228.4572,223.3569,0.0,0.0,230.39,USD,False,Consumer Defensive,8.06254,0.54,Vanguard,1075075200.0,Exchange Traded Fund,0.0836374,ETF,VDC,en-US,US,ETF,Delayed Quote,True,HIGH,PCX,finmb_22939079,America/New_York,EDT,-14400000,us_market,False,-0.869411,230.32,PRE,2.13,1.04419,1.04419,9185586200.0,9.017345,1.8628082,0.00815386,6.9631042,0.031174788,0.09,15,0,False,[],1784534503.0,1784318400,Vanguard Consumer Staples Index Fund ETF Shares,True,1075473000000,1.6799927,0.7294167,232.0,-2.01999,229.29 - 236.22,NYSEArca,161259,24.87001,0.1210514,205.45 - 244.33,-14.0099945,-0.057340458,5.371034,Vanguard Consumer Staples ETF,,"The fund employs an indexing investment approach designed to track the performance of the index, an index made up of stocks of large, mid-size, and small U.S. companies within the consumer staples sector, as classified under the GICS. The Advisor attempts to replicate the target index by seeking to invest all, or substantially all, of its assets in the stocks that make up the index, in order to hold each stock in approximately the same proportion as its weighting in the index. The fund is non-diversified.",Consumer Defensive,Vanguard,Exchange Traded Fund,0.0053,0.9924,0.0,0.0,0.0,0.0023,0.0,0.0178,0.0044,0.97449994,0.0,0.0,0.0,0.0,0.0031,0.0,0.0002,0.0,0.00090000004,0.0073669,0.09,0.2629,99727.38,99727.38,9.0,0.09000000400000001,61.91343829999999,"[{""Symbol"":""WMT"",""Name"":""Walmart Inc"",""Holding Percent"":0.13965589},{""Symbol"":""COST"",""Name"":""Costco Wholesale Corp"",""Holding Percent"":0.113956496},{""Symbol"":""PG"",""Name"":""Procter & Gamble Co"",""Holding Percent"":0.0873991},{""Symbol"":""KO"",""Name"":""Coca-Cola Co"",""Holding Percent"":0.0801222},{""Symbol"":""PM"",""Name"":""Philip Morris International Inc"",""Holding Percent"":0.043797698},{""Symbol"":""PEP"",""Name"":""PepsiCo Inc"",""Holding Percent"":0.0417593},{""Symbol"":""MO"",""Name"":""Altria Group Inc"",""Holding Percent"":0.039686},{""Symbol"":""MDLZ"",""Name"":""Mondelez International Inc Class A"",""Holding Percent"":0.024985699},{""Symbol"":""MNST"",""Name"":""Monster Beverage Corp"",""Holding Percent"":0.0239942},{""Symbol"":""CL"",""Name"":""Colgate-Palmolive Co"",""Holding Percent"":0.0237778}]","[{""Average"":""Price\/Earnings"",""VDC"":0.03999,""Category Average"":null},{""Average"":""Price\/Book"",""VDC"":0.24903,""Category Average"":null},{""Average"":""Price\/Sales"",""VDC"":0.85678,""Category Average"":null},{""Average"":""Price\/Cashflow"",""VDC"":0.06864,""Category Average"":null},{""Average"":""Median Market Cap"",""VDC"":null,""Category Average"":null},{""Average"":""3 Year Earnings Growth"",""VDC"":null,""Category Average"":null}]",0.03999,0.24903,,"[{""Average"":""Duration"",""VDC"":null,""Category Average"":null},{""Average"":""Maturity"",""VDC"":null,""Category Average"":null},{""Average"":""Credit Quality"",""VDC"":null,""Category Average"":null}]",0.0709592,,,,,,,,,,,,,,,,,,,,,,,,,,,,,
Consumer Staples,consumer-defensive,3,FSTA,Fidelity MSCI Consumer Staples Index ETF,https://finance.yahoo.com/research-hub/screener/sec-ind_sec-top-etfs_consumer-defensive/,2026-07-20T08:47:27+00:00,en-US,US,ETF,ETF,Delayed Quote,False,LOW,2.21,24.975025,2.28641,17.508,USD,True,1382621400000.0,2.0,,,,,-0.48,1784318400.0,53.64,55.045,53.41 - 55.045,53.41,207615.0,54.12,200.0,600.0,us_market,finmb_243638583,NYSEArca,Fidelity MSCI Consumer Staples Index ETF,54.57,134361.0,115350.0,[],5.7599983,0.12030072,47.88 - 56.93,-3.290001,-0.057790283,5.073452,0.0,25.483988,0.0,8.07587,1.04898,1.04898,1385185280.0,PRE,2.104851,,,53.1972,0.4427986,0.008323721,52.0426,1.5974007,0.0306941,,15.0,0.0,America/New_York,EDT,-14400000.0,False,False,False,0.084,PCX,56.93,47.88,2.21,,Fidelity MSCI COnsumer Staples ,56.7,50.59,-0.886917,FSTA,,,,,,,,,,,,,,,,"The fund invests at least 80% of assets in securities included in the fund's underlying index. The fund's underlying index is the MSCI USA IMI Consumer Staples 25/50 Index, which represents the performance of the consumer staples sector in the U.S. equity market. It may or may not hold all of the securities in the MSCI USA IMI Consumer Staples 25/50 Index. The fund is non-diversified.",[],[],86400,2,54.12,54.57,53.41,55.045,54.12,54.57,53.41,55.045,25.483988,207615,207615,134361,115350,115350,50.59,56.7,200.0,600.0,0.0221,1385185280.0,47.88,56.93,56.93,24.12,53.1972,52.0426,0.0,0.0,53.66142,USD,False,Consumer Defensive,8.07587,0.54,Fidelity Investments,1382313600.0,Exchange Traded Fund,0.0830793,ETF,FSTA,en-US,US,ETF,Delayed Quote,True,HIGH,PCX,finmb_243638583,America/New_York,EDT,-14400000,us_market,False,-0.886917,53.64,PRE,2.21,1.04898,1.04898,1385185280.0,2.104851,0.4427986,0.008323721,1.5974007,0.0306941,0.084,15,0,False,[],,1784318400,Fidelity MSCI Consumer Staples Index ETF,True,1382621400000,,,,-0.48,53.41 - 55.045,NYSEArca,134361,5.7599983,0.12030072,47.88 - 56.93,-3.290001,-0.057790283,5.073452,Fidelity MSCI COnsumer Staples ,,"The fund invests at least 80% of assets in securities included in the fund's underlying index. The fund's underlying index is the MSCI USA IMI Consumer Staples 25/50 Index, which represents the performance of the consumer staples sector in the U.S. equity market. It may or may not hold all of the securities in the MSCI USA IMI Consumer Staples 25/50 Index. The fund is non-diversified.",Consumer Defensive,Fidelity Investments,Exchange Traded Fund,0.0015,0.9985,0.0,0.0,0.0,0.0,0.0,0.0177,0.0044,0.97480005,0.0,0.0,0.0,0.0,0.0031,0.0,0.0,0.0,0.00084,0.0073669,0.13,0.2629,100804.39,100804.39,13.0,0.084,62.007611499999996,"[{""Symbol"":""WMT"",""Name"":""Walmart Inc"",""Holding Percent"":0.1393421},{""Symbol"":""COST"",""Name"":""Costco Wholesale Corp"",""Holding Percent"":0.113706306},{""Symbol"":""PG"",""Name"":""Procter & Gamble Co"",""Holding Percent"":0.087207206},{""Symbol"":""KO"",""Name"":""Coca-Cola Co"",""Holding Percent"":0.0803117},{""Symbol"":""PM"",""Name"":""Philip Morris International Inc"",""Holding Percent"":0.043645803},{""Symbol"":""PEP"",""Name"":""PepsiCo Inc"",""Holding Percent"":0.0421677},{""Symbol"":""MO"",""Name"":""Altria Group Inc"",""Holding Percent"":0.0403185},{""Symbol"":""MDLZ"",""Name"":""Mondelez International Inc Class A"",""Holding Percent"":0.0256619},{""Symbol"":""MNST"",""Name"":""Monster Beverage Corp"",""Holding Percent"":0.0240297},{""Symbol"":""CL"",""Name"":""Colgate-Palmolive Co"",""Holding Percent"":0.0236852}]","[{""Average"":""Price\/Earnings"",""FSTA"":0.04004,""Category Average"":null},{""Average"":""Price\/Book"",""FSTA"":0.24655,""Category Average"":null},{""Average"":""Price\/Sales"",""FSTA"":0.8463,""Category Average"":null},{""Average"":""Price\/Cashflow"",""FSTA"":0.06847,""Category Average"":null},{""Average"":""Median Market Cap"",""FSTA"":null,""Category Average"":null},{""Average"":""3 Year Earnings Growth"",""FSTA"":null,""Category Average"":null}]",0.04004,0.24655,,"[{""Average"":""Duration"",""FSTA"":null,""Category Average"":null},{""Average"":""Maturity"",""FSTA"":null,""Category Average"":null},{""Average"":""Credit Quality"",""FSTA"":null,""Category Average"":null}]",0.070146896,,,,,,,,,,,,,,,,,,,,,,,,,,,,,
Consumer Staples,consumer-defensive,4,IYK,iShares US Consumer Staples ETF,https://finance.yahoo.com/research-hub/screener/sec-ind_sec-top-etfs_consumer-defensive/,2026-07-20T08:47:27+00:00,en-US,US,ETF,ETF,Nasdaq Real Time Price,False,LOW,2.61,24.096386,-2.76543,17.28525,USD,True,961162200000.0,2.0,,,,,-0.470001,1784318400.0,74.78,76.4,74.37 - 76.4,74.37,367669.0,75.25,100.0,200.0,us_market,finmb_8796322,NYSEArca,iShares US Consumer Staples ETF,75.83,283480.0,174440.0,[],9.57,0.14675663,65.21 - 77.7,-2.9199982,-0.037580416,6.4332485,2.45,24.794828,0.03255814,9.71416,4.34219,4.34219,1344460290.0,PRE,3.0159514,3750000.0,184.656,72.6284,2.151596,0.02962472,70.58865,4.191345,0.059377037,0.40496922,15.0,0.0,America/New_York,EDT,-14400000.0,False,False,False,0.38,PCX,77.7,65.21,2.61,USD,iShares U.S. Consumer Staples E,78.93,71.14,-0.624586,IYK,,,,,,,,,,,,,,,415-670-2000,"The fund generally will invest at least 80% of its assets in the component securities of its underlying index, The underlying index measures the performance of the consumer staples sector of the U.S. equity market. It is non-diversified.",[],[],86400,2,75.25,75.83,74.37,76.4,75.25,75.83,74.37,76.4,24.794828,367669,367669,283480,174440,174440,71.14,78.93,100.0,200.0,0.026099999,1344460288.0,65.21,77.7,77.7,8.333333,72.6284,70.58865,2.45,0.03255814,74.76194,USD,False,Consumer Defensive,9.71416,0.48,iShares,960768000.0,Exchange Traded Fund,0.0677499,ETF,IYK,en-US,US,ETF,Nasdaq Real Time Price,True,HIGH,PCX,finmb_8796322,America/New_York,EDT,-14400000,us_market,False,-0.624586,74.78,PRE,2.61,4.34219,4.34219,1344460290.0,3.0159514,2.151596,0.02962472,4.191345,0.059377037,0.38,15,0,False,[],,1784318400,iShares US Consumer Staples ETF,True,961162200000,,,,-0.470001,74.37 - 76.4,NYSEArca,283480,9.57,0.14675663,65.21 - 77.7,-2.9199982,-0.037580416,6.4332485,iShares U.S. Consumer Staples E,,"The fund generally will invest at least 80% of its assets in the component securities of its underlying index, The underlying index measures the performance of the consumer staples sector of the U.S. equity market. It is non-diversified.",Consumer Defensive,iShares,Exchange Traded Fund,0.0032,0.9968,0.0,0.0,0.0,0.0,0.0,0.014400001,0.026600001,0.8257,0.0,0.0,0.0,0.0,0.0005,0.0,0.1328,0.0,0.0038,0.0073669,0.08,0.2629,104457.2,104457.2,8.0,0.38,65.81322010000001,"[{""Symbol"":""PG"",""Name"":""Procter & Gamble Co"",""Holding Percent"":0.1333965},{""Symbol"":""KO"",""Name"":""Coca-Cola Co"",""Holding Percent"":0.1236384},{""Symbol"":""PM"",""Name"":""Philip Morris International Inc"",""Holding Percent"":0.1107874},{""Symbol"":""PEP"",""Name"":""PepsiCo Inc"",""Holding Percent"":0.0736244},{""Symbol"":""CVS"",""Name"":""CVS Health Corp"",""Holding Percent"":0.0464711},{""Symbol"":""MO"",""Name"":""Altria Group Inc"",""Holding Percent"":0.0433112},{""Symbol"":""MCK"",""Name"":""McKesson Corp"",""Holding Percent"":0.0354149},{""Symbol"":""CL"",""Name"":""Colgate-Palmolive Co"",""Holding Percent"":0.0309568},{""Symbol"":""MDLZ"",""Name"":""Mondelez International Inc Class A"",""Holding Percent"":0.030527001},{""Symbol"":""MNST"",""Name"":""Monster Beverage Corp"",""Holding Percent"":0.0300045}]","[{""Average"":""Price\/Earnings"",""IYK"":0.0415,""Category Average"":null},{""Average"":""Price\/Book"",""IYK"":0.27868,""Category Average"":null},{""Average"":""Price\/Sales"",""IYK"":1.08393,""Category Average"":null},{""Average"":""Price\/Cashflow"",""IYK"":0.06585,""Category Average"":null},{""Average"":""Median Market Cap"",""IYK"":null,""Category Average"":null},{""Average"":""3 Year Earnings Growth"",""IYK"":null,""Category Average"":null}]",0.0415,0.27868,,"[{""Average"":""Duration"",""IYK"":null,""Category Average"":null},{""Average"":""Maturity"",""IYK"":null,""Category Average"":null},{""Average"":""Credit Quality"",""IYK"":null,""Category Average"":null}]",0.0683023,,,,,,,,,,,,,,,,,USD,,,,184.656,0.40496922,,,,,3750000.0,,
