Consumer Staples,consumer-defensive,11,GXPS,Global X Purecap MSCI Consumer Staples ETF,https://finance.yahoo.com/research-hub/screener/sec-ind_sec-top-etfs_consumer-defensive/,2026-07-20T08:47:27+00:00,en-US,US,ETF,ETF,Delayed Quote,False,LOW,,,,,USD,True,1753277400000.0,2.0,,,,,-0.190001,1784318386.0,26.81,27.355,26.66 - 27.355,26.66,20575.0,27.0,100.0,200.0,us_market,finmb_1942486170,NYSEArca,Global X Purecap MSCI Consumer Staples ETF,27.35,28590.0,21680.0,[],3.5299988,0.15163225,23.28 - 28.43,-1.6200008,-0.05698209,7.4506044,0.0,27.366758,0.0,8.28574,0.29508,0.29508,59432416.0,PRE,0.9796556,,,26.79568,0.014320374,0.00053442846,25.948935,0.8610649,0.033183053,,15.0,0.0,America/New_York,EDT,-14400000.0,False,False,False,0.15,PCX,28.43,23.28,,,Global X PureCap MSCI Consumer ,41.83,0.0,-0.703706,GXPS,,,,,,,,,,,,,,,+1 8884938631,"Under normal circumstances, the fund invests at least 80% of its net assets, plus the amount of any borrowings for investment purposes, in the Communication Services sector. The underlying index is designed to track the performance of U.S. securities included in the MSCI USA Index that fall within the Consumer Staples sector based on the MSCI and S&P Dow Jones Indices' Global Industry Classification Standard, as determined by MSCI Inc. The fund is non-diversified.",[],[],86400,2,27.0,27.35,26.66,27.355,27.0,27.35,26.66,27.355,27.366758,20575,20575,28590,21680,21680,0.0,41.83,100.0,200.0,,59432416.0,23.28,28.43,28.43,23.28,26.79568,25.948935,0.0,0.0,26.76,USD,False,Consumer Defensive,8.28574,0.0,Global X Funds,1753142400.0,Exchange Traded Fund,,ETF,GXPS,en-US,US,ETF,Delayed Quote,True,HIGH,PCX,finmb_1942486170,America/New_York,EDT,-14400000,us_market,False,-0.703706,26.81,PRE,,0.29508,0.29508,59432416.0,0.9796556,0.014320374,0.00053442846,0.8610649,0.033183053,0.15,15,0,False,[],,1784318386,Global X Purecap MSCI Consumer Staples ETF,True,1753277400000,,,,-0.190001,26.66 - 27.355,NYSEArca,28590,3.5299988,0.15163225,23.28 - 28.43,-1.6200008,-0.05698209,7.4506044,Global X PureCap MSCI Consumer ,,"Under normal circumstances, the fund invests at least 80% of its net assets, plus the amount of any borrowings for investment purposes, in the Communication Services sector. The underlying index is designed to track the performance of U.S. securities included in the MSCI USA Index that fall within the Consumer Staples sector based on the MSCI and S&P Dow Jones Indices' Global Industry Classification Standard, as determined by MSCI Inc. The fund is non-diversified.",Consumer Defensive,Global X Funds,Exchange Traded Fund,0.0054,0.9946,0.0,0.0,0.0,0.0,0.0,0.010199999,0.0,0.98980004,0.0,0.0,0.0,0.0,0.0,0.0,0.0,0.0,0.0015,0.0073669,0.0344,0.2629,217575.19,217575.19,3.44,0.15,81.00720940000001,"[{""Symbol"":""WMT"",""Name"":""Walmart Inc"",""Holding Percent"":0.16991329},{""Symbol"":""COST"",""Name"":""Costco Wholesale Corp"",""Holding Percent"":0.1419689},{""Symbol"":""PG"",""Name"":""Procter & Gamble Co"",""Holding Percent"":0.116610296},{""Symbol"":""KO"",""Name"":""Coca-Cola Co"",""Holding Percent"":0.107798405},{""Symbol"":""PM"",""Name"":""Philip Morris International Inc"",""Holding Percent"":0.0964797},{""Symbol"":""PEP"",""Name"":""PepsiCo Inc"",""Holding Percent"":0.063298605},{""Symbol"":""MO"",""Name"":""Altria Group Inc"",""Holding Percent"":0.0413193},{""Symbol"":""MDLZ"",""Name"":""Mondelez International Inc Class A"",""Holding Percent"":0.025404898},{""Symbol"":""CL"",""Name"":""Colgate-Palmolive Co"",""Holding Percent"":0.0239338},{""Symbol"":""MNST"",""Name"":""Monster Beverage Corp"",""Holding Percent"":0.0233449}]","[{""Average"":""Price\/Earnings"",""GXPS"":0.03742,""Category Average"":null},{""Average"":""Price\/Book"",""GXPS"":0.16694,""Category Average"":null},{""Average"":""Price\/Sales"",""GXPS"":0.59971,""Category Average"":null},{""Average"":""Price\/Cashflow"",""GXPS"":0.05664,""Category Average"":null},{""Average"":""Median Market Cap"",""GXPS"":null,""Category Average"":null},{""Average"":""3 Year Earnings Growth"",""GXPS"":null,""Category Average"":null}]",0.03742,0.16694,,"[{""Average"":""Duration"",""GXPS"":null,""Category Average"":null},{""Average"":""Maturity"",""GXPS"":null,""Category Average"":null},{""Average"":""Credit Quality"",""GXPS"":null,""Category Average"":null}]",,,,,,,,,,,,,,,,,,,,,,,,,,,,,,
Consumer Staples,consumer-defensive,12,PSCC,Invesco S&P SmallCap Consumer Staples ETF,https://finance.yahoo.com/research-hub/screener/sec-ind_sec-top-etfs_consumer-defensive/,2026-07-20T08:47:27+00:00,en-US,US,ETF,ETF,Nasdaq Real Time Price,False,LOW,1.71,16.815201,14.87009,28.43641,USD,True,1270647000000.0,2.0,,,,,-0.49560165,1784318400.0,36.5794,37.22,36.38 - 37.22,36.38,3619.0,37.075,1.0,1.0,us_market,finmb_100588835,NasdaqGM,Invesco S&P SmallCap Consumer Staples ETF,37.2,7030.0,11890.0,[],5.9793987,0.19540519,30.6 - 37.23,-0.65060043,-0.017475165,4.873848,0.0,17.441591,0.0,14.27913,12.18083,12.18083,34890332.0,PRE,2.0972512,,,34.2188,2.3605995,0.068985455,32.93955,3.6398506,0.110500924,,15.0,0.0,America/New_York,EDT,-14400000.0,False,False,False,0.29,NGM,37.23,30.6,1.71,,Invesco S&P SmallCap Consumer S,47.09,36.48,-1.3367543,PSCC,1498780800.0,,,,,,,,,,,,,,,"The fund generally will invest at least 90% of its total assets in the securities that comprise the underlying index. Strictly in accordance with its guidelines and mandated procedures, S&P Dow Jones Indices, LLC compiles, maintains and calculates the index, which is designed to measure the performance of securities of small-capitalization U.S. companies in the consumer staples sector, as defined by the Global Industry Classification Standard. The fund is non-diversified.",[],[],86400,2,37.075,37.2,36.38,37.22,37.075,37.2,36.38,37.22,17.441591,3619,3619,7030,11890,11890,36.48,47.09,1.0,1.0,0.0171,34890332.0,30.6,37.23,41.03,3.666667,34.2188,32.93955,0.0,0.0,36.56,USD,False,Consumer Defensive,14.27913,0.78,Invesco,1270598400.0,Exchange Traded Fund,0.0181611,ETF,PSCC,en-US,US,ETF,Nasdaq Real Time Price,True,HIGH,NGM,finmb_100588835,America/New_York,EDT,-14400000,us_market,False,-1.3367543,36.5794,PRE,1.71,12.18083,12.18083,34890332.0,2.0972512,2.3605995,0.068985455,3.6398506,0.110500924,0.29,15,0,False,[],,1784318400,Invesco S&P SmallCap Consumer Staples ETF,True,1270647000000,,,,-0.49560165,36.38 - 37.22,NasdaqGM,7030,5.9793987,0.19540519,30.6 - 37.23,-0.65060043,-0.017475165,4.873848,Invesco S&P SmallCap Consumer S,,"The fund generally will invest at least 90% of its total assets in the securities that comprise the underlying index. Strictly in accordance with its guidelines and mandated procedures, S&P Dow Jones Indices, LLC compiles, maintains and calculates the index, which is designed to measure the performance of securities of small-capitalization U.S. companies in the consumer staples sector, as defined by the Global Industry Classification Standard. The fund is non-diversified.",Consumer Defensive,Invesco,Exchange Traded Fund,0.0007,0.9993,0.0,0.0,0.0,0.0,0.0,0.026400002,0.042600002,0.90760005,0.0,0.0,0.0,0.0,0.0234,0.0,0.0,0.0,0.0029,0.0073669,0.26,0.2629,3469.0,3469.0,26.0,0.29,63.29073070000001,"[{""Symbol"":""CAG"",""Name"":""Conagra Brands Inc"",""Holding Percent"":0.115486205},{""Symbol"":""LW"",""Name"":""Lamb Weston Holdings Inc"",""Holding Percent"":0.0955568},{""Symbol"":""PSMT"",""Name"":""Pricesmart Inc"",""Holding Percent"":0.0792465},{""Symbol"":""CPB"",""Name"":""The Campbell's Co"",""Holding Percent"":0.0702231},{""Symbol"":""CALM"",""Name"":""Cal-Maine Foods Inc"",""Holding Percent"":0.057497904},{""Symbol"":""COCO"",""Name"":""The Vita Coco Co Inc"",""Holding Percent"":0.0466123},{""Symbol"":""FRPT"",""Name"":""Freshpet Inc"",""Holding Percent"":0.045377698},{""Symbol"":""CHEF"",""Name"":""The Chefs' Warehouse Inc"",""Holding Percent"":0.0437649},{""Symbol"":""WDFC"",""Name"":""WD-40 Co"",""Holding Percent"":0.0425351},{""Symbol"":""IPAR"",""Name"":""Interparfums Inc"",""Holding Percent"":0.0366068}]","[{""Average"":""Price\/Earnings"",""PSCC"":0.05947,""Category Average"":null},{""Average"":""Price\/Book"",""PSCC"":0.58766,""Category Average"":null},{""Average"":""Price\/Sales"",""PSCC"":1.72786,""Category Average"":null},{""Average"":""Price\/Cashflow"",""PSCC"":0.12498,""Category Average"":null},{""Average"":""Median Market Cap"",""PSCC"":null,""Category Average"":null},{""Average"":""3 Year Earnings Growth"",""PSCC"":null,""Category Average"":null}]",0.05947,0.58766,,"[{""Average"":""Duration"",""PSCC"":null,""Category Average"":null},{""Average"":""Maturity"",""PSCC"":null,""Category Average"":null},{""Average"":""Credit Quality"",""PSCC"":null,""Category Average"":null}]",0.034506,1498780800.0,,,,,,,,,,,,,,,,,,,,,,,,,,,,
Consumer Staples,consumer-defensive,13,FTXG,First Trust Nasdaq Food & Beverage ETF,https://finance.yahoo.com/research-hub/screener/sec-ind_sec-top-etfs_consumer-defensive/,2026-07-20T08:47:27+00:00,en-US,US,ETF,ETF,Delayed Quote,False,LOW,2.59,19.223376,-6.18118,12.3846,USD,True,1476106200000.0,2.0,,,,,-0.20810127,1784318400.0,22.9819,23.545,22.8752 - 23.545,22.8752,5680.0,23.19,1.0,37.0,us_market,finmb_374010002,NasdaqGM,First Trust Nasdaq Food & Beverage ETF,23.5399,11254.0,3550.0,[],2.551899,0.12490939,20.43 - 23.936,-0.95410156,-0.039860524,2.9474974,0.0,19.855715,0.0,7.36061,1.12436,1.12436,23359668.0,PRE,1.1574451,,,22.428,0.55389977,0.024696797,22.038795,0.9431038,0.04279289,,15.0,0.0,America/New_York,EDT,-14400000.0,False,False,False,0.6,NGM,23.936,20.43,2.59,,First Trust Nasdaq Food & Bever,22.99,16.78,-0.89737505,FTXG,1490918400.0,,,,,,,,,,,,,,(800) 621-1675,The fund will normally invest at least 90% of its net assets (including investment borrowings) in the securities that comprise the underlying index. The index is designed to provide exposure to U.S. companies comprising the food and beverage sector that have been selected based upon their liquidity and ranking. The fund is non-diversified.,[],[],86400,2,23.19,23.5399,22.8752,23.545,23.19,23.5399,22.8752,23.545,19.855715,5680,5680,11254,3550,3550,16.78,22.99,1.0,37.0,0.025899999,23359668.0,20.43,23.936,29.66,15.067,22.428,22.038795,0.0,0.0,22.96,USD,False,Consumer Defensive,7.36061,0.48,First Trust,1474329600.0,Exchange Traded Fund,-0.0096252,ETF,FTXG,en-US,US,ETF,Delayed Quote,True,HIGH,NGM,finmb_374010002,America/New_York,EDT,-14400000,us_market,False,-0.89737505,22.9819,PRE,2.59,1.12436,1.12436,23359668.0,1.1574451,0.55389977,0.024696797,0.9431038,0.04279289,0.6,15,0,False,[],,1784318400,First Trust Nasdaq Food & Beverage ETF,True,1476106200000,,,,-0.20810127,22.8752 - 23.545,NasdaqGM,11254,2.551899,0.12490939,20.43 - 23.936,-0.95410156,-0.039860524,2.9474974,First Trust Nasdaq Food & Bever,,The fund will normally invest at least 90% of its net assets (including investment borrowings) in the securities that comprise the underlying index. The index is designed to provide exposure to U.S. companies comprising the food and beverage sector that have been selected based upon their liquidity and ranking. The fund is non-diversified.,Consumer Defensive,First Trust,Exchange Traded Fund,0.00059999997,0.9994,0.0,0.0,0.0,0.0,0.0,0.0,0.045,0.9412,0.0,0.0,0.0,0.0,0.0138,0.0,0.0,0.0,0.006,0.0073669,0.3,0.2629,33362.71,33362.71,30.0,0.6,62.3804696,"[{""Symbol"":""ADM"",""Name"":""Archer-Daniels-Midland Co"",""Holding Percent"":0.094262},{""Symbol"":""KO"",""Name"":""Coca-Cola Co"",""Holding Percent"":0.0848773},{""Symbol"":""KHC"",""Name"":""The Kraft Heinz Co"",""Holding Percent"":0.0817542},{""Symbol"":""MDLZ"",""Name"":""Mondelez International Inc Class A"",""Holding Percent"":0.0800076},{""Symbol"":""PEP"",""Name"":""PepsiCo Inc"",""Holding Percent"":0.0679483},{""Symbol"":""MNST"",""Name"":""Monster Beverage Corp"",""Holding Percent"":0.0479932},{""Symbol"":""KDP"",""Name"":""Keurig Dr Pepper Inc"",""Holding Percent"":0.0460358},{""Symbol"":""CTVA"",""Name"":""Corteva Inc"",""Holding Percent"":0.045019496},{""Symbol"":""USFD"",""Name"":""US Foods Holding Corp"",""Holding Percent"":0.0383836},{""Symbol"":""STZ"",""Name"":""Constellation Brands Inc Class A"",""Holding Percent"":0.0375232}]","[{""Average"":""Price\/Earnings"",""FTXG"":0.05202,""Category Average"":null},{""Average"":""Price\/Book"",""FTXG"":0.51439,""Category Average"":null},{""Average"":""Price\/Sales"",""FTXG"":0.9448,""Category Average"":null},{""Average"":""Price\/Cashflow"",""FTXG"":0.09597,""Category Average"":null},{""Average"":""Median Market Cap"",""FTXG"":null,""Category Average"":null},{""Average"":""3 Year Earnings Growth"",""FTXG"":null,""Category Average"":null}]",0.05202,0.51439,,"[{""Average"":""Duration"",""FTXG"":null,""Category Average"":null},{""Average"":""Maturity"",""FTXG"":null,""Category Average"":null},{""Average"":""Credit Quality"",""FTXG"":null,""Category Average"":null}]",0.0099783,1490918400.0,,,,,,,,,,,,,,,,,,,,,,,,,,,,
Consumer Staples,consumer-defensive,14,MHY,Man Active High Yield ETF,https://finance.yahoo.com/research-hub/screener/sec-ind_sec-top-etfs_consumer-defensive/,2026-07-20T08:47:27+00:00,en-US,US,EQUITY,Equity,Nasdaq Real Time Price,False,LOW,,,,,USD,True,1758202200000.0,2.0,,,,,-0.0160999,1784314355.0,25.6312,25.6312,25.63 - 25.6312,25.63,639.0,25.6473,1800.0,100.0,us_market,finmb_1949944667,NYSEArca,Man Active High Yield ETF,25.63,14093.0,54930.0,[],0.9462013,0.038331024,24.685 - 25.74,-0.10879898,-0.0042268448,1.7506957,0.0,8.212781,0.0,,,,,PRE,3.1208918,,,25.4431,0.18810081,0.0073929993,25.195345,0.43585587,0.017299064,,15.0,0.0,America/New_York,EDT,-14400000.0,False,False,False,,PCX,25.74,24.685,,,Man Active High Yield ETF,0.0,0.0,-0.0627744,MHY,,,,,,,,,,,,,,,,,,,86400,2,25.6473,25.63,25.63,25.6312,25.6473,25.63,25.63,25.6312,,639,639,14093,54930,54930,0.0,0.0,,,,,24.685,25.74,25.74,24.685,25.4431,25.195345,,,,USD,False,,,,,,,,EQUITY,MHY,en-US,US,Equity,Delayed Quote,True,HIGH,PCX,finmb_1949944667,America/New_York,EDT,-14400000,us_market,False,-0.0627744,25.6312,PRE,,,,,,0.18810081,0.0073929993,0.43585587,0.017299064,,15,0,False,[],,1784314355,,True,1758202200000,,,,-0.0160999,25.63 - 25.6312,NYSEArca,14093,0.9462013,0.038331024,24.685 - 25.74,-0.10879898,-0.0042268448,1.7506957,Man Active High Yield ETF,,,,,,,,,,,,,,,,,,,,,,,,,,,,,,,,,,,,,,,,,,,,,,,,,,,,,,fund data: MHY fund data failed: MHY: No Fund data found.,,,,,,,,,,,,,,
Consumer Staples,consumer-defensive,15,KHYB,KraneShares Asia Pacific High Income USD Bond ETF,https://finance.yahoo.com/research-hub/screener/sec-ind_sec-top-etfs_consumer-defensive/,2026-07-20T08:47:27+00:00,en-US,US,ETF,ETF,Delayed Quote,False,LOW,8.28,8.196721,3.71854,-12.83056,USD,True,1531143000000.0,2.0,,,,,0.0100002,1784314460.0,24.1,24.15,24.0992 - 24.15,24.0992,4651.0,24.09,900.0,200.0,us_market,finmb_546573857,NYSEArca,KraneShares Asia Pacific High Income USD Bond ETF,24.1,3587.0,3950.0,[],0.59000015,0.02509571,23.51 - 24.875,-0.7749996,-0.031155763,0.041508675,0.0,8.213762,0.0,2.7663,4.16718,4.16718,15632136.0,PRE,2.9341002,,,24.14594,-0.0459404,-0.0019026138,24.359116,-0.25911522,-0.0106373,,15.0,0.0,America/New_York,EDT,-14400000.0,False,False,False,0.69,PCX,24.875,23.51,8.28,,KraneShares Asia Pacific High I,24.33,21.0,0.041512,KHYB,,,,,,,,,,,,,,,1-855-857-2638,"Under normal circumstances, the fund seeks to achieve its objective by investing at least 80% of its net assets (plus borrowings for investment purposes) in fixed income securities of issuers located in the Asia-Pacific region and other instruments that have economic characteristics similar to such securities. The fund is non-diversified.",[],[],86400,2,24.09,24.1,24.0992,24.15,24.09,24.1,24.0992,24.15,8.213762,4651,4651,3587,3950,3950,21.0,24.33,900.0,200.0,0.0828,15632136.0,23.51,24.875,41.26,22.925,24.14594,24.359116,0.0,0.0,24.16,USD,False,Emerging Markets Bond,2.7663,0.45,KraneShares,1529971200.0,Exchange Traded Fund,0.0889632,ETF,KHYB,en-US,US,ETF,Delayed Quote,True,HIGH,PCX,finmb_546573857,America/New_York,EDT,-14400000,us_market,False,0.041512,24.1,PRE,8.28,4.16718,4.16718,15632136.0,2.9341002,-0.0459404,-0.0019026138,-0.25911522,-0.0106373,0.69,15,0,False,[],,1784314460,KraneShares Asia Pacific High Income USD Bond ETF,True,1531143000000,,,,0.0100002,24.0992 - 24.15,NYSEArca,3587,0.59000015,0.02509571,23.51 - 24.875,-0.7749996,-0.031155763,0.041508675,KraneShares Asia Pacific High I,,"Under normal circumstances, the fund seeks to achieve its objective by investing at least 80% of its net assets (plus borrowings for investment purposes) in fixed income securities of issuers located in the Asia-Pacific region and other instruments that have economic characteristics similar to such securities. The fund is non-diversified.",Emerging Markets Bond,KraneShares,Exchange Traded Fund,0.026199998,0.0,0.9363,0.0,0.0376,0.0,0.0,0.0,0.0,1.0,0.0,0.0,0.0,0.0,0.0,0.0,0.0,0.0531,0.0069,0.0095369,1.98,0.6701,166.04,166.04,198.0,0.69,,,"[{""Average"":""Price\/Earnings"",""KHYB"":0.122,""Category Average"":null},{""Average"":""Price\/Book"",""KHYB"":1.3054,""Category Average"":null},{""Average"":""Price\/Sales"",""KHYB"":3.36451,""Category Average"":null},{""Average"":""Price\/Cashflow"",""KHYB"":0.085,""Category Average"":null},{""Average"":""Median Market Cap"",""KHYB"":null,""Category Average"":null},{""Average"":""3 Year Earnings Growth"",""KHYB"":null,""Category Average"":null}]",0.122,1.3054,,"[{""Average"":""Duration"",""KHYB"":7.46,""Category Average"":null},{""Average"":""Maturity"",""KHYB"":null,""Category Average"":null},{""Average"":""Credit Quality"",""KHYB"":null,""Category Average"":null}]",0.0025565,,0.6465,0.0,0.0,0.015700001,0.0166,0.2536,0.0341,0.0334,,,,,,,,,,,,,,,,,,,,
Consumer Staples,consumer-defensive,16,UGE,ProShares Ultra Consumer Staples,https://finance.yahoo.com/research-hub/screener/sec-ind_sec-top-etfs_consumer-defensive/,2026-07-20T08:47:27+00:00,en-US,US,ETF,ETF,Delayed Quote,False,LOW,2.17,25.278059,2.48742,42.39999,USD,True,1170340200000.0,2.0,,,,,-0.2547,1784318262.0,19.5553,20.525,19.3 - 20.525,19.3,32358.0,19.81,1000.0,1000.0,us_market,finmb_32431306,NYSEArca,ProShares Ultra Consumer Staples,20.22,56327.0,29040.0,[],3.8153,0.24239518,15.74 - 22.26,-2.7047005,-0.12150496,6.188929,0.0,26.562061,0.0,12.7759,2.12949,2.12949,11391031.0,PRE,0.73621166,,,19.1512,0.40410042,0.021100529,18.4605,1.094799,0.05930495,,15.0,0.0,America/New_York,EDT,-14400000.0,False,False,False,0.95,PCX,22.26,15.74,2.17,,ProShares Ultra Consumer Staple,0.0,0.0,-1.28571,UGE,,,,,,,,,,0.01,1955.53,,,,,"The index is designed to measure the performance of consumer staples companies included in the S&P 500 Index. Under normal circumstances, the fund will obtain leveraged exposure to at least 80% of its total assets in components of the index or in instruments with similar economic characteristics. The fund is non-diversified.",[],[],86400,2,19.81,20.22,19.3,20.525,19.81,20.22,19.3,20.525,,32358,32358,56327,29040,29040,0.0,0.0,1000.0,1000.0,0.0217,11391031.0,15.74,22.26,31.5775,0.9125,19.1512,18.4605,,,19.5167,USD,False,Trading--Leveraged Equity,12.7759,0.8,ProShares,1170115200.0,Exchange Traded Fund,0.066752404,ETF,UGE,en-US,US,ETF,Delayed Quote,True,HIGH,PCX,finmb_32431306,America/New_York,EDT,-14400000,us_market,False,-1.28571,19.5553,PRE,2.17,2.12949,2.12949,11391031.0,,0.40410042,0.021100529,1.094799,0.05930495,0.95,15,0,False,[],,1784318262,,True,1170340200000,,,,-0.2547,19.3 - 20.525,NYSEArca,56327,3.8153,0.24239518,15.74 - 22.26,-2.7047005,-0.12150496,6.188929,ProShares Ultra Consumer Staple,,"The index is designed to measure the performance of consumer staples companies included in the S&P 500 Index. Under normal circumstances, the fund will obtain leveraged exposure to at least 80% of its total assets in components of the index or in instruments with similar economic characteristics. The fund is non-diversified.",Trading--Leveraged Equity,ProShares,Exchange Traded Fund,0.192,0.45790002,0.0,0.0,0.0,0.35009998,0.0,0.019,0.0,0.981,0.0,0.0,0.0,0.0,0.0,0.0,0.0,0.0,0.0095,0.0,0.34,,118281.47,118281.47,34.0,0.95,28.977929700000004,"[{""Symbol"":""WMT"",""Name"":""Walmart Inc"",""Holding Percent"":0.0537322},{""Symbol"":""COST"",""Name"":""Costco Wholesale Corp"",""Holding Percent"":0.0449045},{""Symbol"":""PG"",""Name"":""Procter & Gamble Co"",""Holding Percent"":0.0369677},{""Symbol"":""KO"",""Name"":""Coca-Cola Co"",""Holding Percent"":0.0340708},{""Symbol"":""PM"",""Name"":""Philip Morris International Inc"",""Holding Percent"":0.030505098},{""Symbol"":""CL"",""Name"":""Colgate-Palmolive Co"",""Holding Percent"":0.0233694},{""Symbol"":""MO"",""Name"":""Altria Group Inc"",""Holding Percent"":0.0225628},{""Symbol"":""MNST"",""Name"":""Monster Beverage Corp"",""Holding Percent"":0.0221521},{""Symbol"":""PEP"",""Name"":""PepsiCo Inc"",""Holding Percent"":0.021514699}]","[{""Average"":""Price\/Earnings"",""UGE"":0.03956,""Category Average"":null},{""Average"":""Price\/Book"",""UGE"":0.23099,""Category Average"":null},{""Average"":""Price\/Sales"",""UGE"":0.73859,""Category Average"":null},{""Average"":""Price\/Cashflow"",""UGE"":0.06675,""Category Average"":null},{""Average"":""Median Market Cap"",""UGE"":null,""Category Average"":null},{""Average"":""3 Year Earnings Growth"",""UGE"":null,""Category Average"":null}]",0.03956,0.23099,,"[{""Average"":""Duration"",""UGE"":null,""Category Average"":null},{""Average"":""Maturity"",""UGE"":null,""Category Average"":null},{""Average"":""Credit Quality"",""UGE"":null,""Category Average"":null}]",-0.0161583,,,,,,,,,,,,,,,,,,,,,,,,,,,,,
Consumer Staples,consumer-defensive,17,XLSI,State Street Consumer Staples Select Sector SPDR Premium Income ETF,https://finance.yahoo.com/research-hub/screener/sec-ind_sec-top-etfs_consumer-defensive/,2026-07-20T08:47:27+00:00,en-US,US,EQUITY,Equity,Nasdaq Real Time Price,False,LOW,,,,,USD,True,1753882200000.0,2.0,,,,,-0.0825005,1784318135.0,23.501,23.8199,23.4899 - 23.8199,23.4899,14195.0,23.5835,200.0,1000.0,us_market,finmb_1945101955,NYSEArca,State Street Consumer Staples Select Sector SPDR Premium Income ETF,23.85,9191.0,10630.0,[],0.8009987,0.035286285,22.7 - 25.74,-2.2390003,-0.08698525,-5.867982,0.0,25.299076,0.0,,,,,PRE,0.9289272,,,23.46722,0.033779144,0.0014394182,23.883335,-0.38233566,-0.01600847,,15.0,0.0,America/New_York,EDT,-14400000.0,False,False,False,,PCX,25.74,22.7,,,State Street Consumer Staples S,24.95,22.01,-0.349823,XLSI,,,,,,,,The Select Sector SPDR Trust - The Consumer Staples Select Sector SPDR Premium Income Fund,2026-07-19,,,,,,,,,,86400,2,23.5835,23.85,23.4899,23.8199,23.5835,23.85,23.4899,23.8199,25.299076,14195,14195,9191,10630,10630,22.01,24.95,200.0,1000.0,,,22.7,25.74,25.74,22.7,23.46722,23.883335,0.0,0.0,,USD,False,,,,,,,,EQUITY,XLSI,en-US,US,Equity,Nasdaq Real Time Price,True,HIGH,PCX,finmb_1945101955,America/New_York,EDT,-14400000,us_market,False,-0.349823,23.501,PRE,,,,,0.9289272,0.033779144,0.0014394182,-0.38233566,-0.01600847,,15,0,False,[],,1784318135,State Street Consumer Staples Select Sector SPDR Premium Income ETF,True,1753882200000,,,,-0.0825005,23.4899 - 23.8199,NYSEArca,9191,0.8009987,0.035286285,22.7 - 25.74,-2.2390003,-0.08698525,-5.867982,State Street Consumer Staples S,,,,,,,,,,,,,,,,,,,,,,,,,,,,,,,,,,,,,,,,,,,,,,,,,,,,23.501,none,fund data: XLSI fund data failed: XLSI: No Fund data found.,,,,,,,,The Select Sector SPDR Trust - The Consumer Staples Select Sector SPDR Premium Income Fund,2026-07-19,,,,,
