Energy,energy,24,XAGG,Eaton Vance Income Opportunities ETF,https://finance.yahoo.com/research-hub/screener/sec-ind_sec-top-etfs_energy/,2026-07-19T04:19:51+00:00,en-US,US,ETF,ETF,Delayed Quote,False,LOW,6.73,13.646288,8.48277,0.01371,1762785000000.0,0.0,True,1784322300.0,,,50.01976,-0.12976074,-0.0025941897,50.389076,-0.49907684,0.0,13.659978,0.0,2.30067,2.33217,2.33217,1168862720.0,CLOSED,USD,False,False,False,2.0,3.6522753,500.0,finmb_1888407053,NYSEArca,,15.0,0.0,America/New_York,EDT,-14400000.0,[],0.38700104,49.8501,107168.0,-0.100119,0.007817729,49.503 - 51.475,-1.5849991,49.89,49.93,49.8501 - 49.93,51.0,-0.03079163,-0.45889616,,Eaton Vance Income Opportunitie,0.5,49.89,0.0,-0.0499992,1784318400.0,us_market,PCX,51.475,49.503,6.73,-0.009904465,49.89,49.94,Eaton Vance Income Opportunities ETF,49.89,210851.0,330210.0,400.0,XAGG,,,,,,,,,,,,,,,,"The adviser will allocate the fund's investments among the following asset classes or market segments: (1) corporate securities, (2) agency residential and commercial mortgage-backed securities, (3) non-agency residential and commercial mortgage-backed securities, (4) asset-backed securities, (5) emerging market securities, (6) convertible securities, (7) U.S. government securities and foreign sovereign debt, and (8) derivatives.",[],[],86400,2,49.94,49.89,49.8501,49.93,49.94,49.89,49.8501,49.93,13.659978,107168,107168,210851,330210,330210,49.89,51.0,500.0,400.0,0.0673,1168862720.0,49.503,51.475,51.475,49.503,50.01976,50.389076,0.0,0.0,49.8,USD,False,Multisector Bond,2.30067,0.54,Eaton Vance ETFs,870048000.0,Exchange Traded Fund,0.0810897,ETF,XAGG,en-US,US,ETF,Delayed Quote,True,HIGH,[],1784322300.0,1784318400,PCX,finmb_1888407053,America/New_York,EDT,-14400000,us_market,False,-0.100119,49.89,CLOSED,Eaton Vance Income Opportunitie,Eaton Vance Income Opportunities ETF,0.0,49.89,0.0,-0.0499992,49.8501 - 49.93,NYSEArca,210851,0.38700104,0.007817729,49.503 - 51.475,-1.5849991,-0.03079163,-0.45889616,6.73,2.33217,2.33217,1168862720.0,3.6522753,-0.12976074,-0.0025941897,-0.49907684,-0.009904465,0.5,15,0,False,True,1762785000000,,"The adviser will allocate the fund's investments among the following asset classes or market segments: (1) corporate securities, (2) agency residential and commercial mortgage-backed securities, (3) non-agency residential and commercial mortgage-backed securities, (4) asset-backed securities, (5) emerging market securities, (6) convertible securities, (7) U.S. government securities and foreign sovereign debt, and (8) derivatives.",Multisector Bond,Eaton Vance ETFs,Exchange Traded Fund,-0.1246,0.0042,1.0988,0.0044,0.0172,0.0,0.2392,0.098000005,0.0348,0.0674,0.0746,0.0,0.375,0.0,0.086899996,0.0241,0.0,0.1278,0.005,0.0092469,3.04,1.4834,5401.94,5401.94,3.04,0.5,1.8185101,"[{""Symbol"":""MVRXX"",""Name"":""Morgan Stanley Instl Lqudty Govt Instl"",""Holding Percent"":0.018185101}]","[{""Average"":""Price\/Earnings"",""XAGG"":0.07328,""Category Average"":null},{""Average"":""Price\/Book"",""XAGG"":0.50221,""Category Average"":null},{""Average"":""Price\/Sales"",""XAGG"":0.55782,""Category Average"":null},{""Average"":""Price\/Cashflow"",""XAGG"":0.07391,""Category Average"":null},{""Average"":""Median Market Cap"",""XAGG"":null,""Category Average"":null},{""Average"":""3 Year Earnings Growth"",""XAGG"":null,""Category Average"":null}]",0.07328,0.50221,,"[{""Average"":""Duration"",""XAGG"":6.46,""Category Average"":null},{""Average"":""Maturity"",""XAGG"":9.796,""Category Average"":null},{""Average"":""Credit Quality"",""XAGG"":null,""Category Average"":null}]",0.0391458,,0.24340001,0.50060004,0.0128999995,0.0183,-0.085,0.1369,0.133,0.0399,,,,,,,,,,,,,,,,,,,,
Energy,energy,25,SYSB,iShares Systematic Bond ETF,https://finance.yahoo.com/research-hub/screener/sec-ind_sec-top-etfs_energy/,2026-07-19T04:19:51+00:00,en-US,US,ETF,ETF,Nasdaq Real Time Price,False,LOW,,,8.29195,-0.9299,1424961000000.0,0.0,True,1784319005.0,,,88.29402,-0.34402466,-0.0038963528,89.424644,-1.4746475,0.0,,0.0,0.7298,0.91053,0.91053,1160328190.0,CLOSED,USD,False,False,False,2.0,,700.0,finmb_279615910,Cboe US,,15.0,0.0,America/New_York,EDT,-14400000.0,[],1.1299973,87.9201,65595.0,0.0568776,0.0130154025,86.82 - 91.2,-3.25,87.95,88.1,87.9201 - 88.1,90.92,-0.035635967,-0.63045025,,iShares Systematic Bond ETF,0.25,87.95,0.0,0.0499954,1784318397.0,us_market,BTS,91.2,86.82,4.6,-0.016490392,84.92,87.9,iShares Systematic Bond ETF,88.11,99638.0,69330.0,900.0,SYSB,,,,,,,,,,,,,,,415-670-2000,"The underlying index allocates across four components: U.S. Treasury securities, U.S. dollar-denominated mortgage-backed securities (“MBS”), and U.S. dollar-denominated investment-grade and high-yield corporate bonds. The BlackRock Universal Systematic Bond Index allocates across four components: U.S. Treasury securities, U.S. dollar-denominated mortgage-backed securities (“MBS”), and U.S. dollar-denominated investment-grade and high-yield corporate bonds.",[],[],86400,2,87.9,88.11,87.9201,88.1,87.9,88.11,87.9201,88.1,,65595,65595,99638,69330,69330,84.92,90.92,700.0,900.0,0.046,1160328192.0,86.82,91.2,104.0,80.14,88.29402,89.424644,0.0,0.0,87.82107,USD,False,Intermediate Core-Plus Bond,0.7298,0.65,iShares,1424736000.0,Exchange Traded Fund,0.0661443,ETF,SYSB,en-US,US,ETF,Nasdaq Real Time Price,True,HIGH,[],1784319005.0,1784318397,BTS,finmb_279615910,America/New_York,EDT,-14400000,us_market,False,0.0568776,87.95,CLOSED,iShares Systematic Bond ETF,iShares Systematic Bond ETF,0.0,87.95,0.0,0.0499954,87.9201 - 88.1,Cboe US,99638,1.1299973,0.0130154025,86.82 - 91.2,-3.25,-0.035635967,-0.63045025,4.6,0.91053,0.91053,1160328190.0,,-0.34402466,-0.0038963528,-1.4746475,-0.016490392,0.25,15,0,False,True,1424961000000,,"The underlying index allocates across four components: U.S. Treasury securities, U.S. dollar-denominated mortgage-backed securities (“MBS”), and U.S. dollar-denominated investment-grade and high-yield corporate bonds. The BlackRock Universal Systematic Bond Index allocates across four components: U.S. Treasury securities, U.S. dollar-denominated mortgage-backed securities (“MBS”), and U.S. dollar-denominated investment-grade and high-yield corporate bonds.",Intermediate Core-Plus Bond,iShares,Exchange Traded Fund,0.0032,0.0,0.9957,0.0005,0.0005,0.0,0.0,0.0,0.0,0.0,0.0,0.0,0.0,0.0,0.0,1.0,0.0,0.33029997,0.0025,0.0074361004,4.53,1.6444,0.0,0.0,4.53,0.25,8.40662,"[{""Symbol"":""BISXX"",""Name"":""BlackRock Cash Funds Instl SL Agency"",""Holding Percent"":0.0840662}]","[{""Average"":""Price\/Earnings"",""SYSB"":0.0,""Category Average"":null},{""Average"":""Price\/Book"",""SYSB"":0.0,""Category Average"":null},{""Average"":""Price\/Sales"",""SYSB"":0.0,""Category Average"":null},{""Average"":""Price\/Cashflow"",""SYSB"":0.0,""Category Average"":null},{""Average"":""Median Market Cap"",""SYSB"":null,""Category Average"":null},{""Average"":""3 Year Earnings Growth"",""SYSB"":null,""Category Average"":null}]",0.0,0.0,,"[{""Average"":""Duration"",""SYSB"":4.38,""Category Average"":null},{""Average"":""Maturity"",""SYSB"":9.121,""Category Average"":null},{""Average"":""Credit Quality"",""SYSB"":null,""Category Average"":null}]",0.0141512,,0.0991,0.5068,0.0014,0.0715,0.0,0.0746,0.2334,0.013099999,,,,,,,,,,,,,,,,,,,,
Energy,energy,26,HYGV,FlexShares High Yield Value-Scored Bond Index Fund,https://finance.yahoo.com/research-hub/screener/sec-ind_sec-top-etfs_energy/,2026-07-19T04:19:51+00:00,en-US,US,ETF,ETF,Delayed Quote,False,LOW,,,13.00027,6.15168,1531920600000.0,0.0,True,1784322300.0,,,40.1638,-0.01379776,-0.00034353722,40.53067,-0.38066864,0.0,,0.0,1.89701,2.68596,2.68596,1102703230.0,CLOSED,USD,False,False,False,2.0,,1500.0,finmb_557846515,NYSEArca,,15.0,0.0,America/New_York,EDT,-14400000.0,[],0.6000023,40.135,67825.0,-0.04978,0.015170728,39.55 - 41.316,-1.1660004,40.15,40.19,40.135 - 40.19,40.5,-0.02822152,-1.5448749,,FlexShares High Yield Value-Sco,0.37,40.15,0.0,-0.0199966,1784318400.0,us_market,PCX,41.316,39.55,7.37,-0.009392113,39.69,40.17,FlexShares High Yield Value-Scored Bond Index Fund,40.15,110614.0,106990.0,400.0,HYGV,,,,,,,,,,,,,,,1-855-353-9383,"The underlying index is designed to reflect the performance of a diversified universe of high yield, U.S.-dollar denominated bonds of companies exhibiting favorable fundamental qualities, market valuations and liquidity, as defined by NTI’s proprietary scoring models. The fund generally will invest under normal circumstances at least 80% of its total assets (exclusive of collateral held from securities lending) in the securities of its index.",[],[],86400,2,40.17,40.15,40.135,40.19,40.17,40.15,40.135,40.19,,67825,67825,110614,106990,106990,39.69,40.5,1500.0,400.0,0.073699996,1102703232.0,39.55,41.316,50.47,36.86,40.1638,40.53067,0.0,0.0,40.1147,USD,False,High Yield Bond,1.89701,0.61,Flexshares Trust,1531785600.0,Exchange Traded Fund,0.0801702,ETF,HYGV,en-US,US,ETF,Delayed Quote,True,HIGH,[],1784322300.0,1784318400,PCX,finmb_557846515,America/New_York,EDT,-14400000,us_market,False,-0.04978,40.15,CLOSED,FlexShares High Yield Value-Sco,FlexShares High Yield Value-Scored Bond Index Fund,0.0,40.15,0.0,-0.0199966,40.135 - 40.19,NYSEArca,110614,0.6000023,0.015170728,39.55 - 41.316,-1.1660004,-0.02822152,-1.5448749,7.37,2.68596,2.68596,1102703230.0,,-0.01379776,-0.00034353722,-0.38066864,-0.009392113,0.37,15,0,False,True,1531920600000,,"The underlying index is designed to reflect the performance of a diversified universe of high yield, U.S.-dollar denominated bonds of companies exhibiting favorable fundamental qualities, market valuations and liquidity, as defined by NTI’s proprietary scoring models. The fund generally will invest under normal circumstances at least 80% of its total assets (exclusive of collateral held from securities lending) in the securities of its index.",High Yield Bond,Flexshares Trust,Exchange Traded Fund,0.0156,0.0,0.98440003,0.0,0.0,0.0,0.0,0.0,0.0,0.0,0.0,0.0,0.0,0.0,0.0,1.0,0.0,0.0,0.0037,0.008518,1.0,0.7432,0.0,0.0,100.0,0.37,,,"[{""Average"":""Price\/Earnings"",""HYGV"":0.0,""Category Average"":null},{""Average"":""Price\/Book"",""HYGV"":0.0,""Category Average"":null},{""Average"":""Price\/Sales"",""HYGV"":0.0,""Category Average"":null},{""Average"":""Price\/Cashflow"",""HYGV"":0.0,""Category Average"":null},{""Average"":""Median Market Cap"",""HYGV"":null,""Category Average"":null},{""Average"":""3 Year Earnings Growth"",""HYGV"":null,""Category Average"":null}]",0.0,0.0,,"[{""Average"":""Duration"",""HYGV"":7.14,""Category Average"":null},{""Average"":""Maturity"",""HYGV"":9.78,""Category Average"":null},{""Average"":""Credit Quality"",""HYGV"":null,""Category Average"":null}]",0.034153298,,0.4122,0.0,0.0,0.0,0.00059999997,0.4671,0.0,0.1201,,,,,,,,,,,,,,,,,,,,
Energy,energy,27,EIPI,FT Energy Income Partners Enhanced Income ETF,https://finance.yahoo.com/research-hub/screener/sec-ind_sec-top-etfs_energy/,2026-07-19T04:19:51+00:00,en-US,US,ETF,ETF,Delayed Quote,False,LOW,3.38,17.901898,,,1715002200000.0,0.22341889,True,1784332082.0,,,22.1667,0.2132988,0.009622487,21.219545,1.1604538,0.0,18.344526,0.0,14.19168,-1.01346,-1.01346,1046434500.0,CLOSED,USD,False,False,False,2.0,1.2199824,1100.0,finmb_127660568,NYSEArca,,15.0,0.0,America/New_York,EDT,-14400000.0,[],3.0079994,22.34,248956.0,0.0446952,0.15527563,19.372 - 22.96,-0.5799999,22.38,22.53,22.34 - 22.53,22.95,-0.025261322,14.183676,,FT Energy Income Partners Enhan,1.11,22.43,0.050001144,0.00999832,1784318400.0,us_market,PCX,22.96,19.372,3.38,0.054687966,22.17,22.37,FT Energy Income Partners Enhanced Income ETF,22.51,90401.0,91090.0,1200.0,EIPI,,,,,,,,,,,,,,,,"Under normal market conditions, the fund will invest at least 80% of its net assets (plus any borrowings for investment purposes) in securities of, and/or investments that provide exposure to, Energy Companies. The fund’s investments will be concentrated (i.e., invest more than 25% of fund assets) in any one industry or group of industries constituting the energy sector. The fund is non-diversified.",[],[],86400,2,22.37,22.51,22.34,22.53,22.37,22.51,22.34,22.53,18.344526,248956,248956,90401,91090,91090,22.17,22.95,1100.0,1200.0,0.033800002,1046434496.0,19.372,22.96,22.96,17.4,22.1667,21.219545,0.0,0.0,22.35,USD,False,Derivative Income,14.19168,0.31,First Trust,1317081600.0,Exchange Traded Fund,0.1689866,ETF,EIPI,en-US,US,ETF,Delayed Quote,True,HIGH,[],1784332082.0,1784318400,PCX,finmb_127660568,America/New_York,EDT,-14400000,us_market,False,0.0446952,22.38,CLOSED,FT Energy Income Partners Enhan,FT Energy Income Partners Enhanced Income ETF,0.22341889,22.43,0.050001144,0.00999832,22.34 - 22.53,NYSEArca,90401,3.0079994,0.15527563,19.372 - 22.96,-0.5799999,-0.025261322,14.183676,3.38,-1.01346,-1.01346,1046434500.0,1.2199824,0.2132988,0.009622487,1.1604538,0.054687966,1.11,15,0,False,True,1715002200000,,"Under normal market conditions, the fund will invest at least 80% of its net assets (plus any borrowings for investment purposes) in securities of, and/or investments that provide exposure to, Energy Companies. The fund’s investments will be concentrated (i.e., invest more than 25% of fund assets) in any one industry or group of industries constituting the energy sector. The fund is non-diversified.",Derivative Income,First Trust,Exchange Traded Fund,0.0123000005,0.9877,0.0,0.0,0.0,0.0,0.0,0.0,0.0066000004,0.0,0.0,0.0,0.0,0.3206,0.0473,0.62549996,0.0,0.0,0.0111,0.008784,1.03,0.6808,34850.62,34850.62,103.0,1.11,38.8660003,"[{""Symbol"":""EPD"",""Name"":""Enterprise Products Partners LP"",""Holding Percent"":0.0794622},{""Symbol"":""ET"",""Name"":""Energy Transfer LP"",""Holding Percent"":0.0656569},{""Symbol"":""MPLX"",""Name"":""MPLX LP Partnership Units"",""Holding Percent"":0.046033002},{""Symbol"":""KMI"",""Name"":""Kinder Morgan Inc Class P"",""Holding Percent"":0.0399317},{""Symbol"":""WMB"",""Name"":""Williams Companies Inc"",""Holding Percent"":0.030213201},{""Symbol"":""OKE"",""Name"":""ONEOK Inc"",""Holding Percent"":0.0296764},{""Symbol"":""NFG"",""Name"":""National Fuel Gas Co"",""Holding Percent"":0.0255965},{""Symbol"":""DUK"",""Name"":""Duke Energy Corp"",""Holding Percent"":0.0252066},{""Symbol"":""XOM"",""Name"":""Exxon Mobil Corp"",""Holding Percent"":0.0247433},{""Symbol"":""SHEL"",""Name"":""Shell PLC ADR (Representing - Ordinary Shares)"",""Holding Percent"":0.0221402}]","[{""Average"":""Price\/Earnings"",""EIPI"":0.05586,""Category Average"":null},{""Average"":""Price\/Book"",""EIPI"":0.41853,""Category Average"":null},{""Average"":""Price\/Sales"",""EIPI"":0.74949,""Category Average"":null},{""Average"":""Price\/Cashflow"",""EIPI"":0.12816,""Category Average"":null},{""Average"":""Median Market Cap"",""EIPI"":null,""Category Average"":null},{""Average"":""3 Year Earnings Growth"",""EIPI"":null,""Category Average"":null}]",0.05586,0.41853,,"[{""Average"":""Duration"",""EIPI"":null,""Category Average"":null},{""Average"":""Maturity"",""EIPI"":null,""Category Average"":null},{""Average"":""Credit Quality"",""EIPI"":null,""Category Average"":null}]",0.1375259,,,,,,,,,,,,,,,,,,,,,,,,,,,,,
Energy,energy,28,IBHF,iShares iBonds 2026 Term High Yield and Income ETF,https://finance.yahoo.com/research-hub/screener/sec-ind_sec-top-etfs_energy/,2026-07-19T04:19:51+00:00,en-US,US,ETF,ETF,Delayed Quote,False,LOW,7.03,10.989010989010989,,,1605709800000.0,0.0,True,1784322300.0,,,22.65054,-0.10553932,-0.004659462,22.972725,-0.42772484,0.0,10.582967,0.0,0.78193,0.15152,0.15152,857518340.0,CLOSED,USD,False,False,False,2.0,2.13031,800.0,finmb_688329335,Cboe US,,15.0,0.0,America/New_York,EDT,-14400000.0,[],0.034999847,22.53,223833.0,0.0443764,0.0015548577,22.51 - 23.455,-0.90999985,22.545,22.55,22.53 - 22.55,22.55,-0.03879769,-2.8986156,,iShares iBonds 2026 Term High Y,0.35,22.545,0.0,0.0100002,1784318394.0,us_market,BTS,23.455,22.51,6.37,-0.01861881,22.54,22.535,iShares iBonds 2026 Term High Yield and Income ETF,22.53,346080.0,195040.0,1000.0,IBHF,,,,,,,,,,,,,,,415-670-2000,"The fund seeks to meet its investment objective generally by investing in component securities of the index. The index is composed of U.S. dollar-denominated, taxable, fixed-rate, high yield (which are considered below investment-grade) and BBB or equivalently rated corporate bonds scheduled to mature between January 1, 2026 and December 15, 2026, inclusive.",[],[],86400,2,22.535,22.53,22.53,22.55,22.535,22.53,22.53,22.55,10.582967,223833,223833,346080,195040,195040,22.54,22.55,800.0,1000.0,0.0637,857518336.0,22.51,23.455,25.78,21.57,22.65054,22.972725,0.0,0.0,22.5524,USD,False,Target Maturity,0.78193,0.31,iShares,1604966400.0,Exchange Traded Fund,0.0673952,ETF,IBHF,en-US,US,ETF,Delayed Quote,True,HIGH,[],1784322300.0,1784318394,BTS,finmb_688329335,America/New_York,EDT,-14400000,us_market,False,0.0443764,22.545,CLOSED,iShares iBonds 2026 Term High Y,iShares iBonds 2026 Term High Yield and Income ETF,0.0,22.545,0.0,0.0100002,22.53 - 22.55,Cboe US,346080,0.034999847,0.0015548577,22.51 - 23.455,-0.90999985,-0.03879769,-2.8986156,6.37,0.15152,0.15152,857518340.0,2.13031,-0.10553932,-0.004659462,-0.42772484,-0.01861881,0.35,15,0,False,True,1605709800000,,"The fund seeks to meet its investment objective generally by investing in component securities of the index. The index is composed of U.S. dollar-denominated, taxable, fixed-rate, high yield (which are considered below investment-grade) and BBB or equivalently rated corporate bonds scheduled to mature between January 1, 2026 and December 15, 2026, inclusive.",Target Maturity,iShares,Exchange Traded Fund,0.5191,0.0,0.4809,0.0,0.0,0.0,0.0,0.0,0.0,0.0,0.0,0.0,0.0,0.0,0.0,1.0,0.0,0.0,0.0034999999,0.0016391,0.7,0.4005,0.0,0.0,70.0,0.34999999,12.02896,"[{""Symbol"":""XTSLA"",""Name"":""BlackRock Cash Funds Treasury SL Agency"",""Holding Percent"":0.1202896}]","[{""Average"":""Price\/Earnings"",""IBHF"":0.0,""Category Average"":null},{""Average"":""Price\/Book"",""IBHF"":0.0,""Category Average"":null},{""Average"":""Price\/Sales"",""IBHF"":0.0,""Category Average"":null},{""Average"":""Price\/Cashflow"",""IBHF"":0.0,""Category Average"":null},{""Average"":""Median Market Cap"",""IBHF"":null,""Category Average"":null},{""Average"":""3 Year Earnings Growth"",""IBHF"":null,""Category Average"":null}]",0.0,0.0,,"[{""Average"":""Duration"",""IBHF"":4.11,""Category Average"":null},{""Average"":""Maturity"",""IBHF"":9.963,""Category Average"":null},{""Average"":""Credit Quality"",""IBHF"":null,""Category Average"":null}]",0.0397316,,0.2897,0.0,0.0,0.0014,0.0023,0.029000001,0.624,0.0537,,,,,,,,,,,,,,,,,,,,
Energy,energy,29,TPYP,Tortoise North American Pipeline Fund,https://finance.yahoo.com/research-hub/screener/sec-ind_sec-top-etfs_energy/,2026-07-19T04:19:51+00:00,en-US,US,ETF,ETF,Delayed Quote,False,LOW,3.27,22.05558,10.8015,34.74743,1435671000000.0,-2.3133264,True,1784332617.0,0.0,,42.5788,1.0811996,0.02539291,39.205544,4.4544563,0.0,22.994368,0.0,20.56914,-0.42318,-0.42318,853045120.0,CLOSED,USD,False,False,False,2.0,1.8987259,200.0,finmb_297929091,NYSE,,15.0,0.0,America/New_York,EDT,-14400000.0,[],9.720001,43.475,77923.0,0.229565,0.2863878,33.94 - 44.58,-0.920002,43.66,44.0,43.475 - 44.0,45.0,-0.0206371,25.42733,,Tortoise North American Pipelin,0.4,42.65,-1.0099983,0.0999985,1784318402.0,us_market,NYQ,44.58,33.94,3.27,0.11361802,41.17,43.56,Tortoise North American Pipeline Fund,43.77,77229.0,47850.0,200.0,TPYP,1490918400.0,,,,,,,,,,,,,,(414) 287-3700,"The fund will normally invest at least 80% of its net assets, plus the amount of any borrowings for investment purposes, in the types of securities suggested by its name. The underlying index is a float adjusted, capitalization weighted index of pipeline companies that are organized and have their principal place of business in the United States or Canada. The fund is non-diversified.",[],[],86400,2,43.56,43.77,43.475,44.0,43.56,43.77,43.475,44.0,22.994368,77923,77923,77229,47850,47850,41.17,45.0,200.0,200.0,0.0327,853045120.0,33.94,44.58,44.58,10.92,42.5788,39.205544,0.0,0.0,43.6092,USD,False,Energy Limited Partnership,20.56914,0.28,"Tortoise Capital Advisors, LLC",1435536000.0,Exchange Traded Fund,0.2599184,ETF,TPYP,en-US,US,ETF,Delayed Quote,True,HIGH,[],1784332617.0,1784318402,NYQ,finmb_297929091,America/New_York,EDT,-14400000,us_market,False,0.229565,43.66,CLOSED,Tortoise North American Pipelin,Tortoise North American Pipeline Fund,-2.3133264,42.65,-1.0099983,0.0999985,43.475 - 44.0,NYSE,77229,9.720001,0.2863878,33.94 - 44.58,-0.920002,-0.0206371,25.42733,3.27,-0.42318,-0.42318,853045120.0,1.8987259,1.0811996,0.02539291,4.4544563,0.11361802,0.4,15,0,False,True,1435671000000,,"The fund will normally invest at least 80% of its net assets, plus the amount of any borrowings for investment purposes, in the types of securities suggested by its name. The underlying index is a float adjusted, capitalization weighted index of pipeline companies that are organized and have their principal place of business in the United States or Canada. The fund is non-diversified.",Energy Limited Partnership,"Tortoise Capital Advisors, LLC",Exchange Traded Fund,0.0019,0.997,0.0,0.0,0.0,0.0011,0.0,0.0,0.0,0.0,0.0,0.0,0.0,0.1407,0.0,0.8593,0.0,0.0,0.004,0.0156968,0.06,0.3614,35040.37,35040.37,6.0,0.4,62.95146020000001,"[{""Symbol"":""WMB"",""Name"":""Williams Companies Inc"",""Holding Percent"":0.077863105},{""Symbol"":""KMI"",""Name"":""Kinder Morgan Inc Class P"",""Holding Percent"":0.0756212},{""Symbol"":""TRP.TO"",""Name"":""TC Energy Corp"",""Holding Percent"":0.0729445},{""Symbol"":""ENB.TO"",""Name"":""Enbridge Inc"",""Holding Percent"":0.0726941},{""Symbol"":""LNG"",""Name"":""Cheniere Energy Inc"",""Holding Percent"":0.0719035},{""Symbol"":""TRGP"",""Name"":""Targa Resources Corp"",""Holding Percent"":0.0695348},{""Symbol"":""OKE"",""Name"":""ONEOK Inc"",""Holding Percent"":0.0661767},{""Symbol"":""NI"",""Name"":""NiSource Inc"",""Holding Percent"":0.0411615},{""Symbol"":""ATO"",""Name"":""Atmos Energy Corp"",""Holding Percent"":0.041080497},{""Symbol"":""ET"",""Name"":""Energy Transfer LP"",""Holding Percent"":0.0405347}]","[{""Average"":""Price\/Earnings"",""TPYP"":0.04534,""Category Average"":null},{""Average"":""Price\/Book"",""TPYP"":0.32487,""Category Average"":null},{""Average"":""Price\/Sales"",""TPYP"":0.5118,""Category Average"":null},{""Average"":""Price\/Cashflow"",""TPYP"":0.09612,""Category Average"":null},{""Average"":""Median Market Cap"",""TPYP"":null,""Category Average"":null},{""Average"":""3 Year Earnings Growth"",""TPYP"":null,""Category Average"":null}]",0.04534,0.32487,,"[{""Average"":""Duration"",""TPYP"":null,""Category Average"":null},{""Average"":""Maturity"",""TPYP"":null,""Category Average"":null},{""Average"":""Credit Quality"",""TPYP"":null,""Category Average"":null}]",0.1998155,1490918400.0,,,,,,,,,,,,,,,0.0,,,,,,,,,,,,,
