sector,yahoo_sector_key,rank,ticker,etf_name,source_url,retrieved_at_utc,screen_language,screen_region,screen_quote_type,screen_type_disp,screen_quote_source_name,screen_triggerable,screen_custom_price_alert_confidence,screen_yield_ttm,screen_pe_ttm,screen_annual_return_nav_y3,screen_annual_return_nav_y5,screen_first_trade_date_milliseconds,screen_post_market_change_percent,screen_has_pre_post_market_data,screen_post_market_time,screen_shares_outstanding,screen_book_value,screen_fifty_day_average,screen_fifty_day_average_change,screen_fifty_day_average_change_percent,screen_two_hundred_day_average,screen_two_hundred_day_average_change,screen_trailing_annual_dividend_rate,screen_trailing_pe,screen_trailing_annual_dividend_yield,screen_ytd_return,screen_trailing_three_month_returns,screen_trailing_three_month_nav_returns,screen_net_assets,screen_market_state,screen_currency,screen_esg_populated,screen_tradeable,screen_crypto_tradeable,screen_price_hint,screen_eps_trailing_twelve_months,screen_bid_size,screen_message_board_id,screen_full_exchange_name,screen_price_to_book,screen_source_interval,screen_exchange_data_delayed_by,screen_exchange_timezone_name,screen_exchange_timezone_short_name,screen_gmt_off_set_milliseconds,screen_corporate_actions,screen_fifty_two_week_low_change,screen_regular_market_day_low,screen_regular_market_volume,screen_regular_market_change_percent,screen_fifty_two_week_low_change_percent,screen_fifty_two_week_range,screen_fifty_two_week_high_change,screen_regular_market_price,screen_regular_market_day_high,screen_regular_market_day_range,screen_ask,screen_fifty_two_week_high_change_percent,screen_fifty_two_week_change_percent,screen_financial_currency,screen_short_name,screen_net_expense_ratio,screen_post_market_price,screen_post_market_change,screen_regular_market_change,screen_regular_market_time,screen_market,screen_exchange,screen_fifty_two_week_high,screen_fifty_two_week_low,screen_dividend_yield,screen_two_hundred_day_average_change_percent,screen_bid,screen_regular_market_previous_close,screen_long_name,screen_regular_market_open,screen_average_daily_volume3_month,screen_average_daily_volume10_day,screen_ask_size,screen_symbol,screen_dividend_date,screen_ipo_expected_date,screen_earnings_timestamp_start,screen_earnings_timestamp_end,screen_earnings_call_timestamp_start,screen_earnings_call_timestamp_end,screen_is_earnings_date_estimate,screen_prev_name,screen_name_change_date,screen_eps_forward,screen_forward_pe,screen_display_name,screen_implied_shares_outstanding,screen_market_cap,info_phone,info_long_business_summary,info_company_officers,info_executive_team,info_max_age,info_price_hint,info_previous_close,info_open,info_day_low,info_day_high,info_regular_market_previous_close,info_regular_market_open,info_regular_market_day_low,info_regular_market_day_high,info_trailing_pe,info_volume,info_regular_market_volume,info_average_volume,info_average_volume10days,info_average_daily_volume10_day,info_bid,info_ask,info_bid_size,info_ask_size,info_yield,info_total_assets,info_fifty_two_week_low,info_fifty_two_week_high,info_all_time_high,info_all_time_low,info_fifty_day_average,info_two_hundred_day_average,info_trailing_annual_dividend_rate,info_trailing_annual_dividend_yield,info_nav_price,info_currency,info_tradeable,info_category,info_ytd_return,info_beta3_year,info_fund_family,info_fund_inception_date,info_legal_type,info_three_year_average_return,info_quote_type,info_symbol,info_language,info_region,info_type_disp,info_quote_source_name,info_triggerable,info_custom_price_alert_confidence,info_corporate_actions,info_post_market_time,info_regular_market_time,info_exchange,info_message_board_id,info_exchange_timezone_name,info_exchange_timezone_short_name,info_gmt_off_set_milliseconds,info_market,info_esg_populated,info_regular_market_change_percent,info_regular_market_price,info_market_state,info_short_name,info_long_name,info_post_market_change_percent,info_post_market_price,info_post_market_change,info_regular_market_change,info_regular_market_day_range,info_full_exchange_name,info_average_daily_volume3_month,info_fifty_two_week_low_change,info_fifty_two_week_low_change_percent,info_fifty_two_week_range,info_fifty_two_week_high_change,info_fifty_two_week_high_change_percent,info_fifty_two_week_change_percent,info_dividend_yield,info_trailing_three_month_returns,info_trailing_three_month_nav_returns,info_net_assets,info_eps_trailing_twelve_months,info_fifty_day_average_change,info_fifty_day_average_change_percent,info_two_hundred_day_average_change,info_two_hundred_day_average_change_percent,info_net_expense_ratio,info_source_interval,info_exchange_data_delayed_by,info_crypto_tradeable,info_has_pre_post_market_data,info_first_trade_date_milliseconds,info_trailing_peg_ratio,fund_description,fund_overview_category_name,fund_overview_family,fund_overview_legal_type,fund_asset_class_cash_position,fund_asset_class_stock_position,fund_asset_class_bond_position,fund_asset_class_preferred_position,fund_asset_class_convertible_position,fund_asset_class_other_position,fund_sector_weight_realestate,fund_sector_weight_consumer_cyclical,fund_sector_weight_basic_materials,fund_sector_weight_consumer_defensive,fund_sector_weight_technology,fund_sector_weight_communication_services,fund_sector_weight_financial_services,fund_sector_weight_utilities,fund_sector_weight_industrials,fund_sector_weight_energy,fund_sector_weight_healthcare,fund_bond_rating_us_government,fund_annual_report_expense_ratio,fund_annual_report_expense_ratio_category_average,fund_annual_holdings_turnover,fund_annual_holdings_turnover_category_average,fund_total_net_assets,fund_total_net_assets_category_average,compact_annual_holdings_turnover_pct,compact_expense_ratio_pct,compact_top_10_holdings_weight_pct,fund_top_holdings_json,fund_equity_holdings_json,compact_price_to_earnings,compact_price_to_book,compact_weighted_average_market_cap,fund_bond_holdings_json,info_five_year_average_return,info_dividend_date,fund_bond_rating_bb,fund_bond_rating_aa,fund_bond_rating_aaa,fund_bond_rating_a,fund_bond_rating_other,fund_bond_rating_b,fund_bond_rating_bbb,fund_bond_rating_below_b,info_ipo_expected_date,info_earnings_timestamp_start,info_earnings_timestamp_end,info_current_price,info_recommendation_key,retrieval_errors,info_shares_outstanding,info_display_name,info_earnings_call_timestamp_start,info_earnings_call_timestamp_end,info_is_earnings_date_estimate,info_book_value,info_price_to_book,info_financial_currency,info_prev_name,info_name_change_date,info_forward_pe,info_eps_forward,info_market_cap,info_implied_shares_outstanding
Energy,energy,1,IUSB,iShares Core Universal USD Bond ETF,https://finance.yahoo.com/research-hub/screener/sec-ind_sec-top-etfs_energy/,2026-07-19T04:19:51+00:00,en-US,US,ETF,ETF,Nasdaq Real Time Price,False,LOW,4.0,10.989010989010989,6.20431,-1.27768,1402579800000.0,-0.17471462,True,1784324472.0,,,45.9596,-0.16959763,-0.003690146,46.44775,-0.6577492,0.0,10.879714,0.0,0.83088,0.9078,0.9078,42765500000.0,CLOSED,USD,False,False,False,2.0,4.2087502,1.0,finmb_266031808,NasdaqGM,,15.0,0.0,America/New_York,EDT,-14400000.0,[],0.3199997,45.785,3040611.0,0.0436977,0.0070376005,45.47 - 47.23,-1.4399986,45.79,45.8799,45.785 - 45.8799,45.8,-0.030489067,-0.21791458,,iShares Core Universal USD Bond,0.06,45.71,-0.08000183,0.0200005,1784318400.0,us_market,NGM,47.23,45.47,4.21,-0.014161056,45.77,45.77,iShares Core Universal USD Bond ETF,45.83,5777637.0,3466510.0,3.0,IUSB,1522972800.0,,,,,,,,,,,,,,415-670-2000,The fund will invest at least 80% of its assets in the component securities of the underlying index and to-be-announced transactions (“TBAs”) that have economic characteristics that are substantially identical to the economic characteristics of the component securities of the underlying index. The index measures the performance of U.S. dollar-denominated taxable bonds that are rated either investment-grade or high yield.,[],[],86400,2,45.77,45.83,45.785,45.8799,45.77,45.83,45.785,45.8799,10.879714,3040611,3040611,5777637,3466510,3466510,45.77,45.8,1.0,3.0,0.0421,42765500416.0,45.47,47.23,56.835,42.56,45.9596,46.44775,0.0,0.0,45.7793,USD,False,Intermediate Core-Plus Bond,0.83088,0.96,iShares,1402358400.0,Exchange Traded Fund,0.043860503,ETF,IUSB,en-US,US,ETF,Nasdaq Real Time Price,True,HIGH,[],1784324472.0,1784318400,NGM,finmb_266031808,America/New_York,EDT,-14400000,us_market,False,0.0436977,45.79,CLOSED,iShares Core Universal USD Bond,iShares Core Universal USD Bond ETF,-0.17471462,45.71,-0.08000183,0.0200005,45.785 - 45.8799,NasdaqGM,5777637,0.3199997,0.0070376005,45.47 - 47.23,-1.4399986,-0.030489067,-0.21791458,4.21,0.9078,0.9078,42765500000.0,4.2087502,-0.16959763,-0.003690146,-0.6577492,-0.014161056,0.06,15,0,False,True,1402579800000,,The fund will invest at least 80% of its assets in the component securities of the underlying index and to-be-announced transactions (“TBAs”) that have economic characteristics that are substantially identical to the economic characteristics of the component securities of the underlying index. The index measures the performance of U.S. dollar-denominated taxable bonds that are rated either investment-grade or high yield.,Intermediate Core-Plus Bond,iShares,Exchange Traded Fund,0.0087,0.0,0.99120003,0.0,0.0001,0.0,0.0,0.0,0.0,0.0,0.0,0.0,0.0,0.0,0.0,1.0,0.0,0.4509,0.00059999997,0.0074361004,0.88,1.6444,0.0,0.0,88.0,0.059999997,4.151669999999999,"[{""Symbol"":""TMCXX"",""Name"":""BlackRock Liquidity TempCash Instl"",""Holding Percent"":0.0415167}]","[{""Average"":""Price\/Earnings"",""IUSB"":0.0,""Category Average"":null},{""Average"":""Price\/Book"",""IUSB"":0.0,""Category Average"":null},{""Average"":""Price\/Sales"",""IUSB"":0.0,""Category Average"":null},{""Average"":""Price\/Cashflow"",""IUSB"":0.0,""Category Average"":null},{""Average"":""Median Market Cap"",""IUSB"":null,""Category Average"":null},{""Average"":""3 Year Earnings Growth"",""IUSB"":null,""Category Average"":null}]",0.0,0.0,,"[{""Average"":""Duration"",""IUSB"":4.11,""Category Average"":null},{""Average"":""Maturity"",""IUSB"":9.472,""Category Average"":null},{""Average"":""Credit Quality"",""IUSB"":null,""Category Average"":null}]",0.002174,1522972800.0,0.0364,0.64599997,0.023,0.1358,0.00029999999,0.0217,0.1317,0.0050999997,,,,,,,,,,,,,,,,,,,,
Energy,energy,2,XLE,State Street Energy Select Sector SPDR ETF,https://finance.yahoo.com/research-hub/screener/sec-ind_sec-top-etfs_energy/,2026-07-19T04:19:51+00:00,en-US,US,ETF,ETF,Nasdaq Real Time Price,False,LOW,2.85,19.755038,-0.71642,53.25565,914337000000.0,0.15603355,True,1784332763.0,186424000.0,52.115,56.5236,1.1563988,0.020458689,51.879623,5.800377,2.16,21.428017,0.037881445,20.52531,-12.55565,-12.55565,35721339000.0,CLOSED,USD,False,False,False,2.0,2.691803,11800.0,finmb_8795479,NYSEArca,1.106783,15.0,0.0,America/New_York,EDT,-14400000.0,[],15.630001,57.28,31354891.0,1.15749,0.37170038,42.05 - 63.46,-5.779999,57.68,58.115,57.28 - 58.115,57.8,-0.09108098,35.60597,USD,State Street Energy Select Sect,0.08,57.77,0.09000015,0.66,1784318400.0,us_market,PCX,63.46,42.05,2.85,0.11180453,57.71,57.02,State Street Energy Select Sector SPDR ETF,57.95,35989193.0,31687640.0,15900.0,XLE,,,,,,,,,,,,,,,,"In seeking to track the performance of the index, the fund employs a replication strategy. It generally invests substantially all, but at least 95%, of its total assets in the securities comprising the index. The index includes companies that have been identified as Energy companies by the GICS®, including securities of companies from the following industries: oil, gas and consumable fuels; and energy equipment and services. It is non-diversified.",[],[],86400,2,57.02,57.95,57.28,58.115,57.02,57.95,57.28,58.115,21.428017,31354891,31354891,35989193,31687640,31687640,57.71,57.8,11800.0,15900.0,0.028499998,35721338880.0,42.05,63.46,90.94,9.69,56.5236,51.879623,2.16,0.037881445,57.68321,USD,False,Equity Energy,20.52531,-0.02,State Street Investment Management,913766400.0,Exchange Traded Fund,0.1600929,ETF,XLE,en-US,US,ETF,Nasdaq Real Time Price,True,HIGH,[],1784332763.0,1784318400,PCX,finmb_8795479,America/New_York,EDT,-14400000,us_market,False,1.15749,57.68,CLOSED,State Street Energy Select Sect,State Street Energy Select Sector SPDR ETF,0.15603355,57.77,0.09000015,0.66,57.28 - 58.115,NYSEArca,35989193,15.630001,0.37170038,42.05 - 63.46,-5.779999,-0.09108098,35.60597,2.85,-12.55565,-12.55565,35721339000.0,2.691803,1.1563988,0.020458689,5.800377,0.11180453,0.08,15,0,False,True,914337000000,,"In seeking to track the performance of the index, the fund employs a replication strategy. It generally invests substantially all, but at least 95%, of its total assets in the securities comprising the index. The index includes companies that have been identified as Energy companies by the GICS®, including securities of companies from the following industries: oil, gas and consumable fuels; and energy equipment and services. It is non-diversified.",Equity Energy,State Street Investment Management,Exchange Traded Fund,0.0016,0.9984,0.0,0.0,0.0,0.0,0.0,0.0,0.0,0.0,0.0,0.0,0.0,0.0,0.0,1.0,0.0,0.0,0.0008,0.0092652,0.1,0.5106,122845.97,122845.97,10.0,0.08,71.56540989999999,"[{""Symbol"":""XOM"",""Name"":""Exxon Mobil Corp"",""Holding Percent"":0.2025335},{""Symbol"":""CVX"",""Name"":""Chevron Corp"",""Holding Percent"":0.1437405},{""Symbol"":""COP"",""Name"":""ConocoPhillips"",""Holding Percent"":0.0586663},{""Symbol"":""SLB"",""Name"":""SLB Ltd"",""Holding Percent"":0.045293197},{""Symbol"":""WMB"",""Name"":""Williams Companies Inc"",""Holding Percent"":0.0449115},{""Symbol"":""MPC"",""Name"":""Marathon Petroleum Corp"",""Holding Percent"":0.0445644},{""Symbol"":""EOG"",""Name"":""EOG Resources Inc"",""Holding Percent"":0.0444317},{""Symbol"":""VLO"",""Name"":""Valero Energy Corp"",""Holding Percent"":0.0441841},{""Symbol"":""PSX"",""Name"":""Phillips 66"",""Holding Percent"":0.0438871},{""Symbol"":""KMI"",""Name"":""Kinder Morgan Inc Class P"",""Holding Percent"":0.043441802}]","[{""Average"":""Price\/Earnings"",""XLE"":0.05062,""Category Average"":null},{""Average"":""Price\/Book"",""XLE"":0.42553,""Category Average"":null},{""Average"":""Price\/Sales"",""XLE"":0.64728,""Category Average"":null},{""Average"":""Price\/Cashflow"",""XLE"":0.10713,""Category Average"":null},{""Average"":""Median Market Cap"",""XLE"":null,""Category Average"":null},{""Average"":""3 Year Earnings Growth"",""XLE"":null,""Category Average"":null}]",0.05062,0.42553,,"[{""Average"":""Duration"",""XLE"":null,""Category Average"":null},{""Average"":""Maturity"",""XLE"":null,""Category Average"":null},{""Average"":""Credit Quality"",""XLE"":null,""Category Average"":null}]",0.2321312,,,,,,,,,,,,,,,,186424000.0,,,,,52.115,1.106783,USD,,,,,,
Energy,energy,3,USHY,iShares Broad USD High Yield Corporate Bond ETF,https://finance.yahoo.com/research-hub/screener/sec-ind_sec-top-etfs_energy/,2026-07-19T04:19:51+00:00,en-US,US,ETF,ETF,Delayed Quote,False,LOW,6.78,10.989010989010989,13.50456,5.14426,1509024600000.0,-0.054245885,True,1784330933.0,,,36.9413,-0.07130051,-0.0019301028,37.23025,-0.36025238,0.0,10.81882,0.0,1.90604,2.46597,2.46597,28476405800.0,CLOSED,USD,False,False,False,2.0,3.4079502,68000.0,finmb_533589528,Cboe US,,15.0,0.0,America/New_York,EDT,-14400000.0,[],0.47999954,36.86,8897187.0,-0.135426,0.013190425,36.39 - 37.867,-0.99700165,36.87,36.95,36.86 - 36.95,36.87,-0.026329037,-1.3379693,,iShares Broad USD High Yield Co,0.08,36.85,-0.020000458,-0.0499992,1784318401.0,us_market,BTS,37.867,36.39,6.89,-0.009676334,36.87,36.92,iShares Broad USD High Yield Corporate Bond ETF,36.91,10629459.0,8395990.0,94200.0,USHY,,,,,,,,,,,,,,,415-670-2000,The fund will invest at least 80% of its assets in the component securities of the underlying index and it will invest at least 90% of its assets in fixed income securities of the types included in the underlying index that BFA believes will help the fund track the underlying index. The underlying index is designed to provide a broad representation of the U.S. dollar-denominated high yield corporate bond market.,[],[],86400,2,36.92,36.91,36.86,36.95,36.92,36.91,36.86,36.95,10.81882,8897187,8897187,10629459,8395990,8395990,36.87,36.87,68000.0,94200.0,0.0689,28476405760.0,36.39,37.867,41.941666,31.581,36.9413,37.23025,0.0,0.0,36.86328,USD,False,High Yield Bond,1.90604,0.64,iShares,1508889600.0,Exchange Traded Fund,0.0855509,ETF,USHY,en-US,US,ETF,Delayed Quote,True,HIGH,[],1784330933.0,1784318401,BTS,finmb_533589528,America/New_York,EDT,-14400000,us_market,False,-0.135426,36.87,CLOSED,iShares Broad USD High Yield Co,iShares Broad USD High Yield Corporate Bond ETF,-0.054245885,36.85,-0.020000458,-0.0499992,36.86 - 36.95,Cboe US,10629459,0.47999954,0.013190425,36.39 - 37.867,-0.99700165,-0.026329037,-1.3379693,6.89,2.46597,2.46597,28476405800.0,3.4079502,-0.07130051,-0.0019301028,-0.36025238,-0.009676334,0.08,15,0,False,True,1509024600000,,The fund will invest at least 80% of its assets in the component securities of the underlying index and it will invest at least 90% of its assets in fixed income securities of the types included in the underlying index that BFA believes will help the fund track the underlying index. The underlying index is designed to provide a broad representation of the U.S. dollar-denominated high yield corporate bond market.,High Yield Bond,iShares,Exchange Traded Fund,0.0074,0.0,0.9925,0.0,0.0,0.0,0.0081,0.0,0.0,0.0,0.0,0.0,0.0,0.0,0.0,0.9919,0.0,0.0,0.0008,0.008518,0.21,0.7432,0.0,0.0,21.0,0.08,1.34113,"[{""Symbol"":""XTSLA"",""Name"":""BlackRock Cash Funds Treasury SL Agency"",""Holding Percent"":0.0134113}]","[{""Average"":""Price\/Earnings"",""USHY"":0.0,""Category Average"":null},{""Average"":""Price\/Book"",""USHY"":0.0,""Category Average"":null},{""Average"":""Price\/Sales"",""USHY"":0.0,""Category Average"":null},{""Average"":""Price\/Cashflow"",""USHY"":0.0,""Category Average"":null},{""Average"":""Median Market Cap"",""USHY"":null,""Category Average"":null},{""Average"":""3 Year Earnings Growth"",""USHY"":null,""Category Average"":null}]",0.0,0.0,,"[{""Average"":""Duration"",""USHY"":6.7,""Category Average"":null},{""Average"":""Maturity"",""USHY"":9.851,""Category Average"":null},{""Average"":""Credit Quality"",""USHY"":null,""Category Average"":null}]",0.0413707,,0.5479,0.0,0.0,0.0,0.0019,0.3453,0.0117,0.0933,,,,,,,,,,,,,,,,,,,,
Energy,energy,4,PYLD,PIMCO ETF Trust - PIMCO Multisector Bond Active Exchange-Traded Fund,https://finance.yahoo.com/research-hub/screener/sec-ind_sec-top-etfs_energy/,2026-07-19T04:19:51+00:00,en-US,US,ETF,ETF,Delayed Quote,False,LOW,,,,,1687440600000.0,0.07609798,True,1784328796.0,,,26.3657,-0.08569908,-0.0032504003,26.60143,-0.3214302,0.0,,0.0,1.59944,2.34168,2.34168,14711611400.0,CLOSED,USD,False,False,False,2.0,,16100.0,finmb_1835233450,NYSEArca,,15.0,0.0,America/New_York,EDT,-14400000.0,[],0.3600006,26.27,4038432.0,-0.151972,0.013888912,25.92 - 27.04,-0.7600002,26.28,26.34,26.27 - 26.34,26.29,-0.028106516,-0.45454502,,PIMCO Multisector Bond Active E,0.64,26.3,0.01999855,-0.039999,1784318400.0,us_market,PCX,27.04,25.92,5.83,-0.012083192,26.1,26.32,PIMCO ETF Trust - PIMCO Multisector Bond Active Exchange-Traded Fund,26.3,3931146.0,4394230.0,25000.0,PYLD,,,,,,,,,,,,,,,,"The fund seeks to achieve its investment objective by investing, under normal circumstances, at least 80% of its assets in a multi-sector portfolio of Fixed Income Instruments of varying maturities, which may be represented by forwards or derivatives such as options, futures contracts or swap agreements. “Fixed Income Instruments” include bonds, debt securities and other similar instruments issued by various U.S. and non-U.S. public- or private-sector entities.",[],[],86400,2,26.32,26.3,26.27,26.34,26.32,26.3,26.27,26.34,,4038432,4038432,3931146,4394230,4394230,26.1,26.29,16100.0,25000.0,0.0583,14711611392.0,25.92,27.04,27.04,23.765,26.3657,26.60143,0.0,0.0,26.28,USD,False,Multisector Bond,1.59944,0.81,PIMCO,1687305600.0,Exchange Traded Fund,0.0762509,ETF,PYLD,en-US,US,ETF,Delayed Quote,True,HIGH,[],1784328796.0,1784318400,PCX,finmb_1835233450,America/New_York,EDT,-14400000,us_market,False,-0.151972,26.28,CLOSED,PIMCO Multisector Bond Active E,PIMCO ETF Trust - PIMCO Multisector Bond Active Exchange-Traded Fund,0.07609798,26.3,0.01999855,-0.039999,26.27 - 26.34,NYSEArca,3931146,0.3600006,0.013888912,25.92 - 27.04,-0.7600002,-0.028106516,-0.45454502,5.83,2.34168,2.34168,14711611400.0,,-0.08569908,-0.0032504003,-0.3214302,-0.012083192,0.64,15,0,False,True,1687440600000,,"The fund seeks to achieve its investment objective by investing, under normal circumstances, at least 80% of its assets in a multi-sector portfolio of Fixed Income Instruments of varying maturities, which may be represented by forwards or derivatives such as options, futures contracts or swap agreements. “Fixed Income Instruments” include bonds, debt securities and other similar instruments issued by various U.S. and non-U.S. public- or private-sector entities.",Multisector Bond,PIMCO,Exchange Traded Fund,-0.5926,0.0,1.5942,0.0,0.0,-0.0016,0.0,0.0,0.0,0.0,0.0,0.0,0.0,0.0,0.0,1.0,0.0,0.20989999,0.0064,0.0092469,5.01,1.4834,0.0,0.0,5.01,0.64,,,"[{""Average"":""Price\/Earnings"",""PYLD"":0.0,""Category Average"":null},{""Average"":""Price\/Book"",""PYLD"":0.0,""Category Average"":null},{""Average"":""Price\/Sales"",""PYLD"":0.0,""Category Average"":null},{""Average"":""Price\/Cashflow"",""PYLD"":0.0,""Category Average"":null},{""Average"":""Median Market Cap"",""PYLD"":null,""Category Average"":null},{""Average"":""3 Year Earnings Growth"",""PYLD"":null,""Category Average"":null}]",0.0,0.0,,"[{""Average"":""Duration"",""PYLD"":5.3,""Category Average"":null},{""Average"":""Maturity"",""PYLD"":9.835,""Category Average"":null},{""Average"":""Credit Quality"",""PYLD"":null,""Category Average"":null}]",,,0.1188,0.41970003,0.1442,0.0435,0.0,0.0197,0.2391,0.0150999995,,,,,,,,,,,,,,,,,,,,
Energy,energy,5,JCPB,JPMorgan Core Plus Bond ETF,https://finance.yahoo.com/research-hub/screener/sec-ind_sec-top-etfs_energy/,2026-07-19T04:19:51+00:00,en-US,US,ETF,ETF,Delayed Quote,False,LOW,5.14,59.98800239952009,7.04871,-0.501,1552397400000.0,0.0,True,1784322300.0,,,46.7264,-0.14639664,-0.0031330606,47.26728,-0.68727875,0.0,60.377388,0.0,1.16132,0.97595,0.97595,13578677200.0,CLOSED,USD,False,False,False,2.0,0.7714809,7900.0,finmb_576700807,NYSEArca,,15.0,0.0,America/New_York,EDT,-14400000.0,[],0.37000275,46.555,1487808.0,0.0644524,0.008006984,46.21 - 48.17,-1.5899963,46.58,46.655,46.555 - 46.655,47.0,-0.03300802,-0.21422505,,JPMorgan Core Plus Bond ETF,0.37,46.58,0.0,0.0300026,1784318400.0,us_market,PCX,48.17,46.21,4.91,-0.014540264,45.47,46.55,JPMorgan Core Plus Bond ETF,46.6,2247674.0,1567050.0,5200.0,JCPB,,,,,,,,,,,,,,,(844) 457-6383,"As a matter of non-fundamental policy, the fund will ordinarily invest at least 80% of its assets in bonds. The fund's average weighted maturity will ordinarily range between five and twenty years. The balance of the fund's assets are not required to meet any minimum quality rating although the fund will not, under normal circumstances, invest more than 30% of its assets in below investment grade securities (or the unrated equivalent).",[],[],86400,2,46.55,46.6,46.555,46.655,46.55,46.6,46.555,46.655,60.377388,1487808,1487808,2247674,1567050,1567050,45.47,47.0,7900.0,5200.0,0.049099997,13578677248.0,46.21,48.17,56.73,43.47,46.7264,47.26728,0.0,0.0,46.4381,USD,False,Intermediate Core-Plus Bond,1.16132,1.0,JPMorgan,1548633600.0,Exchange Traded Fund,0.0500899,ETF,JCPB,en-US,US,ETF,Delayed Quote,True,HIGH,[],1784322300.0,1784318400,PCX,finmb_576700807,America/New_York,EDT,-14400000,us_market,False,0.0644524,46.58,CLOSED,JPMorgan Core Plus Bond ETF,JPMorgan Core Plus Bond ETF,0.0,46.58,0.0,0.0300026,46.555 - 46.655,NYSEArca,2247674,0.37000275,0.008006984,46.21 - 48.17,-1.5899963,-0.03300802,-0.21422505,4.91,0.97595,0.97595,13578677200.0,0.7714809,-0.14639664,-0.0031330606,-0.68727875,-0.014540264,0.37,15,0,False,True,1552397400000,,"As a matter of non-fundamental policy, the fund will ordinarily invest at least 80% of its assets in bonds. The fund's average weighted maturity will ordinarily range between five and twenty years. The balance of the fund's assets are not required to meet any minimum quality rating although the fund will not, under normal circumstances, invest more than 30% of its assets in below investment grade securities (or the unrated equivalent).",Intermediate Core-Plus Bond,JPMorgan,Exchange Traded Fund,0.1038,0.0,0.8918,0.0033000002,0.0011999999,0.0,0.0,0.0,0.0,0.0,0.0,0.0,0.0,0.0,0.0,1.0,0.0,0.1412,0.0037,0.0074361004,0.58,1.6444,0.0,0.0,57.99999999999999,0.37,10.0489505,"[{""Symbol"":""MGMXX"",""Name"":""JPMorgan US Government MMkt IM"",""Holding Percent"":0.100489505}]","[{""Average"":""Price\/Earnings"",""JCPB"":0.0,""Category Average"":null},{""Average"":""Price\/Book"",""JCPB"":0.0,""Category Average"":null},{""Average"":""Price\/Sales"",""JCPB"":0.0,""Category Average"":null},{""Average"":""Price\/Cashflow"",""JCPB"":0.0,""Category Average"":null},{""Average"":""Median Market Cap"",""JCPB"":null,""Category Average"":null},{""Average"":""3 Year Earnings Growth"",""JCPB"":null,""Category Average"":null}]",0.0,0.0,,"[{""Average"":""Duration"",""JCPB"":4.8,""Category Average"":null},{""Average"":""Maturity"",""JCPB"":9.543,""Category Average"":null},{""Average"":""Credit Quality"",""JCPB"":null,""Category Average"":null}]",0.0091219,,0.0971,0.060100004,0.46240002,0.1163,0.102,0.0209,0.1396,0.0016,,,,,,,,,,,,,,,,,,,,
