Energy,energy,54,HYTR,Counterpoint High Yield Trend ETF,https://finance.yahoo.com/research-hub/screener/sec-ind_sec-top-etfs_energy/,2026-07-19T04:19:51+00:00,en-US,US,ETF,ETF,Delayed Quote,False,LOW,5.47,10.989010989010989,,,1579703400000.0,0.0,True,1784322300.0,,,21.37938,-0.08407974,-0.0039327494,21.61389,-0.31859016,0.0,10.593675,0.0,0.54699,1.6532,1.6532,281449952.0,CLOSED,USD,False,False,False,2.0,2.01019,100.0,finmb_647865688,NYSE,,15.0,0.0,America/New_York,EDT,-14400000.0,[],0.13029861,21.29,60163.0,-0.00376166,0.0061563244,21.165 - 22.04,-0.7447014,21.2953,21.31,21.29 - 21.31,22.4,-0.03378863,-1.7984807,,Counterpoint High Yield Trend E,0.88,21.2953,0.0,-0.000801086,1784316760.0,us_market,NYQ,22.04,21.165,5.74,-0.014740067,20.18,21.2961,Counterpoint High Yield Trend ETF,21.31,60591.0,64040.0,2700.0,HYTR,,,,,,,,,,,,,,,631-470-2621,The fund seeks to achieve its investment objective by investing at least 80% of its net assets in securities included in the index. The rules-based index is comprised of constituents that are a blend of allocations to two asset classes: unaffiliated U.S. high yield corporate bond (or “junk bond”) exchange-traded funds (“ETFs”) and unaffiliated U.S. 3-7 year Treasury ETFs. The index also includes a stop loss mechanism on the U.S. 3-7 year Treasury ETFs that allows the index to invest in U.S. T-bill ETFs.,[],[],86400,2,21.2961,21.31,21.29,21.31,21.2961,21.31,21.29,21.31,10.593675,60163,60163,60591,64040,64040,20.18,22.4,100.0,2700.0,0.0574,281449952.0,21.165,22.04,26.31,20.165,21.37938,21.61389,0.0,0.0,21.28,USD,False,Nontraditional Bond,0.54699,0.64,Counterpoint Mutual Funds,1579651200.0,Exchange Traded Fund,0.0606261,ETF,HYTR,en-US,US,ETF,Delayed Quote,True,HIGH,[],1784322300.0,1784316760,NYQ,finmb_647865688,America/New_York,EDT,-14400000,us_market,False,-0.00376166,21.2953,CLOSED,Counterpoint High Yield Trend E,Counterpoint High Yield Trend ETF,0.0,21.2953,0.0,-0.000801086,21.29 - 21.31,NYSE,60591,0.13029861,0.0061563244,21.165 - 22.04,-0.7447014,-0.03378863,-1.7984807,5.74,1.6532,1.6532,281449952.0,2.01019,-0.08407974,-0.0039327494,-0.31859016,-0.014740067,0.88,15,0,False,True,1579703400000,,The fund seeks to achieve its investment objective by investing at least 80% of its net assets in securities included in the index. The rules-based index is comprised of constituents that are a blend of allocations to two asset classes: unaffiliated U.S. high yield corporate bond (or “junk bond”) exchange-traded funds (“ETFs”) and unaffiliated U.S. 3-7 year Treasury ETFs. The index also includes a stop loss mechanism on the U.S. 3-7 year Treasury ETFs that allows the index to invest in U.S. T-bill ETFs.,Nontraditional Bond,Counterpoint Mutual Funds,Exchange Traded Fund,0.010299999,0.0002,0.9895,0.0,0.0,0.0,0.0045,0.0,0.0,0.0,0.0926,0.0,0.0,0.0,0.0,0.9029,0.0,0.0,0.0088,0.0143136,2.78,2.5095,0.0,0.0,2.78,0.88,99.99376,"[{""Symbol"":""USHY"",""Name"":""iShares Broad USD High Yield Corp Bd ETF"",""Holding Percent"":0.3998059},{""Symbol"":""JNK"",""Name"":""State Street\u00ae SPDR\u00ae Blmbg Hi Yld Bd ETF"",""Holding Percent"":0.3002646},{""Symbol"":""HYG"",""Name"":""iShares iBoxx $ High Yield Corp Bd ETF"",""Holding Percent"":0.2998671}]","[{""Average"":""Price\/Earnings"",""HYTR"":0.0,""Category Average"":null},{""Average"":""Price\/Book"",""HYTR"":0.0,""Category Average"":null},{""Average"":""Price\/Sales"",""HYTR"":0.0,""Category Average"":null},{""Average"":""Price\/Cashflow"",""HYTR"":0.0,""Category Average"":null},{""Average"":""Median Market Cap"",""HYTR"":null,""Category Average"":null},{""Average"":""3 Year Earnings Growth"",""HYTR"":null,""Category Average"":null}]",0.0,0.0,,"[{""Average"":""Duration"",""HYTR"":6.86,""Category Average"":null},{""Average"":""Maturity"",""HYTR"":9.895,""Category Average"":null},{""Average"":""Credit Quality"",""HYTR"":null,""Category Average"":null}]",0.020067899,,0.55869997,0.0,-0.0014,0.0,0.002,0.3474,0.0046,0.088599995,,,,,,,,,,,,,,,,,,,,
Energy,energy,55,MDST,Westwood Salient Enhanced Midstream Income ETF,https://finance.yahoo.com/research-hub/screener/sec-ind_sec-top-etfs_energy/,2026-07-19T04:19:51+00:00,en-US,US,ETF,ETF,Delayed Quote,False,LOW,9.42,20.104544,,,1712755800000.0,0.0,True,1784322300.0,,,29.2393,0.5407009,0.018492267,27.70698,2.073021,0.0,20.680944,0.0,15.26855,2.1478,2.1478,270975264.0,CLOSED,USD,False,False,False,2.0,1.439973,700.0,finmb_1869403092,NYSE,,15.0,0.0,America/New_York,EDT,-14400000.0,[],4.8500004,29.725,57494.0,-0.217787,0.19454473,24.93 - 30.43,-0.6499996,29.78,30.0437,29.725 - 30.0437,29.82,-0.021360487,11.744844,,Westwood Salient Enhanced Midst,0.8,29.78,0.0,-0.0649986,1784318402.0,us_market,NYQ,30.43,24.93,9.42,0.074819446,28.49,29.845,Westwood Salient Enhanced Midstream Income ETF,29.88,60875.0,51830.0,100.0,MDST,,,,,,,,,,,,,,,,"The fund is an actively managed exchange-traded fund (“ETF”) that seeks to achieve its investment objectives by investing, under normal circumstances, at least 80% of its net assets (plus the amount of borrowings, if any, for investment purposes) in securities of Midstream North American corporations and Midstream U.S. master limited partnerships (“MLPs”). The fund is non-diversified.",[],[],86400,2,29.845,29.88,29.725,30.0437,29.845,29.88,29.725,30.0437,20.680944,57494,57494,60875,51830,51830,28.49,29.82,700.0,100.0,0.0942,270975264.0,24.93,30.43,30.43,23.24,29.2393,27.70698,0.0,0.0,29.77,USD,False,Energy Limited Partnership,15.26855,0.0,Westwood,1712534400.0,Exchange Traded Fund,,ETF,MDST,en-US,US,ETF,Delayed Quote,True,HIGH,[],1784322300.0,1784318402,NYQ,finmb_1869403092,America/New_York,EDT,-14400000,us_market,False,-0.217787,29.78,CLOSED,Westwood Salient Enhanced Midst,Westwood Salient Enhanced Midstream Income ETF,0.0,29.78,0.0,-0.0649986,29.725 - 30.0437,NYSE,60875,4.8500004,0.19454473,24.93 - 30.43,-0.6499996,-0.021360487,11.744844,9.42,2.1478,2.1478,270975264.0,1.439973,0.5407009,0.018492267,2.073021,0.074819446,0.8,15,0,False,True,1712755800000,,"The fund is an actively managed exchange-traded fund (“ETF”) that seeks to achieve its investment objectives by investing, under normal circumstances, at least 80% of its net assets (plus the amount of borrowings, if any, for investment purposes) in securities of Midstream North American corporations and Midstream U.S. master limited partnerships (“MLPs”). The fund is non-diversified.",Energy Limited Partnership,Westwood,Exchange Traded Fund,0.0332,0.96690005,0.0,0.0,0.0,0.0,0.0,0.0,0.0,0.0,0.0,0.0,0.0,0.0,0.0,1.0,0.0,0.0,0.008,0.0156968,0.12,0.3614,33005.57,33005.57,12.0,0.8,64.2500513,"[{""Symbol"":""ENB.TO"",""Name"":""Enbridge Inc"",""Holding Percent"":0.0897707},{""Symbol"":""ET"",""Name"":""Energy Transfer LP"",""Holding Percent"":0.0865495},{""Symbol"":""WMB"",""Name"":""Williams Companies Inc"",""Holding Percent"":0.08652601},{""Symbol"":""EPD"",""Name"":""Enterprise Products Partners LP"",""Holding Percent"":0.0664677},{""Symbol"":""DTM"",""Name"":""DT Midstream Inc Ordinary Shares"",""Holding Percent"":0.065614},{""Symbol"":""KMI"",""Name"":""Kinder Morgan Inc Class P"",""Holding Percent"":0.056602},{""Symbol"":""TRP.TO"",""Name"":""TC Energy Corp"",""Holding Percent"":0.0492901},{""Symbol"":""TRGP"",""Name"":""Targa Resources Corp"",""Holding Percent"":0.0473557},{""Symbol"":""AM"",""Name"":""Antero Midstream Corp"",""Holding Percent"":0.0471923},{""Symbol"":""OKE"",""Name"":""ONEOK Inc"",""Holding Percent"":0.047132503}]","[{""Average"":""Price\/Earnings"",""MDST"":0.04974,""Category Average"":null},{""Average"":""Price\/Book"",""MDST"":0.29489,""Category Average"":null},{""Average"":""Price\/Sales"",""MDST"":0.76229,""Category Average"":null},{""Average"":""Price\/Cashflow"",""MDST"":0.12253,""Category Average"":null},{""Average"":""Median Market Cap"",""MDST"":null,""Category Average"":null},{""Average"":""3 Year Earnings Growth"",""MDST"":null,""Category Average"":null}]",0.04974,0.29489,,"[{""Average"":""Duration"",""MDST"":null,""Category Average"":null},{""Average"":""Maturity"",""MDST"":null,""Category Average"":null},{""Average"":""Credit Quality"",""MDST"":null,""Category Average"":null}]",,,,,,,,,,,,,,,,,,,,,,,,,,,,,,
Energy,energy,56,DRLL,Strive U.S. Energy ETF,https://finance.yahoo.com/research-hub/screener/sec-ind_sec-top-etfs_energy/,2026-07-19T04:19:51+00:00,en-US,US,ETF,ETF,Delayed Quote,False,LOW,2.55,18.552876,,,1660051800000.0,1.2653457,True,1784322300.0,,,35.70638,1.2954216,0.03627984,33.039017,3.9627838,0.0,20.473837,0.0,18.82037,-14.69737,-14.69737,261199728.0,CLOSED,USD,False,False,False,2.0,1.8072724,400.0,finmb_1795970621,NYSE,,15.0,0.0,America/New_York,EDT,-14400000.0,[],10.001801,36.6943,12231.0,1.79313,0.37043706,27.0 - 41.025,-4.023201,37.0018,37.1501,36.6943 - 37.1501,36.94,-0.09806705,34.699665,,Strive U.S. Energy ETF,0.41,37.47,0.46820068,0.651802,1784318193.0,us_market,NYQ,41.025,27.0,2.55,0.119942546,36.86,36.35,Strive U.S. Energy ETF,37.0,16682.0,15450.0,600.0,DRLL,,,,,,,,,,,,,,,,"The fund seeks to track the investment results of the Bloomberg U.S. Energy Select Index, which measures the performance of U.S. oil and gas producers. The index is designed by Bloomberg Index Services Limited and consists of U.S. equity securities. It is non-diversified.",[],[],86400,2,36.35,37.0,36.6943,37.1501,36.35,37.0,36.6943,37.1501,20.473837,12231,12231,16682,15450,15450,36.86,36.94,400.0,600.0,0.0255,261199728.0,27.0,41.025,41.025,23.56,35.70638,33.039017,0.0,0.0,36.9994,USD,False,Equity Energy,18.82037,-0.09,Strive AM,1659916800.0,Exchange Traded Fund,0.1362357,ETF,DRLL,en-US,US,ETF,Delayed Quote,True,HIGH,[],1784322300.0,1784318193,NYQ,finmb_1795970621,America/New_York,EDT,-14400000,us_market,False,1.79313,37.0018,CLOSED,Strive U.S. Energy ETF,Strive U.S. Energy ETF,1.2653457,37.47,0.46820068,0.651802,36.6943 - 37.1501,NYSE,16682,10.001801,0.37043706,27.0 - 41.025,-4.023201,-0.09806705,34.699665,2.55,-14.69737,-14.69737,261199728.0,1.8072724,1.2954216,0.03627984,3.9627838,0.119942546,0.41,15,0,False,True,1660051800000,,"The fund seeks to track the investment results of the Bloomberg U.S. Energy Select Index, which measures the performance of U.S. oil and gas producers. The index is designed by Bloomberg Index Services Limited and consists of U.S. equity securities. It is non-diversified.",Equity Energy,Strive AM,Exchange Traded Fund,0.0025,0.9976,0.0,0.0,0.0,-0.0001,0.0,0.0091,0.0,0.0,0.0,0.0,0.0,0.0,0.0,0.9909,0.0,0.0,0.0041,0.0092652,0.08,0.5106,108728.26,108728.26,8.0,0.41000000000000003,78.52782870000001,"[{""Symbol"":""XOM"",""Name"":""Exxon Mobil Corp"",""Holding Percent"":0.21978599},{""Symbol"":""CVX"",""Name"":""Chevron Corp"",""Holding Percent"":0.2176548},{""Symbol"":""VLO"",""Name"":""Valero Energy Corp"",""Holding Percent"":0.0515666},{""Symbol"":""MPC"",""Name"":""Marathon Petroleum Corp"",""Holding Percent"":0.047763},{""Symbol"":""PSX"",""Name"":""Phillips 66"",""Holding Percent"":0.0473632},{""Symbol"":""EOG"",""Name"":""EOG Resources Inc"",""Holding Percent"":0.046024397},{""Symbol"":""DVN"",""Name"":""Devon Energy Corp"",""Holding Percent"":0.042842798},{""Symbol"":""COP"",""Name"":""ConocoPhillips"",""Holding Percent"":0.042690102},{""Symbol"":""OXY"",""Name"":""Occidental Petroleum Corp"",""Holding Percent"":0.0351824},{""Symbol"":""FANG"",""Name"":""Diamondback Energy Inc"",""Holding Percent"":0.034405}]","[{""Average"":""Price\/Earnings"",""DRLL"":0.0539,""Category Average"":null},{""Average"":""Price\/Book"",""DRLL"":0.51145,""Category Average"":null},{""Average"":""Price\/Sales"",""DRLL"":0.74608,""Category Average"":null},{""Average"":""Price\/Cashflow"",""DRLL"":0.13126,""Category Average"":null},{""Average"":""Median Market Cap"",""DRLL"":null,""Category Average"":null},{""Average"":""3 Year Earnings Growth"",""DRLL"":null,""Category Average"":null}]",0.0539,0.51145,,"[{""Average"":""Duration"",""DRLL"":null,""Category Average"":null},{""Average"":""Maturity"",""DRLL"":null,""Category Average"":null},{""Average"":""Credit Quality"",""DRLL"":null,""Category Average"":null}]",,,,,,,,,,,,,,,,,,,,,,,,,,,,,,
Energy,energy,57,HYZD,WisdomTree Interest Rate Hedged High Yield Bond Fund,https://finance.yahoo.com/research-hub/screener/sec-ind_sec-top-etfs_energy/,2026-07-19T04:19:51+00:00,en-US,US,ETF,ETF,Nasdaq Real Time Price,False,LOW,,,11.95935,5.76939,1387377000000.0,-0.022557497,True,1784319004.0,,,22.5688,0.036100388,0.0015995705,22.5049,0.10000038,,,,2.94223,2.87513,2.87513,240625968.0,CLOSED,USD,False,False,False,2.0,,2.0,finmb_253025487,NasdaqGM,,15.0,0.0,America/New_York,EDT,-14400000.0,[],0.6648998,22.5853,30373.0,-0.110909425,0.030305369,21.94 - 22.81,-0.2050991,22.6049,22.67,22.5853 - 22.67,22.61,-0.008991632,0.66815615,,WisdomTree Interest Rate Hedged,0.43,22.6049,-0.0051002502,-0.0250988,1784318400.0,us_market,NGM,22.81,21.94,5.9,0.0044434937,16.26,22.63,WisdomTree Interest Rate Hedged High Yield Bond Fund,22.66,65043.0,83210.0,1.0,HYZD,1495756800.0,,,,,,,,,,,,,,866-909-9473,"Under normal circumstances, at least 80% of the fund’s total assets (exclusive of collateral held from securities lending) will be invested in the constituent securities of the index and investments that have economic characteristics that are substantially identical to the economic characteristics of such constituent securities. The index is comprised of long and short positions. The fund is non-diversified.",[],[],86400,2,22.63,22.66,22.5853,22.67,22.63,22.66,22.5853,22.67,,30373,30373,65043,83210,83210,16.26,22.61,2.0,1.0,0.059,240625968.0,21.94,22.81,26.52,16.0,22.5688,22.5049,,,22.59,USD,False,Nontraditional Bond,2.94223,0.2,WisdomTree,1387324800.0,Exchange Traded Fund,0.0864513,ETF,HYZD,en-US,US,ETF,Nasdaq Real Time Price,True,HIGH,[],1784319004.0,1784318400,NGM,finmb_253025487,America/New_York,EDT,-14400000,us_market,False,-0.110909425,22.6049,CLOSED,WisdomTree Interest Rate Hedged,WisdomTree Interest Rate Hedged High Yield Bond Fund,-0.022557497,22.6049,-0.0051002502,-0.0250988,22.5853 - 22.67,NasdaqGM,65043,0.6648998,0.030305369,21.94 - 22.81,-0.2050991,-0.008991632,0.66815615,5.9,2.87513,2.87513,240625968.0,,0.036100388,0.0015995705,0.10000038,0.0044434937,0.43,15,0,False,True,1387377000000,,"Under normal circumstances, at least 80% of the fund’s total assets (exclusive of collateral held from securities lending) will be invested in the constituent securities of the index and investments that have economic characteristics that are substantially identical to the economic characteristics of such constituent securities. The index is comprised of long and short positions. The fund is non-diversified.",Nontraditional Bond,WisdomTree,Exchange Traded Fund,0.0,0.0,1.0,0.0,0.0,0.0,0.0,0.0,0.0,0.0,0.0,0.0,0.0,0.0,0.0,1.0,0.0,-0.0011,0.0043,0.0143136,0.61,2.5095,0.0,0.0,61.0,0.43,,,"[{""Average"":""Price\/Earnings"",""HYZD"":0.0,""Category Average"":null},{""Average"":""Price\/Book"",""HYZD"":0.0,""Category Average"":null},{""Average"":""Price\/Sales"",""HYZD"":0.0,""Category Average"":null},{""Average"":""Price\/Cashflow"",""HYZD"":0.0,""Category Average"":null},{""Average"":""Median Market Cap"",""HYZD"":null,""Category Average"":null},{""Average"":""3 Year Earnings Growth"",""HYZD"":null,""Category Average"":null}]",0.0,0.0,,"[{""Average"":""Duration"",""HYZD"":6.22,""Category Average"":null},{""Average"":""Maturity"",""HYZD"":9.875,""Category Average"":null},{""Average"":""Credit Quality"",""HYZD"":null,""Category Average"":null}]",0.062433902,1495756800.0,0.59580004,0.0070999996,0.0,0.0,0.0007,0.2458,0.1076,0.0432,,,,,,,,,,,,,,,,,,,,
Energy,energy,58,PGHY,Invesco Global ex-US High Yield Corporate Bond ETF,https://finance.yahoo.com/research-hub/screener/sec-ind_sec-top-etfs_energy/,2026-07-19T04:19:51+00:00,en-US,US,ETF,ETF,Delayed Quote,False,LOW,,,10.35672,1.13505,1371821400000.0,0.0,True,1784322300.0,,,19.7894,-0.05940056,-0.0030016352,19.85005,-0.12005043,0.0,,0.0,2.58715,2.86247,2.86247,219470624.0,CLOSED,USD,False,False,False,2.0,,300.0,finmb_233330119,NYSEArca,,15.0,0.0,America/New_York,EDT,-14400000.0,[],0.4699993,19.72,77796.0,-0.101268,0.024402872,19.26 - 20.4,-0.6700001,19.73,19.8,19.72 - 19.8,19.8,-0.032843143,-0.65458417,,Invesco Global ex-US High Yield,0.35,19.73,0.0,-0.0200005,1784318392.0,us_market,PCX,20.4,19.26,7.14,-0.0060478654,19.72,19.75,Invesco Global ex-US High Yield Corporate Bond ETF,19.74,49451.0,46130.0,100.0,PGHY,,,,,,,,,,,,,,,,"The fund invests at least 80% of its total assets in the components that comprise the underlying index. The underlying index is composed of U.S. dollar denominated, below investment grade corporate debt that is publicly issued in the U.S. domestic and eurobond markets by non-U.S. issuers.",[],[],86400,2,19.75,19.74,19.72,19.8,19.75,19.74,19.72,19.8,,77796,77796,49451,46130,46130,19.72,19.8,300.0,100.0,0.0714,219470624.0,19.26,20.4,28.83,17.4,19.7894,19.85005,0.0,0.0,19.69,USD,False,High Yield Bond,2.58715,0.54,Invesco,1371686400.0,Exchange Traded Fund,0.0838888,ETF,PGHY,en-US,US,ETF,Delayed Quote,True,HIGH,[],1784322300.0,1784318392,PCX,finmb_233330119,America/New_York,EDT,-14400000,us_market,False,-0.101268,19.73,CLOSED,Invesco Global ex-US High Yield,Invesco Global ex-US High Yield Corporate Bond ETF,0.0,19.73,0.0,-0.0200005,19.72 - 19.8,NYSEArca,49451,0.4699993,0.024402872,19.26 - 20.4,-0.6700001,-0.032843143,-0.65458417,7.14,2.86247,2.86247,219470624.0,,-0.05940056,-0.0030016352,-0.12005043,-0.0060478654,0.35,15,0,False,True,1371821400000,,"The fund invests at least 80% of its total assets in the components that comprise the underlying index. The underlying index is composed of U.S. dollar denominated, below investment grade corporate debt that is publicly issued in the U.S. domestic and eurobond markets by non-U.S. issuers.",High Yield Bond,Invesco,Exchange Traded Fund,0.0191,0.0022,0.97720003,0.0,0.0016,0.0,0.0,0.038599998,0.0,0.0,0.0,0.0,0.0,0.0,0.0,0.9614,0.0,0.012,0.0034999999,0.008518,0.31,0.7432,0.0,0.0,31.0,0.34999999,0.87936,"[{""Symbol"":""AGPXX"",""Name"":""Invesco Shrt-Trm Inv Gov&Agcy Instl"",""Holding Percent"":0.0087936}]","[{""Average"":""Price\/Earnings"",""PGHY"":0.0,""Category Average"":null},{""Average"":""Price\/Book"",""PGHY"":0.0,""Category Average"":null},{""Average"":""Price\/Sales"",""PGHY"":0.0,""Category Average"":null},{""Average"":""Price\/Cashflow"",""PGHY"":0.0,""Category Average"":null},{""Average"":""Median Market Cap"",""PGHY"":null,""Category Average"":null},{""Average"":""3 Year Earnings Growth"",""PGHY"":null,""Category Average"":null}]",0.0,0.0,,"[{""Average"":""Duration"",""PGHY"":7.03,""Category Average"":null},{""Average"":""Maturity"",""PGHY"":9.871,""Category Average"":null},{""Average"":""Credit Quality"",""PGHY"":null,""Category Average"":null}]",0.0455435,,0.6261,0.0,0.0043,0.0,0.0037,0.2868,0.0107,0.0684,,,,,,,,,,,,,,,,,,,,
Energy,energy,59,GDMA,Gadsden Dynamic Multi-Asset ETF,https://finance.yahoo.com/research-hub/screener/sec-ind_sec-top-etfs_energy/,2026-07-19T04:19:51+00:00,en-US,US,ETF,ETF,Delayed Quote,False,LOW,2.48,28.498148,1.85317,4.24255,1542292200000.0,0.0,True,1784322300.0,,,41.9378,-0.48630142,-0.011595778,40.72955,0.72195053,0.0,27.210283,0.0,12.6065,6.61022,6.61022,212615808.0,CLOSED,USD,False,False,False,2.0,1.5233762,1800.0,finmb_577854503,Cboe US,,15.0,0.0,America/New_York,EDT,-14400000.0,[],6.5214996,41.295,10718.0,-0.489017,0.18670197,34.93 - 44.04,-2.588501,41.4515,41.505,41.295 - 41.505,45.47,-0.058776133,16.859318,,Gadsden Dynamic Multi-Asset ETF,0.75,41.4515,0.0,-0.203701,1784315075.0,us_market,BTS,44.04,34.93,2.48,0.017725473,41.42,41.6552,Gadsden Dynamic Multi-Asset ETF,41.25,12801.0,9050.0,1800.0,GDMA,,,,,,,,,,,,,,,,"The fund is an actively-managed ETF that seeks to achieve its investment objective by investing in asset classes that the fund's portfolio managers believe offer the most attractive combined risk/return opportunities. The term ""asset classes"" generally includes, among others, U.S. equities, foreign securities, currencies, bonds, and REITs. It may invest globally in any asset class or security and may at times have significant exposure to a single asset class.",[],[],86400,2,41.6552,41.25,41.295,41.505,41.6552,41.25,41.295,41.505,27.210283,10718,10718,12801,9050,9050,41.42,45.47,1800.0,1800.0,0.0248,212615808.0,34.93,44.04,44.04,20.22,41.9378,40.72955,0.0,0.0,41.4348,USD,False,Global Moderately Conservative Allocation,12.6065,0.51,Gadsden,1542153600.0,Exchange Traded Fund,0.1536098,ETF,GDMA,en-US,US,ETF,Delayed Quote,True,HIGH,[],1784322300.0,1784315075,BTS,finmb_577854503,America/New_York,EDT,-14400000,us_market,False,-0.489017,41.4515,CLOSED,Gadsden Dynamic Multi-Asset ETF,Gadsden Dynamic Multi-Asset ETF,0.0,41.4515,0.0,-0.203701,41.295 - 41.505,Cboe US,12801,6.5214996,0.18670197,34.93 - 44.04,-2.588501,-0.058776133,16.859318,2.48,6.61022,6.61022,212615808.0,1.5233762,-0.48630142,-0.011595778,0.72195053,0.017725473,0.75,15,0,False,True,1542292200000,,"The fund is an actively-managed ETF that seeks to achieve its investment objective by investing in asset classes that the fund's portfolio managers believe offer the most attractive combined risk/return opportunities. The term ""asset classes"" generally includes, among others, U.S. equities, foreign securities, currencies, bonds, and REITs. It may invest globally in any asset class or security and may at times have significant exposure to a single asset class.",Global Moderately Conservative Allocation,Gadsden,Exchange Traded Fund,-0.26680002,0.9184,0.3145,0.0,0.0,0.034,0.012,0.0654,0.0184,0.0312,0.4955,0.0661,0.113900006,0.0194,0.0946,0.024600001,0.059,0.32099998,0.0075,0.0099502,6.61,0.6236,337171.78,337171.78,6.61,0.75,80.2473999,"[{""Symbol"":""VTIP"",""Name"":""Vanguard Short-Term Infl-Prot Secs ETF"",""Holding Percent"":0.2972665},{""Symbol"":""BOXX"",""Name"":""Alpha Architect 1-3 Month Box ETF"",""Holding Percent"":0.2913689},{""Symbol"":""DRAM"",""Name"":""Roundhill Memory ETF"",""Holding Percent"":0.033254698},{""Symbol"":""KBE"",""Name"":""State Street\u00ae SPDR\u00ae S&P\u00ae Bank ETF"",""Holding Percent"":0.0298551},{""Symbol"":""BWZ"",""Name"":""State Street\u00ae SPDR\u00ae BlmbgSTIntrnTrsBdETF"",""Holding Percent"":0.029745901},{""Symbol"":""SGOL"",""Name"":""abrdn Physical Gold Shares ETF"",""Holding Percent"":0.0296153},{""Symbol"":""BAI"",""Name"":""iShares A.I. Innovation and Tech Act ETF"",""Holding Percent"":0.0268386},{""Symbol"":""FNDF"",""Name"":""Schwab Fundamental International Eq ETF"",""Holding Percent"":0.0247043},{""Symbol"":""GRID"",""Name"":""First Trust NASDAQ\u00ae Cln Edge\u00aeStGidIfsETF"",""Holding Percent"":0.0199979},{""Symbol"":""SNDK"",""Name"":""SanDisk Corp Ordinary Shares"",""Holding Percent"":0.0198268}]","[{""Average"":""Price\/Earnings"",""GDMA"":0.03509,""Category Average"":null},{""Average"":""Price\/Book"",""GDMA"":0.1892,""Category Average"":null},{""Average"":""Price\/Sales"",""GDMA"":0.24778,""Category Average"":null},{""Average"":""Price\/Cashflow"",""GDMA"":0.04603,""Category Average"":null},{""Average"":""Median Market Cap"",""GDMA"":null,""Category Average"":null},{""Average"":""3 Year Earnings Growth"",""GDMA"":null,""Category Average"":null}]",0.03509,0.1892,,"[{""Average"":""Duration"",""GDMA"":1.25,""Category Average"":null},{""Average"":""Maturity"",""GDMA"":9.806,""Category Average"":null},{""Average"":""Credit Quality"",""GDMA"":null,""Category Average"":null}]",0.0824316,,0.0,0.014099999,0.92440003,0.047,0.00059999997,0.0,0.0139,0.0,,,,,,,,,,,,,,,,,,,,
