Energy,energy,84,OILU,MicroSectorsTM Oil & Gas Exploration & Production 3X Leveraged ETNs,https://finance.yahoo.com/research-hub/screener/sec-ind_sec-top-etfs_energy/,2026-07-19T04:19:51+00:00,en-US,US,ETF,ETF,Nasdaq Real Time Price,False,LOW,0.0,19.204916,,,1636468200000.0,3.1180959,True,1784332650.0,,,40.1021,0.62789917,0.015657512,34.63256,6.097439,0.0,24.257437,0.0,39.73607,-41.22668,-41.22668,48369680.0,CLOSED,USD,False,False,False,2.0,1.6790727,600.0,finmb_1685440285,NYSEArca,,15.0,0.0,America/New_York,EDT,-14400000.0,[],20.949999,39.7994,253262.0,3.98264,1.0591506,19.78 - 61.417,-20.687,40.73,41.35,39.7994 - 41.35,41.29,-0.33682856,92.122635,,MicroSectors Oil & Gas Exp. & P,0.95,42.0,1.2700005,1.56,1784318400.0,us_market,PCX,61.417,19.78,0.0,0.17606087,38.6,39.17,MicroSectorsTM Oil & Gas Exploration & Production 3X Leveraged ETNs,41.25,198241.0,200160.0,400.0,OILU,,,1756125000.0,1756470600.0,1748433600.0,1748433600.0,False,,,,,,,,,,[],[],86400,2,39.17,41.25,39.7994,41.35,39.17,41.25,39.7994,41.35,24.257437,253262,253262,198241,200160,200160,38.6,41.29,600.0,400.0,0.0,48369680.0,19.78,61.417,88.0,15.15,40.1021,34.63256,0.0,0.0,40.78601,USD,False,Trading--Leveraged Equity,39.73607,-0.01,BMO Capital Markets,1636329600.0,Exchange Traded Fund,0.0487249,ETF,OILU,en-US,US,ETF,Nasdaq Real Time Price,True,HIGH,[],1784332650.0,1784318400,PCX,finmb_1685440285,America/New_York,EDT,-14400000,us_market,False,3.98264,40.73,CLOSED,MicroSectors Oil & Gas Exp. & P,MicroSectorsTM Oil & Gas Exploration & Production 3X Leveraged ETNs,3.1180959,42.0,1.2700005,1.56,39.7994 - 41.35,NYSEArca,198241,20.949999,1.0591506,19.78 - 61.417,-20.687,-0.33682856,92.122635,0.0,-41.22668,-41.22668,48369680.0,1.6790727,0.62789917,0.015657512,6.097439,0.17606087,0.95,15,0,False,True,1636468200000,,,Trading--Leveraged Equity,BMO Capital Markets,Exchange Traded Fund,0.0,1.0,0.0,0.0,0.0,0.0,0.0,0.0,0.0,0.0,0.0,0.0,0.0,0.0,0.0,1.0,0.0,0.0,0.0095,0.0,0.0,,95296.81,95296.81,0.0,0.95,67.4053882,"[{""Symbol"":""XOM"",""Name"":""Exxon Mobil Corp"",""Holding Percent"":0.14976579},{""Symbol"":""CVX"",""Name"":""Chevron Corp"",""Holding Percent"":0.14668089},{""Symbol"":""COP"",""Name"":""ConocoPhillips"",""Holding Percent"":0.0656852},{""Symbol"":""SLB"",""Name"":""SLB Ltd"",""Holding Percent"":0.0546829},{""Symbol"":""OXY"",""Name"":""Occidental Petroleum Corp"",""Holding Percent"":0.0539297},{""Symbol"":""DVN"",""Name"":""Devon Energy Corp"",""Holding Percent"":0.044846702},{""Symbol"":""VLO"",""Name"":""Valero Energy Corp"",""Holding Percent"":0.0445551},{""Symbol"":""BKR"",""Name"":""Baker Hughes Co Class A"",""Holding Percent"":0.0392631},{""Symbol"":""EOG"",""Name"":""EOG Resources Inc"",""Holding Percent"":0.0387908},{""Symbol"":""FANG"",""Name"":""Diamondback Energy Inc"",""Holding Percent"":0.0358537}]","[{""Average"":""Price\/Earnings"",""OILU"":0.05207,""Category Average"":null},{""Average"":""Price\/Book"",""OILU"":0.46517,""Category Average"":null},{""Average"":""Price\/Sales"",""OILU"":0.63593,""Category Average"":null},{""Average"":""Price\/Cashflow"",""OILU"":0.12732,""Category Average"":null},{""Average"":""Median Market Cap"",""OILU"":null,""Category Average"":null},{""Average"":""3 Year Earnings Growth"",""OILU"":null,""Category Average"":null}]",0.05207,0.46517,,"[{""Average"":""Duration"",""OILU"":null,""Category Average"":null},{""Average"":""Maturity"",""OILU"":null,""Category Average"":null},{""Average"":""Credit Quality"",""OILU"":null,""Category Average"":null}]",,,,,,,,,,,,1756125000.0,1756470600.0,,,,,,1748433600.0,1748433600.0,False,,,,,,,,,
Energy,energy,85,LNGX,Global X U.S. Natural Gas ETF,https://finance.yahoo.com/research-hub/screener/sec-ind_sec-top-etfs_energy/,2026-07-19T04:19:51+00:00,en-US,US,EQUITY,Equity,Delayed Quote,False,LOW,,,,,1761831000000.0,-2.999996,True,1784325190.0,,,42.03738,-0.03738022,-0.0008892138,40.40453,1.5954704,0.0,13.2942505,0.0,,,,,CLOSED,USD,False,False,False,2.0,3.1592605,900.0,finmb_1956759469,NYSEArca,,15.0,0.0,America/New_York,EDT,-14400000.0,[],8.187,41.455,15145.0,1.65824,0.24212582,33.813 - 49.01,-7.0099983,42.0,42.125,41.455 - 42.125,41.81,-0.143032,24.212587,,Global X U.S. Natural Gas ETF,,40.74,-1.2599983,0.685101,1784318400.0,us_market,PCX,49.01,33.813,,0.039487414,41.64,41.3149,Global X U.S. Natural Gas ETF,41.94,18527.0,9660.0,200.0,LNGX,,,,,,,,Global X Funds - Us Natural Gas ETF,2026-07-19,,,,,,,,,,86400,2,41.3149,41.94,41.455,42.125,41.3149,41.94,41.455,42.125,13.2942505,15145,15145,18527,9660,9660,41.64,41.81,900.0,200.0,,,33.813,49.01,49.01,33.813,42.03738,40.40453,0.0,0.0,,USD,False,,,,,,,,EQUITY,LNGX,en-US,US,Equity,Delayed Quote,True,HIGH,[],1784325190.0,1784318400,PCX,finmb_1956759469,America/New_York,EDT,-14400000,us_market,False,1.65824,42.0,CLOSED,Global X U.S. Natural Gas ETF,Global X U.S. Natural Gas ETF,-2.999996,40.74,-1.2599983,0.685101,41.455 - 42.125,NYSEArca,18527,8.187,0.24212582,33.813 - 49.01,-7.0099983,-0.143032,24.212587,,,,,3.1592605,-0.03738022,-0.0008892138,1.5954704,0.039487414,,15,0,False,True,1761831000000,,,,,,,,,,,,,,,,,,,,,,,,,,,,,,,,,,,,,,,,,,,,,,,,,,,,42.0,none,fund data: LNGX fund data failed: LNGX: No Fund data found.,,,,,,,,,Global X Funds - Us Natural Gas ETF,2026-07-19,,,,
Energy,energy,86,NBET,Neuberger Energy Transition & Infrastructure ETF,https://finance.yahoo.com/research-hub/screener/sec-ind_sec-top-etfs_energy/,2026-07-19T04:19:51+00:00,en-US,US,ETF,ETF,Delayed Quote,False,LOW,2.49,21.303792,,,1649338200000.0,0.0,True,1784322300.0,,,40.01356,0.3876381,0.009687668,36.79376,3.607441,0.0,22.046587,0.0,21.12859,-4.28723,-4.28723,44901392.0,CLOSED,USD,False,False,False,2.0,1.8325375,500.0,finmb_1761865386,NYSEArca,,15.0,0.0,America/New_York,EDT,-14400000.0,[],9.061199,40.35,5780.0,0.232217,0.28912568,31.34 - 42.24,-1.8388023,40.4012,40.4012,40.35 - 40.4012,40.37,-0.043532252,26.716434,,Neuberger Energy Transition & I,0.65,40.4012,0.0,0.0936012,1784316543.0,us_market,PCX,42.24,31.34,2.49,0.09804492,20.17,40.3076,Neuberger Energy Transition & Infrastructure ETF,40.35,4946.0,6140.0,500.0,NBET,,,,,,,,,,,,,,,,"Under normal market conditions, the fund invests at least 80% of its net assets (plus borrowing for investment purposes) in equity securities of carbon transition companies and infrastructure companies. It invests a significant portion of its assets in carbon transition companies, which manager considers to be those companies operating energy infrastructure assets such as pipelines or renewable energy production, utilities, publicly-traded master limited partnerships or limited liability companies taxed as partnerships, MLPs that are taxed as C-corporations, MLP affiliates.",[],[],86400,2,40.3076,40.35,40.35,40.4012,40.3076,40.35,40.35,40.4012,22.046587,5780,5780,4946,6140,6140,20.17,40.37,500.0,500.0,0.0249,44901392.0,31.34,42.24,42.24,20.936,40.01356,36.79376,0.0,0.0,40.38,USD,False,Equity Energy,21.12859,0.6,Neuberger Berman,1649203200.0,Exchange Traded Fund,0.19037041,ETF,NBET,en-US,US,ETF,Delayed Quote,True,HIGH,[],1784322300.0,1784316543,PCX,finmb_1761865386,America/New_York,EDT,-14400000,us_market,False,0.232217,40.4012,CLOSED,Neuberger Energy Transition & I,Neuberger Energy Transition & Infrastructure ETF,0.0,40.4012,0.0,0.0936012,40.35 - 40.4012,NYSEArca,4946,9.061199,0.28912568,31.34 - 42.24,-1.8388023,-0.043532252,26.716434,2.49,-4.28723,-4.28723,44901392.0,1.8325375,0.3876381,0.009687668,3.607441,0.09804492,0.65,15,0,False,True,1649338200000,,"Under normal market conditions, the fund invests at least 80% of its net assets (plus borrowing for investment purposes) in equity securities of carbon transition companies and infrastructure companies. It invests a significant portion of its assets in carbon transition companies, which manager considers to be those companies operating energy infrastructure assets such as pipelines or renewable energy production, utilities, publicly-traded master limited partnerships or limited liability companies taxed as partnerships, MLPs that are taxed as C-corporations, MLP affiliates.",Equity Energy,Neuberger Berman,Exchange Traded Fund,0.0064,0.9935,0.0,0.0,0.0,0.0,0.0,0.0,0.0,0.0,0.0,0.0,0.0,0.0858,0.0257,0.8885,0.0,0.0,0.0064999997,0.0092652,0.15,0.5106,29337.76,29337.76,15.0,0.64999997,58.45563070000001,"[{""Symbol"":""TRGP"",""Name"":""Targa Resources Corp"",""Holding Percent"":0.100421496},{""Symbol"":""EPD"",""Name"":""Enterprise Products Partners LP"",""Holding Percent"":0.076159604},{""Symbol"":""ET"",""Name"":""Energy Transfer LP"",""Holding Percent"":0.075007804},{""Symbol"":""DTM"",""Name"":""DT Midstream Inc Ordinary Shares"",""Holding Percent"":0.064075},{""Symbol"":""LNG"",""Name"":""Cheniere Energy Inc"",""Holding Percent"":0.056480397},{""Symbol"":""WMB"",""Name"":""Williams Companies Inc"",""Holding Percent"":0.056296702},{""Symbol"":""WES"",""Name"":""Western Midstream Partners LP"",""Holding Percent"":0.0423798},{""Symbol"":""AM"",""Name"":""Antero Midstream Corp"",""Holding Percent"":0.041830502},{""Symbol"":""CWEN"",""Name"":""Clearway Energy Inc Class C"",""Holding Percent"":0.037219502},{""Symbol"":""SUNC"",""Name"":""SunocoCorp LLC Common Units"",""Holding Percent"":0.0346855}]","[{""Average"":""Price\/Earnings"",""NBET"":0.04694,""Category Average"":null},{""Average"":""Price\/Book"",""NBET"":0.35949,""Category Average"":null},{""Average"":""Price\/Sales"",""NBET"":0.67042,""Category Average"":null},{""Average"":""Price\/Cashflow"",""NBET"":0.13589,""Category Average"":null},{""Average"":""Median Market Cap"",""NBET"":null,""Category Average"":null},{""Average"":""3 Year Earnings Growth"",""NBET"":null,""Category Average"":null}]",0.04694,0.35949,,"[{""Average"":""Duration"",""NBET"":null,""Category Average"":null},{""Average"":""Maturity"",""NBET"":null,""Category Average"":null},{""Average"":""Credit Quality"",""NBET"":null,""Category Average"":null}]",,,,,,,,,,,,,,,,,,,,,,,,,,,,,,
Energy,energy,87,NRGU,Microsectors U.S. Big Oil 3x Leveraged ETNs,https://finance.yahoo.com/research-hub/screener/sec-ind_sec-top-etfs_energy/,2026-07-19T04:19:51+00:00,en-US,US,ETF,ETF,Nasdaq Real Time Price,False,LOW,0.0,19.654088,,,1740061800000.0,1.9896865,True,1784332457.0,,,35.2154,5.4945984,0.15602829,28.55269,12.157309,0.0,26.87055,0.0,66.90984,-39.67489,-39.67489,44665136.0,CLOSED,USD,False,False,False,2.0,1.5150415,100.0,finmb_1932025486,NYSEArca,,15.0,0.0,America/New_York,EDT,-14400000.0,[],24.55,38.8101,138985.0,6.71035,1.5191832,16.16 - 53.08,-12.370003,40.71,40.89,38.8101 - 40.89,40.83,-0.2330445,128.96513,,MicroSectors U.S. Big Oil 3 Lev,0.35,41.52,0.8100014,2.56,1784318400.0,us_market,PCX,53.08,16.16,0.0,0.42578503,40.95,38.15,Microsectors U.S. Big Oil 3x Leveraged ETNs,40.54,115161.0,111160.0,200.0,NRGU,,,1756125000.0,1756470600.0,1748433600.0,1748433600.0,False,,,,,,,,,"The ETNs are senior unsecured medium-term notes issued by Bank of Montreal with a return linked to a three times leveraged participation in the inverse performance of the index, compounded daily, minus the Daily Investor Fee and, if applicable, the Redemption Fee Amount plus the Daily Interest (which could be negative).",[],[],86400,2,38.15,40.54,38.8101,40.89,38.15,40.54,38.8101,40.89,26.87055,138985,138985,115161,111160,111160,40.95,40.83,100.0,200.0,0.0,44665136.0,16.16,53.08,53.08,10.28,35.2154,28.55269,0.0,0.0,38.23322,USD,False,Trading--Leveraged Equity,66.90984,0.0,BMO Capital Markets,1740009600.0,Exchange Traded Fund,,ETF,NRGU,en-US,US,ETF,Nasdaq Real Time Price,True,HIGH,[],1784332457.0,1784318400,PCX,finmb_1932025486,America/New_York,EDT,-14400000,us_market,False,6.71035,40.71,CLOSED,MicroSectors U.S. Big Oil 3 Lev,Microsectors U.S. Big Oil 3x Leveraged ETNs,1.9896865,41.52,0.8100014,2.56,38.8101 - 40.89,NYSEArca,115161,24.55,1.5191832,16.16 - 53.08,-12.370003,-0.2330445,128.96513,0.0,-39.67489,-39.67489,44665136.0,1.5150415,5.4945984,0.15602829,12.157309,0.42578503,0.35,15,0,False,True,1740061800000,,"The ETNs are senior unsecured medium-term notes issued by Bank of Montreal with a return linked to a three times leveraged participation in the inverse performance of the index, compounded daily, minus the Daily Investor Fee and, if applicable, the Redemption Fee Amount plus the Daily Interest (which could be negative).",Trading--Leveraged Equity,BMO Capital Markets,Exchange Traded Fund,0.0,1.0,0.0,0.0,0.0,0.0,0.0,0.0,0.0,0.0,0.0,0.0,0.0,0.0,0.0,1.0,0.0,,0.0034999999,0.0,0.0,,96396.05,96396.05,0.0,0.34999999,99.9999993,"[{""Symbol"":""VLO"",""Name"":""Valero Energy Corp"",""Holding Percent"":0.1098724},{""Symbol"":""MPC"",""Name"":""Marathon Petroleum Corp"",""Holding Percent"":0.1054253},{""Symbol"":""PSX"",""Name"":""Phillips 66"",""Holding Percent"":0.103941604},{""Symbol"":""EOG"",""Name"":""EOG Resources Inc"",""Holding Percent"":0.0998919},{""Symbol"":""XOM"",""Name"":""Exxon Mobil Corp"",""Holding Percent"":0.098823},{""Symbol"":""DVN"",""Name"":""Devon Energy Corp"",""Holding Percent"":0.098097},{""Symbol"":""CVX"",""Name"":""Chevron Corp"",""Holding Percent"":0.0967873},{""Symbol"":""FANG"",""Name"":""Diamondback Energy Inc"",""Holding Percent"":0.0966854},{""Symbol"":""COP"",""Name"":""ConocoPhillips"",""Holding Percent"":0.095530994},{""Symbol"":""OXY"",""Name"":""Occidental Petroleum Corp"",""Holding Percent"":0.094945095}]","[{""Average"":""Price\/Earnings"",""NRGU"":0.05088,""Category Average"":null},{""Average"":""Price\/Book"",""NRGU"":0.45622,""Category Average"":null},{""Average"":""Price\/Sales"",""NRGU"":0.88247,""Category Average"":null},{""Average"":""Price\/Cashflow"",""NRGU"":0.13044,""Category Average"":null},{""Average"":""Median Market Cap"",""NRGU"":null,""Category Average"":null},{""Average"":""3 Year Earnings Growth"",""NRGU"":null,""Category Average"":null}]",0.05088,0.45622,,"[{""Average"":""Duration"",""NRGU"":null,""Category Average"":null},{""Average"":""Maturity"",""NRGU"":null,""Category Average"":null},{""Average"":""Credit Quality"",""NRGU"":null,""Category Average"":null}]",,,,,,,,,,,,1756125000.0,1756470600.0,,,,,,1748433600.0,1748433600.0,False,,,,,,,,,
Energy,energy,88,TMLP,Tortoise MLP ETF,https://finance.yahoo.com/research-hub/screener/sec-ind_sec-top-etfs_energy/,2026-07-19T04:19:51+00:00,en-US,US,EQUITY,Equity,Delayed Quote,False,LOW,,,,,1767018600000.0,0.0,True,1784322300.0,,,28.61248,0.13252068,0.004631569,27.941362,0.80363846,0.0,13.512092,0.0,,,,,CLOSED,USD,False,False,False,2.0,2.127354,3700.0,finmb_1951086336,NYSEArca,,15.0,0.0,America/New_York,EDT,-14400000.0,[],3.8630009,28.745,687.0,-0.320416,0.15525283,24.882 - 30.16,-1.414999,28.745,29.0,28.745 - 29.0,28.75,-0.046916414,14.53104,,Tortoise MLP ETF,,28.745,0.0,-0.0923996,1784298679.0,us_market,PCX,30.16,24.882,,0.028761607,28.74,28.8374,Tortoise MLP ETF,28.94,4451.0,990.0,100.0,TMLP,,,,,,,,Tortoise Capital Series Trust - Mlp ETF,2026-07-19,,,,,,,,,,86400,2,28.8374,28.94,28.745,29.0,28.8374,28.94,28.745,29.0,13.512092,687,687,4451,990,990,28.74,28.75,3700.0,100.0,,,24.882,30.16,30.16,24.882,28.61248,27.941362,0.0,0.0,,USD,False,,,,,,,,EQUITY,TMLP,en-US,US,Equity,,True,HIGH,[],1784322300.0,1784298679,PCX,finmb_1951086336,America/New_York,EDT,-14400000,us_market,False,-0.320416,28.745,CLOSED,Tortoise MLP ETF,Tortoise MLP ETF,0.0,28.745,0.0,-0.0923996,28.745 - 29.0,NYSEArca,4451,3.8630009,0.15525283,24.882 - 30.16,-1.414999,-0.046916414,14.53104,,,,,2.127354,0.13252068,0.004631569,0.80363846,0.028761607,,15,0,False,True,1767018600000,,,,,,,,,,,,,,,,,,,,,,,,,,,,,,,,,,,,,,,,,,,,,,,,,,,,28.745,none,fund data: TMLP fund data failed: TMLP: No Fund data found.,,,,,,,,,Tortoise Capital Series Trust - Mlp ETF,2026-07-19,,,,
Energy,energy,89,XLEI,State Street Energy Select Sector SPDR Premium Income ETF,https://finance.yahoo.com/research-hub/screener/sec-ind_sec-top-etfs_energy/,2026-07-19T04:19:51+00:00,en-US,US,EQUITY,Equity,Delayed Quote,False,LOW,,,,,1753882200000.0,1.7013189,True,1784332602.0,,,26.21584,0.23416138,0.008932057,25.72205,0.72795105,0.0,21.110655,0.0,,,,,CLOSED,USD,False,False,False,2.0,1.2529218,300.0,finmb_1945162996,NYSEArca,,15.0,0.0,America/New_York,EDT,-14400000.0,[],2.790001,26.31,35200.0,0.64688,0.11792058,23.66 - 29.5,-3.0499992,26.45,26.57,26.31 - 26.57,26.43,-0.10338981,6.020522,,State Street Energy Select Sect,,26.9,0.44999886,0.17,1784318394.0,us_market,PCX,29.5,23.66,,0.028300663,26.36,26.28,State Street Energy Select Sector SPDR Premium Income ETF,26.5,47696.0,49680.0,400.0,XLEI,,,,,,,,The Select Sector SPDR Trust - The Energy Select Sector SPDR Premium Income Fund,2026-07-19,,,,,,,,,,86400,2,26.28,26.5,26.31,26.57,26.28,26.5,26.31,26.57,21.110655,35200,35200,47696,49680,49680,26.36,26.43,300.0,400.0,,,23.66,29.5,29.5,23.66,26.21584,25.72205,0.0,0.0,,USD,False,,,,,,,,EQUITY,XLEI,en-US,US,Equity,Delayed Quote,True,HIGH,[],1784332602.0,1784318394,PCX,finmb_1945162996,America/New_York,EDT,-14400000,us_market,False,0.64688,26.45,CLOSED,State Street Energy Select Sect,State Street Energy Select Sector SPDR Premium Income ETF,1.7013189,26.9,0.44999886,0.17,26.31 - 26.57,NYSEArca,47696,2.790001,0.11792058,23.66 - 29.5,-3.0499992,-0.10338981,6.020522,,,,,1.2529218,0.23416138,0.008932057,0.72795105,0.028300663,,15,0,False,True,1753882200000,,,,,,,,,,,,,,,,,,,,,,,,,,,,,,,,,,,,,,,,,,,,,,,,,,,,26.45,none,fund data: XLEI fund data failed: XLEI: No Fund data found.,,,,,,,,,The Select Sector SPDR Trust - The Energy Select Sector SPDR Premium Income Fund,2026-07-19,,,,
Energy,energy,90,WEEL,Peerless Option Income Wheel ETF,https://finance.yahoo.com/research-hub/screener/sec-ind_sec-top-etfs_energy/,2026-07-19T04:19:51+00:00,en-US,US,ETF,ETF,Delayed Quote,False,LOW,12.85,20.247014,,,1715866200000.0,2.168898,True,1784332578.0,,,20.23484,-0.31684113,-0.015658198,20.22922,-0.31122017,0.0,20.316679,0.0,6.27875,5.46429,5.46429,38706908.0,CLOSED,USD,False,False,False,2.0,0.9803767,700.0,finmb_1871677721,NYSEArca,,15.0,0.0,America/New_York,EDT,-14400000.0,[],0.9379997,19.918,16077.0,-0.608791,0.049420428,18.98 - 23.94,-4.0220013,19.918,19.99,19.918 - 19.99,29.94,-0.1680034,1.3999939,,Peerless Option Income Wheel ET,0.99,20.35,0.4320011,-0.122002,1784312192.0,us_market,PCX,23.94,18.98,12.85,-0.015384685,19.87,20.04,Peerless Option Income Wheel ETF,19.93,16553.0,11980.0,800.0,WEEL,,,,,,,,,,,,,,,,"The fund is an actively managed ETF that seeks current income. The fund’s strategy consists of two main components: firstly, investing in a range of sector-specific ETFs and, in some instances, individual securities; and secondly, implementing an ""option wheel strategy"". The fund will primarily invest in different market sectors using sector ETFs. The fund is non-diversified.",[],[],86400,2,20.04,19.93,19.918,19.99,20.04,19.93,19.918,19.99,20.316679,16077,16077,16553,11980,11980,19.87,29.94,700.0,800.0,0.1285,38706908.0,18.98,23.94,23.94,16.22,20.23484,20.22922,0.0,0.0,19.8762,USD,False,Derivative Income,6.27875,0.0,Peerless ETFs,1715731200.0,Exchange Traded Fund,,ETF,WEEL,en-US,US,ETF,Delayed Quote,True,HIGH,[],1784332578.0,1784312192,PCX,finmb_1871677721,America/New_York,EDT,-14400000,us_market,False,-0.608791,19.918,CLOSED,Peerless Option Income Wheel ET,Peerless Option Income Wheel ETF,2.168898,20.35,0.4320011,-0.122002,19.918 - 19.99,NYSEArca,16553,0.9379997,0.049420428,18.98 - 23.94,-4.0220013,-0.1680034,1.3999939,12.85,5.46429,5.46429,38706908.0,0.9803767,-0.31684113,-0.015658198,-0.31122017,-0.015384685,0.99,15,0,False,True,1715866200000,,"The fund is an actively managed ETF that seeks current income. The fund’s strategy consists of two main components: firstly, investing in a range of sector-specific ETFs and, in some instances, individual securities; and secondly, implementing an ""option wheel strategy"". The fund will primarily invest in different market sectors using sector ETFs. The fund is non-diversified.",Derivative Income,Peerless ETFs,Exchange Traded Fund,0.4652,0.401,0.0,0.0,0.0,0.1338,0.0057,0.1274,0.1095,0.0161,0.2715,0.0986,0.0475,0.1112,0.0372,0.0987,0.0766,0.18100001,0.0099,0.008784,6.38,0.6808,79072.53,79072.53,6.38,0.9900000000000001,66.41758039999999,"[{""Symbol"":""FGXXX"",""Name"":""First American Government Obligs X"",""Holding Percent"":0.2930023},{""Symbol"":""ARKK"",""Name"":""ARK Innovation ETF"",""Holding Percent"":0.081432},{""Symbol"":""QQQ"",""Name"":""Invesco QQQ Trust"",""Holding Percent"":0.0589776},{""Symbol"":""KWEB"",""Name"":""KraneShares CSI China Internet ETF"",""Holding Percent"":0.045833502},{""Symbol"":""XLU"",""Name"":""State Street\u00aeUtilSelSectSPDR\u00aeETF"",""Holding Percent"":0.043926302},{""Symbol"":""EEM"",""Name"":""iShares MSCI Emerging Markets ETF"",""Holding Percent"":0.0406498},{""Symbol"":""GDX"",""Name"":""VanEck Gold Miners ETF"",""Holding Percent"":0.0399599},{""Symbol"":""IGV"",""Name"":""iShares Expanded Tech-Software Sect ETF"",""Holding Percent"":0.0374507},{""Symbol"":""ITB"",""Name"":""iShares US Home Construction ETF"",""Holding Percent"":0.0229437}]","[{""Average"":""Price\/Earnings"",""WEEL"":0.04939,""Category Average"":null},{""Average"":""Price\/Book"",""WEEL"":0.33042,""Category Average"":null},{""Average"":""Price\/Sales"",""WEEL"":0.34824,""Category Average"":null},{""Average"":""Price\/Cashflow"",""WEEL"":0.07401,""Category Average"":null},{""Average"":""Median Market Cap"",""WEEL"":null,""Category Average"":null},{""Average"":""3 Year Earnings Growth"",""WEEL"":null,""Category Average"":null}]",0.04939,0.33042,,"[{""Average"":""Duration"",""WEEL"":null,""Category Average"":null},{""Average"":""Maturity"",""WEEL"":null,""Category Average"":null},{""Average"":""Credit Quality"",""WEEL"":null,""Category Average"":null}]",,,,,,,,,,,,,,,,,,,,,,,,,,,,,,
Energy,energy,91,FTBD,Fidelity Tactical Bond ETF,https://finance.yahoo.com/research-hub/screener/sec-ind_sec-top-etfs_energy/,2026-07-19T04:19:51+00:00,en-US,US,ETF,ETF,Delayed Quote,False,LOW,,,,,1674743400000.0,0.0,True,1784322300.0,,,49.1444,-0.17290115,-0.0035182268,49.628235,-0.65673447,0.0,,0.0,1.70667,1.47234,1.47234,36890064.0,CLOSED,USD,False,False,False,2.0,,100.0,finmb_1818243566,NYSEArca,,15.0,0.0,America/New_York,EDT,-14400000.0,[],0.37150192,48.97,665.0,0.101594,0.0076440726,48.6 - 50.56,-1.588501,48.9715,49.015,48.97 - 49.015,73.45,-0.031418137,-0.36418438,,Fidelity Tactical Bond ETF,0.55,48.9715,0.0,0.0497017,1784310759.0,us_market,PCX,50.56,48.6,5.05,-0.013233081,45.98,48.9218,Fidelity Tactical Bond ETF,49.015,3670.0,4560.0,1000.0,FTBD,,,,,,,,,,,,,,,617-563-7000,"The fund invests at least 80% of assets in debt securities of all types and repurchase agreements for those securities. The advisor allocates assets across the full spectrum of the debt market, including investment-grade, high yield and emerging markets debt securities across different maturities. The fund invests in both U.S. dollar-denominated and non-U.S. dollar-denominated securities, and generally hedging the fund's foreign currency exposures utilizing forward foreign currency exchange contracts.",[],[],86400,2,48.9218,49.015,48.97,49.015,48.9218,49.015,48.97,49.015,,665,665,3670,4560,4560,45.98,73.45,100.0,1000.0,0.0505,36890064.0,48.6,50.56,51.06,45.663,49.1444,49.628235,0.0,0.0,48.91846,USD,False,Multisector Bond,1.70667,1.04,Fidelity Investments,1674518400.0,Exchange Traded Fund,0.0490557,ETF,FTBD,en-US,US,ETF,Delayed Quote,True,HIGH,[],1784322300.0,1784310759,PCX,finmb_1818243566,America/New_York,EDT,-14400000,us_market,False,0.101594,48.9715,CLOSED,Fidelity Tactical Bond ETF,Fidelity Tactical Bond ETF,0.0,48.9715,0.0,0.0497017,48.97 - 49.015,NYSEArca,3670,0.37150192,0.0076440726,48.6 - 50.56,-1.588501,-0.031418137,-0.36418438,5.05,1.47234,1.47234,36890064.0,,-0.17290115,-0.0035182268,-0.65673447,-0.013233081,0.55,15,0,False,True,1674743400000,,"The fund invests at least 80% of assets in debt securities of all types and repurchase agreements for those securities. The advisor allocates assets across the full spectrum of the debt market, including investment-grade, high yield and emerging markets debt securities across different maturities. The fund invests in both U.S. dollar-denominated and non-U.S. dollar-denominated securities, and generally hedging the fund's foreign currency exposures utilizing forward foreign currency exchange contracts.",Multisector Bond,Fidelity Investments,Exchange Traded Fund,0.0001,0.0,0.9143,0.0069,0.0123000005,0.0664,0.0,0.0,0.0,0.0,0.0,0.0,0.0,0.0,0.0,1.0,0.0,0.5107,0.0055,0.0092469,0.53,1.4834,0.0,0.0,53.0,0.5499999999999999,,,"[{""Average"":""Price\/Earnings"",""FTBD"":0.0,""Category Average"":null},{""Average"":""Price\/Book"",""FTBD"":0.0,""Category Average"":null},{""Average"":""Price\/Sales"",""FTBD"":0.0,""Category Average"":null},{""Average"":""Price\/Cashflow"",""FTBD"":0.0,""Category Average"":null},{""Average"":""Median Market Cap"",""FTBD"":null,""Category Average"":null},{""Average"":""3 Year Earnings Growth"",""FTBD"":null,""Category Average"":null}]",0.0,0.0,,"[{""Average"":""Duration"",""FTBD"":5.02,""Category Average"":null},{""Average"":""Maturity"",""FTBD"":9.672,""Category Average"":null},{""Average"":""Credit Quality"",""FTBD"":null,""Category Average"":null}]",,,0.1576,0.0068,0.65410006,0.049000002,-0.064,0.0466,0.1499,0.0,,,,,,,,,,,,,,,,,,,,
