sector,yahoo_sector_key,rank,ticker,etf_name,source_url,retrieved_at_utc,screen_language,screen_region,screen_quote_type,screen_type_disp,screen_quote_source_name,screen_triggerable,screen_custom_price_alert_confidence,screen_yield_ttm,screen_pe_ttm,screen_annual_return_nav_y3,screen_annual_return_nav_y5,screen_esg_populated,screen_tradeable,screen_crypto_tradeable,screen_price_to_book,screen_source_interval,screen_exchange_data_delayed_by,screen_exchange_timezone_name,screen_exchange_timezone_short_name,screen_book_value,screen_fifty_day_average,screen_fifty_day_average_change,screen_fifty_day_average_change_percent,screen_two_hundred_day_average,screen_two_hundred_day_average_change,screen_shares_outstanding,screen_has_pre_post_market_data,screen_first_trade_date_milliseconds,screen_gmt_off_set_milliseconds,screen_net_assets,screen_trailing_three_month_returns,screen_trailing_three_month_nav_returns,screen_short_name,screen_trailing_pe,screen_post_market_change_percent,screen_post_market_time,screen_bid_size,screen_trailing_annual_dividend_yield,screen_currency,screen_price_hint,screen_regular_market_open,screen_average_daily_volume3_month,screen_ytd_return,screen_market_state,screen_regular_market_previous_close,screen_message_board_id,screen_full_exchange_name,screen_average_daily_volume10_day,screen_trailing_annual_dividend_rate,screen_fifty_two_week_high_change,screen_two_hundred_day_average_change_percent,screen_fifty_two_week_low_change_percent,screen_regular_market_price,screen_regular_market_day_high,screen_regular_market_day_range,screen_post_market_price,screen_post_market_change,screen_regular_market_change,screen_regular_market_time,screen_ask_size,screen_regular_market_change_percent,screen_net_expense_ratio,screen_regular_market_day_low,screen_regular_market_volume,screen_market,screen_fifty_two_week_low_change,screen_fifty_two_week_range,screen_corporate_actions,screen_exchange,screen_fifty_two_week_high,screen_fifty_two_week_low,screen_dividend_yield,screen_financial_currency,screen_fifty_two_week_high_change_percent,screen_long_name,screen_fifty_two_week_change_percent,screen_eps_trailing_twelve_months,screen_bid,screen_ask,screen_symbol,screen_dividend_date,screen_ipo_expected_date,screen_earnings_call_timestamp_start,screen_earnings_call_timestamp_end,screen_is_earnings_date_estimate,screen_earnings_timestamp_start,screen_earnings_timestamp_end,screen_prev_name,screen_name_change_date,screen_eps_forward,screen_forward_pe,screen_display_name,screen_market_cap,screen_implied_shares_outstanding,info_phone,info_long_business_summary,info_company_officers,info_executive_team,info_max_age,info_price_hint,info_previous_close,info_open,info_day_low,info_day_high,info_regular_market_previous_close,info_regular_market_open,info_regular_market_day_low,info_regular_market_day_high,info_trailing_pe,info_volume,info_regular_market_volume,info_average_volume,info_average_volume10days,info_average_daily_volume10_day,info_bid,info_ask,info_bid_size,info_ask_size,info_yield,info_total_assets,info_fifty_two_week_low,info_fifty_two_week_high,info_all_time_high,info_all_time_low,info_fifty_day_average,info_two_hundred_day_average,info_trailing_annual_dividend_rate,info_trailing_annual_dividend_yield,info_nav_price,info_currency,info_tradeable,info_category,info_ytd_return,info_beta3_year,info_fund_family,info_fund_inception_date,info_legal_type,info_three_year_average_return,info_quote_type,info_symbol,info_language,info_region,info_type_disp,info_quote_source_name,info_triggerable,info_custom_price_alert_confidence,info_market_state,info_corporate_actions,info_post_market_time,info_regular_market_time,info_exchange,info_message_board_id,info_exchange_timezone_name,info_exchange_timezone_short_name,info_gmt_off_set_milliseconds,info_market,info_esg_populated,info_regular_market_change_percent,info_regular_market_price,info_has_pre_post_market_data,info_first_trade_date_milliseconds,info_post_market_change_percent,info_post_market_price,info_post_market_change,info_regular_market_change,info_regular_market_day_range,info_full_exchange_name,info_average_daily_volume3_month,info_fifty_two_week_low_change,info_fifty_two_week_low_change_percent,info_fifty_two_week_range,info_fifty_two_week_high_change,info_fifty_two_week_high_change_percent,info_fifty_two_week_change_percent,info_dividend_yield,info_trailing_three_month_returns,info_trailing_three_month_nav_returns,info_net_assets,info_eps_trailing_twelve_months,info_short_name,info_long_name,info_fifty_day_average_change,info_fifty_day_average_change_percent,info_two_hundred_day_average_change,info_two_hundred_day_average_change_percent,info_net_expense_ratio,info_source_interval,info_exchange_data_delayed_by,info_crypto_tradeable,info_trailing_peg_ratio,fund_description,fund_overview_category_name,fund_overview_family,fund_overview_legal_type,fund_asset_class_cash_position,fund_asset_class_stock_position,fund_asset_class_bond_position,fund_asset_class_preferred_position,fund_asset_class_convertible_position,fund_asset_class_other_position,fund_sector_weight_realestate,fund_sector_weight_consumer_cyclical,fund_sector_weight_basic_materials,fund_sector_weight_consumer_defensive,fund_sector_weight_technology,fund_sector_weight_communication_services,fund_sector_weight_financial_services,fund_sector_weight_utilities,fund_sector_weight_industrials,fund_sector_weight_energy,fund_sector_weight_healthcare,fund_bond_rating_us_government,fund_annual_report_expense_ratio,fund_annual_report_expense_ratio_category_average,fund_annual_holdings_turnover,fund_annual_holdings_turnover_category_average,fund_total_net_assets,fund_total_net_assets_category_average,compact_annual_holdings_turnover_pct,compact_expense_ratio_pct,compact_top_10_holdings_weight_pct,fund_top_holdings_json,fund_equity_holdings_json,compact_price_to_earnings,compact_price_to_book,compact_weighted_average_market_cap,fund_bond_holdings_json,info_five_year_average_return,fund_bond_rating_bb,fund_bond_rating_aa,fund_bond_rating_aaa,fund_bond_rating_a,fund_bond_rating_other,fund_bond_rating_b,fund_bond_rating_bbb,fund_bond_rating_below_b,info_ipo_expected_date,info_dividend_date,info_earnings_timestamp_start,info_earnings_timestamp_end,info_current_price,info_recommendation_key,retrieval_errors,info_display_name,info_financial_currency,info_earnings_call_timestamp_start,info_earnings_call_timestamp_end,info_is_earnings_date_estimate,info_book_value,info_price_to_book,info_forward_pe,info_eps_forward,info_shares_outstanding,info_prev_name,info_name_change_date,info_market_cap,info_implied_shares_outstanding
Materials,basic-materials,1,GDX,VanEck Gold Miners ETF,https://finance.yahoo.com/research-hub/screener/sec-ind_sec-top-etfs_basic-materials/,2026-07-18T07:04:17+00:00,en-US,US,ETF,ETF,Nasdaq Real Time Price,False,LOW,0.84,13.577733,10.23739,-9.50732,False,False,False,,15,0,America/New_York,EDT,,82.3478,-11.0278015,-0.13391738,87.58755,-16.267548,,True,1148304600000,-14400000,22753128400.0,-17.42989,-17.42989,VanEck Gold Miners ETF,12.848134,0.14021099,1784332786.0,300.0,0.0,USD,2,70.4,22295961,-12.38084,CLOSED,71.4,finmb_27307407,NYSEArca,17984930,0.0,-45.86,-0.185729,0.3951487,71.32,71.92,69.74 - 71.92,71.42,0.099998474,-0.0800018,1784318400,900.0,-0.112047,0.51,69.74,18140981,us_market,20.2,51.12 - 117.18,[],PCX,117.18,51.12,0.84,,-0.3913637,VanEck Gold Miners ETF,39.487576,5.5510006,71.2,71.33,GDX,,,,,,,,,,,,,,,888-658-8287,"The fund normally invests at least 80% of its total assets in securities that comprise the fund’s benchmark index. The index is a modified capitalization weighted, float-adjusted index comprised of publicly traded companies primarily involved in the gold and silver mining industry. The fund is non-diversified.",[],[],86400.0,2.0,71.4,70.4,69.74,71.92,71.4,70.4,69.74,71.92,,18140981.0,18140981.0,22295961.0,17984930.0,17984930.0,71.2,71.33,300.0,900.0,0.0084,22753128448.0,51.12,117.18,117.18,12.4,82.3478,87.58755,,,71.58,USD,False,Equity Precious Metals,-12.38084,0.81,VanEck,1147737600.0,Exchange Traded Fund,0.32250407,ETF,GDX,en-US,US,ETF,Nasdaq Real Time Price,True,HIGH,CLOSED,[],1784332786.0,1784318400.0,PCX,finmb_27307407,America/New_York,EDT,-14400000.0,us_market,False,-0.112047,71.32,True,1148304600000.0,0.14021099,71.42,0.099998474,-0.0800018,69.74 - 71.92,NYSEArca,22295961.0,20.2,0.3951487,51.12 - 117.18,-45.86,-0.3913637,39.487576,0.84,-17.42989,-17.42989,22753128400.0,,,,-11.0278015,-0.13391738,-16.267548,-0.185729,0.51,15.0,0.0,False,,"The fund normally invests at least 80% of its total assets in securities that comprise the fund’s benchmark index. The index is a modified capitalization weighted, float-adjusted index comprised of publicly traded companies primarily involved in the gold and silver mining industry. The fund is non-diversified.",Equity Precious Metals,VanEck,Exchange Traded Fund,0.001,0.999,0.0,0.0,0.0,0.0,0.0,0.0,1.0,0.0,0.0,0.0,0.0,0.0,0.0,0.0,0.0,0.0,0.0050999997,0.0114857,0.5,0.5542,23833.34,23833.34,50.0,0.50999997,58.443049400000014,"[{""Symbol"":""AEM.TO"",""Name"":""Agnico Eagle Mines Ltd"",""Holding Percent"":0.1052023},{""Symbol"":""NEM"",""Name"":""Newmont Corp"",""Holding Percent"":0.1048356},{""Symbol"":""ABX.TO"",""Name"":""Barrick Mining Corp"",""Holding Percent"":0.079513},{""Symbol"":""WPM.TO"",""Name"":""Wheaton Precious Metals Corp"",""Holding Percent"":0.0550701},{""Symbol"":""AU"",""Name"":""Anglogold Ashanti PLC"",""Holding Percent"":0.0507249},{""Symbol"":""FNV.TO"",""Name"":""Franco-Nevada Corp"",""Holding Percent"":0.048395},{""Symbol"":""K.TO"",""Name"":""Kinross Gold Corp"",""Holding Percent"":0.044019297},{""Symbol"":""GFI"",""Name"":""Gold Fields Ltd ADR"",""Holding Percent"":0.040145997},{""Symbol"":""PAAS.TO"",""Name"":""Pan American Silver Corp"",""Holding Percent"":0.0295106},{""Symbol"":""NST.AX"",""Name"":""Northern Star Resources Ltd"",""Holding Percent"":0.0270137}]","[{""Average"":""Price\/Earnings"",""GDX"":0.07365,""Category Average"":null},{""Average"":""Price\/Book"",""GDX"":0.35121,""Category Average"":null},{""Average"":""Price\/Sales"",""GDX"":0.23348,""Category Average"":null},{""Average"":""Price\/Cashflow"",""GDX"":0.10957,""Category Average"":null},{""Average"":""Median Market Cap"",""GDX"":null,""Category Average"":null},{""Average"":""3 Year Earnings Growth"",""GDX"":null,""Category Average"":null}]",0.07365,0.35121,,"[{""Average"":""Duration"",""GDX"":null,""Category Average"":null},{""Average"":""Maturity"",""GDX"":null,""Category Average"":null},{""Average"":""Credit Quality"",""GDX"":null,""Category Average"":null}]",0.1766749,,,,,,,,,,,,,,,,,,,,,,,,,,,,,
Materials,basic-materials,2,XLB,State Street Materials Select Sector SPDR ETF,https://finance.yahoo.com/research-hub/screener/sec-ind_sec-top-etfs_basic-materials/,2026-07-18T07:04:17+00:00,en-US,US,ETF,ETF,Delayed Quote,False,LOW,1.67,26.239832,12.44029,27.46714,False,False,False,0.6386986,15,0,America/New_York,EDT,79.114,51.129,-0.59900284,-0.01171552,48.6197,1.9102974,71923696.0,True,914337000000,-14400000,8166011400.0,2.18263,2.18263,State Street Materials Select S,26.067762,0.29685637,1784332460.0,7300.0,0.027313814,USD,2,50.8,11280080,13.12288,CLOSED,50.89,finmb_8795509,NYSEArca,10964260,1.39,-3.6100006,0.039290603,0.20209347,50.53,51.445,50.385 - 51.445,50.68,0.15000153,-0.360001,1784318400,6200.0,-0.707409,0.08,50.385,8124328,us_market,8.494999,42.035 - 54.14,[],PCX,54.14,42.035,1.67,USD,-0.06667899,State Street Materials Select Sector SPDR ETF,12.015068,1.9384096,50.5,50.51,XLB,,,,,,,,,,,,,,,,"In seeking to track the performance of the index, the fund employs a replication strategy. It generally invests substantially all, but at least 95%, of its total assets in the securities comprising the index. The index includes securities of companies from the following industries: chemicals; metals and mining; paper and forest products; containers and packaging; and construction materials. The fund is non-diversified.",[],[],86400.0,2.0,50.89,50.8,50.385,51.445,50.89,50.8,50.385,51.445,26.067762,8124328.0,8122719.0,11280080.0,10964260.0,10964260.0,50.5,50.51,7300.0,6200.0,0.0167,8166011392.0,42.035,54.14,93.26,8.265,51.129,48.6197,1.39,0.027313814,50.87324,USD,False,Natural Resources,13.12288,0.82,State Street Investment Management,913766400.0,Exchange Traded Fund,0.0898822,ETF,XLB,en-US,US,ETF,Delayed Quote,True,HIGH,CLOSED,[],1784332460.0,1784318400.0,PCX,finmb_8795509,America/New_York,EDT,-14400000.0,us_market,False,-0.707409,50.53,True,914337000000.0,0.29685637,50.68,0.15000153,-0.360001,50.385 - 51.445,NYSEArca,11280080.0,8.494999,0.20209347,42.035 - 54.14,-3.6100006,-0.06667899,12.015068,1.67,2.18263,2.18263,8166011400.0,1.9384096,State Street Materials Select S,State Street Materials Select Sector SPDR ETF,-0.59900284,-0.01171552,1.9102974,0.039290603,0.08,15.0,0.0,False,,"In seeking to track the performance of the index, the fund employs a replication strategy. It generally invests substantially all, but at least 95%, of its total assets in the securities comprising the index. The index includes securities of companies from the following industries: chemicals; metals and mining; paper and forest products; containers and packaging; and construction materials. The fund is non-diversified.",Natural Resources,State Street Investment Management,Exchange Traded Fund,0.0011999999,0.9988,0.0,0.0,0.0,0.0,0.0,0.15359999,0.8464,0.0,0.0,0.0,0.0,0.0,0.0,0.0,0.0,0.0,0.0008,0.0086928,0.29,0.441,50179.98,50179.98,28.999999999999996,0.08,58.311699399999995,"[{""Symbol"":""LIN"",""Name"":""Linde PLC"",""Holding Percent"":0.1404455},{""Symbol"":""NEM"",""Name"":""Newmont Corp"",""Holding Percent"":0.0583657},{""Symbol"":""FCX"",""Name"":""Freeport-McMoRan Inc"",""Holding Percent"":0.0529213},{""Symbol"":""CTVA"",""Name"":""Corteva Inc"",""Holding Percent"":0.049528196},{""Symbol"":""SHW"",""Name"":""Sherwin-Williams Co"",""Holding Percent"":0.0493363},{""Symbol"":""ECL"",""Name"":""Ecolab Inc"",""Holding Percent"":0.0472095},{""Symbol"":""VMC"",""Name"":""Vulcan Materials Co"",""Holding Percent"":0.0471143},{""Symbol"":""CRH"",""Name"":""CRH PLC"",""Holding Percent"":0.0466028},{""Symbol"":""APD"",""Name"":""Air Products and Chemicals Inc"",""Holding Percent"":0.046171598},{""Symbol"":""MLM"",""Name"":""Martin Marietta Materials Inc"",""Holding Percent"":0.0454218}]","[{""Average"":""Price\/Earnings"",""XLB"":0.03811,""Category Average"":null},{""Average"":""Price\/Book"",""XLB"":0.35239,""Category Average"":null},{""Average"":""Price\/Sales"",""XLB"":0.4978,""Category Average"":null},{""Average"":""Price\/Cashflow"",""XLB"":0.06962,""Category Average"":null},{""Average"":""Median Market Cap"",""XLB"":null,""Category Average"":null},{""Average"":""3 Year Earnings Growth"",""XLB"":null,""Category Average"":null}]",0.03811,0.35239,,"[{""Average"":""Duration"",""XLB"":null,""Category Average"":null},{""Average"":""Maturity"",""XLB"":null,""Category Average"":null},{""Average"":""Credit Quality"",""XLB"":null,""Category Average"":null}]",0.0673761,,,,,,,,,,,,,,,,,USD,,,,79.114,0.6386986,,,71923696.0,,,,
Materials,basic-materials,3,VCRB,Vanguard Core Bond ETF,https://finance.yahoo.com/research-hub/screener/sec-ind_sec-top-etfs_basic-materials/,2026-07-18T07:04:17+00:00,en-US,US,ETF,ETF,Nasdaq Real Time Price,False,LOW,4.48,36.101083,,,False,False,False,,15,0,America/New_York,EDT,,76.89926,-0.31436157,-0.004087966,77.79693,-1.2120285,,True,1702564200000,-14400000,7294146600.0,0.99263,0.99263,Vanguard Core Bond ETF,35.79828,0.006396019,1784319005.0,3.0,,USD,2,76.67,529290,0.94643,CLOSED,76.54,finmb_1858476233,NasdaqGM,527210,,-2.5951004,-0.015579388,0.0060413782,76.5849,76.7,76.57 - 76.7,76.5849,0.0048980713,0.044898987,1784318400,3.0,0.058660813,0.1,76.57,354226,us_market,0.4598999,76.125 - 79.18,[],NGM,79.18,76.125,4.48,,-0.032774694,Vanguard Core Bond ETF,-0.26696324,2.139346,76.5,76.59,VCRB,,2023-12-14,,,,,,,,,,,,,,"The fund invests in fixed income securities of various maturities, yields, and qualities. Under normal circumstances, the fund will invest at least 80% of its assets in bonds, which include fixed income securities such as corporate bonds; U.S. Treasury obligations and other U.S. government and agency securities; and asset-backed, mortgage-backed, and mortgage-related securities.",[],[],86400.0,2.0,76.54,76.67,76.57,76.7,76.54,76.67,76.57,76.7,35.79828,354226.0,354226.0,529290.0,527210.0,527210.0,76.5,76.59,3.0,3.0,0.0448,7294146560.0,76.125,79.18,79.86,74.22,76.89926,77.79693,,,76.46,USD,False,Intermediate Core Bond,0.94643,0.0,Vanguard,1702512000.0,Exchange Traded Fund,,ETF,VCRB,en-US,US,ETF,Nasdaq Real Time Price,True,HIGH,CLOSED,[],1784319005.0,1784318400.0,NGM,finmb_1858476233,America/New_York,EDT,-14400000.0,us_market,False,0.058660813,76.5849,True,1702564200000.0,0.006396019,76.5849,0.0048980713,0.044898987,76.57 - 76.7,NasdaqGM,529290.0,0.4598999,0.0060413782,76.125 - 79.18,-2.5951004,-0.032774694,-0.26696324,4.48,0.99263,0.99263,7294146600.0,2.139346,Vanguard Core Bond ETF,Vanguard Core Bond ETF,-0.31436157,-0.004087966,-1.2120285,-0.015579388,0.1,15.0,0.0,False,,"The fund invests in fixed income securities of various maturities, yields, and qualities. Under normal circumstances, the fund will invest at least 80% of its assets in bonds, which include fixed income securities such as corporate bonds; U.S. Treasury obligations and other U.S. government and agency securities; and asset-backed, mortgage-backed, and mortgage-related securities.",Intermediate Core Bond,Vanguard,Exchange Traded Fund,0.0034,0.0,0.9964,0.0,0.0002,0.0,0.0,0.0,0.8333,0.0,0.0,0.0,0.0,0.0,0.0,0.0,0.1667,0.2698,0.001,0.005351,4.26,1.2448,1759.43,1759.43,4.26,0.1,,,"[{""Average"":""Price\/Earnings"",""VCRB"":0.0277,""Category Average"":null},{""Average"":""Price\/Book"",""VCRB"":0.67357,""Category Average"":null},{""Average"":""Price\/Sales"",""VCRB"":1.76046,""Category Average"":null},{""Average"":""Price\/Cashflow"",""VCRB"":0.1169,""Category Average"":null},{""Average"":""Median Market Cap"",""VCRB"":null,""Category Average"":null},{""Average"":""3 Year Earnings Growth"",""VCRB"":null,""Category Average"":null}]",0.0277,0.67357,,"[{""Average"":""Duration"",""VCRB"":null,""Category Average"":null},{""Average"":""Maturity"",""VCRB"":9.617,""Category Average"":null},{""Average"":""Credit Quality"",""VCRB"":null,""Category Average"":null}]",,0.0186,0.4376,0.1118,0.1692,0.0186,0.0023999999,0.24159999,0.0002,2023-12-14,,,,,,,,,,,,,,,,,,,,
Materials,basic-materials,4,COPX,Global X Copper Miners ETF,https://finance.yahoo.com/research-hub/screener/sec-ind_sec-top-etfs_basic-materials/,2026-07-18T07:04:17+00:00,en-US,US,ETF,ETF,Nasdaq Real Time Price,False,LOW,2.51,17.190992,9.29965,24.01101,False,False,False,,15,0,America/New_York,EDT,,82.2688,-8.9188,-0.108410485,76.41355,-3.0635529,,True,1271770200000,-14400000,7154050600.0,3.97765,3.97765,Global X Copper Miners ETF,16.39739,0.19086489,1784332759.0,600.0,,USD,2,72.21,3790361,7.0057,CLOSED,74.68,finmb_102327242,NYSEArca,2638740,,-26.64,-0.04009175,0.74892706,73.35,74.08,71.76 - 74.08,73.49,0.13999939,-1.33,1784318400,600.0,-1.78093,0.65,71.76,2099882,us_market,31.41,41.94 - 99.99,[],PCX,99.99,41.94,2.51,,-0.26642665,Global X Copper Miners ETF,67.19854,4.473273,73.31,73.35,COPX,,,,,,,,,,,,,,,+1 8884938631,"The fund invests at least 80% of its total assets in the securities of the underlying index and in American Depositary Receipts (""ADRs"") and Global Depositary Receipts (""GDRs"") based on the securities in the underlying index. The underlying index is designed to measure broad-based equity market performance of global companies involved in the copper mining industry. The fund is non-diversified.",[],[],86400.0,2.0,74.68,72.21,71.76,74.08,74.68,72.21,71.76,74.08,16.39739,2099882.0,2099882.0,3790361.0,2638740.0,2638740.0,73.31,73.35,600.0,600.0,0.0251,7154050560.0,41.94,99.99,99.99,8.66,82.2688,76.41355,,,75.21,USD,False,Natural Resources,7.0057,1.49,Global X Funds,1271635200.0,Exchange Traded Fund,0.2574206,ETF,COPX,en-US,US,ETF,Nasdaq Real Time Price,True,HIGH,CLOSED,[],1784332759.0,1784318400.0,PCX,finmb_102327242,America/New_York,EDT,-14400000.0,us_market,False,-1.78093,73.35,True,1271770200000.0,0.19086489,73.49,0.13999939,-1.33,71.76 - 74.08,NYSEArca,3790361.0,31.41,0.74892706,41.94 - 99.99,-26.64,-0.26642665,67.19854,2.51,3.97765,3.97765,7154050600.0,4.473273,Global X Copper Miners ETF,Global X Copper Miners ETF,-8.9188,-0.108410485,-3.0635529,-0.04009175,0.65,15.0,0.0,False,,"The fund invests at least 80% of its total assets in the securities of the underlying index and in American Depositary Receipts (""ADRs"") and Global Depositary Receipts (""GDRs"") based on the securities in the underlying index. The underlying index is designed to measure broad-based equity market performance of global companies involved in the copper mining industry. The fund is non-diversified.",Natural Resources,Global X Funds,Exchange Traded Fund,0.0033000002,0.9967,0.0,0.0,0.0,0.0,0.0,0.0,0.96870005,0.0,0.0,0.0,0.0,0.0,0.0313,0.0,0.0,0.0,0.0064999997,0.0086928,0.0,0.441,19141.99,19141.99,0.0,0.64999997,51.817719499999995,"[{""Symbol"":""HBM.TO"",""Name"":""Hudbay Minerals Inc"",""Holding Percent"":0.056178197},{""Symbol"":""TECK-B.TO"",""Name"":""Teck Resources Ltd Class B (Sub Voting)"",""Holding Percent"":0.0546317},{""Symbol"":""BHP.AX"",""Name"":""BHP Group Ltd"",""Holding Percent"":0.054586},{""Symbol"":""ANTO.L"",""Name"":""Antofagasta PLC"",""Holding Percent"":0.0527731},{""Symbol"":""KGH.WA"",""Name"":""KGHM Polska Miedz SA"",""Holding Percent"":0.0522129},{""Symbol"":""FM.TO"",""Name"":""First Quantum Minerals Ltd"",""Holding Percent"":0.0508742},{""Symbol"":""BOL.ST"",""Name"":""Boliden AB"",""Holding Percent"":0.0504123},{""Symbol"":""SCCO"",""Name"":""Southern Copper Corp"",""Holding Percent"":0.0496114},{""Symbol"":""FCX"",""Name"":""Freeport-McMoRan Inc"",""Holding Percent"":0.0488748},{""Symbol"":""GLEN.L"",""Name"":""Glencore PLC"",""Holding Percent"":0.048022598}]","[{""Average"":""Price\/Earnings"",""COPX"":0.05817,""Category Average"":null},{""Average"":""Price\/Book"",""COPX"":0.43707,""Category Average"":null},{""Average"":""Price\/Sales"",""COPX"":0.74324,""Category Average"":null},{""Average"":""Price\/Cashflow"",""COPX"":0.08924,""Category Average"":null},{""Average"":""Median Market Cap"",""COPX"":null,""Category Average"":null},{""Average"":""3 Year Earnings Growth"",""COPX"":null,""Category Average"":null}]",0.05817,0.43707,,"[{""Average"":""Duration"",""COPX"":null,""Category Average"":null},{""Average"":""Maturity"",""COPX"":null,""Category Average"":null},{""Average"":""Credit Quality"",""COPX"":null,""Category Average"":null}]",0.1898848,,,,,,,,,,,,,,,,,,,,,,,,,,,,,
