Materials,basic-materials,35,SLX,VanEck Steel ETF,https://finance.yahoo.com/research-hub/screener/sec-ind_sec-top-etfs_basic-materials/,2026-07-18T07:04:17+00:00,en-US,US,ETF,ETF,Delayed Quote,False,LOW,1.33,19.443904,31.306,28.3097,False,False,False,,15,0,America/New_York,EDT,,105.1116,-4.8916016,-0.046537217,92.57975,7.640251,,True,1161091800000,-14400000,169951152.0,7.57757,7.57757,VanEck Steel ETF,19.721365,0.0,1784323877.0,300.0,0.0,USD,2,99.15,55853,16.53497,CLOSED,100.275,finmb_29729860,NYSEArca,26400,0.0,-13.779999,0.08252616,0.502774,100.22,100.73,98.7214 - 100.73,100.22,0.0,-0.0550003,1784318398,200.0,-0.0548495,0.55,98.7214,17481,us_market,33.53,66.69 - 114.0,[],PCX,114.0,66.69,1.33,,-0.120877184,VanEck Steel ETF,43.089664,5.0817986,100.11,100.55,SLX,,,,,,,,,,,,,,,888-658-8287,"The fund normally invests at least 80% of its total assets in securities that comprise the fund’s benchmark index. The steel index is a modified market-capitalization weighted, float-adjusted index comprised of publicly traded companies primarily involved in mining and processing of iron ore, the production, processing, fabrication and recycling of steel products, the operation of steel production facilities and related services, and/or recycling of steel products. The fund is non-diversified.",[],[],86400.0,2.0,100.275,99.15,98.7214,100.73,100.275,99.15,98.7214,100.73,19.721365,17481.0,17481.0,55853.0,26400.0,26400.0,100.11,100.55,300.0,200.0,0.013300001,169951152.0,66.69,114.0,114.12,15.3,105.1116,92.57975,0.0,0.0,100.66,USD,False,Natural Resources,16.53497,1.36,VanEck,1160438400.0,Exchange Traded Fund,0.17521049,ETF,SLX,en-US,US,ETF,Delayed Quote,True,HIGH,CLOSED,[],1784323877.0,1784318398.0,PCX,finmb_29729860,America/New_York,EDT,-14400000.0,us_market,False,-0.0548495,100.22,True,1161091800000.0,0.0,100.22,0.0,-0.0550003,98.7214 - 100.73,NYSEArca,55853.0,33.53,0.502774,66.69 - 114.0,-13.779999,-0.120877184,43.089664,1.33,7.57757,7.57757,169951152.0,5.0817986,VanEck Steel ETF,VanEck Steel ETF,-4.8916016,-0.046537217,7.640251,0.08252616,0.55,15.0,0.0,False,,"The fund normally invests at least 80% of its total assets in securities that comprise the fund’s benchmark index. The steel index is a modified market-capitalization weighted, float-adjusted index comprised of publicly traded companies primarily involved in mining and processing of iron ore, the production, processing, fabrication and recycling of steel products, the operation of steel production facilities and related services, and/or recycling of steel products. The fund is non-diversified.",Natural Resources,VanEck,Exchange Traded Fund,-0.0011,1.0012001,0.0,0.0,0.0,0.0,0.0,0.0,0.92660004,0.0,0.0,0.0,0.0,0.0,0.0341,0.0394,0.0,0.0,0.0055,0.0086928,1.07,0.441,25591.2,25591.2,107.0,0.5499999999999999,57.9943605,"[{""Symbol"":""BHP"",""Name"":""BHP Group Ltd ADR"",""Holding Percent"":0.0755066},{""Symbol"":""VALE"",""Name"":""Vale SA ADR"",""Holding Percent"":0.0745647},{""Symbol"":""RIO"",""Name"":""Rio Tinto PLC ADR"",""Holding Percent"":0.072936},{""Symbol"":""NUE"",""Name"":""Nucor Corp"",""Holding Percent"":0.062757105},{""Symbol"":""STLD"",""Name"":""Steel Dynamics Inc"",""Holding Percent"":0.0554207},{""Symbol"":""RIO.AX"",""Name"":""Rio Tinto Ltd"",""Holding Percent"":0.0500216},{""Symbol"":""MT"",""Name"":""ArcelorMittal SA Depository Receipt"",""Holding Percent"":0.0494811},{""Symbol"":""5401.T"",""Name"":""Nippon Steel Corp"",""Holding Percent"":0.0477456},{""Symbol"":""FMG.AX"",""Name"":""Fortescue Ltd"",""Holding Percent"":0.0463021},{""Symbol"":""RS"",""Name"":""Reliance Inc"",""Holding Percent"":0.0452081}]","[{""Average"":""Price\/Earnings"",""SLX"":0.05143,""Category Average"":null},{""Average"":""Price\/Book"",""SLX"":0.83369,""Category Average"":null},{""Average"":""Price\/Sales"",""SLX"":1.22963,""Category Average"":null},{""Average"":""Price\/Cashflow"",""SLX"":0.12679,""Category Average"":null},{""Average"":""Median Market Cap"",""SLX"":null,""Category Average"":null},{""Average"":""3 Year Earnings Growth"",""SLX"":null,""Category Average"":null}]",0.05143,0.83369,,"[{""Average"":""Duration"",""SLX"":null,""Category Average"":null},{""Average"":""Maturity"",""SLX"":null,""Category Average"":null},{""Average"":""Credit Quality"",""SLX"":null,""Category Average"":null}]",0.151894,,,,,,,,,,,,,,,,,,,,,,,,,,,,,
Materials,basic-materials,36,GOAU,U.S. Global GO GOLD and Precious Metal Miners ETF,https://finance.yahoo.com/research-hub/screener/sec-ind_sec-top-etfs_basic-materials/,2026-07-18T07:04:17+00:00,en-US,US,ETF,ETF,Delayed Quote,False,LOW,1.08,15.554519,10.67325,-8.71679,False,False,False,,15,0,America/New_York,EDT,,40.10286,-4.93536,-0.123067535,43.275455,-8.107956,,True,1498743000000,-14400000,164807904.0,-16.35083,-16.35083,US Global GO Gold and Precious ,14.736792,1.9691507,1784330934.0,300.0,,USD,2,34.67,33780,-13.03872,CLOSED,35.37,finmb_430331952,NYSEArca,22150,,-21.9225,-0.18735692,0.24398652,35.1675,35.3965,34.3428 - 35.3965,35.86,0.69250107,-0.202499,1784317053,600.0,-0.572517,0.6,34.3428,31142,us_market,6.897499,28.27 - 57.09,[],PCX,57.09,28.27,1.08,,-0.38399896,U.S. Global GO GOLD and Precious Metal Miners ETF,22.111107,2.3863742,35.01,35.1,GOAU,,,,,,,,,,,,,,,(414) 765-5586,"Under normal circumstances, the fund will invest at least 80% of its net assets (plus borrowings for investment purposes) in Precious Metals Companies and at least 20% of its net assets (plus borrowings for investment purposes) in Precious Metals Companies that primarily derive their revenue from gold (“Gold Companies”). The fund is non-diversified.",[],[],86400.0,2.0,35.37,34.67,34.3428,35.3965,35.37,34.67,34.3428,35.3965,14.736792,31142.0,31142.0,33780.0,22150.0,22150.0,35.01,35.1,300.0,600.0,0.0108,164807904.0,28.27,57.09,57.09,8.96,40.10286,43.275455,,,35.5286,USD,False,Equity Precious Metals,-13.03872,0.8,U.S. Global Investors,1498521600.0,Exchange Traded Fund,0.276035,ETF,GOAU,en-US,US,ETF,Delayed Quote,True,HIGH,CLOSED,[],1784330934.0,1784317053.0,PCX,finmb_430331952,America/New_York,EDT,-14400000.0,us_market,False,-0.572517,35.1675,True,1498743000000.0,1.9691507,35.86,0.69250107,-0.202499,34.3428 - 35.3965,NYSEArca,33780.0,6.897499,0.24398652,28.27 - 57.09,-21.9225,-0.38399896,22.111107,1.08,-16.35083,-16.35083,164807904.0,2.3863742,US Global GO Gold and Precious ,U.S. Global GO GOLD and Precious Metal Miners ETF,-4.93536,-0.123067535,-8.107956,-0.18735692,0.6,15.0,0.0,False,,"Under normal circumstances, the fund will invest at least 80% of its net assets (plus borrowings for investment purposes) in Precious Metals Companies and at least 20% of its net assets (plus borrowings for investment purposes) in Precious Metals Companies that primarily derive their revenue from gold (“Gold Companies”). The fund is non-diversified.",Equity Precious Metals,U.S. Global Investors,Exchange Traded Fund,0.0223,0.9775,0.0,0.0,0.0,0.0002,0.0,0.0,1.0,0.0,0.0,0.0,0.0,0.0,0.0,0.0,0.0,0.0,0.006,0.0114857,1.81,0.5542,7420.21,7420.21,181.0,0.6,54.8504892,"[{""Symbol"":""FNV.TO"",""Name"":""Franco-Nevada Corp"",""Holding Percent"":0.099323},{""Symbol"":""OR.TO"",""Name"":""OR Royalties Inc"",""Holding Percent"":0.0956192},{""Symbol"":""WPM.TO"",""Name"":""Wheaton Precious Metals Corp"",""Holding Percent"":0.095021695},{""Symbol"":""AYA.TO"",""Name"":""Aya Gold & Silver Inc"",""Holding Percent"":0.040220097},{""Symbol"":""HMY"",""Name"":""Harmony Gold Mining Co Ltd ADR"",""Holding Percent"":0.0395595},{""Symbol"":""FVI.TO"",""Name"":""Fortuna Mining Corp"",""Holding Percent"":0.0381253},{""Symbol"":""EDV.L"",""Name"":""Endeavour Mining PLC"",""Holding Percent"":0.0380286},{""Symbol"":""EXK"",""Name"":""Endeavour Silver Corp"",""Holding Percent"":0.0375797},{""Symbol"":""CMM.AX"",""Name"":""Capricorn Metals Ltd"",""Holding Percent"":0.0330844},{""Symbol"":""GMD.AX"",""Name"":""Genesis Minerals Ltd"",""Holding Percent"":0.0319434}]","[{""Average"":""Price\/Earnings"",""GOAU"":0.06429,""Category Average"":null},{""Average"":""Price\/Book"",""GOAU"":0.31452,""Category Average"":null},{""Average"":""Price\/Sales"",""GOAU"":0.22144,""Category Average"":null},{""Average"":""Price\/Cashflow"",""GOAU"":0.0984,""Category Average"":null},{""Average"":""Median Market Cap"",""GOAU"":null,""Category Average"":null},{""Average"":""3 Year Earnings Growth"",""GOAU"":null,""Category Average"":null}]",0.06429,0.31452,,"[{""Average"":""Duration"",""GOAU"":null,""Category Average"":null},{""Average"":""Maturity"",""GOAU"":null,""Category Average"":null},{""Average"":""Credit Quality"",""GOAU"":null,""Category Average"":null}]",0.1466821,,,,,,,,,,,,,,,,,,,,,,,,,,,,,
Materials,basic-materials,37,COPJ,Sprott Junior Copper Miners ETF,https://finance.yahoo.com/research-hub/screener/sec-ind_sec-top-etfs_basic-materials/,2026-07-18T07:04:17+00:00,en-US,US,ETF,ETF,Nasdaq Real Time Price,False,LOW,,,,,False,False,False,,15,0,America/New_York,EDT,,41.7413,-4.1363983,-0.09909606,40.641705,-3.0368042,,True,1675348200000,-14400000,150915808.0,4.1318,4.1318,Sprott Junior Copper Miners ETF,18.751095,-0.04972662,1784331121.0,3.0,0.0,USD,2,37.47,90712,1.60755,CLOSED,38.24,finmb_1802730191,NasdaqGM,58400,0.0,-16.3401,-0.07472138,0.5505896,37.6049,37.875,36.71 - 37.875,37.5862,-0.018699646,-0.6351013,1784318400,3.0,-1.6608298,0.75,36.71,65123,us_market,13.3529,24.252 - 53.945,[],NGM,53.945,24.252,11.42,,-0.30290294,Sprott Junior Copper Miners ETF,45.243526,2.0054777,37.24,37.96,COPJ,,2023-02-02,,,,,,,,,,,,,203-656-2400,"The fund will, under normal circumstances, invest at least 80% of its total assets in securities of the index. The index is designed to track the performance of companies that derive at least 50% of their revenue and/or assets from mining, exploration, development, and production of copper. The index generally consists of from 25 to 45 constituents. The fund is non-diversified.",[],[],86400.0,2.0,38.24,37.47,36.71,37.875,38.24,37.47,36.71,37.875,18.751095,65123.0,65123.0,90712.0,58400.0,58400.0,37.24,37.96,3.0,3.0,0.1142,150915808.0,24.252,53.945,53.945,15.84,41.7413,40.641705,0.0,0.0,38.08,USD,False,Natural Resources,1.60755,1.36,Sprott,1675209600.0,Exchange Traded Fund,0.3330491,ETF,COPJ,en-US,US,ETF,Nasdaq Real Time Price,True,HIGH,CLOSED,[],1784331121.0,1784318400.0,NGM,finmb_1802730191,America/New_York,EDT,-14400000.0,us_market,False,-1.6608298,37.6049,True,1675348200000.0,-0.04972662,37.5862,-0.018699646,-0.6351013,36.71 - 37.875,NasdaqGM,90712.0,13.3529,0.5505896,24.252 - 53.945,-16.3401,-0.30290294,45.243526,11.42,4.1318,4.1318,150915808.0,2.0054777,Sprott Junior Copper Miners ETF,Sprott Junior Copper Miners ETF,-4.1363983,-0.09909606,-3.0368042,-0.07472138,0.75,15.0,0.0,False,,"The fund will, under normal circumstances, invest at least 80% of its total assets in securities of the index. The index is designed to track the performance of companies that derive at least 50% of their revenue and/or assets from mining, exploration, development, and production of copper. The index generally consists of from 25 to 45 constituents. The fund is non-diversified.",Natural Resources,Sprott,Exchange Traded Fund,0.0251,0.9749,0.0,0.0,0.0,0.0,0.0,0.0,1.0,0.0,0.0,0.0,0.0,0.0,0.0,0.0,0.0,0.0,0.0075,0.0086928,0.59,0.441,605.0,605.0,59.0,0.75,42.886979399999994,"[{""Symbol"":""FDY.TO"",""Name"":""Faraday Copper Corp"",""Holding Percent"":0.049545202},{""Symbol"":""TKO"",""Name"":""Taseko Mines Ltd"",""Holding Percent"":0.0484795},{""Symbol"":""ATYM.L"",""Name"":""Atalaya Mining Copper SA"",""Holding Percent"":0.048014596},{""Symbol"":""ERO.TO"",""Name"":""Ero Copper Corp"",""Holding Percent"":0.0464758},{""Symbol"":""OM.TO"",""Name"":""Osisko Metals Inc"",""Holding Percent"":0.043899298},{""Symbol"":""FFM.AX"",""Name"":""FireFly Metals Ltd"",""Holding Percent"":0.0434068},{""Symbol"":""SLS.TO"",""Name"":""Solaris Resources Inc Ordinary Shares"",""Holding Percent"":0.0430323},{""Symbol"":""IE"",""Name"":""Ivanhoe Electric Inc"",""Holding Percent"":0.0373309},{""Symbol"":""PUCOBRE.SN"",""Name"":""Sociedad Punta del Cobre SA Ordinary Shares"",""Holding Percent"":0.0354096},{""Symbol"":""ARG.TO"",""Name"":""Amerigo Resources Ltd"",""Holding Percent"":0.033275798}]","[{""Average"":""Price\/Earnings"",""COPJ"":0.0,""Category Average"":null},{""Average"":""Price\/Book"",""COPJ"":0.36838,""Category Average"":null},{""Average"":""Price\/Sales"",""COPJ"":0.0,""Category Average"":null},{""Average"":""Price\/Cashflow"",""COPJ"":0.0,""Category Average"":null},{""Average"":""Median Market Cap"",""COPJ"":null,""Category Average"":null},{""Average"":""3 Year Earnings Growth"",""COPJ"":null,""Category Average"":null}]",0.0,0.36838,,"[{""Average"":""Duration"",""COPJ"":null,""Category Average"":null},{""Average"":""Maturity"",""COPJ"":null,""Category Average"":null},{""Average"":""Credit Quality"",""COPJ"":null,""Category Average"":null}]",,,,,,,,,,2023-02-02,,,,,,,,,,,,,,,,,,,,
Materials,basic-materials,38,GDMN,WisdomTree Efficient Gold Plus Gold Miners Strategy Fund,https://finance.yahoo.com/research-hub/screener/sec-ind_sec-top-etfs_basic-materials/,2026-07-18T07:04:17+00:00,en-US,US,ETF,ETF,Nasdaq Real Time Price,False,LOW,3.47,12.677485,,,False,False,False,,15,0,America/New_York,EDT,,84.40042,-15.720421,-0.18625998,96.08187,-27.40187,,True,1639665000000,-14400000,148428352.0,-27.3876,-27.3876,WisdomTree Efficient Gold Plus ,12.025436,0.13103719,1784328321.0,500.0,0.0,USD,2,67.12,45200,-22.60726,CLOSED,68.55,finmb_1681262913,Cboe US,42490,0.0,-78.590004,-0.28519294,0.4140707,68.68,69.39,67.25 - 69.39,68.77,0.08999634,0.129997,1784318393,500.0,0.189639,0.45,67.25,26824,us_market,20.111,48.569 - 147.27,[],BTS,147.27,48.569,3.47,,-0.5336457,WisdomTree Efficient Gold Plus Gold Miners Strategy Fund,38.803555,5.7112274,67.5,68.63,GDMN,,,,,,,,,,,,,,,866-909-9473,"The fund invests, either directly or through a wholly-owned subsidiary, in a portfolio comprised of (i) U.S.-listed gold futures contracts and (ii) global equity securities issued by companies that derive at least 50% of their revenue from the gold mining business. The fund will invest in a representative basket of global equity securities issued by Gold Miners generally weighted by market capitalization. The fund may invest in U.S. Treasury securities and other liquid short-term investments as collateral for its U.S.-listed gold futures contracts. The fund is non-diversified.",[],[],86400.0,2.0,68.55,67.12,67.25,69.39,68.55,67.12,67.25,69.39,12.025436,26724.0,26724.0,45200.0,42490.0,42490.0,67.5,68.63,500.0,500.0,0.0347,148428352.0,48.569,147.27,147.27,16.552,84.40042,96.08187,0.0,0.0,68.865,USD,False,Multi-Asset Overlay,-22.60726,0.87,WisdomTree,1639440000.0,Exchange Traded Fund,0.4700679,ETF,GDMN,en-US,US,ETF,Nasdaq Real Time Price,True,HIGH,CLOSED,[],1784328321.0,1784318393.0,BTS,finmb_1681262913,America/New_York,EDT,-14400000.0,us_market,False,0.189639,68.68,True,1639665000000.0,0.13103719,68.77,0.08999634,0.129997,67.25 - 69.39,Cboe US,45200.0,20.111,0.4140707,48.569 - 147.27,-78.590004,-0.5336457,38.803555,3.47,-27.3876,-27.3876,148428352.0,5.7112274,WisdomTree Efficient Gold Plus ,WisdomTree Efficient Gold Plus Gold Miners Strategy Fund,-15.720421,-0.18625998,-27.40187,-0.28519294,0.45,15.0,0.0,False,,"The fund invests, either directly or through a wholly-owned subsidiary, in a portfolio comprised of (i) U.S.-listed gold futures contracts and (ii) global equity securities issued by companies that derive at least 50% of their revenue from the gold mining business. The fund will invest in a representative basket of global equity securities issued by Gold Miners generally weighted by market capitalization. The fund may invest in U.S. Treasury securities and other liquid short-term investments as collateral for its U.S.-listed gold futures contracts. The fund is non-diversified.",Multi-Asset Overlay,WisdomTree,Exchange Traded Fund,0.0,1.1413,0.0,0.0,0.0,-0.14130001,0.0,0.0,1.0,0.0,0.0,0.0,0.0,0.0,0.0,0.0,0.0,0.0,0.0045,0.0,0.2,,25517.83,25517.83,20.0,0.44999999999999996,65.2638998,"[{""Symbol"":""NEM"",""Name"":""Newmont Corp"",""Holding Percent"":0.1421055},{""Symbol"":""ABX.TO"",""Name"":""Barrick Mining Corp"",""Holding Percent"":0.0955165},{""Symbol"":""AEM.TO"",""Name"":""Agnico Eagle Mines Ltd"",""Holding Percent"":0.09079},{""Symbol"":""AU"",""Name"":""Anglogold Ashanti PLC"",""Holding Percent"":0.070492804},{""Symbol"":""K.TO"",""Name"":""Kinross Gold Corp"",""Holding Percent"":0.060985997},{""Symbol"":""GFI"",""Name"":""Gold Fields Ltd ADR"",""Holding Percent"":0.0544982},{""Symbol"":""WPM.TO"",""Name"":""Wheaton Precious Metals Corp"",""Holding Percent"":0.0495078},{""Symbol"":""FNV.TO"",""Name"":""Franco-Nevada Corp"",""Holding Percent"":0.047137097},{""Symbol"":""PAAS.TO"",""Name"":""Pan American Silver Corp"",""Holding Percent"":0.0416051}]","[{""Average"":""Price\/Earnings"",""GDMN"":0.07888,""Category Average"":null},{""Average"":""Price\/Book"",""GDMN"":0.36178,""Category Average"":null},{""Average"":""Price\/Sales"",""GDMN"":0.24722,""Category Average"":null},{""Average"":""Price\/Cashflow"",""GDMN"":0.11472,""Category Average"":null},{""Average"":""Median Market Cap"",""GDMN"":null,""Category Average"":null},{""Average"":""3 Year Earnings Growth"",""GDMN"":null,""Category Average"":null}]",0.07888,0.36178,,"[{""Average"":""Duration"",""GDMN"":null,""Category Average"":null},{""Average"":""Maturity"",""GDMN"":null,""Category Average"":null},{""Average"":""Credit Quality"",""GDMN"":null,""Category Average"":null}]",,,,,,,,,,,,,,,,,,,,,,,,,,,,,,
Materials,basic-materials,39,GBUG,Sprott Active Gold & Silver Miners ETF,https://finance.yahoo.com/research-hub/screener/sec-ind_sec-top-etfs_basic-materials/,2026-07-18T07:04:17+00:00,en-US,US,ETF,ETF,Nasdaq Real Time Price,False,LOW,1.74,12.851819,,,False,False,False,,15,0,America/New_York,EDT,,41.73728,-4.9351807,-0.11824394,43.894596,-7.092495,,True,1740061800000,-14400000,140809888.0,-13.65649,-13.65649,Sprott Active Gold & Silver Min,12.11297,0.14721899,1784319005.0,1.0,0.0,USD,2,36.52,39474,-10.56855,CLOSED,36.746,finmb_1913073300,NasdaqGM,24860,0.0,-22.2179,-0.16158015,0.523581,36.8021,37.1587,35.915 - 37.1587,36.8021,0.054100037,0.056102753,1784318400,1.0,0.15267718,0.9,35.915,39466,us_market,12.6471,24.155 - 59.02,[],NGM,59.02,24.155,1.74,,-0.37644696,Sprott Active Gold & Silver Miners ETF,47.91801,3.0382392,34.14,39.45,GBUG,,2025-02-20,,,,,,,,,,,,,203-656-2400,"The fund seeks to achieve its investment objective by investing 80% of its net assets in shares of gold and silver, focused companies that are engaged in exploring, developing and mining; or royalty and streaming companies engaged in the financing of gold and silver assets. The investment strategy of the fund is value oriented and contrarian. The fund is non-diversified.",[],[],86400.0,2.0,36.746,36.52,35.915,37.1587,36.746,36.52,35.915,37.1587,12.11297,39466.0,39466.0,39474.0,24860.0,24860.0,34.14,39.45,1.0,1.0,0.0174,140809888.0,24.155,59.02,59.02,18.39,41.73728,43.894596,0.0,0.0,37.02,USD,False,Equity Precious Metals,-10.56855,0.0,Sprott,1739923200.0,Exchange Traded Fund,,ETF,GBUG,en-US,US,ETF,Nasdaq Real Time Price,True,HIGH,CLOSED,[],1784319005.0,1784318400.0,NGM,finmb_1913073300,America/New_York,EDT,-14400000.0,us_market,False,0.15267718,36.8021,True,1740061800000.0,0.14721899,36.8021,0.054100037,0.056102753,35.915 - 37.1587,NasdaqGM,39474.0,12.6471,0.523581,24.155 - 59.02,-22.2179,-0.37644696,47.91801,1.74,-13.65649,-13.65649,140809888.0,3.0382392,Sprott Active Gold & Silver Min,Sprott Active Gold & Silver Miners ETF,-4.9351807,-0.11824394,-7.092495,-0.16158015,0.9,15.0,0.0,False,,"The fund seeks to achieve its investment objective by investing 80% of its net assets in shares of gold and silver, focused companies that are engaged in exploring, developing and mining; or royalty and streaming companies engaged in the financing of gold and silver assets. The investment strategy of the fund is value oriented and contrarian. The fund is non-diversified.",Equity Precious Metals,Sprott,Exchange Traded Fund,0.0098,0.9902,0.0,0.0,0.0,0.0,0.0,0.0,1.0,0.0,0.0,0.0,0.0,0.0,0.0,0.0,0.0,0.0,0.009,0.0114857,0.2,0.5542,7551.79,7551.79,20.0,0.8999999999999999,38.94513,"[{""Symbol"":""GMIN.TO"",""Name"":""G Mining Ventures Corp"",""Holding Percent"":0.0495862},{""Symbol"":""DPM.TO"",""Name"":""DPM Metals Inc"",""Holding Percent"":0.0495825},{""Symbol"":""IMG.TO"",""Name"":""Iamgold Corp"",""Holding Percent"":0.0412764},{""Symbol"":""CDE"",""Name"":""Coeur Mining Inc"",""Holding Percent"":0.0397469},{""Symbol"":""DSV"",""Name"":""Discovery Silver Corp"",""Holding Percent"":0.0391091},{""Symbol"":""MAU.TO"",""Name"":""Montage Gold Corp Ordinary Shares"",""Holding Percent"":0.0369372},{""Symbol"":""ELD.TO"",""Name"":""Eldorado Gold Corp"",""Holding Percent"":0.0352687},{""Symbol"":""OGC.TO"",""Name"":""OceanaGold Corp"",""Holding Percent"":0.0350678},{""Symbol"":""WDO.TO"",""Name"":""Wesdome Gold Mines Ltd"",""Holding Percent"":0.0315305},{""Symbol"":""AEM.TO"",""Name"":""Agnico Eagle Mines Ltd"",""Holding Percent"":0.031346}]","[{""Average"":""Price\/Earnings"",""GBUG"":0.07781,""Category Average"":null},{""Average"":""Price\/Book"",""GBUG"":0.34939,""Category Average"":null},{""Average"":""Price\/Sales"",""GBUG"":0.23693,""Category Average"":null},{""Average"":""Price\/Cashflow"",""GBUG"":0.11144,""Category Average"":null},{""Average"":""Median Market Cap"",""GBUG"":null,""Category Average"":null},{""Average"":""3 Year Earnings Growth"",""GBUG"":null,""Category Average"":null}]",0.07781,0.34939,,"[{""Average"":""Duration"",""GBUG"":null,""Category Average"":null},{""Average"":""Maturity"",""GBUG"":null,""Category Average"":null},{""Average"":""Credit Quality"",""GBUG"":null,""Category Average"":null}]",,,,,,,,,,2025-02-20,,,,,,,,,,,,,,,,,,,,
Materials,basic-materials,40,GDXD,MicroSectors Gold Miners -3X Inverse Leveraged ETNs,https://finance.yahoo.com/research-hub/screener/sec-ind_sec-top-etfs_basic-materials/,2026-07-18T07:04:17+00:00,en-US,US,ETF,ETF,Nasdaq Real Time Price,False,LOW,0.0,13.504389,,,False,False,False,,15,0,America/New_York,EDT,,43.8236,13.8064,0.31504485,73.7604,-16.130398,,True,1607005800000,-14400000,126952912.0,23.29304,23.29304,MicroSectors Gold Miners -3X In,15.325719,-0.39909688,1784332484.0,200.0,0.0,USD,2,60.06,791624,-40.31995,CLOSED,57.12,finmb_697832108,NYSEArca,443000,0.0,-588.37,-0.21868642,1.4249948,57.63,61.9998,55.8 - 61.9998,57.4,-0.22999954,0.510002,1784318400,100.0,0.892861,0.95,55.8,433707,us_market,33.865,23.765 - 646.0,[],PCX,646.0,23.765,0.0,,-0.9107895,MicroSectors Gold Miners -3X Inverse Leveraged ETNs,-91.05125,3.7603457,56.7,58.0,GDXD,,,1748433600.0,1748433600.0,False,1756125000.0,1756470600.0,,,,,,,,,,[],[],86400.0,2.0,57.12,60.06,55.8,61.9998,57.12,60.06,55.8,61.9998,15.325719,433707.0,433707.0,791624.0,443000.0,443000.0,56.7,58.0,200.0,100.0,0.0,126952912.0,23.765,646.0,62800.0,14.89,43.8236,73.7604,0.0,0.0,57.16524,USD,False,Trading--Inverse Commodities,-40.31995,-0.57,BMO Capital Markets,1606867200.0,Exchange Traded Fund,-0.8187941,ETF,GDXD,en-US,US,ETF,Nasdaq Real Time Price,True,HIGH,CLOSED,[],1784332484.0,1784318400.0,PCX,finmb_697832108,America/New_York,EDT,-14400000.0,us_market,False,0.892861,57.63,True,1607005800000.0,-0.39909688,57.4,-0.22999954,0.510002,55.8 - 61.9998,NYSEArca,791624.0,33.865,1.4249948,23.765 - 646.0,-588.37,-0.9107895,-91.05125,0.0,23.29304,23.29304,126952912.0,3.7603457,MicroSectors Gold Miners -3X In,MicroSectors Gold Miners -3X Inverse Leveraged ETNs,13.8064,0.31504485,-16.130398,-0.21868642,0.95,15.0,0.0,False,,,Trading--Inverse Commodities,BMO Capital Markets,Exchange Traded Fund,0.0011,0.999,0.0,0.0,0.0,0.0,0.0,0.0,1.0,0.0,0.0,0.0,0.0,0.0,0.0,0.0,0.0,0.0,0.0095,0.0,0.0,,17076.4,17076.4,0.0,0.95,100.0,"[{""Symbol"":""GDX"",""Name"":""VanEck Gold Miners ETF"",""Holding Percent"":0.7609411},{""Symbol"":""GDXJ"",""Name"":""VanEck Junior Gold Miners ETF"",""Holding Percent"":0.2390589}]","[{""Average"":""Price\/Earnings"",""GDXD"":0.07405,""Category Average"":null},{""Average"":""Price\/Book"",""GDXD"":0.35992,""Category Average"":null},{""Average"":""Price\/Sales"",""GDXD"":0.24645,""Category Average"":null},{""Average"":""Price\/Cashflow"",""GDXD"":0.11247,""Category Average"":null},{""Average"":""Median Market Cap"",""GDXD"":null,""Category Average"":null},{""Average"":""3 Year Earnings Growth"",""GDXD"":null,""Category Average"":null}]",0.07405,0.35992,,"[{""Average"":""Duration"",""GDXD"":null,""Category Average"":null},{""Average"":""Maturity"",""GDXD"":null,""Category Average"":null},{""Average"":""Credit Quality"",""GDXD"":null,""Category Average"":null}]",-0.7296655,,,,,,,,,,,1756125000.0,1756470600.0,,,,,,1748433600.0,1748433600.0,False,,,,,,,,,
