Materials,basic-materials,17,VSDB,Vanguard Short Duration Bond ETF Shares,https://finance.yahoo.com/research-hub/screener/sec-ind_sec-top-etfs_basic-materials/,2026-07-18T07:04:17+00:00,en-US,US,ETF,ETF,Nasdaq Real Time Price,False,LOW,3.95,46.274873,,,False,False,False,,15,0,America/New_York,EDT,,76.11124,-0.06123352,-0.0008045267,76.43224,-0.3822403,,True,1743687000000,-14400000,895731010.0,1.0724,1.0724,Vanguard Short Duration Bond ET,46.183784,-0.02628716,1784319005.0,700.0,0.0,USD,2,76.135,121670,1.28249,CLOSED,76.09,finmb_1917052984,Cboe US,50580,0.0,-1.5899963,-0.0050010346,0.0038278894,76.05,76.1422,76.04 - 76.1422,76.05,-0.019996643,-0.0399933,1784318391,700.0,-0.0525605,0.15,76.04,30292,us_market,0.29000092,75.76 - 77.64,[],BTS,77.64,75.76,3.95,,-0.020479087,Vanguard Short Duration Bond ETF Shares,0.18442869,1.6466819,76.05,114.13,VSDB,,,,,,,,,,,,,,,,"The fund invests in fixed income securities of various maturities, yields, and qualities. Under normal circumstances, the fund will invest at least 80% of its net assets in bonds, which include fixed income securities such as corporate bonds; U.S. Treasury obligations and other U.S. government and agency securities; and asset-backed, mortgage-backed, and mortgage-related securities.",[],[],86400.0,2.0,76.09,76.135,76.04,76.1422,76.09,76.135,76.04,76.1422,46.183784,30292.0,30292.0,121670.0,50580.0,50580.0,76.05,114.13,700.0,700.0,0.0395,895731008.0,75.76,77.64,77.64,74.4,76.11124,76.43224,0.0,0.0,75.97,USD,False,Short-Term Bond,1.28249,0.0,Vanguard,1743552000.0,Exchange Traded Fund,,ETF,VSDB,en-US,US,ETF,Nasdaq Real Time Price,True,HIGH,CLOSED,[],1784319005.0,1784318391.0,BTS,finmb_1917052984,America/New_York,EDT,-14400000.0,us_market,False,-0.0525605,76.05,True,1743687000000.0,-0.02628716,76.05,-0.019996643,-0.0399933,76.04 - 76.1422,Cboe US,121670.0,0.29000092,0.0038278894,75.76 - 77.64,-1.5899963,-0.020479087,0.18442869,3.95,1.0724,1.0724,895731010.0,1.6466819,Vanguard Short Duration Bond ET,Vanguard Short Duration Bond ETF Shares,-0.06123352,-0.0008045267,-0.3822403,-0.0050010346,0.15,15.0,0.0,False,,"The fund invests in fixed income securities of various maturities, yields, and qualities. Under normal circumstances, the fund will invest at least 80% of its net assets in bonds, which include fixed income securities such as corporate bonds; U.S. Treasury obligations and other U.S. government and agency securities; and asset-backed, mortgage-backed, and mortgage-related securities.",Short-Term Bond,Vanguard,Exchange Traded Fund,0.0139,0.0004,0.9858,0.0,0.0,0.0,0.0,0.0,0.9252,0.0,0.0,0.0,0.0,0.0,0.0,0.0,0.0748,0.3211,0.0015,0.0063138995,1.1,1.2983,1713.05,1713.05,110.00000000000001,0.15,,,"[{""Average"":""Price\/Earnings"",""VSDB"":0.02161,""Category Average"":null},{""Average"":""Price\/Book"",""VSDB"":0.65481,""Category Average"":null},{""Average"":""Price\/Sales"",""VSDB"":1.9031,""Category Average"":null},{""Average"":""Price\/Cashflow"",""VSDB"":0.11745,""Category Average"":null},{""Average"":""Median Market Cap"",""VSDB"":null,""Category Average"":null},{""Average"":""3 Year Earnings Growth"",""VSDB"":null,""Category Average"":null}]",0.02161,0.65481,,"[{""Average"":""Duration"",""VSDB"":null,""Category Average"":null},{""Average"":""Maturity"",""VSDB"":9.88,""Category Average"":null},{""Average"":""Credit Quality"",""VSDB"":null,""Category Average"":null}]",,0.1039,0.3854,0.030199999,0.2017,-0.0067000003,0.0434,0.2344,0.0077,,,,,,,,,,,,,,,,,,,,,
Materials,basic-materials,18,NUGT,Direxion Daily Gold Miners Index Bull 2X Shares,https://finance.yahoo.com/research-hub/screener/sec-ind_sec-top-etfs_basic-materials/,2026-07-18T07:04:17+00:00,en-US,US,ETF,ETF,Nasdaq Real Time Price,False,LOW,0.61,13.577733,2.71469,-26.28461,False,False,False,,15,0,America/New_York,EDT,,144.0782,-40.6082,-0.28184834,182.32065,-78.85065,,True,1291818600000,-14400000,855724740.0,-37.6426,-37.6426,Direxion Daily Gold Miners Inde,11.987917,0.51222456,1784332536.0,500.0,,USD,2,100.53,626201,-36.09717,CLOSED,103.93,finmb_116840403,NYSEArca,630810,,-217.32,-0.43248338,0.45037857,103.47,105.255,99.0227 - 105.255,104.0,0.5299988,-0.459999,1784318400,300.0,-0.442605,1.13,99.0227,686145,us_market,32.130005,71.34 - 320.79,[],PCX,320.79,71.34,0.61,,-0.67745256,Direxion Daily Gold Miners Index Bull 2X Shares,45.03784,8.631191,103.18,104.0,NUGT,,,,,,,,,,,,,,,866-476-7523,"The index is comprised of publicly traded common stocks, ADRs or global depositary receipts of companies that operate globally in both developed and emerging markets, and the index provider defines as involved primarily in mining for gold and, to a lesser extent, in mining for silver. The fund invests at least 80% of its net assets in financial instruments, that, in combination, provide 2X daily leveraged exposure to the index, consistent with the fund's investment objective. It is non-diversified.",[],[],86400.0,2.0,103.93,100.53,99.0227,105.255,103.93,100.53,99.0227,105.255,11.987917,686145.0,686145.0,626201.0,630810.0,630810.0,103.18,104.0,500.0,300.0,0.0061000003,855724736.0,71.34,320.79,87300.0,20.3,144.0782,182.32065,,,103.836,USD,False,Trading--Leveraged Equity,-36.09717,0.61,Direxion Funds,1291766400.0,Exchange Traded Fund,0.4043903,ETF,NUGT,en-US,US,ETF,Nasdaq Real Time Price,True,HIGH,CLOSED,[],1784332536.0,1784318400.0,PCX,finmb_116840403,America/New_York,EDT,-14400000.0,us_market,False,-0.442605,103.47,True,1291818600000.0,0.51222456,104.0,0.5299988,-0.459999,99.0227 - 105.255,NYSEArca,626201.0,32.130005,0.45037857,71.34 - 320.79,-217.32,-0.67745256,45.03784,0.61,-37.6426,-37.6426,855724740.0,8.631191,Direxion Daily Gold Miners Inde,Direxion Daily Gold Miners Index Bull 2X Shares,-40.6082,-0.28184834,-78.85065,-0.43248338,1.13,15.0,0.0,False,,"The index is comprised of publicly traded common stocks, ADRs or global depositary receipts of companies that operate globally in both developed and emerging markets, and the index provider defines as involved primarily in mining for gold and, to a lesser extent, in mining for silver. The fund invests at least 80% of its net assets in financial instruments, that, in combination, provide 2X daily leveraged exposure to the index, consistent with the fund's investment objective. It is non-diversified.",Trading--Leveraged Equity,Direxion Funds,Exchange Traded Fund,0.5525,0.4475,0.0,0.0,0.0,0.0,0.0,0.0,1.0,0.0,0.0,0.0,0.0,0.0,0.0,0.0,0.0,0.0,0.0113,0.0,0.74,,23833.34,23833.34,74.0,1.13,60.29553,"[{""Symbol"":""GDX"",""Name"":""VanEck Gold Miners ETF"",""Holding Percent"":0.6029553}]","[{""Average"":""Price\/Earnings"",""NUGT"":0.07365,""Category Average"":null},{""Average"":""Price\/Book"",""NUGT"":0.35121,""Category Average"":null},{""Average"":""Price\/Sales"",""NUGT"":0.23348,""Category Average"":null},{""Average"":""Price\/Cashflow"",""NUGT"":0.10957,""Category Average"":null},{""Average"":""Median Market Cap"",""NUGT"":null,""Category Average"":null},{""Average"":""3 Year Earnings Growth"",""NUGT"":null,""Category Average"":null}]",0.07365,0.35121,,"[{""Average"":""Duration"",""NUGT"":null,""Category Average"":null},{""Average"":""Maturity"",""NUGT"":null,""Category Average"":null},{""Average"":""Credit Quality"",""NUGT"":null,""Category Average"":null}]",0.13592881,,,,,,,,,,,,,,,,,,,,,,,,,,,,,
Materials,basic-materials,19,SLVP,iShares MSCI Global Silver and Metals Miners ETF,https://finance.yahoo.com/research-hub/screener/sec-ind_sec-top-etfs_basic-materials/,2026-07-18T07:04:17+00:00,en-US,US,ETF,ETF,Delayed Quote,False,LOW,2.28,15.713388,-2.05343,-23.04693,False,False,False,,15,0,America/New_York,EDT,,33.704,-4.7039986,-0.13956797,34.64435,-5.644348,7100000.0,True,1328193000000,-14400000,822772480.0,-12.73738,-12.73738,iShares MSCI Global Silver and ,14.780677,1.8275886,1784324701.0,700.0,,USD,2,28.53,360856,-9.41486,CLOSED,28.99,finmb_160292609,Cboe US,228100,,-21.150002,-0.16292262,0.66475314,29.0,29.23,28.12 - 29.23,29.53,0.5300007,0.0100002,1784318400,400.0,0.0344954,0.39,28.12,115254,us_market,11.58,17.42 - 50.15,[],BTS,50.15,17.42,2.28,,-0.4217348,iShares MSCI Global Silver and Metals Miners ETF,63.65689,1.9620211,28.93,31.9,SLVP,,,,,,,,,,,,,,,,"The fund generally will invest at least 80% of its assets in the component securities of the underlying index and in investments that have economic characteristics that are substantially identical to the component securities of the underlying index. The index has been developed by MSCI Inc. (the ""index provider"" or ""MSCI"") to focus on approximately 25 companies in developed and emerging markets that are involved in silver mining or exploration. The fund is non-diversified.",[],[],86400.0,2.0,28.99,28.53,28.12,29.23,28.99,28.53,28.12,29.23,14.780677,115254.0,115254.0,360856.0,228100.0,228100.0,28.93,31.9,700.0,400.0,0.0228,822772480.0,17.42,50.15,50.15,4.59,33.704,34.64435,,,28.99724,USD,False,Equity Precious Metals,-9.41486,1.21,iShares,1327968000.0,Exchange Traded Fund,0.4230867,ETF,SLVP,en-US,US,ETF,Delayed Quote,True,HIGH,CLOSED,[],1784324701.0,1784318400.0,BTS,finmb_160292609,America/New_York,EDT,-14400000.0,us_market,False,0.0344954,29.0,True,1328193000000.0,1.8275886,29.53,0.5300007,0.0100002,28.12 - 29.23,Cboe US,360856.0,11.58,0.66475314,17.42 - 50.15,-21.150002,-0.4217348,63.65689,2.28,-12.73738,-12.73738,822772480.0,1.9620211,iShares MSCI Global Silver and ,iShares MSCI Global Silver and Metals Miners ETF,-4.7039986,-0.13956797,-5.644348,-0.16292262,0.39,15.0,0.0,False,,"The fund generally will invest at least 80% of its assets in the component securities of the underlying index and in investments that have economic characteristics that are substantially identical to the component securities of the underlying index. The index has been developed by MSCI Inc. (the ""index provider"" or ""MSCI"") to focus on approximately 25 companies in developed and emerging markets that are involved in silver mining or exploration. The fund is non-diversified.",Equity Precious Metals,iShares,Exchange Traded Fund,0.0011999999,0.9987,0.0,0.0,0.0,0.0,0.0,0.0,1.0,0.0,0.0,0.0,0.0,0.0,0.0,0.0,0.0,0.0,0.0039,0.0114857,0.74,0.5542,10214.31,10214.31,74.0,0.38999999999999996,70.77535300000001,"[{""Symbol"":""HL"",""Name"":""Hecla Mining Co"",""Holding Percent"":0.13635351},{""Symbol"":""PE&OLES.MX"",""Name"":""Industrias Penoles SAB de CV"",""Holding Percent"":0.10807551},{""Symbol"":""AG.TO"",""Name"":""First Majestic Silver Corp"",""Holding Percent"":0.1040977},{""Symbol"":""FRES.L"",""Name"":""Fresnillo PLC"",""Holding Percent"":0.089210704},{""Symbol"":""AYA.TO"",""Name"":""Aya Gold & Silver Inc"",""Holding Percent"":0.048501402},{""Symbol"":""DSV"",""Name"":""Discovery Silver Corp"",""Holding Percent"":0.0479773},{""Symbol"":""AEM.TO"",""Name"":""Agnico Eagle Mines Ltd"",""Holding Percent"":0.045475602},{""Symbol"":""NEM"",""Name"":""Newmont Corp"",""Holding Percent"":0.0443462},{""Symbol"":""WPM.TO"",""Name"":""Wheaton Precious Metals Corp"",""Holding Percent"":0.0423658},{""Symbol"":""EXK"",""Name"":""Endeavour Silver Corp"",""Holding Percent"":0.041349802}]","[{""Average"":""Price\/Earnings"",""SLVP"":0.06364,""Category Average"":null},{""Average"":""Price\/Book"",""SLVP"":0.30572,""Category Average"":null},{""Average"":""Price\/Sales"",""SLVP"":0.24107,""Category Average"":null},{""Average"":""Price\/Cashflow"",""SLVP"":0.0955,""Category Average"":null},{""Average"":""Median Market Cap"",""SLVP"":null,""Category Average"":null},{""Average"":""3 Year Earnings Growth"",""SLVP"":null,""Category Average"":null}]",0.06364,0.30572,,"[{""Average"":""Duration"",""SLVP"":null,""Category Average"":null},{""Average"":""Maturity"",""SLVP"":null,""Category Average"":null},{""Average"":""Credit Quality"",""SLVP"":null,""Category Average"":null}]",0.1623168,,,,,,,,,,,,,,,,,,,,,,,,,7100000.0,,,,
Materials,basic-materials,20,GDXU,MicroSectors Gold Miners 3X Leveraged ETNs,https://finance.yahoo.com/research-hub/screener/sec-ind_sec-top-etfs_basic-materials/,2026-07-18T07:04:17+00:00,en-US,US,ETF,ETF,Delayed Quote,False,LOW,0.0,13.504389,,,False,False,False,,15,0,America/New_York,EDT,,124.8416,-55.7016,-0.4461782,220.21635,-151.07635,,True,1607005800000,-14400000,728154560.0,-57.70792,-57.70792,MicroSectors Gold Miners 3X Lev,10.899326,0.24587528,1784332781.0,100.0,0.0,USD,2,66.65,1425446,-64.75804,CLOSED,69.89,finmb_698149477,NYSEArca,1445640,0.0,-471.64,-0.68603605,0.07276963,69.14,71.25,64.605 - 71.25,69.31,0.16999817,-0.75,1784318400,400.0,-1.07311,0.95,64.605,1135427,us_market,4.6900024,64.45 - 540.78,[],PCX,540.78,64.45,0.0,,-0.8721476,MicroSectors Gold Miners 3X Leveraged ETNs,2.3992896,6.343511,68.5,69.72,GDXU,,,1748433600.0,1748433600.0,False,1756125000.0,1756470600.0,,,,,,,,,,[],[],86400.0,2.0,69.89,66.65,64.605,71.25,69.89,66.65,64.605,71.25,10.899326,1135427.0,1135427.0,1425446.0,1445640.0,1445640.0,68.5,69.72,100.0,400.0,0.0,728154560.0,64.45,540.78,540.78,17.21,124.8416,220.21635,0.0,0.0,69.75237,USD,False,Trading--Leveraged Commodities,-64.75804,1.12,BMO Capital Markets,1606867200.0,Exchange Traded Fund,0.17033319,ETF,GDXU,en-US,US,ETF,Delayed Quote,True,HIGH,CLOSED,[],1784332781.0,1784318400.0,PCX,finmb_698149477,America/New_York,EDT,-14400000.0,us_market,False,-1.07311,69.14,True,1607005800000.0,0.24587528,69.31,0.16999817,-0.75,64.605 - 71.25,NYSEArca,1425446.0,4.6900024,0.07276963,64.45 - 540.78,-471.64,-0.8721476,2.3992896,0.0,-57.70792,-57.70792,728154560.0,6.343511,MicroSectors Gold Miners 3X Lev,MicroSectors Gold Miners 3X Leveraged ETNs,-55.7016,-0.4461782,-151.07635,-0.68603605,0.95,15.0,0.0,False,,,Trading--Leveraged Commodities,BMO Capital Markets,Exchange Traded Fund,0.0011,0.999,0.0,0.0,0.0,0.0,0.0,0.0,1.0,0.0,0.0,0.0,0.0,0.0,0.0,0.0,0.0,0.0,0.0095,0.0,0.0,,17076.4,17076.4,0.0,0.95,100.0,"[{""Symbol"":""GDX"",""Name"":""VanEck Gold Miners ETF"",""Holding Percent"":0.7609411},{""Symbol"":""GDXJ"",""Name"":""VanEck Junior Gold Miners ETF"",""Holding Percent"":0.2390589}]","[{""Average"":""Price\/Earnings"",""GDXU"":0.07405,""Category Average"":null},{""Average"":""Price\/Book"",""GDXU"":0.35992,""Category Average"":null},{""Average"":""Price\/Sales"",""GDXU"":0.24645,""Category Average"":null},{""Average"":""Price\/Cashflow"",""GDXU"":0.11247,""Category Average"":null},{""Average"":""Median Market Cap"",""GDXU"":null,""Category Average"":null},{""Average"":""3 Year Earnings Growth"",""GDXU"":null,""Category Average"":null}]",0.07405,0.35992,,"[{""Average"":""Duration"",""GDXU"":null,""Category Average"":null},{""Average"":""Maturity"",""GDXU"":null,""Category Average"":null},{""Average"":""Credit Quality"",""GDXU"":null,""Category Average"":null}]",-0.1442577,,,,,,,,,,,1756125000.0,1756470600.0,,,,,,1748433600.0,1748433600.0,False,,,,,,,,,
Materials,basic-materials,21,SLVR,Sprott Silver Miners & Physical Silver ETF,https://finance.yahoo.com/research-hub/screener/sec-ind_sec-top-etfs_basic-materials/,2026-07-18T07:04:17+00:00,en-US,US,ETF,ETF,Nasdaq Real Time Price,False,LOW,4.09,21.838829,,,False,False,False,,15,0,America/New_York,EDT,,56.1546,-9.0896,-0.16186741,57.17014,-10.105141,,True,1736951400000,-14400000,645818880.0,-14.81615,-14.81615,Sprott Silver Miners & Physical,20.479069,-0.13810396,1784330746.0,4.0,0.0,USD,2,46.18,166751,-9.88338,CLOSED,46.93,finmb_1887728648,NasdaqGM,100300,0.0,-38.835003,-0.17675558,0.57883257,47.065,47.47,45.51 - 47.47,47.0,-0.06499863,0.134998,1784318400,4.0,0.287659,0.65,45.51,76052,us_market,17.255,29.81 - 85.9,[],NGM,85.9,29.81,4.09,,-0.45209548,Sprott Silver Miners & Physical Silver ETF,48.75158,2.2982001,46.9,47.21,SLVR,,2025-01-15,,,,,,,,,,SILVERspac,,,203-656-2400,"The fund will, under normal circumstances, invest at least 80% of the value of its total assets in securities of the index. The index is designed to track the performance of companies that derive at least 50% of their revenue and/or assets from mining, production, development, or exploration of silver; and publicly traded closed-end trusts that invest 50% or more of their assets in physical silver. The fund is non-diversified.",[],[],86400.0,2.0,46.93,46.18,45.51,47.47,46.93,46.18,45.51,47.47,20.479069,76052.0,76052.0,166751.0,100300.0,100300.0,46.9,47.21,4.0,4.0,0.040900003,645818880.0,29.81,85.9,85.9,19.66,56.1546,57.17014,0.0,0.0,47.037,USD,False,Equity Precious Metals,-9.88338,0.0,Sprott,1736812800.0,Exchange Traded Fund,,ETF,SLVR,en-US,US,ETF,Nasdaq Real Time Price,True,HIGH,CLOSED,[],1784330746.0,1784318400.0,NGM,finmb_1887728648,America/New_York,EDT,-14400000.0,us_market,False,0.287659,47.065,True,1736951400000.0,-0.13810396,47.0,-0.06499863,0.134998,45.51 - 47.47,NasdaqGM,166751.0,17.255,0.57883257,29.81 - 85.9,-38.835003,-0.45209548,48.75158,4.09,-14.81615,-14.81615,645818880.0,2.2982001,Sprott Silver Miners & Physical,Sprott Silver Miners & Physical Silver ETF,-9.0896,-0.16186741,-10.105141,-0.17675558,0.65,15.0,0.0,False,,"The fund will, under normal circumstances, invest at least 80% of the value of its total assets in securities of the index. The index is designed to track the performance of companies that derive at least 50% of their revenue and/or assets from mining, production, development, or exploration of silver; and publicly traded closed-end trusts that invest 50% or more of their assets in physical silver. The fund is non-diversified.",Equity Precious Metals,Sprott,Exchange Traded Fund,0.0004,0.8308,0.0,0.0,0.0,0.1688,0.0,0.0,0.9938,0.0062,0.0,0.0,0.0,0.0,0.0,0.0,0.0,0.0,0.0064999997,0.0114857,0.49,0.5542,2857.86,2857.86,49.0,0.64999997,74.0028313,"[{""Symbol"":""AG.TO"",""Name"":""First Majestic Silver Corp"",""Holding Percent"":0.21821131},{""Symbol"":""PSLV"",""Name"":""Sprott Physical Silver Trust"",""Holding Percent"":0.1690968},{""Symbol"":""AYA.TO"",""Name"":""Aya Gold & Silver Inc"",""Holding Percent"":0.0708461},{""Symbol"":""WPM.TO"",""Name"":""Wheaton Precious Metals Corp"",""Holding Percent"":0.049527403},{""Symbol"":""EXK"",""Name"":""Endeavour Silver Corp"",""Holding Percent"":0.0486645},{""Symbol"":""SVM.TO"",""Name"":""Silvercorp Metals Inc"",""Holding Percent"":0.0444002},{""Symbol"":""ABRA.TO"",""Name"":""Abrasilver Resource Corp"",""Holding Percent"":0.0422782},{""Symbol"":""USA.TO"",""Name"":""Americas Gold And Silver Corp"",""Holding Percent"":0.0387704},{""Symbol"":""VZLA.TO"",""Name"":""Vizsla Silver Corp Ordinary Shares (New Shares)"",""Holding Percent"":0.0307336},{""Symbol"":""GGD.TO"",""Name"":""GoGold Resources Inc"",""Holding Percent"":0.0274998}]","[{""Average"":""Price\/Earnings"",""SLVR"":0.04579,""Category Average"":null},{""Average"":""Price\/Book"",""SLVR"":0.29643,""Category Average"":null},{""Average"":""Price\/Sales"",""SLVR"":0.17946,""Category Average"":null},{""Average"":""Price\/Cashflow"",""SLVR"":0.07436,""Category Average"":null},{""Average"":""Median Market Cap"",""SLVR"":null,""Category Average"":null},{""Average"":""3 Year Earnings Growth"",""SLVR"":null,""Category Average"":null}]",0.04579,0.29643,,"[{""Average"":""Duration"",""SLVR"":null,""Category Average"":null},{""Average"":""Maturity"",""SLVR"":null,""Category Average"":null},{""Average"":""Credit Quality"",""SLVR"":null,""Category Average"":null}]",,,,,,,,,,2025-01-15,,,,,,,SILVERspac,,,,,,,,,,,,,
Materials,basic-materials,22,FMAT,Fidelity MSCI Materials Index ETF,https://finance.yahoo.com/research-hub/screener/sec-ind_sec-top-etfs_basic-materials/,2026-07-18T07:04:17+00:00,en-US,US,ETF,ETF,Delayed Quote,False,LOW,1.43,24.727992,13.66281,27.60483,False,False,False,,15,0,America/New_York,EDT,,58.906,-1.730999,-0.029385785,56.52995,0.64505005,,True,1382621400000,-14400000,623540800.0,1.87529,1.87529,Fidelity MSCI Materials Index E,24.14792,0.0,1784323604.0,1400.0,0.0,USD,2,57.52,65364,11.03352,CLOSED,57.745,finmb_243638576,NYSEArca,45460,0.0,-5.665001,0.011410766,0.17258,57.175,58.0,57.11 - 58.0,57.175,0.0,-0.57,1784318393,700.0,-0.987098,0.084,57.11,41666,us_market,8.415001,48.76 - 62.84,[],PCX,62.84,48.76,1.43,,-0.090149604,Fidelity MSCI Materials Index ETF,11.679686,2.3676987,57.23,57.25,FMAT,,,,,,,,,,,,,,,,"The fund invests at least 80% of assets in securities included in the fund's underlying index. The fund's underlying index is the MSCI USA IMI Materials 25/50 Index, which represents the performance of the materials sector in the U.S. equity market. It may or may not hold all of the securities in the MSCI USA IMI Materials 25/50 Index. The fund is non-diversified.",[],[],86400.0,2.0,57.745,57.52,57.11,58.0,57.745,57.52,57.11,58.0,24.14792,41666.0,41666.0,65364.0,45460.0,45460.0,57.23,57.25,1400.0,700.0,0.0143,623540800.0,48.76,62.84,62.84,20.29,58.906,56.52995,0.0,0.0,57.75389,USD,False,Natural Resources,11.03352,0.91,Fidelity Investments,1382313600.0,Exchange Traded Fund,0.08865151,ETF,FMAT,en-US,US,ETF,Delayed Quote,True,HIGH,CLOSED,[],1784323604.0,1784318393.0,PCX,finmb_243638576,America/New_York,EDT,-14400000.0,us_market,False,-0.987098,57.175,True,1382621400000.0,0.0,57.175,0.0,-0.57,57.11 - 58.0,NYSEArca,65364.0,8.415001,0.17258,48.76 - 62.84,-5.665001,-0.090149604,11.679686,1.43,1.87529,1.87529,623540800.0,2.3676987,Fidelity MSCI Materials Index E,Fidelity MSCI Materials Index ETF,-1.730999,-0.029385785,0.64505005,0.011410766,0.084,15.0,0.0,False,,"The fund invests at least 80% of assets in securities included in the fund's underlying index. The fund's underlying index is the MSCI USA IMI Materials 25/50 Index, which represents the performance of the materials sector in the U.S. equity market. It may or may not hold all of the securities in the MSCI USA IMI Materials 25/50 Index. The fund is non-diversified.",Natural Resources,Fidelity Investments,Exchange Traded Fund,0.0011999999,0.9987,0.0,0.0,0.0,0.0,0.0,0.094,0.8912,0.0,0.0,0.0,0.0,0.0,0.0095,0.0,0.0053,0.0,0.00084,0.0086928,0.06,0.441,40993.28,40993.28,6.0,0.084,56.2292802,"[{""Symbol"":""LIN"",""Name"":""Linde PLC"",""Holding Percent"":0.1555968},{""Symbol"":""NEM"",""Name"":""Newmont Corp"",""Holding Percent"":0.0670591},{""Symbol"":""FCX"",""Name"":""Freeport-McMoRan Inc"",""Holding Percent"":0.0581864},{""Symbol"":""SHW"",""Name"":""Sherwin-Williams Co"",""Holding Percent"":0.0531593},{""Symbol"":""CRH"",""Name"":""CRH PLC"",""Holding Percent"":0.0478827},{""Symbol"":""ECL"",""Name"":""Ecolab Inc"",""Holding Percent"":0.0465277},{""Symbol"":""APD"",""Name"":""Air Products and Chemicals Inc"",""Holding Percent"":0.0377113},{""Symbol"":""CTVA"",""Name"":""Corteva Inc"",""Holding Percent"":0.036774598},{""Symbol"":""NUE"",""Name"":""Nucor Corp"",""Holding Percent"":0.033352003},{""Symbol"":""VMC"",""Name"":""Vulcan Materials Co"",""Holding Percent"":0.026042901}]","[{""Average"":""Price\/Earnings"",""FMAT"":0.04044,""Category Average"":null},{""Average"":""Price\/Book"",""FMAT"":0.33286,""Category Average"":null},{""Average"":""Price\/Sales"",""FMAT"":0.4929,""Category Average"":null},{""Average"":""Price\/Cashflow"",""FMAT"":0.06991,""Category Average"":null},{""Average"":""Median Market Cap"",""FMAT"":null,""Category Average"":null},{""Average"":""3 Year Earnings Growth"",""FMAT"":null,""Category Average"":null}]",0.04044,0.33286,,"[{""Average"":""Duration"",""FMAT"":null,""Category Average"":null},{""Average"":""Maturity"",""FMAT"":null,""Category Average"":null},{""Average"":""Credit Quality"",""FMAT"":null,""Category Average"":null}]",0.0685746,,,,,,,,,,,,,,,,,,,,,,,,,,,,,
