Materials,basic-materials,47,PYZ,Invesco DWA Basic Materials Momentum ETF,https://finance.yahoo.com/research-hub/screener/sec-ind_sec-top-etfs_basic-materials/,2026-07-18T07:04:17+00:00,en-US,US,ETF,ETF,Nasdaq Real Time Price,False,LOW,0.47,25.3614,9.61517,32.71402,False,False,False,,15,0,America/New_York,EDT,,126.595,-8.385498,-0.066238776,119.34915,-1.1396484,,True,1160659800000,-14400000,80614624.0,5.11663,5.11663,Invesco Dorsey Wright Basic Mat,23.82416,-0.10183272,1784319005.0,15.0,0.0,USD,2,118.435,5509,14.7039,CLOSED,119.17,finmb_29596592,NasdaqGM,2840,0.0,-15.890503,-0.009548861,0.25567776,118.2095,118.435,118.2095 - 118.435,118.2095,-0.12049866,-0.960495,1784318400,15.0,-0.80598724,0.6,118.2095,18876,us_market,24.069504,94.14 - 134.1,[],NGM,134.1,94.14,0.47,,-0.11849741,Invesco DWA Basic Materials Momentum ETF,18.162739,4.961749,118.14,118.53,PYZ,1522281600.0,,,,,,,,,,,,,,,"The fund generally will invest at least 90% of its total assets in the securities that comprise the underlying index. The underlying index is composed of at least 30 securities of companies in the basic materials sector that have powerful relative strength or ""momentum"" characteristics.",[],[],86400.0,2.0,119.17,118.435,118.2095,118.435,119.17,118.435,118.2095,118.435,23.82416,18876.0,18876.0,5509.0,2840.0,2840.0,118.14,118.53,15.0,15.0,0.0047,80614624.0,94.14,134.1,134.1,13.42,126.595,119.34915,0.0,0.0,118.52,USD,False,Natural Resources,14.7039,1.28,Invesco,1160611200.0,Exchange Traded Fund,0.1175898,ETF,PYZ,en-US,US,ETF,Nasdaq Real Time Price,True,HIGH,CLOSED,[],1784319005.0,1784318400.0,NGM,finmb_29596592,America/New_York,EDT,-14400000.0,us_market,False,-0.80598724,118.2095,True,1160659800000.0,-0.10183272,118.2095,-0.12049866,-0.960495,118.2095 - 118.435,NasdaqGM,5509.0,24.069504,0.25567776,94.14 - 134.1,-15.890503,-0.11849741,18.162739,0.47,5.11663,5.11663,80614624.0,4.961749,Invesco Dorsey Wright Basic Mat,Invesco DWA Basic Materials Momentum ETF,-8.385498,-0.066238776,-1.1396484,-0.009548861,0.6,15.0,0.0,False,,"The fund generally will invest at least 90% of its total assets in the securities that comprise the underlying index. The underlying index is composed of at least 30 securities of companies in the basic materials sector that have powerful relative strength or ""momentum"" characteristics.",Natural Resources,Invesco,Exchange Traded Fund,0.0019,0.9981,0.0,0.0,0.0,0.0,0.0,0.0,0.8172,0.0,0.0,0.0,0.0,0.0,0.18280001,0.0,0.0,0.0,0.006,0.0086928,0.91,0.441,15340.47,15340.47,91.0,0.6,40.876550599999995,"[{""Symbol"":""CRS"",""Name"":""Carpenter Technology Corp"",""Holding Percent"":0.094571106},{""Symbol"":""ATI"",""Name"":""ATI Inc"",""Holding Percent"":0.0636457},{""Symbol"":""CF"",""Name"":""CF Industries Holdings Inc"",""Holding Percent"":0.0472298},{""Symbol"":""STLD"",""Name"":""Steel Dynamics Inc"",""Holding Percent"":0.0377734},{""Symbol"":""CTVA"",""Name"":""Corteva Inc"",""Holding Percent"":0.036793},{""Symbol"":""AA"",""Name"":""Alcoa Corp"",""Holding Percent"":0.0326545},{""Symbol"":""USAR"",""Name"":""USA Rare Earth Inc"",""Holding Percent"":0.0324018},{""Symbol"":""FCX"",""Name"":""Freeport-McMoRan Inc"",""Holding Percent"":0.0321961},{""Symbol"":""ESI"",""Name"":""Element Solutions Inc"",""Holding Percent"":0.0315001}]","[{""Average"":""Price\/Earnings"",""PYZ"":0.03943,""Category Average"":null},{""Average"":""Price\/Book"",""PYZ"":0.31791,""Category Average"":null},{""Average"":""Price\/Sales"",""PYZ"":0.51842,""Category Average"":null},{""Average"":""Price\/Cashflow"",""PYZ"":0.06765,""Category Average"":null},{""Average"":""Median Market Cap"",""PYZ"":null,""Category Average"":null},{""Average"":""3 Year Earnings Growth"",""PYZ"":null,""Category Average"":null}]",0.03943,0.31791,,"[{""Average"":""Duration"",""PYZ"":null,""Category Average"":null},{""Average"":""Maturity"",""PYZ"":null,""Category Average"":null},{""Average"":""Credit Quality"",""PYZ"":null,""Category Average"":null}]",0.0854008,,,,,,,,,,1522281600.0,,,,,,,,,,,,,,,,,,,
Materials,basic-materials,48,REXC,Sprott Rare Earths Ex-China ETF,https://finance.yahoo.com/research-hub/screener/sec-ind_sec-top-etfs_basic-materials/,2026-07-18T07:04:17+00:00,en-US,US,ETF,ETF,Nasdaq Real Time Price,False,LOW,,,,,False,False,False,,15,0,America/New_York,EDT,,20.5162,-3.9312,-0.19161443,20.826769,-4.24177,,True,1776259800000,-14400000,55918288.0,,,Sprott Rare Earths Ex-China ETF,,0.090521365,1784319005.0,1.0,0.0,USD,2,16.68,121640,,CLOSED,16.9998,finmb_1982723846,NasdaqGM,76120,0.0,-8.805,-0.20366913,0.01561538,16.585,16.794,16.33 - 16.794,16.585,0.01499939,-0.41480064,1784318400,1.0,-2.4400325,0.65,16.33,54632,us_market,0.25499916,16.33 - 25.39,[],NGM,25.39,16.33,,,-0.3467901,Sprott Rare Earths Ex-China ETF,-20.697897,,15.26,17.93,REXC,,2026-04-15,,,,,,,,,,,,,203-656-2400,"The fund will, under normal circumstances, invest at least 80% of its total assets in securities of the index. The index is designed to track the performance of companies that derive at least 50% of their revenue and/or assets from mining, exploration, development, separation, refining, or production of rare earth minerals (“Rare Earths Companies”). It is non-diversified.",[],[],86400.0,2.0,16.9998,16.68,16.33,16.794,16.9998,16.68,16.33,16.794,,54632.0,54632.0,121640.0,76120.0,76120.0,15.26,17.93,1.0,1.0,,55918288.0,16.33,25.39,25.39,16.33,20.5162,20.826769,0.0,0.0,17.0915,USD,False,Natural Resources,,0.0,Sprott,1776124800.0,Exchange Traded Fund,,ETF,REXC,en-US,US,ETF,Nasdaq Real Time Price,True,HIGH,CLOSED,[],1784319005.0,1784318400.0,NGM,finmb_1982723846,America/New_York,EDT,-14400000.0,us_market,False,-2.4400325,16.585,True,1776259800000.0,0.090521365,16.585,0.01499939,-0.41480064,16.33 - 16.794,NasdaqGM,121640.0,0.25499916,0.01561538,16.33 - 25.39,-8.805,-0.3467901,-20.697897,,,,55918288.0,,Sprott Rare Earths Ex-China ETF,Sprott Rare Earths Ex-China ETF,-3.9312,-0.19161443,-4.24177,-0.20366913,0.65,15.0,0.0,False,,"The fund will, under normal circumstances, invest at least 80% of its total assets in securities of the index. The index is designed to track the performance of companies that derive at least 50% of their revenue and/or assets from mining, exploration, development, separation, refining, or production of rare earth minerals (“Rare Earths Companies”). It is non-diversified.",Natural Resources,Sprott,Exchange Traded Fund,0.0007,0.9992,0.0,0.0,0.0,0.0,0.0,0.0,0.93050003,0.0,0.0,0.0,0.0,0.0,0.047199998,0.0223,0.0,0.0,0.0064999997,0.0086928,0.0,0.441,2557.25,2557.25,0.0,0.64999997,76.0967799,"[{""Symbol"":""LYC.AX"",""Name"":""Lynas Rare Earths Ltd"",""Holding Percent"":0.2021184},{""Symbol"":""MP"",""Name"":""MP Materials Corp Ordinary Shares - Class A"",""Holding Percent"":0.1932569},{""Symbol"":""NEO.TO"",""Name"":""Neo Performance Materials Inc Ordinary Shares"",""Holding Percent"":0.0558167},{""Symbol"":""USAR"",""Name"":""USA Rare Earth Inc"",""Holding Percent"":0.0492043},{""Symbol"":""SRL.AX"",""Name"":""Sunrise Energy Metals Ltd"",""Holding Percent"":0.047133997},{""Symbol"":""ILU.AX"",""Name"":""Iluka Resources Ltd"",""Holding Percent"":0.0456583},{""Symbol"":""CRML"",""Name"":""Critical Metals Corp"",""Holding Percent"":0.0447224},{""Symbol"":""ALOY"",""Name"":""REalloys Inc"",""Holding Percent"":0.0444518},{""Symbol"":""LIN.AX"",""Name"":""Lindian Resources Ltd"",""Holding Percent"":0.0433023},{""Symbol"":""NB"",""Name"":""NioCorp Developments Ltd"",""Holding Percent"":0.035302702}]","[{""Average"":""Price\/Earnings"",""REXC"":0.0,""Category Average"":null},{""Average"":""Price\/Book"",""REXC"":0.24403,""Category Average"":null},{""Average"":""Price\/Sales"",""REXC"":0.10498,""Category Average"":null},{""Average"":""Price\/Cashflow"",""REXC"":0.0,""Category Average"":null},{""Average"":""Median Market Cap"",""REXC"":null,""Category Average"":null},{""Average"":""3 Year Earnings Growth"",""REXC"":null,""Category Average"":null}]",0.0,0.24403,,"[{""Average"":""Duration"",""REXC"":null,""Category Average"":null},{""Average"":""Maturity"",""REXC"":null,""Category Average"":null},{""Average"":""Credit Quality"",""REXC"":null,""Category Average"":null}]",,,,,,,,,,2026-04-15,,,,,,,,,,,,,,,,,,,,
Materials,basic-materials,49,SLJY,Amplify SILJ Junior Silver Miners Covered Call ETF,https://finance.yahoo.com/research-hub/screener/sec-ind_sec-top-etfs_basic-materials/,2026-07-18T07:04:17+00:00,en-US,US,EQUITY,Equity,Delayed Quote,False,LOW,,,,,False,False,False,,15,0,America/New_York,EDT,,30.533,-4.4730015,-0.14649728,32.9107,-6.8507023,,True,1755610200000,-14400000,,,,Amplify SILJ Junior Silver Mine,15.282023,0.5372268,1784326531.0,100.0,0.0,USD,2,25.89,42006,,CLOSED,26.1374,finmb_1949193104,NYSEArca,21910,0.0,-20.930002,-0.20816033,0.06711437,26.06,26.2905,25.455 - 26.2905,26.2,0.1400013,-0.0774002,1784318393,100.0,-0.296128,,25.455,29167,us_market,1.6389999,24.421 - 46.99,[],PCX,46.99,24.421,,,-0.44541395,Amplify SILJ Junior Silver Miners Covered Call ETF,6.7114353,1.7052715,25.79,26.07,SLJY,,,,,,,,Amplify ETF Trust - Amplify SILJ Covered Call ETF,2026-07-18,,,,,,,,,,86400.0,2.0,26.1374,25.89,25.455,26.2905,26.1374,25.89,25.455,26.2905,15.282023,29167.0,29167.0,42006.0,21910.0,21910.0,25.79,26.07,100.0,100.0,,,24.421,46.99,46.99,24.421,30.533,32.9107,0.0,0.0,,USD,False,,,,,,,,EQUITY,SLJY,en-US,US,Equity,Delayed Quote,True,HIGH,CLOSED,[],1784326531.0,1784318393.0,PCX,finmb_1949193104,America/New_York,EDT,-14400000.0,us_market,False,-0.296128,26.06,True,1755610200000.0,0.5372268,26.2,0.1400013,-0.0774002,25.455 - 26.2905,NYSEArca,42006.0,1.6389999,0.06711437,24.421 - 46.99,-20.930002,-0.44541395,6.7114353,,,,,1.7052715,Amplify SILJ Junior Silver Mine,Amplify SILJ Junior Silver Miners Covered Call ETF,-4.4730015,-0.14649728,-6.8507023,-0.20816033,,15.0,0.0,False,,,,,,,,,,,,,,,,,,,,,,,,,,,,,,,,,,,,,,,,,,,,,,,,,,,,26.06,none,fund data: SLJY fund data failed: SLJY: No Fund data found.,,,,,,,,,,,Amplify ETF Trust - Amplify SILJ Covered Call ETF,2026-07-17,,
Materials,basic-materials,50,NIKL,Sprott Nickel Miners ETF,https://finance.yahoo.com/research-hub/screener/sec-ind_sec-top-etfs_basic-materials/,2026-07-18T07:04:17+00:00,en-US,US,ETF,ETF,Nasdaq Real Time Price,False,LOW,2.57,15.9821000479463,,,False,False,False,,15,0,America/New_York,EDT,,14.4532,-1.4632006,-0.10123713,15.845745,-2.8557453,,True,1679491800000,-14400000,53747464.0,-17.39974,-17.39974,Sprott Nickel Miners ETF,12.967362,0.38640025,1784319005.0,2.0,0.0,USD,2,12.96,132141,-18.71419,CLOSED,13.08,finmb_1802738135,NasdaqGM,70540,0.0,-8.865,-0.18022159,0.12467529,12.99,13.07,12.82 - 13.07,12.99,0.05000019,-0.09000015,1784318400,1.0,-0.6880746,0.75,12.82,59408,us_market,1.4399996,11.55 - 21.855,[],NGM,21.855,11.55,3.11,,-0.405628,Sprott Nickel Miners ETF,6.344664,1.0017457,12.91,13.95,NIKL,,2023-03-22,,,,,,,,,,,,,203-656-2400,"The fund will, under normal circumstances, invest at least 80% of its total assets in securities of the index. The index is designed to track the performance of companies that derive at least 50% of their revenue and/or assets from (i) mining, exploration, development, or production of nickel (“Nickel Mining Companies”); (ii) investments in nickel that represent all or a significant portion of their assets, and/or (iii) supplying nickel. The fund is non-diversified.",[],[],86400.0,2.0,13.08,12.96,12.82,13.07,13.08,12.96,12.82,13.07,12.967362,59408.0,59408.0,132141.0,70540.0,70540.0,12.91,13.95,2.0,1.0,0.0311,53747464.0,11.55,21.855,23.19,7.25,14.4532,15.845745,0.0,0.0,13.16,USD,False,Natural Resources,-18.71419,1.25,Sprott,1679356800.0,Exchange Traded Fund,-0.100689605,ETF,NIKL,en-US,US,ETF,Nasdaq Real Time Price,True,HIGH,CLOSED,[],1784319005.0,1784318400.0,NGM,finmb_1802738135,America/New_York,EDT,-14400000.0,us_market,False,-0.6880746,12.99,True,1679491800000.0,0.38640025,12.99,0.05000019,-0.09000015,12.82 - 13.07,NasdaqGM,132141.0,1.4399996,0.12467529,11.55 - 21.855,-8.865,-0.405628,6.344664,3.11,-17.39974,-17.39974,53747464.0,1.0017457,Sprott Nickel Miners ETF,Sprott Nickel Miners ETF,-1.4632006,-0.10123713,-2.8557453,-0.18022159,0.75,15.0,0.0,False,,"The fund will, under normal circumstances, invest at least 80% of its total assets in securities of the index. The index is designed to track the performance of companies that derive at least 50% of their revenue and/or assets from (i) mining, exploration, development, or production of nickel (“Nickel Mining Companies”); (ii) investments in nickel that represent all or a significant portion of their assets, and/or (iii) supplying nickel. The fund is non-diversified.",Natural Resources,Sprott,Exchange Traded Fund,-0.0053,1.0053,0.0,0.0,0.0,0.0,0.0,0.0,0.96269995,0.0,0.0,0.0,0.0,0.0,0.0373,0.0,0.0,0.0,0.0075,0.0086928,0.48,0.441,1216.21,1216.21,48.0,0.75,76.1163207,"[{""Symbol"":""NIC.AX"",""Name"":""Nickel Industries Ltd Ordinary Shares"",""Holding Percent"":0.163265},{""Symbol"":""ANTM.JK"",""Name"":""ANTAM (Persero) Tbk PT"",""Holding Percent"":0.1314984},{""Symbol"":""MBMA.JK"",""Name"":""PT Merdeka Battery Materials Tbk"",""Holding Percent"":0.1114426},{""Symbol"":""IGO.AX"",""Name"":""IGO Ltd"",""Holding Percent"":0.095477305},{""Symbol"":""TLO.TO"",""Name"":""Talon Metals Corp"",""Holding Percent"":0.048165597},{""Symbol"":""NICU.TO"",""Name"":""Magna Mining Inc"",""Holding Percent"":0.0472034},{""Symbol"":""NCKL.JK"",""Name"":""PT Trimegah Bangun Persada Tbk"",""Holding Percent"":0.0467891},{""Symbol"":""INCO.JK"",""Name"":""PT Vale Indonesia Tbk"",""Holding Percent"":0.045373403},{""Symbol"":""SRL.AX"",""Name"":""Sunrise Energy Metals Ltd"",""Holding Percent"":0.037486702},{""Symbol"":""NIKL.XPHS"",""Name"":""Nickel Asia Corp"",""Holding Percent"":0.0344617}]","[{""Average"":""Price\/Earnings"",""NIKL"":0.0,""Category Average"":null},{""Average"":""Price\/Book"",""NIKL"":0.65072,""Category Average"":null},{""Average"":""Price\/Sales"",""NIKL"":0.60546,""Category Average"":null},{""Average"":""Price\/Cashflow"",""NIKL"":0.09212,""Category Average"":null},{""Average"":""Median Market Cap"",""NIKL"":null,""Category Average"":null},{""Average"":""3 Year Earnings Growth"",""NIKL"":null,""Category Average"":null}]",0.0,0.65072,,"[{""Average"":""Duration"",""NIKL"":null,""Category Average"":null},{""Average"":""Maturity"",""NIKL"":null,""Category Average"":null},{""Average"":""Credit Quality"",""NIKL"":null,""Category Average"":null}]",,,,,,,,,,2023-03-22,,,,,,,,,,,,,,,,,,,,
Materials,basic-materials,51,LENS,Sarmaya Thematic ETF,https://finance.yahoo.com/research-hub/screener/sec-ind_sec-top-etfs_basic-materials/,2026-07-18T07:04:17+00:00,en-US,US,ETF,ETF,Delayed Quote,False,LOW,1.59,14.482259,,,False,False,False,,15,0,America/New_York,EDT,,41.97868,-3.0389786,-0.07239338,41.58598,-2.6462784,,True,1738161000000,-14400000,49628196.0,-15.58422,-15.58422,Sarmaya Thematic ETF,14.5449,0.0,1784322300.0,1000.0,0.0,USD,2,38.77,9824,0.44794,CLOSED,38.7484,finmb_1916998289,Cboe US,7390,0.0,-11.900299,-0.06363391,0.41290644,38.9397,38.98,38.82 - 38.98,38.9397,0.0,0.191299,1784314543,1000.0,0.493696,0.79,38.82,27227,us_market,11.379702,27.56 - 50.84,[],BTS,50.84,27.56,1.59,,-0.23407355,Sarmaya Thematic ETF,38.798786,2.6772065,19.45,58.33,LENS,,,,,,,,,,,,Presbia,,,,"The fund is an actively managed exchange-traded fund (“ETF”) that will invest primarily in domestic and foreign equity securities of companies considered by Sarmaya Partners, LLC, the sub-adviser to the fund (the “Sub-Adviser”), to reflect an emerging or prevailing market theme. The Sub-Adviser defines “emerging or prevailing market theme” as market sectors, asset classes, or regions that are believed to be poised for future growth through the market cycle (i.e, the period of time between two major lows for a market. The fund is non-diversified.",[],[],86400.0,2.0,38.7484,38.77,38.82,38.98,38.7484,38.77,38.82,38.98,14.5449,27227.0,27227.0,9824.0,7390.0,7390.0,19.45,58.33,1000.0,1000.0,0.0159,49628196.0,27.56,50.84,50.84,23.928,41.97868,41.58598,0.0,0.0,38.7398,USD,False,Global Large-Stock Blend,0.44794,0.0,"Sarmaya Partners, LLC",1738022400.0,Exchange Traded Fund,,ETF,LENS,en-US,US,ETF,Delayed Quote,True,HIGH,CLOSED,[],1784322300.0,1784314543.0,BTS,finmb_1916998289,America/New_York,EDT,-14400000.0,us_market,False,0.493696,38.9397,True,1738161000000.0,0.0,38.9397,0.0,0.191299,38.82 - 38.98,Cboe US,9824.0,11.379702,0.41290644,27.56 - 50.84,-11.900299,-0.23407355,38.798786,1.59,-15.58422,-15.58422,49628196.0,2.6772065,Sarmaya Thematic ETF,Sarmaya Thematic ETF,-3.0389786,-0.07239338,-2.6462784,-0.06363391,0.79,15.0,0.0,False,,"The fund is an actively managed exchange-traded fund (“ETF”) that will invest primarily in domestic and foreign equity securities of companies considered by Sarmaya Partners, LLC, the sub-adviser to the fund (the “Sub-Adviser”), to reflect an emerging or prevailing market theme. The Sub-Adviser defines “emerging or prevailing market theme” as market sectors, asset classes, or regions that are believed to be poised for future growth through the market cycle (i.e, the period of time between two major lows for a market. The fund is non-diversified.",Global Large-Stock Blend,"Sarmaya Partners, LLC",Exchange Traded Fund,0.044299997,0.7648,0.0,0.0,0.0,0.1909,0.0,0.0,0.48650002,0.0,0.0,0.0,0.0,0.0,0.0255,0.488,0.0,0.0,0.007900001,0.0093474,0.52,0.4889,27105.61,27105.61,52.0,0.7900001,41.6720402,"[{""Symbol"":""GLDM"",""Name"":""SPDR\u00ae Gold MiniShares"",""Holding Percent"":0.0887014},{""Symbol"":""IAUM"",""Name"":""iShares\u00ae Gold Trust Micro"",""Holding Percent"":0.057009302},{""Symbol"":""XOM"",""Name"":""Exxon Mobil Corp"",""Holding Percent"":0.0441939},{""Symbol"":""CVX"",""Name"":""Chevron Corp"",""Holding Percent"":0.042645603},{""Symbol"":""SLV"",""Name"":""iShares Silver Trust"",""Holding Percent"":0.036704198},{""Symbol"":""K.TO"",""Name"":""Kinross Gold Corp"",""Holding Percent"":0.0344423},{""Symbol"":""FGXXX"",""Name"":""First American Government Obligs X"",""Holding Percent"":0.0331601},{""Symbol"":""AEM.TO"",""Name"":""Agnico Eagle Mines Ltd"",""Holding Percent"":0.0285108},{""Symbol"":""GFI"",""Name"":""Gold Fields Ltd ADR"",""Holding Percent"":0.0266835},{""Symbol"":""RRC"",""Name"":""Range Resources Corp"",""Holding Percent"":0.024669299}]","[{""Average"":""Price\/Earnings"",""LENS"":0.06905,""Category Average"":null},{""Average"":""Price\/Book"",""LENS"":0.43816,""Category Average"":null},{""Average"":""Price\/Sales"",""LENS"":0.5932,""Category Average"":null},{""Average"":""Price\/Cashflow"",""LENS"":0.1504,""Category Average"":null},{""Average"":""Median Market Cap"",""LENS"":null,""Category Average"":null},{""Average"":""3 Year Earnings Growth"",""LENS"":null,""Category Average"":null}]",0.06905,0.43816,,"[{""Average"":""Duration"",""LENS"":null,""Category Average"":null},{""Average"":""Maturity"",""LENS"":null,""Category Average"":null},{""Average"":""Credit Quality"",""LENS"":null,""Category Average"":null}]",,,,,,,,,,,,,,,,,Presbia,,,,,,,,,,,,,
Materials,basic-materials,52,LITP,Sprott Lithium Miners ETF,https://finance.yahoo.com/research-hub/screener/sec-ind_sec-top-etfs_basic-materials/,2026-07-18T07:04:17+00:00,en-US,US,ETF,ETF,Nasdaq Real Time Price,False,LOW,4.26,24.50379808870375,,,False,False,False,,15,0,America/New_York,EDT,,14.271,-3.7089996,-0.25989768,13.091695,-2.5296946,,True,1675348200000,-14400000,45531476.0,-5.24316,-5.24316,Sprott Lithium Miners ETF,31.294937,-0.26439923,1784319005.0,1.0,0.0,USD,2,10.44,74011,2.88779,CLOSED,10.679,finmb_1802725874,NasdaqGM,30610,0.0,-7.997999,-0.19322896,0.6249231,10.562,10.6,10.2998 - 10.6,10.562,-0.027999878,-0.116999626,1784318400,3.0,-1.0956047,0.65,10.2998,25532,us_market,4.0620003,6.5 - 18.56,[],NGM,18.56,6.5,7.16,,-0.43092668,Sprott Lithium Miners ETF,47.720276,0.3374987,10.36,10.92,LITP,,2023-02-02,,,,,,,,,,,,,203-656-2400,"The fund will, under normal circumstances, invest at least 80% of its total assets in securities of the index. The index is designed to track the performance of companies that derive at least 50% of their revenue and/or assets from mining, exploration, development, or production of lithium. The index generally consists of from 40 to 50 constituents. The fund is non-diversified.",[],[],86400.0,2.0,10.679,10.44,10.2998,10.6,10.679,10.44,10.2998,10.6,31.294937,25532.0,25532.0,74011.0,30610.0,30610.0,10.36,10.92,1.0,3.0,0.0716,45531476.0,6.5,18.56,20.54,4.63,14.271,13.091695,0.0,0.0,10.72,USD,False,Natural Resources,2.88779,1.53,Sprott,1675209600.0,Exchange Traded Fund,-0.1422647,ETF,LITP,en-US,US,ETF,Nasdaq Real Time Price,True,HIGH,CLOSED,[],1784319005.0,1784318400.0,NGM,finmb_1802725874,America/New_York,EDT,-14400000.0,us_market,False,-1.0956047,10.562,True,1675348200000.0,-0.26439923,10.562,-0.027999878,-0.116999626,10.2998 - 10.6,NasdaqGM,74011.0,4.0620003,0.6249231,6.5 - 18.56,-7.997999,-0.43092668,47.720276,7.16,-5.24316,-5.24316,45531476.0,0.3374987,Sprott Lithium Miners ETF,Sprott Lithium Miners ETF,-3.7089996,-0.25989768,-2.5296946,-0.19322896,0.65,15.0,0.0,False,,"The fund will, under normal circumstances, invest at least 80% of its total assets in securities of the index. The index is designed to track the performance of companies that derive at least 50% of their revenue and/or assets from mining, exploration, development, or production of lithium. The index generally consists of from 40 to 50 constituents. The fund is non-diversified.",Natural Resources,Sprott,Exchange Traded Fund,0.0,0.9999,0.0,0.0,0.0,0.0,0.0,0.0,1.0,0.0,0.0,0.0,0.0,0.0,0.0,0.0,0.0,0.0,0.0064999997,0.0086928,0.4,0.441,3341.6,3341.6,40.0,0.64999997,71.1737105,"[{""Symbol"":""SQM"",""Name"":""Sociedad Quimica Y Minera De Chile SA ADR"",""Holding Percent"":0.1089858},{""Symbol"":""01772"",""Name"":""Ganfeng Lithium Group Co Ltd"",""Holding Percent"":0.0987623},{""Symbol"":""ALB"",""Name"":""Albemarle Corp"",""Holding Percent"":0.0967029},{""Symbol"":""PLS.AX"",""Name"":""PLS Group Ltd"",""Holding Percent"":0.0943842},{""Symbol"":""LTR.AX"",""Name"":""Liontown Ltd"",""Holding Percent"":0.0846066},{""Symbol"":""LAR.TO"",""Name"":""Lithium Argentina AG"",""Holding Percent"":0.0489145},{""Symbol"":""IGO.AX"",""Name"":""IGO Ltd"",""Holding Percent"":0.0454801},{""Symbol"":""LAC.TO"",""Name"":""Lithium Americas Corp"",""Holding Percent"":0.045471102},{""Symbol"":""9696.HK"",""Name"":""Tianqi Lithium Corp Class H"",""Holding Percent"":0.044338103},{""Symbol"":""ELV.AX"",""Name"":""Elevra Lithium Ltd"",""Holding Percent"":0.0440915}]","[{""Average"":""Price\/Earnings"",""LITP"":0.0,""Category Average"":null},{""Average"":""Price\/Book"",""LITP"":0.47969,""Category Average"":null},{""Average"":""Price\/Sales"",""LITP"":0.19237,""Category Average"":null},{""Average"":""Price\/Cashflow"",""LITP"":0.04576,""Category Average"":null},{""Average"":""Median Market Cap"",""LITP"":null,""Category Average"":null},{""Average"":""3 Year Earnings Growth"",""LITP"":null,""Category Average"":null}]",0.0,0.47969,,"[{""Average"":""Duration"",""LITP"":null,""Category Average"":null},{""Average"":""Maturity"",""LITP"":null,""Category Average"":null},{""Average"":""Credit Quality"",""LITP"":null,""Category Average"":null}]",,,,,,,,,,2023-02-02,,,,,,,,,,,,,,,,,,,,
