sector,yahoo_sector_key,rank,ticker,etf_name,source_url,retrieved_at_utc,screen_language,screen_region,screen_quote_type,screen_type_disp,screen_quote_source_name,screen_triggerable,screen_custom_price_alert_confidence,screen_yield_ttm,screen_pe_ttm,screen_annual_return_nav_y3,screen_annual_return_nav_y5,screen_esg_populated,screen_tradeable,screen_crypto_tradeable,screen_price_to_book,screen_source_interval,screen_exchange_data_delayed_by,screen_exchange_timezone_name,screen_exchange_timezone_short_name,screen_book_value,screen_fifty_day_average,screen_fifty_day_average_change,screen_fifty_day_average_change_percent,screen_two_hundred_day_average,screen_two_hundred_day_average_change,screen_shares_outstanding,screen_has_pre_post_market_data,screen_first_trade_date_milliseconds,screen_gmt_off_set_milliseconds,screen_net_assets,screen_trailing_three_month_returns,screen_trailing_three_month_nav_returns,screen_short_name,screen_trailing_pe,screen_post_market_change_percent,screen_post_market_time,screen_bid_size,screen_trailing_annual_dividend_yield,screen_currency,screen_price_hint,screen_regular_market_open,screen_average_daily_volume3_month,screen_ytd_return,screen_market_state,screen_regular_market_previous_close,screen_message_board_id,screen_full_exchange_name,screen_average_daily_volume10_day,screen_trailing_annual_dividend_rate,screen_fifty_two_week_high_change,screen_two_hundred_day_average_change_percent,screen_fifty_two_week_low_change_percent,screen_regular_market_price,screen_regular_market_day_high,screen_regular_market_day_range,screen_post_market_price,screen_post_market_change,screen_regular_market_change,screen_regular_market_time,screen_ask_size,screen_regular_market_change_percent,screen_net_expense_ratio,screen_regular_market_day_low,screen_regular_market_volume,screen_market,screen_fifty_two_week_low_change,screen_fifty_two_week_range,screen_corporate_actions,screen_exchange,screen_fifty_two_week_high,screen_fifty_two_week_low,screen_dividend_yield,screen_financial_currency,screen_fifty_two_week_high_change_percent,screen_long_name,screen_fifty_two_week_change_percent,screen_eps_trailing_twelve_months,screen_bid,screen_ask,screen_symbol,screen_dividend_date,screen_ipo_expected_date,screen_earnings_call_timestamp_start,screen_earnings_call_timestamp_end,screen_is_earnings_date_estimate,screen_earnings_timestamp_start,screen_earnings_timestamp_end,screen_prev_name,screen_name_change_date,screen_eps_forward,screen_forward_pe,screen_display_name,screen_market_cap,screen_implied_shares_outstanding,info_phone,info_long_business_summary,info_company_officers,info_executive_team,info_max_age,info_price_hint,info_previous_close,info_open,info_day_low,info_day_high,info_regular_market_previous_close,info_regular_market_open,info_regular_market_day_low,info_regular_market_day_high,info_trailing_pe,info_volume,info_regular_market_volume,info_average_volume,info_average_volume10days,info_average_daily_volume10_day,info_bid,info_ask,info_bid_size,info_ask_size,info_yield,info_total_assets,info_fifty_two_week_low,info_fifty_two_week_high,info_all_time_high,info_all_time_low,info_fifty_day_average,info_two_hundred_day_average,info_trailing_annual_dividend_rate,info_trailing_annual_dividend_yield,info_nav_price,info_currency,info_tradeable,info_category,info_ytd_return,info_beta3_year,info_fund_family,info_fund_inception_date,info_legal_type,info_three_year_average_return,info_quote_type,info_symbol,info_language,info_region,info_type_disp,info_quote_source_name,info_triggerable,info_custom_price_alert_confidence,info_market_state,info_corporate_actions,info_post_market_time,info_regular_market_time,info_exchange,info_message_board_id,info_exchange_timezone_name,info_exchange_timezone_short_name,info_gmt_off_set_milliseconds,info_market,info_esg_populated,info_regular_market_change_percent,info_regular_market_price,info_has_pre_post_market_data,info_first_trade_date_milliseconds,info_post_market_change_percent,info_post_market_price,info_post_market_change,info_regular_market_change,info_regular_market_day_range,info_full_exchange_name,info_average_daily_volume3_month,info_fifty_two_week_low_change,info_fifty_two_week_low_change_percent,info_fifty_two_week_range,info_fifty_two_week_high_change,info_fifty_two_week_high_change_percent,info_fifty_two_week_change_percent,info_dividend_yield,info_trailing_three_month_returns,info_trailing_three_month_nav_returns,info_net_assets,info_eps_trailing_twelve_months,info_short_name,info_long_name,info_fifty_day_average_change,info_fifty_day_average_change_percent,info_two_hundred_day_average_change,info_two_hundred_day_average_change_percent,info_net_expense_ratio,info_source_interval,info_exchange_data_delayed_by,info_crypto_tradeable,info_trailing_peg_ratio,fund_description,fund_overview_category_name,fund_overview_family,fund_overview_legal_type,fund_asset_class_cash_position,fund_asset_class_stock_position,fund_asset_class_bond_position,fund_asset_class_preferred_position,fund_asset_class_convertible_position,fund_asset_class_other_position,fund_sector_weight_realestate,fund_sector_weight_consumer_cyclical,fund_sector_weight_basic_materials,fund_sector_weight_consumer_defensive,fund_sector_weight_technology,fund_sector_weight_communication_services,fund_sector_weight_financial_services,fund_sector_weight_utilities,fund_sector_weight_industrials,fund_sector_weight_energy,fund_sector_weight_healthcare,fund_bond_rating_us_government,fund_annual_report_expense_ratio,fund_annual_report_expense_ratio_category_average,fund_annual_holdings_turnover,fund_annual_holdings_turnover_category_average,fund_total_net_assets,fund_total_net_assets_category_average,compact_annual_holdings_turnover_pct,compact_expense_ratio_pct,compact_top_10_holdings_weight_pct,fund_top_holdings_json,fund_equity_holdings_json,compact_price_to_earnings,compact_price_to_book,compact_weighted_average_market_cap,fund_bond_holdings_json,info_five_year_average_return,fund_bond_rating_bb,fund_bond_rating_aa,fund_bond_rating_aaa,fund_bond_rating_a,fund_bond_rating_other,fund_bond_rating_b,fund_bond_rating_bbb,fund_bond_rating_below_b,info_ipo_expected_date,info_dividend_date,info_earnings_timestamp_start,info_earnings_timestamp_end,info_current_price,info_recommendation_key,retrieval_errors,info_display_name,info_financial_currency,info_earnings_call_timestamp_start,info_earnings_call_timestamp_end,info_is_earnings_date_estimate,info_book_value,info_price_to_book,info_forward_pe,info_eps_forward,info_shares_outstanding,info_prev_name,info_name_change_date,info_market_cap,info_implied_shares_outstanding
Utilities,utilities,1,XLU,State Street Utilities Select Sector SPDR ETF,https://finance.yahoo.com/research-hub/screener/sec-ind_sec-top-etfs_utilities/,2026-07-18T07:04:17+00:00,en-US,US,ETF,ETF,Delayed Quote,False,LOW,2.64,20.93364,-7.14123,17.58388,False,False,False,0.7058915,15,0,America/New_York,EDT,63.99,44.8704,0.2995987,0.0066769784,44.836224,0.33377457,163274000.0,True,914337000000,-14400000,23111417900.0,-0.5478,-0.5478,State Street Utilities Select S,20.853619,0.287804,1784332550.0,32100.0,0.04288542,USD,2,45.9,20276435,7.64233,CLOSED,45.47,finmb_8795452,NYSEArca,17228860,1.95,-2.630001,0.007444306,0.09769129,45.17,46.14,45.055 - 46.14,45.3,0.13000107,-0.300003,1784318400,28300.0,-0.659782,0.08,45.055,20919897,us_market,4.0199966,41.15 - 47.8,[],PCX,47.8,41.15,2.64,USD,-0.055020943,State Street Utilities Select Sector SPDR ETF,7.8686595,2.166051,45.15,45.16,XLU,,,,,,,,,,,,,,,,"In seeking to track the performance of the index, the fund employs a replication strategy. It generally invests substantially all, but at least 95%, of its total assets in the securities comprising the index. The index includes securities of companies from the following industries: electric utilities; water utilities; multi-utilities; independent power and renewable electricity producers; and gas utilities. The fund is non-diversified.",[],[],86400.0,2.0,45.47,45.9,45.055,46.14,45.47,45.9,45.055,46.14,20.853619,20919897.0,20919897.0,20276435.0,17228860.0,17228860.0,45.15,45.16,32100.0,28300.0,0.026400002,23111417856.0,41.15,47.8,75.72,7.45,44.8704,44.836224,1.95,0.04288542,45.4865,USD,False,Utilities,7.64233,0.49,State Street Investment Management,913766400.0,Exchange Traded Fund,0.1416715,ETF,XLU,en-US,US,ETF,Delayed Quote,True,HIGH,CLOSED,[],1784332550.0,1784318400.0,PCX,finmb_8795452,America/New_York,EDT,-14400000.0,us_market,False,-0.659782,45.17,True,914337000000.0,0.287804,45.3,0.13000107,-0.300003,45.055 - 46.14,NYSEArca,20276435.0,4.0199966,0.09769129,41.15 - 47.8,-2.630001,-0.055020943,7.8686595,2.64,-0.5478,-0.5478,23111417900.0,2.166051,State Street Utilities Select S,State Street Utilities Select Sector SPDR ETF,0.2995987,0.0066769784,0.33377457,0.007444306,0.08,15.0,0.0,False,,"In seeking to track the performance of the index, the fund employs a replication strategy. It generally invests substantially all, but at least 95%, of its total assets in the securities comprising the index. The index includes securities of companies from the following industries: electric utilities; water utilities; multi-utilities; independent power and renewable electricity producers; and gas utilities. The fund is non-diversified.",Utilities,State Street Investment Management,Exchange Traded Fund,0.0025,0.9975,0.0,0.0,0.0,0.0,0.0,0.0,0.0,0.0,0.0,0.0,0.0,1.0,0.0,0.0,0.0,0.0,0.0008,0.009681,0.02,0.47,57142.09,57142.09,2.0,0.08,57.4217996,"[{""Symbol"":""NEE"",""Name"":""NextEra Energy Inc"",""Holding Percent"":0.12862429},{""Symbol"":""SO"",""Name"":""Southern Co"",""Holding Percent"":0.075822204},{""Symbol"":""DUK"",""Name"":""Duke Energy Corp"",""Holding Percent"":0.0693479},{""Symbol"":""CEG"",""Name"":""Constellation Energy Corp"",""Holding Percent"":0.0557973},{""Symbol"":""AEP"",""Name"":""American Electric Power Co Inc"",""Holding Percent"":0.052311704},{""Symbol"":""SRE"",""Name"":""Sempra"",""Holding Percent"":0.0425889},{""Symbol"":""D"",""Name"":""Dominion Energy Inc"",""Holding Percent"":0.0422058},{""Symbol"":""ETR"",""Name"":""Entergy Corp"",""Holding Percent"":0.0369595},{""Symbol"":""VST"",""Name"":""Vistra Corp"",""Holding Percent"":0.0353326},{""Symbol"":""XEL"",""Name"":""Xcel Energy Inc"",""Holding Percent"":0.035227798}]","[{""Average"":""Price\/Earnings"",""XLU"":0.04777,""Category Average"":null},{""Average"":""Price\/Book"",""XLU"":0.4277,""Category Average"":null},{""Average"":""Price\/Sales"",""XLU"":0.34802,""Category Average"":null},{""Average"":""Price\/Cashflow"",""XLU"":0.09904,""Category Average"":null},{""Average"":""Median Market Cap"",""XLU"":null,""Category Average"":null},{""Average"":""3 Year Earnings Growth"",""XLU"":null,""Category Average"":null}]",0.04777,0.4277,,"[{""Average"":""Duration"",""XLU"":null,""Category Average"":null},{""Average"":""Maturity"",""XLU"":null,""Category Average"":null},{""Average"":""Credit Quality"",""XLU"":null,""Category Average"":null}]",0.0977343,,,,,,,,,,,,,,,,,USD,,,,63.99,0.7058915,,,163274000.0,,,,
Utilities,utilities,2,HYG,iShares iBoxx $ High Yield Corporate Bond ETF,https://finance.yahoo.com/research-hub/screener/sec-ind_sec-top-etfs_utilities/,2026-07-18T07:04:17+00:00,en-US,US,ETF,ETF,Delayed Quote,False,LOW,5.88,10.989010989010989,12.41463,4.12229,False,False,False,0.90546346,15,0,America/New_York,EDT,87.966,79.83,-0.1800003,-0.0022547953,80.3111,-0.66109467,195600000.0,True,1176298200000,-14400000,17626118100.0,2.22732,2.22732,iShares iBoxx $ High Yield Corp,10.951965,0.04142766,1784331391.0,29000.0,0.04765664,USD,2,79.75,34510835,1.70104,CLOSED,79.8,finmb_33837611,NYSEArca,28305190,3.803,-1.7099991,-0.008231672,0.013745728,79.65,79.835,79.63 - 79.835,79.683,0.03299713,-0.150002,1784318400,30200.0,-0.187972,0.49,79.63,35716275,us_market,1.0800018,78.57 - 81.36,[],PCX,81.36,78.57,5.9,USD,-0.021017687,iShares iBoxx $ High Yield Corporate Bond ETF,-0.7476628,7.2726674,79.68,79.68,HYG,,,,,,,,,,0.06,1327.5,,,,415-670-2000,"The underlying index is a rules-based index consisting of U.S. dollar-denominated, high yield corporate bonds for sale in the U.S. The fund will invest at least 80% of its assets in the component securities of the underlying index, and the fund will invest at least 90% of its assets in fixed income securities of the types included in the underlying index that the advisor believes will help the fund track the underlying index.",[],[],86400.0,2.0,79.8,79.75,79.63,79.835,79.8,79.75,79.63,79.835,10.951965,35716275.0,35716275.0,34510835.0,28305190.0,28305190.0,79.68,79.68,29000.0,30200.0,0.059,17626118144.0,78.57,81.36,106.47,61.5,79.83,80.3111,3.803,0.04765664,79.68794,USD,False,High Yield Bond,1.70104,0.66,iShares,1175644800.0,Exchange Traded Fund,0.082506396,ETF,HYG,en-US,US,ETF,Delayed Quote,True,HIGH,CLOSED,[],1784331391.0,1784318400.0,PCX,finmb_33837611,America/New_York,EDT,-14400000.0,us_market,False,-0.187972,79.65,True,1176298200000.0,0.04142766,79.683,0.03299713,-0.150002,79.63 - 79.835,NYSEArca,34510835.0,1.0800018,0.013745728,78.57 - 81.36,-1.7099991,-0.021017687,-0.7476628,5.9,2.22732,2.22732,17626118100.0,,,,-0.1800003,-0.0022547953,-0.66109467,-0.008231672,0.49,15.0,0.0,False,,"The underlying index is a rules-based index consisting of U.S. dollar-denominated, high yield corporate bonds for sale in the U.S. The fund will invest at least 80% of its assets in the component securities of the underlying index, and the fund will invest at least 90% of its assets in fixed income securities of the types included in the underlying index that the advisor believes will help the fund track the underlying index.",High Yield Bond,iShares,Exchange Traded Fund,0.0057,0.0,0.9944,0.0,0.0,0.0,0.0041,0.0,0.0,0.0,0.0,0.0,0.0,0.9959,0.0,0.0,0.0,0.0,0.0049,0.008518,0.22,0.7432,0.0,0.0,22.0,0.49,0.84323,"[{""Symbol"":""XTSLA"",""Name"":""BlackRock Cash Funds Treasury SL Agency"",""Holding Percent"":0.0084323}]","[{""Average"":""Price\/Earnings"",""HYG"":0.0,""Category Average"":null},{""Average"":""Price\/Book"",""HYG"":0.0,""Category Average"":null},{""Average"":""Price\/Sales"",""HYG"":0.0,""Category Average"":null},{""Average"":""Price\/Cashflow"",""HYG"":0.0,""Category Average"":null},{""Average"":""Median Market Cap"",""HYG"":null,""Category Average"":null},{""Average"":""3 Year Earnings Growth"",""HYG"":null,""Category Average"":null}]",0.0,0.0,,"[{""Average"":""Duration"",""HYG"":6.66,""Category Average"":null},{""Average"":""Maturity"",""HYG"":9.883,""Category Average"":null},{""Average"":""Credit Quality"",""HYG"":null,""Category Average"":null}]",0.037288,0.5712,0.0,0.0,0.0,0.0025,0.3291,0.0095999995,0.0876,,,,,,,,,,,,,,,1327.5,,,,,,
Utilities,utilities,3,PFF,iShares Preferred and Income Securities ETF,https://finance.yahoo.com/research-hub/screener/sec-ind_sec-top-etfs_utilities/,2026-07-18T07:04:17+00:00,en-US,US,ETF,ETF,Nasdaq Real Time Price,False,LOW,,,9.32043,7.08736,False,False,False,0.79294574,15,0,America/New_York,EDT,38.275,30.9964,-0.64640045,-0.020854048,31.1595,-0.80949974,418449984.0,True,1175261400000,-14400000,13096669200.0,2.22101,2.22101,iShares Preferred and Income Se,3.7627077,0.16474213,1784324075.0,1.0,0.059993412,USD,2,30.259,2913545,0.42885,CLOSED,30.37,finmb_33508791,NasdaqGM,2503600,1.822,-1.9099979,-0.025979228,0.008305647,30.35,30.42,30.21 - 30.42,30.4,0.049999237,-0.0200005,1784318400,1.0,-0.065856,0.45,30.21,2175930,us_market,0.25,30.1 - 32.26,[],NGM,32.26,30.1,5.6,USD,-0.059206385,iShares Preferred and Income Securities ETF,-2.6307344,8.066,29.34,31.23,PFF,1522972800.0,,,,,,,,,,,,,,415-670-2000,"The fund may invest at least 80% of its assets in the component securities of its underlying index and and may invest up to 20% of its assets in certain futures, options and swap contracts, cash and cash equivalents.",[],[],86400.0,2.0,30.37,30.259,30.21,30.42,30.37,30.259,30.21,30.42,3.7627077,2175930.0,2175930.0,2913545.0,2503600.0,2503600.0,29.34,31.23,1.0,1.0,0.055999998,13096669184.0,30.1,32.26,50.57,14.1,30.9964,31.1595,1.822,0.059993412,30.39925,USD,False,Preferred Stock,0.42885,0.97,iShares,1174867200.0,Exchange Traded Fund,0.0574368,ETF,PFF,en-US,US,ETF,Nasdaq Real Time Price,True,HIGH,CLOSED,[],1784324075.0,1784318400.0,NGM,finmb_33508791,America/New_York,EDT,-14400000.0,us_market,False,-0.065856,30.35,True,1175261400000.0,0.16474213,30.4,0.049999237,-0.0200005,30.21 - 30.42,NasdaqGM,2913545.0,0.25,0.008305647,30.1 - 32.26,-1.9099979,-0.059206385,-2.6307344,5.6,2.22101,2.22101,13096669200.0,8.066,iShares Preferred and Income Se,iShares Preferred and Income Securities ETF,-0.64640045,-0.020854048,-0.80949974,-0.025979228,0.45,15.0,0.0,False,,"The fund may invest at least 80% of its assets in the component securities of its underlying index and and may invest up to 20% of its assets in certain futures, options and swap contracts, cash and cash equivalents.",Preferred Stock,iShares,Exchange Traded Fund,0.0148,0.0544,0.0001,0.92480004,0.0025,0.0034,0.0,0.0,0.0,0.0,0.0733,0.0,0.0,0.7691,0.0,0.0,0.1576,0.0004,0.0045,0.0092324,0.2,0.3987,0.0,0.0,20.0,0.44999999999999996,13.644040050000001,"[{""Symbol"":""STRC"",""Name"":""Strategy Inc VR PRF PERPETUAL USD 100 - Ser A"",""Holding Percent"":0.036384203},{""Symbol"":""BAPA"",""Name"":""Boeing Co 6% PRF CONVERT 15\/10\/2027 USD 50 - Dep Rep 1\/20th Sr A"",""Holding Percent"":0.036208898},{""Symbol"":""WFCPL"",""Name"":""Wells Fargo & Co 7 1\/2 % Non Cum Perp Conv Pfd Shs -A- Series -L-"",""Holding Percent"":0.0214858},{""Symbol"":""HPEPC"",""Name"":""Hewlett Packard Enterprise Co 7.625% PRF CONVERT 01\/09\/2027 USD 50 - Ser C"",""Holding Percent"":0.0162477},{""Symbol"":""BACPL"",""Name"":""Bank of America Corp 7 1\/4 % Non-Cum Perp Conv Pfd Shs Series -L-"",""Holding Percent"":0.014019299},{""Symbol"":""CPN"",""Name"":""Citigroup Capital XIII Floating Rate Trust Pfd Secs Registered 2010-30.10.4"",""Holding Percent"":0.0120945005}]","[{""Average"":""Price\/Earnings"",""PFF"":0.0,""Category Average"":null},{""Average"":""Price\/Book"",""PFF"":0.0,""Category Average"":null},{""Average"":""Price\/Sales"",""PFF"":0.0,""Category Average"":null},{""Average"":""Price\/Cashflow"",""PFF"":0.0,""Category Average"":null},{""Average"":""Median Market Cap"",""PFF"":null,""Category Average"":null},{""Average"":""3 Year Earnings Growth"",""PFF"":null,""Category Average"":null}]",0.0,0.0,,"[{""Average"":""Duration"",""PFF"":5.8,""Category Average"":null},{""Average"":""Maturity"",""PFF"":null,""Category Average"":null},{""Average"":""Credit Quality"",""PFF"":null,""Category Average"":null}]",0.0082548,0.0,0.0,0.0,0.0,0.0,0.0,0.0,0.0,,1522972800.0,,,,,,,USD,,,,38.275,0.79294574,,,418449984.0,,,,
Utilities,utilities,4,VPU,Vanguard Utilities Index Fund ETF Shares,https://finance.yahoo.com/research-hub/screener/sec-ind_sec-top-etfs_utilities/,2026-07-18T07:04:17+00:00,en-US,US,ETF,ETF,Delayed Quote,False,LOW,2.64,20.820321,-7.4652,17.33085,False,False,False,1.8826003,15,0,America/New_York,EDT,103.697,194.3136,0.9064026,0.004664638,194.20676,1.0132446,26720900.0,True,1075473000000,-14400000,10763640800.0,-0.45253,-0.45253,Vanguard Utilities ETF,20.76607,0.78373057,1784332586.0,500.0,0.022133442,USD,2,197.73,218714,7.28538,CLOSED,196.49,finmb_22939110,NYSEArca,196130,4.349,-10.880005,0.00521735,0.093608245,195.22,199.225,194.81 - 199.225,196.75,1.5299988,-1.27,1784318400,400.0,-0.646345,0.09,194.81,183282,us_market,16.710007,178.51 - 206.1,[],PCX,206.1,178.51,2.64,USD,-0.05278993,Vanguard Utilities Index Fund ETF Shares,7.7968,9.400912,194.25,199.99,VPU,,,,,,,,,,,,,,,,"The fund employs an indexing investment approach designed to track the performance of the index, an index made up of stocks of large, mid-size, and small U.S. companies within the utilities sector, as classified under the GICS. The Advisor attempts to replicate the target index by seeking to invest all, or substantially all, of its assets in the stocks that make up the index, in order to hold each stock in approximately the same proportion as its weighting in the index. The fund is non-diversified.",[],[],86400.0,2.0,196.49,197.73,194.81,199.225,196.49,197.73,194.81,199.225,20.76607,183282.0,183282.0,218714.0,196130.0,196130.0,194.25,199.99,500.0,400.0,0.026400002,10763640832.0,178.51,206.1,206.1,46.64,194.3136,194.20676,4.349,0.022133442,196.55,USD,False,Utilities,7.28538,0.5,Vanguard,1075075200.0,Exchange Traded Fund,0.1408032,ETF,VPU,en-US,US,ETF,Delayed Quote,True,HIGH,CLOSED,[],1784332586.0,1784318400.0,PCX,finmb_22939110,America/New_York,EDT,-14400000.0,us_market,False,-0.646345,195.22,True,1075473000000.0,0.78373057,196.75,1.5299988,-1.27,194.81 - 199.225,NYSEArca,218714.0,16.710007,0.093608245,178.51 - 206.1,-10.880005,-0.05278993,7.7968,2.64,-0.45253,-0.45253,10763640800.0,,,,0.9064026,0.004664638,1.0132446,0.00521735,0.09,15.0,0.0,False,,"The fund employs an indexing investment approach designed to track the performance of the index, an index made up of stocks of large, mid-size, and small U.S. companies within the utilities sector, as classified under the GICS. The Advisor attempts to replicate the target index by seeking to invest all, or substantially all, of its assets in the stocks that make up the index, in order to hold each stock in approximately the same proportion as its weighting in the index. The fund is non-diversified.",Utilities,Vanguard,Exchange Traded Fund,0.0037,0.9927,0.0,0.0,0.0,0.0034999999,0.0,0.0,0.0,0.0,0.0,0.0,0.0,0.9934,0.0022,0.0045,0.0,0.0,0.00090000004,0.009681,0.06,0.47,45977.77,45977.77,6.0,0.09000000400000001,51.8093294,"[{""Symbol"":""NEE"",""Name"":""NextEra Energy Inc"",""Holding Percent"":0.116025105},{""Symbol"":""SO"",""Name"":""Southern Co"",""Holding Percent"":0.0683966},{""Symbol"":""DUK"",""Name"":""Duke Energy Corp"",""Holding Percent"":0.062445696},{""Symbol"":""CEG"",""Name"":""Constellation Energy Corp"",""Holding Percent"":0.048485998},{""Symbol"":""AEP"",""Name"":""American Electric Power Co Inc"",""Holding Percent"":0.0471416},{""Symbol"":""SRE"",""Name"":""Sempra"",""Holding Percent"":0.0383971},{""Symbol"":""D"",""Name"":""Dominion Energy Inc"",""Holding Percent"":0.038050998},{""Symbol"":""VST"",""Name"":""Vistra Corp"",""Holding Percent"":0.0340444},{""Symbol"":""ETR"",""Name"":""Entergy Corp"",""Holding Percent"":0.0333334},{""Symbol"":""XEL"",""Name"":""Xcel Energy Inc"",""Holding Percent"":0.031772397}]","[{""Average"":""Price\/Earnings"",""VPU"":0.04803,""Category Average"":null},{""Average"":""Price\/Book"",""VPU"":0.437,""Category Average"":null},{""Average"":""Price\/Sales"",""VPU"":0.35207,""Category Average"":null},{""Average"":""Price\/Cashflow"",""VPU"":0.10045,""Category Average"":null},{""Average"":""Median Market Cap"",""VPU"":null,""Category Average"":null},{""Average"":""3 Year Earnings Growth"",""VPU"":null,""Category Average"":null}]",0.04803,0.437,,"[{""Average"":""Duration"",""VPU"":null,""Category Average"":null},{""Average"":""Maturity"",""VPU"":null,""Category Average"":null},{""Average"":""Credit Quality"",""VPU"":null,""Category Average"":null}]",0.095874205,,,,,,,,,,,,,,,,,,,,,,,,,,,,,
