Utilities,utilities,42,WTBN,Wisdomtree Bianco Fixed Income Total Return Fund,https://finance.yahoo.com/research-hub/screener/sec-ind_sec-top-etfs_utilities/,2026-07-18T07:04:17+00:00,en-US,US,ETF,ETF,Nasdaq Real Time Price,False,LOW,,,,,False,False,False,,15,0,America/New_York,EDT,,25.12274,-0.19774055,-0.007870979,25.45819,-0.5331917,,True,1703082600000,-14400000,107324560.0,0.68672,0.68672,WisdomTree Bianco Total Return ,,0.020060837,1784319005.0,2.0,0.0,USD,2,24.952,23250,0.29609,CLOSED,24.925,finmb_1861385923,NasdaqGM,34050,0.0,-1.0750008,-0.020943817,0.0030180626,24.925,24.965,24.87 - 24.965,24.925,0.0049991608,0.0,1784318400,2.0,0.0,0.6,24.87,14054,us_market,0.074998856,24.85 - 26.0,[],NGM,26.0,24.85,4.05,,-0.041346185,Wisdomtree Bianco Fixed Income Total Return Fund,-1.4042735,,17.97,31.97,WTBN,,2023-12-20,,,,,,,,,,,,,866-909-9473,"Under normal circumstances, the fund primarily invests in the constituent exchange-traded funds (“ETF”) of the index. The index, created by Bianco Research Advisors LLC, is composed of approximately 5 to 20 fixed income ETFs that are specifically selected and weighted using a modified market-capitalization weighting scheme to achieve specified factor exposures. It is non-diversified.",[],[],86400.0,2.0,24.925,24.952,24.87,24.965,24.925,24.952,24.89,24.965,,14054.0,14054.0,23250.0,34050.0,34050.0,17.97,31.97,2.0,2.0,0.0405,107324560.0,24.85,26.0,26.0,24.183,25.12274,25.45819,0.0,0.0,24.921,USD,False,Intermediate Core Bond,0.29609,0.0,WisdomTree,1702857600.0,Exchange Traded Fund,,ETF,WTBN,en-US,US,ETF,Nasdaq Real Time Price,True,HIGH,CLOSED,[],1784319005.0,1784318400.0,NGM,finmb_1861385923,America/New_York,EDT,-14400000.0,us_market,False,0.0,24.925,True,1703082600000.0,0.020060837,24.925,0.0049991608,0.0,24.89 - 24.965,NasdaqGM,23250.0,0.074998856,0.0030180626,24.85 - 26.0,-1.0750008,-0.041346185,-1.4042735,4.05,0.68672,0.68672,107324560.0,,WisdomTree Bianco Total Return ,Wisdomtree Bianco Fixed Income Total Return Fund,-0.19774055,-0.007870979,-0.5331917,-0.020943817,0.6,15.0,0.0,False,,"Under normal circumstances, the fund primarily invests in the constituent exchange-traded funds (“ETF”) of the index. The index, created by Bianco Research Advisors LLC, is composed of approximately 5 to 20 fixed income ETFs that are specifically selected and weighted using a modified market-capitalization weighting scheme to achieve specified factor exposures. It is non-diversified.",Intermediate Core Bond,WisdomTree,Exchange Traded Fund,0.010299999,0.0014,0.9395,0.0052,0.0436,0.0,0.0,0.0,0.0,0.0,0.1378,0.0008,0.0,0.8149,0.0466,0.0,0.0,0.5044,0.006,0.005351,1.54,1.2448,0.0,0.0,154.0,0.6,95.2470111,"[{""Symbol"":""MBB"",""Name"":""iShares MBS ETF"",""Holding Percent"":0.2598114},{""Symbol"":""IEI"",""Name"":""iShares 3-7 Year Treasury Bond ETF"",""Holding Percent"":0.1680894},{""Symbol"":""SCHQ"",""Name"":""Schwab Long-Term US Treasury ETF"",""Holding Percent"":0.09912521},{""Symbol"":""SCHO"",""Name"":""Schwab Short-Term US Treasury ETF\u2122"",""Holding Percent"":0.0908962},{""Symbol"":""IEF"",""Name"":""iShares 7-10 Year Treasury Bond ETF"",""Holding Percent"":0.072411},{""Symbol"":""VCLT"",""Name"":""Vanguard Long-Term Corporate Bd ETF"",""Holding Percent"":0.0612402},{""Symbol"":""VCSH"",""Name"":""Vanguard Short-Term Corporate Bond ETF"",""Holding Percent"":0.059841298},{""Symbol"":""CWB"",""Name"":""State Street\u00ae SPDR\u00ae Blmbg Cnvrt Secs ETF"",""Holding Percent"":0.050258003},{""Symbol"":""STIP"",""Name"":""iShares 0-5 Year TIPS Bond ETF"",""Holding Percent"":0.0496311},{""Symbol"":""VCIT"",""Name"":""Vanguard Interm-Term Corp Bd ETF"",""Holding Percent"":0.0411663}]","[{""Average"":""Price\/Earnings"",""WTBN"":0.0,""Category Average"":null},{""Average"":""Price\/Book"",""WTBN"":0.0,""Category Average"":null},{""Average"":""Price\/Sales"",""WTBN"":0.0,""Category Average"":null},{""Average"":""Price\/Cashflow"",""WTBN"":0.0,""Category Average"":null},{""Average"":""Median Market Cap"",""WTBN"":null,""Category Average"":null},{""Average"":""3 Year Earnings Growth"",""WTBN"":null,""Category Average"":null}]",0.0,0.0,,"[{""Average"":""Duration"",""WTBN"":3.63,""Category Average"":null},{""Average"":""Maturity"",""WTBN"":9.458,""Category Average"":null},{""Average"":""Credit Quality"",""WTBN"":null,""Category Average"":null}]",,0.0,0.8248,0.0021,0.0774,0.0,0.0,0.095699996,0.0,2023-12-20,,,,,,,,,,,,,,,,,,,,
Utilities,utilities,43,HISF,First Trust High Income Strategic Focus ETF,https://finance.yahoo.com/research-hub/screener/sec-ind_sec-top-etfs_utilities/,2026-07-18T07:04:17+00:00,en-US,US,ETF,ETF,Nasdaq Real Time Price,False,LOW,4.6,22.321428571428573,6.4996,9.53016,False,False,False,,15,0,America/New_York,EDT,,44.32614,-0.096141815,-0.0021689641,44.885845,-0.65584564,,True,1408023000000,-14400000,97459280.0,1.16741,1.16741,First Trust High Income Strateg,,0.04523967,1784319004.0,2.0,0.0,USD,2,44.255,7633,0.51855,CLOSED,44.2299,finmb_264493463,NasdaqGM,8420,0.0,-1.3850021,-0.014611414,0.007746643,44.23,44.255,44.21 - 44.255,44.23,0.020000458,9.918213e-05,1784318400,2.0,0.00022424226,0.83,44.21,3722,us_market,0.34000015,43.89 - 45.615,[],NGM,45.615,43.89,5.03,,-0.030362865,First Trust High Income Strategic Focus ETF,-0.51732063,,31.85,56.67,HISF,,,,,,,,,,,,,,,,"Under normal market conditions, the fund seeks to achieve its investment objectives by investing in a portfolio of U.S.-listed ETFs that is designed to follow the High Income Model developed by the advisor. The fund, through its investments in the underlying ETFs comprising the High Income Model, seeks to provide investors with a diversified income stream by holding a blend of fixed income assets that are actively managed to seek levels of high income and total return.",[],[],86400.0,2.0,44.2299,44.255,44.21,44.255,44.2299,44.255,44.21,44.255,,3722.0,3722.0,7633.0,8420.0,8420.0,31.85,56.67,2.0,2.0,0.050300002,97459280.0,43.89,45.615,53.067,37.26,44.32614,44.885845,0.0,0.0,44.22,USD,False,Multisector Bond,0.51855,0.88,First Trust,1407888000.0,Exchange Traded Fund,0.048930302,ETF,HISF,en-US,US,ETF,Nasdaq Real Time Price,True,HIGH,CLOSED,[],1784319004.0,1784318400.0,NGM,finmb_264493463,America/New_York,EDT,-14400000.0,us_market,False,0.00022424226,44.23,True,1408023000000.0,0.04523967,44.23,0.020000458,9.918213e-05,44.21 - 44.255,NasdaqGM,7633.0,0.34000015,0.007746643,43.89 - 45.615,-1.3850021,-0.030362865,-0.51732063,5.03,1.16741,1.16741,97459280.0,,First Trust High Income Strateg,First Trust High Income Strategic Focus ETF,-0.096141815,-0.0021689641,-0.65584564,-0.014611414,0.83,15.0,0.0,False,,"Under normal market conditions, the fund seeks to achieve its investment objectives by investing in a portfolio of U.S.-listed ETFs that is designed to follow the High Income Model developed by the advisor. The fund, through its investments in the underlying ETFs comprising the High Income Model, seeks to provide investors with a diversified income stream by holding a blend of fixed income assets that are actively managed to seek levels of high income and total return.",Multisector Bond,First Trust,Exchange Traded Fund,0.0339,0.0,0.9383,0.0272,0.0005,0.0001,0.0,0.0,0.0,0.0,0.0,0.0,0.0,1.0,0.0,0.0,0.0,0.184,0.0083,0.0092469,0.32,1.4834,0.0,0.0,32.0,0.83,94.96932989999999,"[{""Symbol"":""FTCB"",""Name"":""First Trust Core Investment Grade ETF"",""Holding Percent"":0.2797205},{""Symbol"":""LMBS"",""Name"":""First Trust Low Duration Oppos ETF"",""Holding Percent"":0.100089595},{""Symbol"":""HYLS"",""Name"":""First Trust Tactical High Yield ETF"",""Holding Percent"":0.100004904},{""Symbol"":""FIXD"",""Name"":""First Trust Smith Opportnstc Fxd Inc ETF"",""Holding Percent"":0.099853694},{""Symbol"":""FIIG"",""Name"":""First Trust Intermediate DurInvGrdCrpETF"",""Holding Percent"":0.0998264},{""Symbol"":""LGOV"",""Name"":""First Trust Long Duration Opp ETF"",""Holding Percent"":0.069709904},{""Symbol"":""FEMB"",""Name"":""First Trust Emerging Mkts Lcl Ccy Bd ETF"",""Holding Percent"":0.050293397},{""Symbol"":""FTSL"",""Name"":""First Trust Senior Loan ETF"",""Holding Percent"":0.050092403},{""Symbol"":""FSIG"",""Name"":""First Trust Ltd Drtn Inv Grd Corp ETF"",""Holding Percent"":0.050056502},{""Symbol"":""SCIO"",""Name"":""First Trust Structured Crd Inc Opp ETF"",""Holding Percent"":0.050046}]","[{""Average"":""Price\/Earnings"",""HISF"":0.0,""Category Average"":null},{""Average"":""Price\/Book"",""HISF"":0.0,""Category Average"":null},{""Average"":""Price\/Sales"",""HISF"":0.0,""Category Average"":null},{""Average"":""Price\/Cashflow"",""HISF"":0.0,""Category Average"":null},{""Average"":""Median Market Cap"",""HISF"":null,""Category Average"":null},{""Average"":""3 Year Earnings Growth"",""HISF"":null,""Category Average"":null}]",0.0,0.0,,"[{""Average"":""Duration"",""HISF"":5.08,""Category Average"":null},{""Average"":""Maturity"",""HISF"":9.4,""Category Average"":null},{""Average"":""Credit Quality"",""HISF"":null,""Category Average"":null}]",0.0179673,0.1149,0.0294,0.43490002,0.0866,0.0128,0.074200004,0.2319,0.0153,,,,,,,,,,,,,,,,,,,,,
Utilities,utilities,44,PUI,Invesco Dorsey Wright Utilities Momentum ETF,https://finance.yahoo.com/research-hub/screener/sec-ind_sec-top-etfs_utilities/,2026-07-18T07:04:17+00:00,en-US,US,ETF,ETF,Nasdaq Real Time Price,False,LOW,1.97,21.317416,-4.40543,14.95354,False,False,False,1.1409484,15,0,America/New_York,EDT,40.805,46.8746,-0.31819916,-0.006788307,46.39135,0.1650505,6200000.0,True,1130333400000,-14400000,76488904.0,1.4692,1.4692,Invesco Dorsey Wright Utilities,20.869425,-0.0077342656,1784319005.0,15.0,0.019906024,USD,2,46.815,14233,10.16827,CLOSED,46.82,finmb_25333490,NasdaqGM,48210,0.932,-2.743599,0.0035577863,0.091592,46.5564,46.815,46.5564 - 46.815,46.5564,-0.0036010742,-0.2635994,1784318400,15.0,-0.563006,0.6,46.5564,1045,us_market,3.9063988,42.65 - 49.3,[],NGM,49.3,42.65,1.97,USD,-0.055651095,Invesco Dorsey Wright Utilities Momentum ETF,8.405125,2.2308426,46.47,46.63,PUI,1522281600.0,,,,,,,,,,,,,,,"The fund generally will invest at least 90% of its total assets in securities that comprise the underlying index. The underlying index is composed of at least 30 securities of companies in the utilities sector that have powerful relative strength or ""momentum"" characteristics.",[],[],86400.0,2.0,46.82,46.815,46.5564,46.815,46.82,46.815,46.5564,46.815,20.869425,1045.0,1045.0,14233.0,48210.0,48210.0,46.47,46.63,15.0,15.0,0.0197,76488904.0,42.65,49.3,49.3,11.45,46.8746,46.39135,0.932,0.019906024,46.86,USD,False,Utilities,0.08469889,0.52,Invesco,1130284800.0,Exchange Traded Fund,0.14844,ETF,PUI,en-US,US,ETF,Nasdaq Real Time Price,True,HIGH,CLOSED,[],1784319005.0,1784318400.0,NGM,finmb_25333490,America/New_York,EDT,-14400000.0,us_market,False,-0.563006,46.5564,True,1130333400000.0,-0.0077342656,46.5564,-0.0036010742,-0.2635994,46.5564 - 46.815,NasdaqGM,14233.0,3.9063988,0.091592,42.65 - 49.3,-2.743599,-0.055651095,8.405125,,,,,,,,-0.31819916,-0.006788307,0.1650505,0.0035577863,,15.0,0.0,False,,"The fund generally will invest at least 90% of its total assets in securities that comprise the underlying index. The underlying index is composed of at least 30 securities of companies in the utilities sector that have powerful relative strength or ""momentum"" characteristics.",Utilities,Invesco,Exchange Traded Fund,0.0015,0.9985,0.0,0.0,0.0,0.0,0.0,0.0,0.0,0.0,0.0,0.0171,0.0,0.77019995,0.1109,0.1018,0.0,0.0,0.006,0.009681,0.58,0.47,28441.33,28441.33,57.99999999999999,0.6,39.6840403,"[{""Symbol"":""GEV"",""Name"":""GE Vernova Inc"",""Holding Percent"":0.0590493},{""Symbol"":""OKE"",""Name"":""ONEOK Inc"",""Holding Percent"":0.042072803},{""Symbol"":""NI"",""Name"":""NiSource Inc"",""Holding Percent"":0.041055},{""Symbol"":""ATO"",""Name"":""Atmos Energy Corp"",""Holding Percent"":0.0386771},{""Symbol"":""WEC"",""Name"":""WEC Energy Group Inc"",""Holding Percent"":0.0384623},{""Symbol"":""DUK"",""Name"":""Duke Energy Corp"",""Holding Percent"":0.0382183},{""Symbol"":""SRE"",""Name"":""Sempra"",""Holding Percent"":0.0360749},{""Symbol"":""CEG"",""Name"":""Constellation Energy Corp"",""Holding Percent"":0.0357109},{""Symbol"":""DTE"",""Name"":""DTE Energy Co"",""Holding Percent"":0.0347844},{""Symbol"":""ETR"",""Name"":""Entergy Corp"",""Holding Percent"":0.0327354}]","[{""Average"":""Price\/Earnings"",""PUI"":0.04691,""Category Average"":null},{""Average"":""Price\/Book"",""PUI"":0.42102,""Category Average"":null},{""Average"":""Price\/Sales"",""PUI"":0.40976,""Category Average"":null},{""Average"":""Price\/Cashflow"",""PUI"":0.10434,""Category Average"":null},{""Average"":""Median Market Cap"",""PUI"":null,""Category Average"":null},{""Average"":""3 Year Earnings Growth"",""PUI"":null,""Category Average"":null}]",0.04691,0.42102,,"[{""Average"":""Duration"",""PUI"":null,""Category Average"":null},{""Average"":""Maturity"",""PUI"":null,""Category Average"":null},{""Average"":""Credit Quality"",""PUI"":null,""Category Average"":null}]",0.0898866,,,,,,,,,,,,,,,,,,,,,,,,,,,,,
Utilities,utilities,45,DUKZ,Ocean Park Diversified Income ETF,https://finance.yahoo.com/research-hub/screener/sec-ind_sec-top-etfs_utilities/,2026-07-18T07:04:17+00:00,en-US,US,ETF,ETF,Delayed Quote,False,LOW,4.32,24.752475247524753,,,False,False,False,,15,0,America/New_York,EDT,,25.49074,-0.1607399,-0.006305815,25.42785,-0.0978508,,True,1720704600000,-14400000,46821300.0,3.65291,3.65291,Ocean Park Diversified Income E,,0.0,1784322300.0,2100.0,0.0,USD,2,25.35,23048,2.87314,CLOSED,25.38,finmb_1879271265,NYSEArca,29890,0.0,-0.61100006,-0.0038481741,0.024676401,25.33,25.35,25.31 - 25.35,25.33,0.0,-0.0499992,1784318385,2000.0,-0.197003,1.03,25.31,4502,us_market,0.6100006,24.72 - 25.941,[],PCX,25.941,24.72,3.81,,-0.02355345,Ocean Park Diversified Income ETF,1.4986396,,23.95,26.9,DUKZ,,,,,,,,,,,,,,,631-470-2600,"The fund is an actively managed exchange-traded fund (“ETF”) that seeks to achieve its investment objective by tactically allocating the fund’s assets between unaffiliated fixed income ETFs and cash equivalents. Under normal market conditions, the advisor expects to invest substantially all of its assets in underlying ETFs.",[],[],86400.0,2.0,25.38,25.35,25.31,25.35,25.38,25.35,25.31,25.35,,4502.0,4502.0,23048.0,29890.0,29890.0,23.95,26.9,2100.0,2000.0,0.0381,46821300.0,24.72,25.941,26.15,24.09,25.49074,25.42785,0.0,0.0,25.34,USD,False,Nontraditional Bond,2.87314,0.0,Ocean Park Asset Management ETF,1720569600.0,Exchange Traded Fund,,ETF,DUKZ,en-US,US,ETF,Delayed Quote,True,HIGH,CLOSED,[],1784322300.0,1784318385.0,PCX,finmb_1879271265,America/New_York,EDT,-14400000.0,us_market,False,-0.197003,25.33,True,1720704600000.0,0.0,25.33,0.0,-0.0499992,25.31 - 25.35,NYSEArca,23048.0,0.6100006,0.024676401,24.72 - 25.941,-0.61100006,-0.02355345,1.4986396,3.81,3.65291,3.65291,46821300.0,,Ocean Park Diversified Income E,Ocean Park Diversified Income ETF,-0.1607399,-0.006305815,-0.0978508,-0.0038481741,1.03,15.0,0.0,False,,"The fund is an actively managed exchange-traded fund (“ETF”) that seeks to achieve its investment objective by tactically allocating the fund’s assets between unaffiliated fixed income ETFs and cash equivalents. Under normal market conditions, the advisor expects to invest substantially all of its assets in underlying ETFs.",Nontraditional Bond,Ocean Park Asset Management ETF,Exchange Traded Fund,0.0189,0.0082,0.7549,0.1349,0.081499994,0.0016,0.0,0.0,0.0,0.0,0.1266,0.0,0.0,0.8602,0.0,0.0,0.013200001,0.22,0.010299999,0.0143136,2.69,2.5095,0.0,0.0,2.69,1.0299999,99.8655895,"[{""Symbol"":""MBB"",""Name"":""iShares MBS ETF"",""Holding Percent"":0.1497605},{""Symbol"":""PFFD"",""Name"":""Global X US Preferred ETF"",""Holding Percent"":0.1466489},{""Symbol"":""BNDX"",""Name"":""Vanguard Total International Bond ETF"",""Holding Percent"":0.1017219},{""Symbol"":""ICVT"",""Name"":""iShares Convertible Bond ETF"",""Holding Percent"":0.1013579},{""Symbol"":""HYMB"",""Name"":""Stt Strt\u00ae SPDR\u00ae Nuveen ICE HY Muncpl ETF"",""Holding Percent"":0.1007574},{""Symbol"":""BKLN"",""Name"":""Invesco Senior Loan ETF"",""Holding Percent"":0.0994462},{""Symbol"":""USHY"",""Name"":""iShares Broad USD High Yield Corp Bd ETF"",""Holding Percent"":0.0987806},{""Symbol"":""EMB"",""Name"":""iShares JP Morgan USD Em Mkts Bd ETF"",""Holding Percent"":0.0753718},{""Symbol"":""EMLC"",""Name"":""VanEck JPMorgan EMLcl Ccy Bd ETF"",""Holding Percent"":0.074781395},{""Symbol"":""MUB"",""Name"":""iShares National Muni Bond ETF"",""Holding Percent"":0.0500293}]","[{""Average"":""Price\/Earnings"",""DUKZ"":0.0,""Category Average"":null},{""Average"":""Price\/Book"",""DUKZ"":0.0,""Category Average"":null},{""Average"":""Price\/Sales"",""DUKZ"":0.0,""Category Average"":null},{""Average"":""Price\/Cashflow"",""DUKZ"":0.0,""Category Average"":null},{""Average"":""Median Market Cap"",""DUKZ"":null,""Category Average"":null},{""Average"":""3 Year Earnings Growth"",""DUKZ"":null,""Category Average"":null}]",0.0,0.0,,"[{""Average"":""Duration"",""DUKZ"":4.71,""Category Average"":null},{""Average"":""Maturity"",""DUKZ"":9.764,""Category Average"":null},{""Average"":""Credit Quality"",""DUKZ"":null,""Category Average"":null}]",,0.1609,0.2638,0.0545,0.1191,0.087799996,0.1521,0.136,0.025899999,,,,,,,,,,,,,,,,,,,,,
Utilities,utilities,46,UTSL,Direxion Daily Utilities Bull 3X Shares,https://finance.yahoo.com/research-hub/screener/sec-ind_sec-top-etfs_utilities/,2026-07-18T07:04:17+00:00,en-US,US,ETF,ETF,Delayed Quote,False,LOW,1.54,20.93364,-35.54238,48.10649,False,False,False,,15,0,America/New_York,EDT,,44.3026,0.48740005,0.011001613,45.89095,-1.1009483,,True,1493818200000,-14400000,45702228.0,-6.15046,-6.15046,Direxion Daily Utilities Bull 3,20.515902,0.22326072,1784330620.0,100.0,0.0,USD,2,46.55,99340,13.82815,CLOSED,45.81,finmb_424861530,NYSEArca,78340,0.0,-10.419998,-0.023990532,0.21612813,44.79,47.72,44.52 - 47.72,44.89,0.099998474,-1.02,1784318400,100.0,-2.22659,0.97,44.52,117042,us_market,7.959999,36.83 - 55.21,[],PCX,55.21,36.83,1.54,,-0.18873389,Direxion Daily Utilities Bull 3X Shares,13.306355,2.1831846,44.55,47.07,UTSL,,,,,,,,,,,,,,,866-476-7523,"The fund invests at least 80% of its net assets in financial instruments, such as swap agreements, securities of the index, and exchange-traded funds (""ETFs"") that track the index, that, in combination, provide 3X daily leveraged exposure to the index, consistent with the fund's investment objective. The index includes domestic companies from the utilities sector which includes the following industries: electric utilities; multi-utilities; water utilities and etc. The fund is non-diversified.",[],[],86400.0,2.0,45.81,46.55,44.52,47.72,45.81,46.55,44.52,47.72,20.515902,117042.0,117042.0,99340.0,78340.0,78340.0,44.55,47.07,100.0,100.0,0.0154,45702228.0,36.83,55.21,59.83,10.854,44.3026,45.89095,0.0,0.0,45.785,USD,False,Trading--Leveraged Equity,13.82815,1.2,Direxion Funds,1493769600.0,Exchange Traded Fund,0.2213942,ETF,UTSL,en-US,US,ETF,Delayed Quote,True,HIGH,CLOSED,[],1784330620.0,1784318400.0,PCX,finmb_424861530,America/New_York,EDT,-14400000.0,us_market,False,-2.22659,44.79,True,1493818200000.0,0.22326072,44.89,0.099998474,-1.02,44.52 - 47.72,NYSEArca,99340.0,7.959999,0.21612813,36.83 - 55.21,-10.419998,-0.18873389,13.306355,1.54,-6.15046,-6.15046,45702228.0,2.1831846,Direxion Daily Utilities Bull 3,Direxion Daily Utilities Bull 3X Shares,0.48740005,0.011001613,-1.1009483,-0.023990532,0.97,15.0,0.0,False,,"The fund invests at least 80% of its net assets in financial instruments, such as swap agreements, securities of the index, and exchange-traded funds (""ETFs"") that track the index, that, in combination, provide 3X daily leveraged exposure to the index, consistent with the fund's investment objective. The index includes domestic companies from the utilities sector which includes the following industries: electric utilities; multi-utilities; water utilities and etc. The fund is non-diversified.",Trading--Leveraged Equity,Direxion Funds,Exchange Traded Fund,0.24209999,0.7579,0.0,0.0,0.0,0.0,0.0,0.0,0.0,0.0,0.0,0.0,0.0,1.0,0.0,0.0,0.0,0.0,0.0097,0.0,0.48,,57141.93,57141.93,48.0,0.97,32.8074003,"[{""Symbol"":""NEE"",""Name"":""NextEra Energy Inc"",""Holding Percent"":0.0837836},{""Symbol"":""SO"",""Name"":""Southern Co"",""Holding Percent"":0.0493892},{""Symbol"":""DUK"",""Name"":""Duke Energy Corp"",""Holding Percent"":0.045172703},{""Symbol"":""CEG"",""Name"":""Constellation Energy Corp"",""Holding Percent"":0.0363436},{""Symbol"":""AEP"",""Name"":""American Electric Power Co Inc"",""Holding Percent"":0.034075998},{""Symbol"":""SRE"",""Name"":""Sempra"",""Holding Percent"":0.027741},{""Symbol"":""D"",""Name"":""Dominion Energy Inc"",""Holding Percent"":0.027492002},{""Symbol"":""ETR"",""Name"":""Entergy Corp"",""Holding Percent"":0.0240759}]","[{""Average"":""Price\/Earnings"",""UTSL"":0.04777,""Category Average"":null},{""Average"":""Price\/Book"",""UTSL"":0.4277,""Category Average"":null},{""Average"":""Price\/Sales"",""UTSL"":0.34802,""Category Average"":null},{""Average"":""Price\/Cashflow"",""UTSL"":0.09904,""Category Average"":null},{""Average"":""Median Market Cap"",""UTSL"":null,""Category Average"":null},{""Average"":""3 Year Earnings Growth"",""UTSL"":null,""Category Average"":null}]",0.04777,0.4277,,"[{""Average"":""Duration"",""UTSL"":null,""Category Average"":null},{""Average"":""Maturity"",""UTSL"":null,""Category Average"":null},{""Average"":""Credit Quality"",""UTSL"":null,""Category Average"":null}]",0.0980245,,,,,,,,,,,,,,,,,,,,,,,,,,,,,
Utilities,utilities,47,JHMU,John Hancock Dynamic Municipal Bond ETF,https://finance.yahoo.com/research-hub/screener/sec-ind_sec-top-etfs_utilities/,2026-07-18T07:04:17+00:00,en-US,US,ETF,ETF,Delayed Quote,False,LOW,2.47,17.956545160711077,23.18502,11.25287,False,False,False,,15,0,America/New_York,EDT,,26.21298,-0.07298088,-0.0027841504,26.24442,-0.10441971,,True,1698931800000,-14400000,44071684.0,2.41966,2.41966,John Hancock Dynamic Municipal ,,,,300.0,0.0,USD,2,26.1565,4448,2.3621,CLOSED,26.1351,finmb_1849974960,NYSEArca,3680,0.0,-0.5550003,-0.0039787395,0.034428135,26.14,26.14,26.14 - 26.14,,,0.00489998,1784225139,200.0,0.0187487,0.39,26.14,31,us_market,0.86999893,25.27 - 26.695,[],PCX,26.695,25.27,3.74,,-0.020790422,John Hancock Dynamic Municipal Bond ETF,3.205943,,23.26,29.26,JHMU,,,,,,,,,,,,,,,,"Under normal market conditions, the fund invests at least 80% of its net assets, plus amounts borrowed for investment purposes, in municipal bonds of any maturity. It primarily invests in bonds that are investment grade when purchased, but the fund may also invest up to 20% of its net assets in non-investment grade bonds rated BB or lower by S&P Global Ratings, Fitch Ratings, or Moody’s Investors Service, Inc., or comparable rating by any NRSRO or unrated equivalents.",[],[],86400.0,2.0,26.1351,26.1565,26.14,26.14,26.1351,26.1565,26.14,26.14,,31.0,31.0,4448.0,3680.0,3680.0,23.26,29.26,300.0,200.0,0.0374,44071684.0,25.27,26.695,27.15,24.68,26.21298,26.24442,0.0,0.0,26.13554,USD,False,Muni National Interm,2.3621,0.0,John Hancock,1698796800.0,Exchange Traded Fund,,ETF,JHMU,en-US,US,ETF,Delayed Quote,True,HIGH,CLOSED,[],,1784225139.0,PCX,finmb_1849974960,America/New_York,EDT,-14400000.0,us_market,False,0.0187487,26.14,True,1698931800000.0,,,,0.00489998,26.14 - 26.14,NYSEArca,4448.0,0.86999893,0.034428135,25.27 - 26.695,-0.5550003,-0.020790422,3.205943,3.74,2.41966,2.41966,44071684.0,,John Hancock Dynamic Municipal ,John Hancock Dynamic Municipal Bond ETF,-0.07298088,-0.0027841504,-0.10441971,-0.0039787395,0.39,15.0,0.0,False,,"Under normal market conditions, the fund invests at least 80% of its net assets, plus amounts borrowed for investment purposes, in municipal bonds of any maturity. It primarily invests in bonds that are investment grade when purchased, but the fund may also invest up to 20% of its net assets in non-investment grade bonds rated BB or lower by S&P Global Ratings, Fitch Ratings, or Moody’s Investors Service, Inc., or comparable rating by any NRSRO or unrated equivalents.",Muni National Interm,John Hancock,Exchange Traded Fund,0.0054,0.0,0.9946,0.0,0.0,0.0,,,,,,,,,,,,0.0,0.0039,0.0062208003,0.38,0.4285,0.0,0.0,38.0,0.38999999999999996,,,"[{""Average"":""Price\/Earnings"",""JHMU"":0.0,""Category Average"":null},{""Average"":""Price\/Book"",""JHMU"":0.0,""Category Average"":null},{""Average"":""Price\/Sales"",""JHMU"":0.0,""Category Average"":null},{""Average"":""Price\/Cashflow"",""JHMU"":0.0,""Category Average"":null},{""Average"":""Median Market Cap"",""JHMU"":null,""Category Average"":null},{""Average"":""3 Year Earnings Growth"",""JHMU"":null,""Category Average"":null}]",0.0,0.0,,"[{""Average"":""Duration"",""JHMU"":4.84,""Category Average"":null},{""Average"":""Maturity"",""JHMU"":10.4,""Category Average"":null},{""Average"":""Credit Quality"",""JHMU"":null,""Category Average"":null}]",,0.059299998,0.2747,0.0794,0.3123,0.0864,0.013300001,0.17459999,0.0,,,,,,,,,,,,,,,,,,,,,
