Utilities,utilities,24,RSPU,Invesco S&P 500 Equal Weight Utilities ETF,https://finance.yahoo.com/research-hub/screener/sec-ind_sec-top-etfs_utilities/,2026-07-18T07:04:17+00:00,en-US,US,ETF,ETF,Delayed Quote,False,LOW,2.49,19.77457,-3.51487,16.98823,False,False,False,,15,0,America/New_York,EDT,,79.7908,0.8091965,0.010141476,78.9666,1.6334,,True,1162909800000,-14400000,553843520.0,0.72793,0.72793,Invesco S&P 500 Equal Weight Ut,19.645388,0.0,1784322300.0,100.0,0.0,USD,2,81.69,40862,9.94347,CLOSED,81.22,finmb_30119287,NYSEArca,27130,0.0,-3.9199982,0.020684695,0.11680754,80.6,82.35,80.49 - 82.35,80.6,0.0,-0.620003,1784318391,200.0,-0.763362,0.4,80.49,34103,us_market,8.43,72.17 - 84.52,[],PCX,84.52,72.17,2.49,,-0.046379536,Invesco S&P 500 Equal Weight Utilities ETF,10.380721,4.102744,80.58,80.6,RSPU,,,,,,,,,,,,,,,,"The fund generally will invest at least 90% of its total assets in the securities that comprise the underlying index. The underlying index is composed of all of the components of the S&P 500® Utilities Plus Index, an index that contains the common stocks of all companies included in the S&P 500® Index that are classified as members of the utilities sector, as defined according to the Global Industry Classification Standard (""GICS"").",[],[],86400.0,2.0,81.22,81.69,80.49,82.35,81.22,81.69,80.49,82.35,19.645388,34103.0,34103.0,40862.0,27130.0,27130.0,80.58,80.6,100.0,200.0,0.0249,553843520.0,72.17,84.52,84.52,15.935,79.7908,78.9666,0.0,0.0,81.23,USD,False,Utilities,9.94347,0.45,Invesco,1162339200.0,Exchange Traded Fund,0.1587895,ETF,RSPU,en-US,US,ETF,Delayed Quote,True,HIGH,CLOSED,[],1784322300.0,1784318391.0,PCX,finmb_30119287,America/New_York,EDT,-14400000.0,us_market,False,-0.763362,80.6,True,1162909800000.0,0.0,80.6,0.0,-0.620003,80.49 - 82.35,NYSEArca,40862.0,8.43,0.11680754,72.17 - 84.52,-3.9199982,-0.046379536,10.380721,2.49,0.72793,0.72793,553843520.0,4.102744,Invesco S&P 500 Equal Weight Ut,Invesco S&P 500 Equal Weight Utilities ETF,0.8091965,0.010141476,1.6334,0.020684695,0.4,15.0,0.0,False,,"The fund generally will invest at least 90% of its total assets in the securities that comprise the underlying index. The underlying index is composed of all of the components of the S&P 500® Utilities Plus Index, an index that contains the common stocks of all companies included in the S&P 500® Index that are classified as members of the utilities sector, as defined according to the Global Industry Classification Standard (""GICS"").",Utilities,Invesco,Exchange Traded Fund,-0.00059999997,1.0006,0.0,0.0,0.0,0.0,0.0,0.0,0.0,0.0,0.0,0.0,0.0,1.0,0.0,0.0,0.0,0.0,0.004,0.009681,0.09,0.47,37809.42,37809.42,9.0,0.4,33.288430000000005,"[{""Symbol"":""NRG"",""Name"":""NRG Energy Inc"",""Holding Percent"":0.0375945},{""Symbol"":""VST"",""Name"":""Vistra Corp"",""Holding Percent"":0.0355572},{""Symbol"":""AEP"",""Name"":""American Electric Power Co Inc"",""Holding Percent"":0.0330545},{""Symbol"":""LNT"",""Name"":""Alliant Energy Corp"",""Holding Percent"":0.0324537},{""Symbol"":""ES"",""Name"":""Eversource Energy"",""Holding Percent"":0.0324412},{""Symbol"":""EVRG"",""Name"":""Evergy Inc"",""Holding Percent"":0.0324038},{""Symbol"":""DTE"",""Name"":""DTE Energy Co"",""Holding Percent"":0.0323934},{""Symbol"":""CMS"",""Name"":""CMS Energy Corp"",""Holding Percent"":0.0323393},{""Symbol"":""EIX"",""Name"":""Edison International"",""Holding Percent"":0.0323353},{""Symbol"":""AWK"",""Name"":""American Water Works Co Inc"",""Holding Percent"":0.0323114}]","[{""Average"":""Price\/Earnings"",""RSPU"":0.05057,""Category Average"":null},{""Average"":""Price\/Book"",""RSPU"":0.44615,""Category Average"":null},{""Average"":""Price\/Sales"",""RSPU"":0.41058,""Category Average"":null},{""Average"":""Price\/Cashflow"",""RSPU"":0.11269,""Category Average"":null},{""Average"":""Median Market Cap"",""RSPU"":null,""Category Average"":null},{""Average"":""3 Year Earnings Growth"",""RSPU"":null,""Category Average"":null}]",0.05057,0.44615,,"[{""Average"":""Duration"",""RSPU"":null,""Category Average"":null},{""Average"":""Maturity"",""RSPU"":null,""Category Average"":null},{""Average"":""Credit Quality"",""RSPU"":null,""Category Average"":null}]",0.114198595,,,,,,,,,,,,,,,,,,,,,,,,,,,,,
Utilities,utilities,25,HYGH,iShares Interest Rate Hedged High Yield Bond ETF,https://finance.yahoo.com/research-hub/screener/sec-ind_sec-top-etfs_utilities/,2026-07-18T07:04:17+00:00,en-US,US,ETF,ETF,Delayed Quote,False,LOW,7.73,10.989010989010989,12.29089,5.72647,False,False,False,,15,0,America/New_York,EDT,,86.48308,-0.08307648,-0.00096060964,86.22388,0.17612457,,True,1401370200000,-14400000,549573120.0,2.84848,2.84848,iShares Interest Rate Hedged Hi,10.947199,0.0,1784322300.0,100.0,0.0,USD,2,86.41,56770,3.19708,CLOSED,86.54,finmb_259653076,NYSEArca,60370,0.0,-0.7900009,0.0020426428,0.019108312,86.4,86.66,86.4 - 86.66,86.4,0.0,-0.139999,1784318392,200.0,-0.161774,0.52,86.4,44956,us_market,1.6200027,84.78 - 87.19,[],PCX,87.19,84.78,6.61,,-0.009060683,iShares Interest Rate Hedged High Yield Bond ETF,0.0926733,7.8924303,86.43,86.5,HYGH,,,,,,,,,,,,,,,(415) 670-2000,"The fund seeks to track the investment results of the underlying index, which is designed to minimize the interest-rate risk of a portfolio composed of U.S. dollar-denominated, high yield corporate bonds, represented in the underlying index by the underlying fund. It invests at least 80% of its net assets in component securities and instruments in the fund’s underlying index.",[],[],86400.0,2.0,86.54,86.41,86.4,86.66,86.54,86.41,86.4,86.66,10.947199,44956.0,44956.0,56770.0,60370.0,60370.0,86.43,86.5,100.0,200.0,0.0661,549573120.0,84.78,87.19,101.48,63.02,86.48308,86.22388,0.0,0.0,86.47569,USD,False,High Yield Bond,3.19708,0.2,iShares,1401148800.0,Exchange Traded Fund,0.093196295,ETF,HYGH,en-US,US,ETF,Delayed Quote,True,HIGH,CLOSED,[],1784322300.0,1784318392.0,PCX,finmb_259653076,America/New_York,EDT,-14400000.0,us_market,False,-0.161774,86.4,True,1401370200000.0,0.0,86.4,0.0,-0.139999,86.4 - 86.66,NYSEArca,56770.0,1.6200027,0.019108312,84.78 - 87.19,-0.7900009,-0.009060683,0.0926733,6.61,2.84848,2.84848,549573120.0,7.8924303,iShares Interest Rate Hedged Hi,iShares Interest Rate Hedged High Yield Bond ETF,-0.08307648,-0.00096060964,0.17612457,0.0020426428,0.52,15.0,0.0,False,,"The fund seeks to track the investment results of the underlying index, which is designed to minimize the interest-rate risk of a portfolio composed of U.S. dollar-denominated, high yield corporate bonds, represented in the underlying index by the underlying fund. It invests at least 80% of its net assets in component securities and instruments in the fund’s underlying index.",High Yield Bond,iShares,Exchange Traded Fund,0.9743,0.0,0.93230003,0.0,0.0,-0.90660006,0.0039,0.0,0.0,0.0,0.0,0.0,0.0,0.9961,0.0,0.0,0.0,0.0,0.0052,0.008518,0.01,0.7432,0.0,0.0,1.0,0.52,98.14211479999999,"[{""Symbol"":""HYG"",""Name"":""iShares iBoxx $ High Yield Corp Bd ETF"",""Holding Percent"":0.94000685},{""Symbol"":""XTSLA"",""Name"":""BlackRock Cash Funds Treasury SL Agency"",""Holding Percent"":0.041414298}]","[{""Average"":""Price\/Earnings"",""HYGH"":0.0,""Category Average"":null},{""Average"":""Price\/Book"",""HYGH"":0.0,""Category Average"":null},{""Average"":""Price\/Sales"",""HYGH"":0.0,""Category Average"":null},{""Average"":""Price\/Cashflow"",""HYGH"":0.0,""Category Average"":null},{""Average"":""Median Market Cap"",""HYGH"":null,""Category Average"":null},{""Average"":""3 Year Earnings Growth"",""HYGH"":null,""Category Average"":null}]",0.0,0.0,,"[{""Average"":""Duration"",""HYGH"":null,""Category Average"":null},{""Average"":""Maturity"",""HYGH"":null,""Category Average"":null},{""Average"":""Credit Quality"",""HYGH"":null,""Category Average"":null}]",0.0703546,0.5667,0.0078,0.0,0.0,0.0025,0.32650003,0.0095,0.086899996,,,,,,,,,,,,,,,,,,,,,
Utilities,utilities,26,ZAP,Global X U.S. Electrification ETF,https://finance.yahoo.com/research-hub/screener/sec-ind_sec-top-etfs_utilities/,2026-07-18T07:04:17+00:00,en-US,US,ETF,ETF,Nasdaq Real Time Price,False,LOW,1.5,22.376371,,,False,False,False,,15,0,America/New_York,EDT,,33.7797,-0.60970306,-0.018049391,31.84696,1.3230381,,True,1734532200000,-14400000,484599456.0,8.17417,8.17417,Global X U.S. Electrification E,21.445366,-0.030145075,1784319005.0,1.0,0.0,USD,2,33.31,117729,19.64718,CLOSED,33.32,finmb_1899070904,NasdaqGM,85540,0.0,-2.2200012,0.04154362,0.21858923,33.17,33.63,33.12 - 33.63,33.17,-0.010002136,-0.15000153,1784318400,4.0,-0.45018467,0.5,33.12,67518,us_market,5.949999,27.22 - 35.39,[],NGM,35.39,27.22,1.5,,-0.06272962,Global X U.S. Electrification ETF,20.521759,1.546721,33.15,33.26,ZAP,,2024-12-18,,,,,,,,,,,,,+1 8884938631,"The fund invests at least 80% of its net assets, plus borrowings for investment purposes (if any), in the securities of the underlying index, which may include common stocks and American Depositary Receipts (""ADRs"") based on the securities in the underlying index. The underlying index is, as presently constituted, designed to track the performance of U.S. listed companies domiciled in developed markets and involved in electrification. The fund is non-diversified.",[],[],86400.0,2.0,33.32,33.31,33.12,33.63,33.32,33.31,33.12,33.63,21.445366,67518.0,67518.0,117729.0,85540.0,85540.0,33.15,33.26,1.0,4.0,0.015,484599456.0,27.22,35.39,35.39,22.16,33.7797,31.84696,0.0,0.0,33.28,USD,False,Utilities,19.64718,0.0,Global X Funds,1734393600.0,Exchange Traded Fund,,ETF,ZAP,en-US,US,ETF,Nasdaq Real Time Price,True,HIGH,CLOSED,[],1784319005.0,1784318400.0,NGM,finmb_1899070904,America/New_York,EDT,-14400000.0,us_market,False,-0.45018467,33.17,True,1734532200000.0,-0.030145075,33.17,-0.010002136,-0.15000153,33.12 - 33.63,NasdaqGM,117729.0,5.949999,0.21858923,27.22 - 35.39,-2.2200012,-0.06272962,20.521759,1.5,8.17417,8.17417,484599456.0,1.546721,Global X U.S. Electrification E,Global X U.S. Electrification ETF,-0.60970306,-0.018049391,1.3230381,0.04154362,0.5,15.0,0.0,False,,"The fund invests at least 80% of its net assets, plus borrowings for investment purposes (if any), in the securities of the underlying index, which may include common stocks and American Depositary Receipts (""ADRs"") based on the securities in the underlying index. The underlying index is, as presently constituted, designed to track the performance of U.S. listed companies domiciled in developed markets and involved in electrification. The fund is non-diversified.",Utilities,Global X Funds,Exchange Traded Fund,0.0015,0.9985,0.0,0.0,0.0,0.0,0.0,0.0002,0.0,0.0,0.0,0.0,0.0,0.7453,0.2545,0.0,0.0,0.0,0.005,0.009681,0.18090001,0.47,47420.46,47420.46,18.090001,0.5,42.1519299,"[{""Symbol"":""BE"",""Name"":""Bloom Energy Corp Class A"",""Holding Percent"":0.0566733},{""Symbol"":""PWR"",""Name"":""Quanta Services Inc"",""Holding Percent"":0.0465498},{""Symbol"":""D"",""Name"":""Dominion Energy Inc"",""Holding Percent"":0.042581},{""Symbol"":""ETN"",""Name"":""Eaton Corp PLC"",""Holding Percent"":0.040784102},{""Symbol"":""AEP"",""Name"":""American Electric Power Co Inc"",""Holding Percent"":0.039838802},{""Symbol"":""AME"",""Name"":""AMETEK Inc"",""Holding Percent"":0.0396403},{""Symbol"":""SO"",""Name"":""Southern Co"",""Holding Percent"":0.0391874},{""Symbol"":""ED"",""Name"":""Consolidated Edison Inc"",""Holding Percent"":0.0388377},{""Symbol"":""PEG"",""Name"":""Public Service Enterprise Group Inc"",""Holding Percent"":0.038723398},{""Symbol"":""ETR"",""Name"":""Entergy Corp"",""Holding Percent"":0.038703497}]","[{""Average"":""Price\/Earnings"",""ZAP"":0.04469,""Category Average"":null},{""Average"":""Price\/Book"",""ZAP"":0.36655,""Category Average"":null},{""Average"":""Price\/Sales"",""ZAP"":0.31437,""Category Average"":null},{""Average"":""Price\/Cashflow"",""ZAP"":0.08659,""Category Average"":null},{""Average"":""Median Market Cap"",""ZAP"":null,""Category Average"":null},{""Average"":""3 Year Earnings Growth"",""ZAP"":null,""Category Average"":null}]",0.04469,0.36655,,"[{""Average"":""Duration"",""ZAP"":null,""Category Average"":null},{""Average"":""Maturity"",""ZAP"":null,""Category Average"":null},{""Average"":""Credit Quality"",""ZAP"":null,""Category Average"":null}]",,,,,,,,,,2024-12-18,,,,,,,,,,,,,,,,,,,,
Utilities,utilities,27,PFLD,AAM Low Duration Preferred and Income Securities ETF,https://finance.yahoo.com/research-hub/screener/sec-ind_sec-top-etfs_utilities/,2026-07-18T07:04:17+00:00,en-US,US,ETF,ETF,Delayed Quote,False,LOW,,,,,False,False,False,,15,0,America/New_York,EDT,,19.6299,0.00069999695,3.565973e-05,19.65232,-0.021720886,,True,1574260200000,-14400000,420170336.0,2.63653,2.63653,AAM Low Duration Preferred and ,,0.0,1784322300.0,400.0,0.0,USD,2,19.58,66383,2.51839,CLOSED,19.64,finmb_639845855,NYSEArca,52180,0.0,-0.26939964,-0.0011052581,0.017656768,19.6306,19.65,19.61 - 19.65,19.6306,0.0,-0.00939941,1784318237,600.0,-0.0478585,0.45,19.61,26101,us_market,0.34059906,19.29 - 19.9,[],PCX,19.9,19.29,5.47,,-0.0135376705,AAM Low Duration Preferred and Income Securities ETF,0.36298037,,19.62,19.65,PFLD,,,,,,,,,,,,,,,(414) 765-5586,"The index measures the performance of exchange-listed, U.S. dollar-denominated preferred securities and hybrid securities listed on the New York Stock Exchange (""NYSE"") or NASDAQ Capital Market (""NASDAQ"") with an option-adjusted duration of less than five years. Under normal circumstances, at least 80% of the fund’s net assets, plus borrowings for investment purposes, will be invested in preferred and income securities.",[],[],86400.0,2.0,19.64,19.58,19.61,19.65,19.64,19.58,19.61,19.65,,26101.0,26101.0,66383.0,52180.0,52180.0,19.62,19.65,400.0,600.0,0.0547,420170336.0,19.29,19.9,25.58,16.25,19.6299,19.65232,0.0,0.0,19.6375,USD,False,Preferred Stock,2.51839,0.48,AAM,1574121600.0,Exchange Traded Fund,0.0466304,ETF,PFLD,en-US,US,ETF,Delayed Quote,True,HIGH,CLOSED,[],1784322300.0,1784318237.0,PCX,finmb_639845855,America/New_York,EDT,-14400000.0,us_market,False,-0.0478585,19.6306,True,1574260200000.0,0.0,19.6306,0.0,-0.00939941,19.61 - 19.65,NYSEArca,66383.0,0.34059906,0.017656768,19.29 - 19.9,-0.26939964,-0.0135376705,0.36298037,5.47,2.63653,2.63653,420170336.0,,AAM Low Duration Preferred and ,AAM Low Duration Preferred and Income Securities ETF,0.00069999695,3.565973e-05,-0.021720886,-0.0011052581,0.45,15.0,0.0,False,,"The index measures the performance of exchange-listed, U.S. dollar-denominated preferred securities and hybrid securities listed on the New York Stock Exchange (""NYSE"") or NASDAQ Capital Market (""NASDAQ"") with an option-adjusted duration of less than five years. Under normal circumstances, at least 80% of the fund’s net assets, plus borrowings for investment purposes, will be invested in preferred and income securities.",Preferred Stock,AAM,Exchange Traded Fund,0.0183,0.0,0.3205,0.6111,0.040900003,0.0092,0.0,0.0,0.0,0.0,0.0,0.0,0.0,1.0,0.0,0.0,0.0,0.0,0.0045,0.0092324,1.5,0.3987,0.0,0.0,150.0,0.44999999999999996,1.85372,"[{""Symbol"":""AGPXX"",""Name"":""Invesco Shrt-Trm Inv Gov&Agcy Instl"",""Holding Percent"":0.0185372}]","[{""Average"":""Price\/Earnings"",""PFLD"":0.0,""Category Average"":null},{""Average"":""Price\/Book"",""PFLD"":0.0,""Category Average"":null},{""Average"":""Price\/Sales"",""PFLD"":0.0,""Category Average"":null},{""Average"":""Price\/Cashflow"",""PFLD"":0.0,""Category Average"":null},{""Average"":""Median Market Cap"",""PFLD"":null,""Category Average"":null},{""Average"":""3 Year Earnings Growth"",""PFLD"":null,""Category Average"":null}]",0.0,0.0,,"[{""Average"":""Duration"",""PFLD"":6.15,""Category Average"":null},{""Average"":""Maturity"",""PFLD"":10.005,""Category Average"":null},{""Average"":""Credit Quality"",""PFLD"":null,""Category Average"":null}]",0.0094298,,,,,,,,,,,,,,,,,,,,,,,,,,,,,
Utilities,utilities,28,CDX,Simplify High Yield ETF,https://finance.yahoo.com/research-hub/screener/sec-ind_sec-top-etfs_utilities/,2026-07-18T07:04:17+00:00,en-US,US,ETF,ETF,Delayed Quote,False,LOW,8.27,27.570995,,,False,False,False,,15,0,America/New_York,EDT,,21.12612,-0.21611977,-0.01022998,21.91871,-1.0087109,,True,1645108200000,-14400000,393534944.0,0.07801,0.07801,Simplify High Yield ETF,27.296852,1.8651334,1784323472.0,100.0,0.0,USD,2,20.86,148111,-1.74665,CLOSED,20.9,finmb_1777213266,NYSEArca,102940,0.0,-2.42,-0.046020538,0.0038406109,20.91,20.93,20.83 - 20.93,21.3,0.3899994,0.0100002,1784318371,600.0,0.047848,0.25,20.83,41408,us_market,0.07999992,20.83 - 23.33,[],PCX,23.33,20.83,8.27,,-0.10372911,Simplify High Yield ETF,-8.769631,0.7660224,20.77,21.41,CDX,,,,,,,,,,,,,,,614-469-3294,"The adviser seeks to achieve the fund’s investment objective by investing in high yield bonds also known as “junk bonds” primarily by purchasing exchange traded funds and applying a credit hedge derivatives strategy to the fund’s investments. Under normal circumstances, the fund will invest at least 80% of its net assets in high yield securities. The fund may invest up to 20% of its portfolio in derivatives.",[],[],86400.0,2.0,20.9,20.86,20.83,20.93,20.9,20.86,20.83,20.93,,41408.0,41408.0,148111.0,102940.0,102940.0,20.77,21.41,100.0,600.0,0.08270001,393534944.0,20.83,23.33,25.69,20.51,21.12612,21.91871,,,20.9335,USD,False,High Yield Bond,-1.74665,0.56,Simplify Asset Management,1644796800.0,Exchange Traded Fund,0.0723831,ETF,CDX,en-US,US,ETF,Delayed Quote,True,HIGH,CLOSED,[],1784323472.0,1784318371.0,PCX,finmb_1777213266,America/New_York,EDT,-14400000.0,us_market,False,0.047848,20.91,True,1645108200000.0,1.8651334,21.3,0.3899994,0.0100002,20.83 - 20.93,NYSEArca,148111.0,0.07999992,0.0038406109,20.83 - 23.33,-2.42,-0.10372911,-8.769631,8.27,0.07801,0.07801,393534944.0,,,,-0.21611977,-0.01022998,-1.0087109,-0.046020538,0.25,15.0,0.0,False,,"The adviser seeks to achieve the fund’s investment objective by investing in high yield bonds also known as “junk bonds” primarily by purchasing exchange traded funds and applying a credit hedge derivatives strategy to the fund’s investments. Under normal circumstances, the fund will invest at least 80% of its net assets in high yield securities. The fund may invest up to 20% of its portfolio in derivatives.",High Yield Bond,Simplify Asset Management,Exchange Traded Fund,0.5084,0.0109,0.48430002,0.0,0.0,-0.0036000002,0.028299998,0.0988,0.060399998,0.0298,0.2538,0.04,0.108100004,0.020299999,0.1616,0.0688,0.13,0.6873,0.0025,0.008518,6.22,0.7432,82853.83,82853.83,6.22,0.25,74.037138,"[{""Symbol"":""SBIL"",""Name"":""Simplify Government Money Market ETF"",""Holding Percent"":0.49462268},{""Symbol"":""TUA"",""Name"":""Simplify Short Term Trsy Futs Strat ETF"",""Holding Percent"":0.2457487}]","[{""Average"":""Price\/Earnings"",""CDX"":0.03627,""Category Average"":null},{""Average"":""Price\/Book"",""CDX"":0.20513,""Category Average"":null},{""Average"":""Price\/Sales"",""CDX"":0.37731,""Category Average"":null},{""Average"":""Price\/Cashflow"",""CDX"":0.05344,""Category Average"":null},{""Average"":""Median Market Cap"",""CDX"":null,""Category Average"":null},{""Average"":""3 Year Earnings Growth"",""CDX"":null,""Category Average"":null}]",0.03627,0.20513,,"[{""Average"":""Duration"",""CDX"":null,""Category Average"":null},{""Average"":""Maturity"",""CDX"":null,""Category Average"":null},{""Average"":""Credit Quality"",""CDX"":null,""Category Average"":null}]",,0.5659,0.0,0.0,0.0,0.0004,0.31620002,0.0064,0.111099996,,,,,,,,,,,,,,,,,,,,,
Utilities,utilities,29,JXI,iShares Global Utilities ETF,https://finance.yahoo.com/research-hub/screener/sec-ind_sec-top-etfs_utilities/,2026-07-18T07:04:17+00:00,en-US,US,ETF,ETF,Delayed Quote,False,LOW,2.41,20.169423,0.8418,10.81794,False,False,False,,15,0,America/New_York,EDT,,84.5678,0.39219666,0.0046376595,83.17085,1.7891464,,True,1158931800000,-14400000,322841760.0,-0.09717,-0.09717,iShares Global Utilities ETF,20.16981,0.0,1784322300.0,1200.0,0.0,USD,2,85.68,28561,9.63847,CLOSED,84.94,finmb_29103222,NYSEArca,24640,0.0,-5.1299973,0.0215117,0.15356413,84.96,86.235,84.93 - 86.235,84.96,0.0,0.0199966,1784318395,800.0,0.0235421,0.39,84.93,20045,us_market,11.309998,73.65 - 90.09,[],PCX,90.09,73.65,2.41,,-0.05694303,iShares Global Utilities ETF,14.532221,4.212236,84.9,85.07,JXI,,,,,,,,,,,,,,,415-670-2000,"The fund generally will invest at least 80% of its assets in the component securities of its index and in investments that have economic characteristics that are substantially identical to the component securities of its index and may invest up to 20% of its assets in certain futures, options and swap contracts, cash and cash equivalents.",[],[],86400.0,2.0,84.94,85.68,84.93,86.235,84.94,85.68,84.93,86.235,,20045.0,20045.0,28561.0,24640.0,24640.0,84.9,85.07,1200.0,800.0,0.0241,322841760.0,73.65,90.09,90.09,33.37,84.5678,83.17085,,,85.12243,USD,False,Utilities,9.63847,0.5,iShares,1158019200.0,Exchange Traded Fund,0.1529836,ETF,JXI,en-US,US,ETF,Delayed Quote,True,HIGH,CLOSED,[],1784322300.0,1784318395.0,PCX,finmb_29103222,America/New_York,EDT,-14400000.0,us_market,False,0.0235421,84.96,True,1158931800000.0,0.0,84.96,0.0,0.0199966,84.93 - 86.235,NYSEArca,28561.0,11.309998,0.15356413,73.65 - 90.09,-5.1299973,-0.05694303,14.532221,2.41,-0.09717,-0.09717,322841760.0,,,,0.39219666,0.0046376595,1.7891464,0.0215117,0.39,15.0,0.0,False,,"The fund generally will invest at least 80% of its assets in the component securities of its index and in investments that have economic characteristics that are substantially identical to the component securities of its index and may invest up to 20% of its assets in certain futures, options and swap contracts, cash and cash equivalents.",Utilities,iShares,Exchange Traded Fund,0.0041,0.9959,0.0,0.0,0.0,0.0,0.0,0.0,0.0,0.0,0.0,0.0,0.0,0.9878,0.012200001,0.0,0.0,0.0,0.0039,0.009681,0.06,0.47,53780.71,53780.71,6.0,0.38999999999999996,43.1746299,"[{""Symbol"":""NEE"",""Name"":""NextEra Energy Inc"",""Holding Percent"":0.0797715},{""Symbol"":""IBE.MC"",""Name"":""Iberdrola SA"",""Holding Percent"":0.0676937},{""Symbol"":""SO"",""Name"":""Southern Co"",""Holding Percent"":0.0470243},{""Symbol"":""DUK"",""Name"":""Duke Energy Corp"",""Holding Percent"":0.0430091},{""Symbol"":""ENEL.MI"",""Name"":""Enel SpA"",""Holding Percent"":0.0387134},{""Symbol"":""NG.L"",""Name"":""National Grid PLC"",""Holding Percent"":0.035886098},{""Symbol"":""CEG"",""Name"":""Constellation Energy Corp"",""Holding Percent"":0.0346094},{""Symbol"":""AEP"",""Name"":""American Electric Power Co Inc"",""Holding Percent"":0.0324435},{""Symbol"":""SRE"",""Name"":""Sempra"",""Holding Percent"":0.0264044},{""Symbol"":""D"",""Name"":""Dominion Energy Inc"",""Holding Percent"":0.026190901}]","[{""Average"":""Price\/Earnings"",""JXI"":0.04958,""Category Average"":null},{""Average"":""Price\/Book"",""JXI"":0.46319,""Category Average"":null},{""Average"":""Price\/Sales"",""JXI"":0.46207,""Category Average"":null},{""Average"":""Price\/Cashflow"",""JXI"":0.1092,""Category Average"":null},{""Average"":""Median Market Cap"",""JXI"":null,""Category Average"":null},{""Average"":""3 Year Earnings Growth"",""JXI"":null,""Category Average"":null}]",0.04958,0.46319,,"[{""Average"":""Duration"",""JXI"":null,""Category Average"":null},{""Average"":""Maturity"",""JXI"":null,""Category Average"":null},{""Average"":""Credit Quality"",""JXI"":null,""Category Average"":null}]",0.09994099,,,,,,,,,,,,,,,,,,,,,,,,,,,,,
