Utilities,utilities,12,UCON,First Trust Smith Unconstrained Plus Bond ETF,https://finance.yahoo.com/research-hub/screener/sec-ind_sec-top-etfs_utilities/,2026-07-18T07:04:17+00:00,en-US,US,ETF,ETF,Delayed Quote,False,LOW,4.51,22.321428571428573,7.55258,1.01988,False,False,False,,15,0,America/New_York,EDT,,24.8651,-0.085100174,-0.0034224745,25.06024,-0.2802391,,True,1528205400000,-14400000,3285839100.0,1.33661,1.33661,First Trust Smith Unconstrained,21.95947,0.0,1784322300.0,2500.0,0.0,USD,2,24.81,546198,1.08993,CLOSED,24.8,finmb_556963123,NYSEArca,472090,0.0,-0.8449993,-0.011182618,0.015157756,24.78,24.87,24.78 - 24.87,24.78,0.0,-0.0199986,1784318400,3700.0,-0.0806393,0.86,24.78,609729,us_market,0.37000084,24.41 - 25.625,[],PCX,25.625,24.41,4.69,,-0.032975584,First Trust Smith Unconstrained Plus Bond ETF,-0.24154782,1.1284425,24.78,37.18,UCON,1532995200.0,,,,,,,,,,,,,,,"Under normal market conditions, the fund invests at least 80% of its net assets (including investment borrowings) in a portfolio of fixed income securities. Its average portfolio duration will vary from between 0 to 10 years. It may invest a significant portion of its assets in securitized investment products, including up to 50% of its net assets in each of asset-backed securities, residential mortgage-backed securities and commercial mortgage-backed securities.",[],[],86400.0,2.0,24.8,24.81,24.78,24.87,24.8,24.81,24.78,24.87,21.95947,609729.0,609729.0,546198.0,472090.0,472090.0,24.78,37.18,2500.0,3700.0,0.0469,3285839104.0,24.41,25.625,27.75,21.07,24.8651,25.06024,0.0,0.0,24.75,USD,False,Nontraditional Bond,1.08993,0.59,First Trust,1528070400.0,Exchange Traded Fund,0.0570964,ETF,UCON,en-US,US,ETF,Delayed Quote,True,HIGH,CLOSED,[],1784322300.0,1784318400.0,PCX,finmb_556963123,America/New_York,EDT,-14400000.0,us_market,False,-0.0806393,24.78,True,1528205400000.0,0.0,24.78,0.0,-0.0199986,24.78 - 24.87,NYSEArca,546198.0,0.37000084,0.015157756,24.41 - 25.625,-0.8449993,-0.032975584,-0.24154782,4.69,1.33661,1.33661,3285839100.0,1.1284425,First Trust Smith Unconstrained,First Trust Smith Unconstrained Plus Bond ETF,-0.085100174,-0.0034224745,-0.2802391,-0.011182618,0.86,15.0,0.0,False,,"Under normal market conditions, the fund invests at least 80% of its net assets (including investment borrowings) in a portfolio of fixed income securities. Its average portfolio duration will vary from between 0 to 10 years. It may invest a significant portion of its assets in securitized investment products, including up to 50% of its net assets in each of asset-backed securities, residential mortgage-backed securities and commercial mortgage-backed securities.",Nontraditional Bond,First Trust,Exchange Traded Fund,0.0018000001,0.0,0.96580005,0.0325,0.0,0.0,0.0,0.0,0.0,0.0,0.0,0.0,0.0,1.0,0.0,0.0,0.0,0.141,0.0086,0.0143136,3.05,2.5095,0.0,0.0,3.05,0.86,,,"[{""Average"":""Price\/Earnings"",""UCON"":0.0,""Category Average"":null},{""Average"":""Price\/Book"",""UCON"":0.0,""Category Average"":null},{""Average"":""Price\/Sales"",""UCON"":0.0,""Category Average"":null},{""Average"":""Price\/Cashflow"",""UCON"":0.0,""Category Average"":null},{""Average"":""Median Market Cap"",""UCON"":null,""Category Average"":null},{""Average"":""3 Year Earnings Growth"",""UCON"":null,""Category Average"":null}]",0.0,0.0,,"[{""Average"":""Duration"",""UCON"":5.35,""Category Average"":null},{""Average"":""Maturity"",""UCON"":9.879,""Category Average"":null},{""Average"":""Credit Quality"",""UCON"":null,""Category Average"":null}]",0.027551401,0.2475,0.0218,0.24270001,0.1114,0.0,0.0884,0.2866,0.0016,,1532995200.0,,,,,,,,,,,,,,,,,,,
Utilities,utilities,13,HYMB,State Street SPDR Nuveen ICE High Yield Municipal Bond ETF,https://finance.yahoo.com/research-hub/screener/sec-ind_sec-top-etfs_utilities/,2026-07-18T07:04:17+00:00,en-US,US,ETF,ETF,Delayed Quote,False,LOW,,,7.37005,5.44919,False,False,False,,15,0,America/New_York,EDT,,25.1748,-0.0048007965,-0.00019069848,25.0987,0.07130051,,True,1302787800000,-14400000,3091741440.0,3.40748,3.40748,State Street SPDR Nuveen ICE Hi,,0.0,1784322300.0,6800.0,0.0,USD,2,25.17,967338,3.65822,CLOSED,25.17,finmb_129842776,NYSEArca,1061230,0.0,-0.3199997,0.0028408049,0.047440674,25.17,25.18,25.1423 - 25.18,25.17,0.0,0.0,1784318400,2400.0,0.0,0.35,25.1423,851729,us_market,1.1399994,24.03 - 25.49,[],PCX,25.49,24.03,4.51,,-0.012553931,State Street SPDR Nuveen ICE High Yield Municipal Bond ETF,4.051256,,25.17,25.18,HYMB,,,,,,,,,,,,,,,,"The fund invests substantially all, but at least 80%, of its total assets in the securities comprising the index and in securities that the Sub-Adviser determines have economic characteristics that are substantially identical to the economic characteristics of the securities that comprise the index. The index is market capitalization-weighted and designed to measure the performance of lower-rated (A3/A+ or lower) and unrated U.S. dollar-denominated tax-exempt debt.",[],[],86400.0,2.0,25.17,25.17,25.1423,25.18,25.17,25.17,25.1423,25.18,,851729.0,851729.0,967338.0,1061230.0,1061230.0,25.17,25.18,6800.0,2400.0,0.045100003,3091741440.0,24.03,25.49,30.67,21.08,25.1748,25.0987,0.0,0.0,25.06625,USD,False,High Yield Muni,3.65822,1.11,State Street Investment Management,1302652800.0,Exchange Traded Fund,0.048666902,ETF,HYMB,en-US,US,ETF,Delayed Quote,True,HIGH,CLOSED,[],1784322300.0,1784318400.0,PCX,finmb_129842776,America/New_York,EDT,-14400000.0,us_market,False,0.0,25.17,True,1302787800000.0,0.0,25.17,0.0,0.0,25.1423 - 25.18,NYSEArca,967338.0,1.1399994,0.047440674,24.03 - 25.49,-0.3199997,-0.012553931,4.051256,4.51,3.40748,3.40748,3091741440.0,,State Street SPDR Nuveen ICE Hi,State Street SPDR Nuveen ICE High Yield Municipal Bond ETF,-0.0048007965,-0.00019069848,0.07130051,0.0028408049,0.35,15.0,0.0,False,,"The fund invests substantially all, but at least 80%, of its total assets in the securities comprising the index and in securities that the Sub-Adviser determines have economic characteristics that are substantially identical to the economic characteristics of the securities that comprise the index. The index is market capitalization-weighted and designed to measure the performance of lower-rated (A3/A+ or lower) and unrated U.S. dollar-denominated tax-exempt debt.",High Yield Muni,State Street Investment Management,Exchange Traded Fund,0.0081,0.0001,0.9917,0.0,0.0,0.0,0.0,0.0,0.0,0.0,0.0,0.0,0.0,1.0,0.0,0.0,0.0,0.0,0.0034999999,0.0093021,0.1,0.5565,0.0,0.0,10.0,0.34999999,,,"[{""Average"":""Price\/Earnings"",""HYMB"":0.0,""Category Average"":null},{""Average"":""Price\/Book"",""HYMB"":0.0,""Category Average"":null},{""Average"":""Price\/Sales"",""HYMB"":0.0,""Category Average"":null},{""Average"":""Price\/Cashflow"",""HYMB"":0.0,""Category Average"":null},{""Average"":""Median Market Cap"",""HYMB"":null,""Category Average"":null},{""Average"":""3 Year Earnings Growth"",""HYMB"":null,""Category Average"":null}]",0.0,0.0,,"[{""Average"":""Duration"",""HYMB"":5.03,""Category Average"":null},{""Average"":""Maturity"",""HYMB"":9.563,""Category Average"":null},{""Average"":""Credit Quality"",""HYMB"":null,""Category Average"":null}]",0.002223,0.16549999,0.005,-0.0008,0.1277,0.4694,0.031400003,0.1889,0.012999999,,,,,,,,,,,,,,,,,,,,,
Utilities,utilities,14,VRP,Invesco Variable Rate Preferred ETF,https://finance.yahoo.com/research-hub/screener/sec-ind_sec-top-etfs_utilities/,2026-07-18T07:04:17+00:00,en-US,US,ETF,ETF,Delayed Quote,False,LOW,,,10.42886,4.08598,False,False,False,,15,0,America/New_York,EDT,,24.3434,0.036600113,0.0015034922,24.4106,-0.030601501,,True,1398951000000,-14400000,2978023940.0,2.60015,2.60015,Invesco Variable Rate Preferred,,0.0,1784322300.0,900.0,0.0,USD,2,24.36,785524,2.31814,CLOSED,24.36,finmb_255959630,NYSEArca,487810,0.0,-0.55000114,-0.0012536152,0.028258123,24.38,24.513,24.319 - 24.513,24.38,0.0,0.0199986,1784318400,1200.0,0.0820959,0.5,24.319,1007890,us_market,0.6700001,23.71 - 24.93,[],PCX,24.93,23.71,6.23,,-0.02206182,Invesco Variable Rate Preferred ETF,-0.4897952,,24.3,24.39,VRP,,,,,,,,,,,,,,,,"The fund will invest at least 90% of its total assets in the components of the index, as well as ADRs that represent securities in the index. The index provider compiles and calculates the index, a market capitalization-weighted index designed to track the performance of floating and variable rate investment grade and below investment grade U.S. dollar denominated preferred stock, as well as certain types of hybrid securities. It is non-diversified.",[],[],86400.0,2.0,24.36,24.36,24.319,24.513,24.36,24.36,24.319,24.513,,1007890.0,1007890.0,785524.0,487810.0,487810.0,24.3,24.39,900.0,1200.0,0.0623,2978023936.0,23.71,24.93,29.295,13.33,24.3434,24.4106,0.0,0.0,24.35,USD,False,Preferred Stock,2.31814,0.47,Invesco,1398902400.0,Exchange Traded Fund,0.0934057,ETF,VRP,en-US,US,ETF,Delayed Quote,True,HIGH,CLOSED,[],1784322300.0,1784318400.0,PCX,finmb_255959630,America/New_York,EDT,-14400000.0,us_market,False,0.0820959,24.38,True,1398951000000.0,0.0,24.38,0.0,0.0199986,24.319 - 24.513,NYSEArca,785524.0,0.6700001,0.028258123,23.71 - 24.93,-0.55000114,-0.02206182,-0.4897952,6.23,2.60015,2.60015,2978023940.0,,Invesco Variable Rate Preferred,Invesco Variable Rate Preferred ETF,0.036600113,0.0015034922,-0.030601501,-0.0012536152,0.5,15.0,0.0,False,,"The fund will invest at least 90% of its total assets in the components of the index, as well as ADRs that represent securities in the index. The index provider compiles and calculates the index, a market capitalization-weighted index designed to track the performance of floating and variable rate investment grade and below investment grade U.S. dollar denominated preferred stock, as well as certain types of hybrid securities. It is non-diversified.",Preferred Stock,Invesco,Exchange Traded Fund,0.0095,0.0,0.4465,0.4997,0.0442,0.0,0.0,0.0,0.0,0.0,0.0,0.0,0.0,1.0,0.0,0.0,0.0,0.0,0.005,0.0092324,0.2,0.3987,0.0,0.0,20.0,0.5,1.8767699999999998,"[{""Symbol"":""AGPXX"",""Name"":""Invesco Shrt-Trm Inv Gov&Agcy Instl"",""Holding Percent"":0.0095343},{""Symbol"":""CPN"",""Name"":""Citigroup Capital XIII Floating Rate Trust Pfd Secs Registered 2010-30.10.4"",""Holding Percent"":0.0092334}]","[{""Average"":""Price\/Earnings"",""VRP"":0.0,""Category Average"":null},{""Average"":""Price\/Book"",""VRP"":0.0,""Category Average"":null},{""Average"":""Price\/Sales"",""VRP"":0.0,""Category Average"":null},{""Average"":""Price\/Cashflow"",""VRP"":0.0,""Category Average"":null},{""Average"":""Median Market Cap"",""VRP"":null,""Category Average"":null},{""Average"":""3 Year Earnings Growth"",""VRP"":null,""Category Average"":null}]",0.0,0.0,,"[{""Average"":""Duration"",""VRP"":6.33,""Category Average"":null},{""Average"":""Maturity"",""VRP"":10.069,""Category Average"":null},{""Average"":""Credit Quality"",""VRP"":null,""Category Average"":null}]",0.0425044,0.33080003,0.0016,-0.015800001,0.0189,0.035,0.006,0.6235,0.0,,,,,,,,,,,,,,,,,,,,,
Utilities,utilities,15,ICLN,iShares Global Clean Energy ETF,https://finance.yahoo.com/research-hub/screener/sec-ind_sec-top-etfs_utilities/,2026-07-18T07:04:17+00:00,en-US,US,ETF,ETF,Nasdaq Real Time Price,False,LOW,0.9,22.197558,-20.32937,-23.79633,False,False,False,,15,0,America/New_York,EDT,,20.9566,-2.5865993,-0.123426475,18.5468,-0.17679977,,True,1214400600000,-14400000,2908022020.0,13.20088,13.20088,iShares Global Clean Energy ETF,19.85546,0.707671,1784332234.0,8.0,0.0,USD,2,18.075,5996945,25.50067,CLOSED,18.35,finmb_61565163,NasdaqGM,3887330,0.0,-5.41,-0.0095326295,0.3750001,18.37,18.615,17.95 - 18.615,18.5,0.12999916,0.0200005,1784318401,8.0,0.108994,0.39,17.95,4323352,us_market,5.010001,13.36 - 23.78,[],NGM,23.78,13.36,0.9,,-0.2275021,iShares Global Clean Energy ETF,35.272453,0.9251864,18.2,18.51,ICLN,1482969600.0,,,,,,,,,,,,,,415-670-2000,"The index is designed to track the performance of approximately 100 clean energy-related companies. The fund generally invests at least 80% of its assets in the component securities of the index and in investments that have economic characteristics that are substantially identical to the component securities of the index and may invest up to 20% of its assets in certain futures, options and swap contracts, cash and cash equivalents, as well as in securities not included in the index. It is non-diversified.",[],[],86400.0,2.0,18.35,18.075,17.95,18.615,18.35,18.075,17.95,18.615,19.85546,4323352.0,4278310.0,5996945.0,3887330.0,3887330.0,18.2,18.51,8.0,8.0,0.009,2908022016.0,13.36,23.78,60.0,6.13,20.9566,18.5468,0.0,0.0,18.38904,USD,False,Miscellaneous Sector,25.50067,1.43,iShares,1214265600.0,Exchange Traded Fund,0.010283399,ETF,ICLN,en-US,US,ETF,Nasdaq Real Time Price,True,HIGH,CLOSED,[],1784332234.0,1784318401.0,NGM,finmb_61565163,America/New_York,EDT,-14400000.0,us_market,False,0.108994,18.37,True,1214400600000.0,0.707671,18.5,0.12999916,0.0200005,17.95 - 18.615,NasdaqGM,5996945.0,5.010001,0.3750001,13.36 - 23.78,-5.41,-0.2275021,35.272453,0.9,13.20088,13.20088,2908022020.0,0.9251864,iShares Global Clean Energy ETF,iShares Global Clean Energy ETF,-2.5865993,-0.123426475,-0.17679977,-0.0095326295,0.39,15.0,0.0,False,,"The index is designed to track the performance of approximately 100 clean energy-related companies. The fund generally invests at least 80% of its assets in the component securities of the index and in investments that have economic characteristics that are substantially identical to the component securities of the index and may invest up to 20% of its assets in certain futures, options and swap contracts, cash and cash equivalents, as well as in securities not included in the index. It is non-diversified.",Miscellaneous Sector,iShares,Exchange Traded Fund,0.0050999997,0.9949,0.0,0.0,0.0,0.0,0.0,0.0,0.0148,0.0,0.3382,0.0,0.0,0.3344,0.3127,0.0,0.0,0.0,0.0039,0.0,0.68,,13100.48,13100.48,68.0,0.38999999999999996,54.817770200000005,"[{""Symbol"":""BE"",""Name"":""Bloom Energy Corp Class A"",""Holding Percent"":0.1474929},{""Symbol"":""FSLR"",""Name"":""First Solar Inc"",""Holding Percent"":0.0840512},{""Symbol"":""NXT"",""Name"":""Nextpower Inc Class A"",""Holding Percent"":0.0731948},{""Symbol"":""600900.SS"",""Name"":""China Yangtze Power Co Ltd Class A"",""Holding Percent"":0.057781503},{""Symbol"":""ENPH"",""Name"":""Enphase Energy Inc"",""Holding Percent"":0.048737798},{""Symbol"":""VWS.CO"",""Name"":""Vestas Wind Systems AS"",""Holding Percent"":0.0311113},{""Symbol"":""PLUG"",""Name"":""Plug Power Inc"",""Holding Percent"":0.028544},{""Symbol"":""SEDG"",""Name"":""SolarEdge Technologies Inc"",""Holding Percent"":0.0264549},{""Symbol"":""EQTL3.SA"",""Name"":""Equatorial SA"",""Holding Percent"":0.0255787},{""Symbol"":""SUZLON.BO"",""Name"":""Suzlon Energy Ltd"",""Holding Percent"":0.025230601}]","[{""Average"":""Price\/Earnings"",""ICLN"":0.04505,""Category Average"":null},{""Average"":""Price\/Book"",""ICLN"":0.37408,""Category Average"":null},{""Average"":""Price\/Sales"",""ICLN"":0.45048,""Category Average"":null},{""Average"":""Price\/Cashflow"",""ICLN"":0.08215,""Category Average"":null},{""Average"":""Median Market Cap"",""ICLN"":null,""Category Average"":null},{""Average"":""3 Year Earnings Growth"",""ICLN"":null,""Category Average"":null}]",0.04505,0.37408,,"[{""Average"":""Duration"",""ICLN"":null,""Category Average"":null},{""Average"":""Maturity"",""ICLN"":null,""Category Average"":null},{""Average"":""Credit Quality"",""ICLN"":null,""Category Average"":null}]",-0.0236007,,,,,,,,,,1482969600.0,,,,,,,,,,,,,,,,,,,
Utilities,utilities,16,PFXF,VanEck Preferred Securities ex Financials ETF,https://finance.yahoo.com/research-hub/screener/sec-ind_sec-top-etfs_utilities/,2026-07-18T07:04:17+00:00,en-US,US,ETF,ETF,Delayed Quote,False,LOW,,,11.40761,11.54616,False,False,False,,15,0,America/New_York,EDT,,18.2972,-0.82719994,-0.045209102,18.04395,-0.5739498,,True,1342704600000,-14400000,2628590080.0,3.11223,3.11223,VanEck Preferred Securities ex ,,0.0,1784322300.0,7300.0,0.0,USD,2,17.47,983143,2.98304,CLOSED,17.54,finmb_214279555,NYSEArca,762930,0.0,-1.6000004,-0.031808436,0.025836676,17.47,17.565,17.3299 - 17.565,17.47,0.0,-0.0700016,1784318400,6600.0,-0.399097,0.4,17.3299,924663,us_market,0.43999863,17.03 - 19.07,[],PCX,19.07,17.03,6.42,,-0.083901435,VanEck Preferred Securities ex Financials ETF,-0.7950008,,17.33,17.48,PFXF,,,,,,,,,,,,,,,888-658-8287,"The fund normally invests at least 80% of its total assets in securities that comprise the fund's benchmark index. The index is comprised of U.S. exchange-listed hybrid debt, preferred stock and convertible preferred stock issued by non-financial corporations. The fund is non-diversified.",[],[],86400.0,2.0,17.54,17.47,17.3299,17.565,17.54,17.47,17.3299,17.565,,924663.0,924663.0,983143.0,762930.0,762930.0,17.33,17.48,7300.0,6600.0,0.0642,2628590080.0,17.03,19.07,21.98,12.26,18.2972,18.04395,0.0,0.0,17.49,USD,False,Preferred Stock,2.98304,0.97,VanEck,1342396800.0,Exchange Traded Fund,0.0752373,ETF,PFXF,en-US,US,ETF,Delayed Quote,True,HIGH,CLOSED,[],1784322300.0,1784318400.0,PCX,finmb_214279555,America/New_York,EDT,-14400000.0,us_market,False,-0.399097,17.47,True,1342704600000.0,0.0,17.47,0.0,-0.0700016,17.3299 - 17.565,NYSEArca,983143.0,0.43999863,0.025836676,17.03 - 19.07,-1.6000004,-0.083901435,-0.7950008,6.42,3.11223,3.11223,2628590080.0,,VanEck Preferred Securities ex ,VanEck Preferred Securities ex Financials ETF,-0.82719994,-0.045209102,-0.5739498,-0.031808436,0.4,15.0,0.0,False,,"The fund normally invests at least 80% of its total assets in securities that comprise the fund's benchmark index. The index is comprised of U.S. exchange-listed hybrid debt, preferred stock and convertible preferred stock issued by non-financial corporations. The fund is non-diversified.",Preferred Stock,VanEck,Exchange Traded Fund,0.0022,0.1532,0.0,0.84459996,0.0,0.0,0.0,0.0,0.0,0.0,0.0689,0.0,0.0,0.7396,0.043,0.0,0.14850001,0.0,0.004,0.0092324,0.31,0.3987,0.0,0.0,31.0,0.4,42.13403999999999,"[{""Symbol"":""BAPA"",""Name"":""Boeing Co 6% PRF CONVERT 15\/10\/2027 USD 50 - Dep Rep 1\/20th Sr A"",""Holding Percent"":0.0969915},{""Symbol"":""STRC"",""Name"":""Strategy Inc VR PRF PERPETUAL USD 100 - Ser A"",""Holding Percent"":0.0619799},{""Symbol"":""ORCLPD"",""Name"":""Oracle Corp FR PRF PERPETUAL USD - DpSh 1\/2000 Prf Sr D"",""Holding Percent"":0.0567004},{""Symbol"":""HPEPC"",""Name"":""Hewlett Packard Enterprise Co 7.625% PRF CONVERT 01\/09\/2027 USD 50 - Ser C"",""Holding Percent"":0.0432854},{""Symbol"":""ALBPA"",""Name"":""Albemarle Corp PRF PERPETUAL USD 1000 - Ser A 1\/20th Pref St"",""Holding Percent"":0.0315414},{""Symbol"":""MCHPP"",""Name"":""Microchip Technology Inc 7.50% PRF CONVERT 15\/03\/2028 USD 50 - Ser A 1\/20th"",""Holding Percent"":0.027966},{""Symbol"":""NEEPV"",""Name"":""NextEra Energy Inc Unit (Corporate Units 15\/02\/2029)"",""Holding Percent"":0.027845599},{""Symbol"":""NEEPS"",""Name"":""NextEra Energy Inc 7.299% CORP UNIT 01\/06\/2027"",""Holding Percent"":0.027056001},{""Symbol"":""SOMN"",""Name"":""Southern Co Unit (2025 Series A Corporate Units 15\/12\/2028)"",""Holding Percent"":0.0252228},{""Symbol"":""BTSGU"",""Name"":""BrightSpring Health Services Inc Units"",""Holding Percent"":0.0227514}]","[{""Average"":""Price\/Earnings"",""PFXF"":0.0,""Category Average"":null},{""Average"":""Price\/Book"",""PFXF"":0.0,""Category Average"":null},{""Average"":""Price\/Sales"",""PFXF"":0.0,""Category Average"":null},{""Average"":""Price\/Cashflow"",""PFXF"":0.0,""Category Average"":null},{""Average"":""Median Market Cap"",""PFXF"":null,""Category Average"":null},{""Average"":""3 Year Earnings Growth"",""PFXF"":null,""Category Average"":null}]",0.0,0.0,,"[{""Average"":""Duration"",""PFXF"":null,""Category Average"":null},{""Average"":""Maturity"",""PFXF"":null,""Category Average"":null},{""Average"":""Credit Quality"",""PFXF"":null,""Category Average"":null}]",0.0305492,0.2941,0.0054,0.0,0.0396,0.3441,0.0416,0.2752,0.0,,,,,,,,,,,,,,,,,,,,,
Utilities,utilities,17,FUTY,Fidelity MSCI Utilities Index ETF,https://finance.yahoo.com/research-hub/screener/sec-ind_sec-top-etfs_utilities/,2026-07-18T07:04:17+00:00,en-US,US,ETF,ETF,Delayed Quote,False,LOW,2.59,20.837675,-7.44503,17.37839,False,False,False,,15,0,America/New_York,EDT,,57.9584,0.32159805,0.005548774,57.9325,0.34749985,,True,1382621400000,-14400000,2349204480.0,-0.41757,-0.41757,Fidelity MSCI Utilities Index E,20.781363,0.3774901,1784326510.0,900.0,0.0,USD,2,58.99,339103,7.33952,CLOSED,58.66,finmb_243638577,NYSEArca,302220,0.0,-3.2299995,0.0059983577,0.0948713,58.28,59.43,58.1499 - 59.43,58.5,0.22000122,-0.380001,1784318400,900.0,-0.647803,0.084,58.1499,303581,us_market,5.049999,53.23 - 61.51,[],PCX,61.51,53.23,2.59,,-0.05251178,Fidelity MSCI Utilities Index ETF,7.905948,2.804436,58.24,58.26,FUTY,,,,,,,,,,,,,,,,"The fund invests at least 80% of assets in securities included in the fund's underlying index. The fund's underlying index is the MSCI USA IMI Utilities 25/50 Index, which represents the performance of the utilities sector in the U.S. equity market. It may or may not hold all of the securities in the MSCI USA IMI Utilities 25/50 Index. The fund is non-diversified.",[],[],86400.0,2.0,58.66,58.99,58.1499,59.43,58.66,58.99,58.1499,59.43,20.781363,303581.0,303581.0,339103.0,302220.0,302220.0,58.24,58.26,900.0,900.0,0.025899999,2349204480.0,53.23,61.51,61.51,24.36,57.9584,57.9325,0.0,0.0,58.66033,USD,False,Utilities,7.33952,0.5,Fidelity Investments,1382313600.0,Exchange Traded Fund,0.1413998,ETF,FUTY,en-US,US,ETF,Delayed Quote,True,HIGH,CLOSED,[],1784326510.0,1784318400.0,PCX,finmb_243638577,America/New_York,EDT,-14400000.0,us_market,False,-0.647803,58.28,True,1382621400000.0,0.3774901,58.5,0.22000122,-0.380001,58.1499 - 59.43,NYSEArca,339103.0,5.049999,0.0948713,53.23 - 61.51,-3.2299995,-0.05251178,7.905948,2.59,-0.41757,-0.41757,2349204480.0,2.804436,Fidelity MSCI Utilities Index E,Fidelity MSCI Utilities Index ETF,0.32159805,0.005548774,0.34749985,0.0059983577,0.084,15.0,0.0,False,,"The fund invests at least 80% of assets in securities included in the fund's underlying index. The fund's underlying index is the MSCI USA IMI Utilities 25/50 Index, which represents the performance of the utilities sector in the U.S. equity market. It may or may not hold all of the securities in the MSCI USA IMI Utilities 25/50 Index. The fund is non-diversified.",Utilities,Fidelity Investments,Exchange Traded Fund,0.002,0.998,0.0,0.0,0.0,0.0,0.0,0.0,0.0,0.0,0.0,0.0,0.0,0.9934,0.0021,0.0045,0.0,0.0,0.00084,0.009681,0.04,0.47,46154.22,46154.22,4.0,0.084,51.884410800000005,"[{""Symbol"":""NEE"",""Name"":""NextEra Energy Inc"",""Holding Percent"":0.115540706},{""Symbol"":""SO"",""Name"":""Southern Co"",""Holding Percent"":0.06816},{""Symbol"":""DUK"",""Name"":""Duke Energy Corp"",""Holding Percent"":0.0624117},{""Symbol"":""CEG"",""Name"":""Constellation Energy Corp"",""Holding Percent"":0.0499062},{""Symbol"":""AEP"",""Name"":""American Electric Power Co Inc"",""Holding Percent"":0.0468677},{""Symbol"":""SRE"",""Name"":""Sempra"",""Holding Percent"":0.0383429},{""Symbol"":""D"",""Name"":""Dominion Energy Inc"",""Holding Percent"":0.0380005},{""Symbol"":""VST"",""Name"":""Vistra Corp"",""Holding Percent"":0.0343554},{""Symbol"":""ETR"",""Name"":""Entergy Corp"",""Holding Percent"":0.033281602},{""Symbol"":""XEL"",""Name"":""Xcel Energy Inc"",""Holding Percent"":0.0319774}]","[{""Average"":""Price\/Earnings"",""FUTY"":0.04799,""Category Average"":null},{""Average"":""Price\/Book"",""FUTY"":0.43653,""Category Average"":null},{""Average"":""Price\/Sales"",""FUTY"":0.35185,""Category Average"":null},{""Average"":""Price\/Cashflow"",""FUTY"":0.10031,""Category Average"":null},{""Average"":""Median Market Cap"",""FUTY"":null,""Category Average"":null},{""Average"":""3 Year Earnings Growth"",""FUTY"":null,""Category Average"":null}]",0.04799,0.43653,,"[{""Average"":""Duration"",""FUTY"":null,""Category Average"":null},{""Average"":""Maturity"",""FUTY"":null,""Category Average"":null},{""Average"":""Credit Quality"",""FUTY"":null,""Category Average"":null}]",0.0966394,,,,,,,,,,,,,,,,,,,,,,,,,,,,,
